room and give her his pages so that she, in turn, could give them to the girl. Sometimes Jacinta would hand him a note that Penélope had written for him, and he
would spend days rereading it. That game went on for months. While time brought
them no good fortune, Julián did whatever was necessary to be close to Penélope. Jacinta helped him, to see Penélope happy, to keep that light glowing. Julián, for his
part, felt that the casual innocence of the beginning was now fading and it was necessary to start giving way. That is how he began to lie to Don Ricardo about his plans
for the future, to fake an enthusiasm for a career in banking and finance, to feign an
affection and an attachment for Jorge Aldaya that he did not feel, in order to justify
his almost constant presence in the house on Avenida del Tibidabo; to say only what
2 6 6 · T h e S h a d o w o f t h e W i n d
he knew others wanted to hear him say, to read their looks and their hopes, to put
aside honesty and sincerity, to feel that he was selling his soul away in pieces, and to
fear that if he ever did come to deserve Penélope, there would be nothing left of the
Julián who saw her the first time. Sometimes Julián would wake up at dawn, burning
with anger, longing to tell the world his real feelings, to face Don Ricardo Aldaya and
tell him he had no interest whatsoever in his fortune, his opportunities for the future,
or his company; that he only wanted his daughter, Penélope, and was thinking of taking her as far away as possible from that empty, shrouded world in which her father
had imprisoned her. The light of day dispelled his courage."|"The Shadow of the Wind"|"Carlos Ruiz Zafon"
12:00|midday|"Jacinta kept a photograph of Julián and Penélope taken by Recasens, the official
portrait photographer of the Aldayas, by the door of the hat shop in Ronda de San
Antonio. It was an innocent image, taken at midday in the presence of Don Ricardo
and of Sophie Carax. Jacinta always carried it with her. One day, while she was waiting for Jorge outside the school, the governess absentmindedly left her bag by one of
the fountains, and, when she went back for it, found young Fumero prowling around
the area, looking at her nervously. That night she looked for the photograph but
couldn’t find it and was certain that the boy had stolen it. On another occasion, a
few weeks later,Francisco Javier Fumero went up to Jacinta and asked her whether she
could give Penélope something from him. When Jacinta asked what this thing was, the
boy pulled out a piece of cloth in which he had wrapped what looked like a figure
carved in pinewood. Jacinta recognized Penélope in the figure and felt a shiver.Before
C i t y o f S h a d o w s · 2 6 7"|"The Shadow of the Wind"|"Carlos Ruiz Zafon"
12:00|noon|"One day, almost three years to the day since Don Ricardo Aldaya’s first visit to the
Fortuny and Sons hat shop, the hatter left Quimet in charge of the shop and told him
2 6 8 · T h e S h a d o w o f t h e W i n d
he’d be back at noon. He boldly presented himself at the offices of Aldaya’s consortium on Paseo de Gracia and asked to see Don Ricardo."|"The Shadow of the Wind"|"Carlos Ruiz Zafon"
12:00|midday|"The following day, during the midday break,Francisco Javier appeared unexpect-edly. News of the previous day’s scene had already spread among the pupils: he was
met with laughter and questioned about what he’d done with his little sailor suit.The
laughter ended abruptly when the boys noticed he was carrying his father’s gun in his
hand. Silence reigned, and many of them moved away. Only the circle formed by Aldaya, Moliner, Fernando, and Julián turned around and stared at the boy, without
understanding. Francisco Javier gave no warning: he raised his rifle and aimed. Later,
witnesses said there was no irritation or anger in his expression. Francisco Javier displayed the same automatic coolness with which he performed his cleaning jobs in the
garden. The first bullet scraped past Julián’s head. The second would have gone
through his throat had Miquel Moliner not thrown himself on the caretaker’s son,
punched him, and wrenched the gun from him. Julián Carax watched the scene in astonishment, paralyzed. Everyone thought the shots were aimed at Jorge Aldaya in revenge for the humiliation Javier had suffered the day before. Only later, when the
Civil Guards were taking the boy away and the caretakers were being almost literally
kicked out of their home, did Miquel Moliner go up to Julián and tell him, without
any pride, that he had saved his life."|"The Shadow of the Wind"|"Carlos Ruiz Zafon"
12:00|midday|"The girl listened to him in astonishment, enthralled. Moliner’s plan was impeccable. Miquel would buy the tickets under a false name and hire a third party to collect them at the ticket office in the station. If by any chance the police discovered him,
all he’d be able to offer would be the description of someone who did not look like
Julián. Julián and Penélope would meet on the train. There would be no waiting on
the platform, where they might be seen. The escape would take place on a Sunday, at
midday. Julián would make his own way to the Estación de Francia. Miquel would be
waiting for him there, with the tickets and the money."|"The Shadow of the Wind"|"Carlos Ruiz Zafon"
"ap 11:00"|"eleven o’clock"|"The most delicate part of the plan concerned Penélope. She had to deceive Jacinta
and ask her to invent an excuse for taking her out of the eleven o’clock mass and returning home. On the way Penélope would ask Jacinta to let her go and meet Julián,
promising to be back before the family had returned to the mansion. This would be
Penélope’s opportunity to get to the station. They both knew that if they told her the
truth, Jacinta would not allow them to leave. She loved them too much."|"The Shadow of the Wind"|"Carlos Ruiz Zafon"
13:00|"one in the
afternoon"|"The most difficult thing was convincing Penélope of the need to keep Jacinta in
the dark. Only Miquel would know the truth. The train would depart at one in the
afternoon. By the time Penélope’s absence was noticed, they would have crossed the
border. Once in Paris, they would settle in a hostel as man and wife, using a false
name. They would then send Miquel Moliner a letter addressed to their families, confessing their love, telling them they were well, that they loved them, announcing their
church wedding, and asking for forgiveness and understanding. Miquel Moliner
would put the letter in a second envelope to do away with the Paris postmark and
would see to it that it was posted from some nearby town."|"The Shadow of the Wind"|"Carlos Ruiz Zafon"
"< 12:00"|"just before noon"|"The Estación de Francia was deserted; the platforms, reflecting the burning light
of dawn, curved off into the mist like glistening sabers. Julián sat on a bench under
the vaulted ceiling and took out his book. He let the hours go by lost in the magic of
words, shedding his skin and his name, feeling like another person. He allowed himself to be carried away by the dreams of shadowy characters, the only refuge left for
him. By then he knew that Penélope wouldn’t come. He knew he would board that
train with no other company than his memories. When, just before noon, Miquel Mo-2 7 8 · T h e S h a d o w o f t h e W i n d
liner arrived in the station and gave him his ticket and all the money he had been
able to gather, the two friends embraced without a word. Julián had never seen
Miquel Moliner cry. Clocks were everywhere, counting the minutes that flew by."|"The Shadow of the Wind"|"Carlos Ruiz Zafon"
"ap 01:05"|"five past one"|"At five past one, the stationmaster gave the last call for passengers traveling to
Paris. The train had already started to slide along the platform when Julián turned
around to say good-bye to his friend. Miquel Moliner stood there watching him, his
hands sunk in his pockets."|"The Shadow of the Wind"|"Carlos Ruiz Zafon"
00:30|"half past midnight"|"Have you ever covered a woman with oil, from head to toe, completely and meticulously?”
“Fermín, it’s half past midnight, and I’m dead on my feet.”
“Please forgive me, Daniel. It’s just that your father insisted that I come up and have dinner with him, and afterward I felt terribly drowsy. Beef has a narcotic effect on me, you see. Your father suggested that I lie down here for a while, insisting that you wouldn’t mind. . . .”"|"The Shadow of the Wind"|"Carlos Ruiz Zafon"
"ap 07:30"|seven-thirty|"Morning came, and it was pouring. Streets were flooded, and the rain beat angrily against the windows. The telephone rang at seven-thirty. I jumped out of the armchair to answer, with my heart in my mouth."|"The Shadow of the Wind"|"Carlos Ruiz Zafon"
12:00|noon|"It rained all morning. Shortly after we opened the bookshop, there was a general power cut in the whole neighborhood that lasted until noon."|"The Shadow of the Wind"|"Carlos Ruiz Zafon"
"ap 03:00"|three|"At three the first leaks began. Fermín offered to go up to Merceditas’s apartment to borrow some buckets, dishes, or any other hollow receptacle."|"The Shadow of the Wind"|"Carlos Ruiz Zafon"
"< 00:00"|"almost midnight"|"3 1 2 · T h e S h a d o w o f t h e W i n d It was almost midnight when I got back home, shivering with cold and carrying the world on my shoulders. She’ll call tomorrow, I told myself a thousand times while I tried to fall asleep. Bea didn’t call the next day. Or the next. She didn’t call that whole week, the longest and the last of my life."|"The Shadow of the Wind"|"Carlos Ruiz Zafon"
12:00|noon|"Only someone who has barely a week left to live could waste his time the way I wasted mine during those days. All I did was watch over the telephone and gnaw at my soul, so much a prisoner of my own blindness that I wasn’t even capable of guessing what destiny was already taking for granted. On Monday at noon, I went over to the Literature Faculty in Plaza Universidad, hoping to see Bea. I knew she wouldn’t be amused if I turned up there and we were seen together, but facing her anger was preferable to continuing with my uncertainty."|"The Shadow of the Wind"|"Carlos Ruiz Zafon"
12:00|noon|"When the time came, I lied again and made my way to the home of Nuria Monfort, whose touch and smell remained indelible in my memory. The cobblestones of Plaza de San Felipe Neri had been taken over by a flock of pigeons, but otherwise the square was deserted. I crossed the paving under the watchful eye of dozens of pigeons and looked around in vain for Fermín, disguised as heaven knows what—he had refused to reveal his planned ruse. I went into the building and saw that the name of Miquel Moliner was still on the letterbox; I wondered whether that would be the first flaw I was going to point out in Nuria Monfort’s story. As I went up the stairs in the dark, I almost hoped she wouldn’t be at home. Nobody can feel more compassion for a fibber than another fibber. When I reached the fourth-floor landing, I stopped to gather up courage and devise some excuse with which to justify my visit. The neighbor’s radio was still thundering at the other end of the landing, this time broadcasting a game show on which contestants tested their knowledge of religious lore. It went by the name With a Little Help from the Lord,  and reputedly held the whole of Spain spellbound every Tuesday at noon."|"The Shadow of the Wind"|"Carlos Ruiz Zafon"
"ap 08:30"|"half past eight"|"“Sure, but I must warn you that I turn in for the night at half past eight.”"|"The Shadow of the Wind"|"Carlos Ruiz Zafon"
"~ 00:00"|"about midnight"|"It was about midnight when we heard more bangs on the door, this time weaker, almost fearful. My father, who was dabbing iodine on the bruise left on my cheek by Fumero’s gun, suddenly froze. Our eyes met. There were three more knocks."|"The Shadow of the Wind"|"Carlos Ruiz Zafon"
18:15|"6:15 pm"|"It seems that the murderer, fifty-five-year-old Antonio José Gu-tiérrez Alcayete, from Villa Inmunda in the province of Cáceres, is a well-known criminal with a long record of mental illness, who escaped from La Modelo Prison six years ago and has managed to elude the authorities by assuming different identities. At the moment of the crime, he was dressed in a cassock. He is armed, and the police describe him as highly dangerous. It is not yet known whether the victim and her murderer knew each other, although sources from Police Headquarters indicate that everything points toward that hypothesis; nor is it known what may have been the motive behind the crime. The victim was stabbed six times in her stomach, chest, and throat. The attack, which took place close to a school, was witnessed by a number of pupils, who alerted the teachers. These in turn called the police and an ambulance. According to the police report, death was caused by multiple wounds. The victim was pronounced dead on arrival at the Hospital Clínico of Barcelona, at 6:15 pm."|"The Shadow of the Wind"|"Carlos Ruiz Zafon"
"ap < 03:00"|"Shortly before three o’clock"|"Shortly before three o’clock, I got on a bus on Paseo de Colón that would take me to the cemetery on Montjuïc. Through the window I could see the forest of masts and fluttering pennants at the docks."|"The Shadow of the Wind"|"Carlos Ruiz Zafon"
"ap 04:30"|"half past four"|"“What time does the last bus leave?” I asked the driver before getting off.
“At half past four.”
The driver left me by the cemetery gates. An avenue of cypress trees rose in the mist. Even from there, at the foot of the mountain, one could already begin to see the vast city of the dead that scaled the slope to the very top: avenues of tombs, walks lined with gravestones, and alleyways of mausoleums, towers crowned by fiery angels and whole forests of sepulchers that seemed to grow against one another. The city of the dead was a pit of palaces guarded by an army of rotting stone statues sinking into the mud. I took a deep breath and entered the labyrinth. My mother lay buried a hundred yards away from the path along which I walked. With every step I took, I could feel the cold, the emptiness, and the fury of that place, the horror of its silence, of the faces trapped in the old photographs that had been abandoned to the company of candles and dead flowers. After a while C i t y o f S h a d o w s · 3 5 1"|"The Shadow of the Wind"|"Carlos Ruiz Zafon"
"ap 00:00"|"twelve o’clock"|"I got to the Gare d’Austerlitz just in time to catch the twelve o’clock train to Barcelona. The ticket inspector who sold me the ticket asked me whether I was feeling all right. I nodded and shut myself up in the compartment. The train was already leaving when I looked out the window and caught a glimpse of Julián on the platform, in the same place I’d seen him for the first time. I closed my eyes and didn’t open them again until we had lost sight of the station and that bewitching city to which I could never return. I arrived in Barcelona the following morning, as day was breaking."|"The Shadow of the Wind"|"Carlos Ruiz Zafon"
00:00|midnight|"Jorge Aldaya had revealed this to Miquel the next day, making him swear he would never tell anyone. Jorge explained how, when he was given the news, Don Ricardo exploded with anger and rushed up to Penélope’s room, shouting like a madman. When she heard her father’s yells, Penélope locked her door and wept with terror. Don Ricardo kicked in the door and found his daughter on her knees, trembling and begging for mercy. Don Ricardo then slapped her in the face so hard that she fell down. Not even Jorge was able to repeat the words Don Ricardo hurled at her in his fury. All the members of the family and the servants waited downstairs, terrified, not knowing what to do. Jorge hid in his room, in the dark, but even there he could hear Don Ricardo’s shouts. Jacinta was dismissed that same day. Don Ricardo didn’t even deign to see her. He ordered the servants to throw her out of the house and threatened them with a similar fate if any of them had any contact with her again.
When Don Ricardo went down to the library, it was already midnight.
He’d left Penélope locked up in what had been Jacinta’s bedroom and strictly forbade anyone, whether members of his staff or family, to go up to see her."|"The Shadow of the Wind"|"Carlos Ruiz Zafon"
"ap 03:00"|three|"Their secret meetings lasted ninety-six days. They met in the afternoons, always in that empty apartment on the corner of Diputación and Rambla de Cataluña. Tuesdays and Thursdays at three. Their meetings never lasted more than an hour. Sometimes Sophie stayed on alone once Aldaya had left, crying or shaking in a corner of the bedroom. Then, when Sunday came, Sophie looked desperately into the hatter’s eyes for traces of the woman who was disappearing, yearning for both devotion and decep-tion. The hatter didn’t see the marks on her skin, the cuts and burns that peppered her body. The hatter didn’t see the despair in her smile, in her meekness. The hatter didn’t see anything. Perhaps for that reason, she accepted his promise of marriage. By then she already suspected that she was carrying Aldaya’s child, but was afraid of telling him, almost as much as she was afraid of losing him. Once again it was Aldaya who saw in Sophie what she was incapable of admitting. He gave her five hundred pesetas and an address on Calle Platería and ordered her to get rid of the baby. Sophie refused. Don Ricardo Aldaya slapped her until her ears bled, then threatened to have her killed if she dared mention their meetings or admit that the child was his. When Sophie told the hatter that some thugs had assaulted her in Plaza del Pino, he believed her. When she told him she wanted to be his wife, he believed her. On the day of her wedding, someone erroneously sent a funeral wreath to the church. Everyone laughed nervously when they saw the florist’s mistake. All except Sophie, who knew perfectly well that Don Ricardo Aldaya had not forgotten her on her wedding day."|"The Shadow of the Wind"|"Carlos Ruiz Zafon"
">> 00:00"|"well after midnight"|"Sometimes I’d catch him looking at me with a gentle smile, as if the very sight of my presence were his greatest treasure. Every afternoon he would come to meet me on my way out of the office, his only moment of leisure in the whole day. He feigned strength, but I saw how he stooped when he walked, and how he coughed. He would take me for a snack or to look at the shop windows on Calle Fernando, and then we’d go back home, where he would continue working until well after midnight. I silently blessed every minute we spent together, and every night he would fall asleep embracing me, while I hid the tears caused by the anger I felt at having been incapable of loving that man the way he loved me, incapable of giving him what I had so pointlessly abandoned at Julián’s feet. Many a night I swore to myself that I would forget Julián, that I would devote the rest of my life to making that poor man happy and returning to him some small part of what he had given me. I was Julián’s lover for two weeks, but I would be Miquel’s wife the rest 3 9 4 · T h e S h a d o w o f t h e W i n d of my life. If some day these pages should reach your hands and you should judge me, as I have judged myself when writing them, looking at my reflection in this mirror of curses and remorse, remember me like this, Daniel."|"The Shadow of the Wind"|"Carlos Ruiz Zafon"
"~ 00:00"|"around midnight"|"Miquel drank barely half a glass, but I finished off almost the entire bottle without noticing, on an empty stomach. At around midnight I was overpowered by drowsiness and collapsed on the sofa. I dreamed that Miquel was kissing my forehead and covering me with a shawl. When I woke up, I 4 0 2 · T h e S h a d o w o f t h e W i n d felt a sharp, stabbing pain in my head, which I recognized as the prelude to a fierce hangover. I went to look for Miquel, to curse the hour when he’d had the bright idea of getting me drunk, but I realized I was alone in the apartment. I went over to the desk and saw that there was a note on the typewriter in which he asked me not to be alarmed and to wait for him there. He’d gone out in search of Julián and would soon bring him home."|"The Shadow of the Wind"|"Carlos Ruiz Zafon"
"> 00:00"|"past midnight"|"That afternoon the flower vendor had called the offices of the Diario de Barcelona  and left a message for Miquel saying he’d seen the man we had described to him prowling around the old mansion like a ghost. It was past midnight when Miquel reached number 32, Avenida del Tibidabo, a dark, deserted valley struck by darts of moonlight that filtered through the grove. Although he hadn’t seen him for seventeen years, Miquel recognized Julián by his light, almost catlike walk. His silhouette glided through the shadows of the garden, near the fountain. Julián had jumped over the garden wall and lay in wait by the house like a restless animal. Miquel could have called to him, but he preferred not to alert any possible witnesses. He felt that furtive eyes were spying on the avenue from the dark windows of neighboring mansions. He walked around the walls of the estate until he reached the part by the old tennis courts and the coach houses. There he noticed the crevices in the wall that Julián must have used as steps, and the flagstones that had come loose on the top. He lifted himself up, almost out of breath, feeling an acute pain in his chest and experiencing periodic waves of blindness. He lay down on the wall, his hands shaking, and called Julián in a whisper. The silhouette that hovered by the fountain stood still, joining the rest of the statues. Miquel saw two shining eyes fixing on him. He wondered whether Julián would recognize him, af-4 0 4 · T h e S h a d o w o f t h e W i n d ter seventeen years and an illness that had taken away his very breath. The silhouette slowly came closer, wielding a long, shiny object in his right hand. A piece of glass."|"The Shadow of the Wind"|"Carlos Ruiz Zafon"
"< 04:00"|"almost four in the morning"|"Nobody answered my call. It was almost four in the morning when I got home. The apartment was full of smoke and the stench of burned paper."|"The Shadow of the Wind"|"Carlos Ruiz Zafon"
"> 00:00"|"shortly after midnight"|"When the firefighters managed to extinguish the flames shortly before daybreak, there was nothing left, just the brick-and-metal skeleton that held up the vault. There I found Lluís Carbó, who had been the night watchman for ten years. He stared in disbelief at the smoldering ruins. His eyebrows and the hairs on his arms were singed, and his skin shone like wet bronze. It was he who told me that the blaze had started shortly after midnight and had devoured tens of thousands of books, until dawn came and he was faced with a river of ashes. Lluís still held a handful of books he had managed to save, some of Verdaguer’s collected poems and two volumes of the History of the
French Revolution.  That was all that had survived. Various members of the union had arrived to help the firefighters. One of them told me the firefighters found a burned body in the debris. At first they had assumed that the man was dead, but then one of them noticed he was still breathing, and they had taken him to the nearby Hospital del Mar."|"The Shadow of the Wind"|"Carlos Ruiz Zafon"
"> 00:00"|"after midnight"|"He made a vague gesture with his head, as if he couldn’t remember who Fumero was, or no longer cared. Several weeks passed in that way. I always went to the apartment at night, after midnight. I asked Julián what he’d done during the day, and he looked at me without understanding. We would spend the night together, holding each other, and I left at daybreak, promising to return as soon as I could. When I left, I always locked the door of the 4 3 2 · T h e S h a d o w o f t h e W i n d apartment. Julián didn’t have a copy of the key. I preferred to keep him there like a prisoner rather than risk his life."|"The Shadow of the Wind"|"Carlos Ruiz Zafon"
23:00|"eleven at night"|"Mercedes had already warned me that sooner or later something like this would happen. A few days afterward, Sanmartí, whose grammar was no better than an ape’s, started returning all the manuscripts that I corrected, alleging that they were full of errors. Practically every day I stayed on in the office until ten or eleven at night, endlessly redoing pages and pages with Sanmartí’s crossings-out and comments."|"The Shadow of the Wind"|"Carlos Ruiz Zafon"
00:00|midnight|"A minute before the end of the film, Julián stood up and left. For months we saw each other like that, in the dark, in cinemas or alleyways, at midnight. Julián always found me. I felt his silent presence without seeing him and was always vigilant. Sometimes he mentioned you. Every time I heard him talk about you, I sensed a rare tenderness in his voice that confused him, a tenderness that, for years now, I had thought lost. I found out that he’d returned to the Aldaya mansion and that he now lived there, halfway between a ghost and a beggar, watching over Penélope’s remains and those of their son. It was the only place that he still felt was his. There are worse prisons than words."|"The Shadow of the Wind"|"Carlos Ruiz Zafon"
"ap 01:00"|"one o’clock"|"The clock ticking on the bedside table showed one o’clock—in the afternoon, I supposed."|"The Shadow of the Wind"|"Carlos Ruiz Zafon"
