"ap 02:00"|"two o'clock"|"At night, in bed, I would imagine about Maybelle. Often this would keep me from sleeping until as late as one or two o'clock. Sometimes Sucker would wake up and ask me why I couldn't get settled and I'd tell him to hush his mouth. I suppose I was mean to him lots of times. I guess I wanted to ignore somebody like Maybelle did me. You could always tell by Sucker's face when his feelings were hurt. I don't remember all the ugly remarks I must have made because even when I was saying them my mind was on Maybelle."|"Collected Stories"|"Carson McCullers"
12:00|noon|"Then gradually the spring began to come. I cannot understand why I was so unconscious of the way in which things began to change, of the milder air and the sun that began to grow stronger and light up the court and all the rooms around it. The thin, sooty-gray patches of snow disappeared and the sky was bright azure at noon. I noticed that I could wear my sweater instead of my coat, that sounds from outside were beginning to get so clear that they bothered me when reading, that every morning the sun was bright on the wall of the opposite building. But I was busy with the job I had and school and the restlessness that these books I read in my spare time made me feel. It was not until one morning when I found the heat in our building turned off and stood looking out through the open window that I realized the great change that had come about. Oddly enough, too, it was then when I saw the man with the red hair plainly for the first time."|"Collected Stories"|"Carson McCullers"
"< 00:00"|"almost midnight"|"I felt that this man across from me understood the cellist and everyone else on the court as well. I had a feeling that nothing would surprise him and that he understood more than most people. Maybe it was the secretive droop of his eyelids. I'm not sure what it was. I just knew that it was good to watch him and think about him. At night he would come in with a paper sack and carefully take his food out and eat it. Later he would put on his pajamas and do exercises in his room and after that he'd usually just sit, doing nothing, until almost midnight. He was an exquisite housekeeper, his window sill was never cluttered up. He would tend his plants every morning, the sun shining on his healthily pale face. Often he carefully watered them with a rubber bulb that looked like an ear syringe. I could never guess for sure just what his job in the day time was."|"Collected Stories"|"Carson McCullers"
"ap ~ 02:00"|"about two o'clock"|"It was a week later when this thing happened chat brought it all to a finish. It must have been about two o'clock one night when I was waked up by a strange sound. It was dark and all the lights were out. The noise seemed to come from the court and as I listened to it I could hardly keep myself from trembling. It was not loud (I don't sleep very well or otherwise it wouldn't have waked me) but there was something animal-like about it—high and breathless, between a moan and an exclamation. It occurred to me that I had heard such a sound sometime in my life before, but it went too far back for me to remember."|"Collected Stories"|"Carson McCullers"
12:00|noonday|"For several minutes the mother and daughter said nothing. Mrs. Lane moved jerkily from the spirea bushes to the fever-bright flowers that bordered the driveway, snipping hastily at the blooms, the dark shadow at her feet dogging her with noonday squatness. Constance watched her with eyes half closed against the glare, with her bony hands against the bubbling, thumping dynamo that was her chest. Finally she shaped the words on her lips and let them emerge. ""Am I going up there by myself?"""|"Collected Stories"|"Carson McCullers"
"ap ~ 11:00"|"about eleven"|"It was a few years later that two occurrences came about that brought me in a direct relation with the Home. Meanwhile, I looked on myself as a big girl, and had passed the place a thousand times, walking alone, or on skates, or bicycle. The terror had diminished to a sort of special fascination. I always stared at the Home in passing, and sometimes I would see the orphans, walking with Sunday slowness on their way to Sunday school and church, grouped in marching formation with the two biggest orphans leading and the two smallest orphans at the end. I was about eleven when changes occurred that drew me in closer as a spectator, and opened an unexpected area of romance. First, my Grandmother was made a member of the Board of the Orphans' Home. That was in the autumn. Then at the beginning of the spring term the orphans were transferred to the Seventeenth Street School, where I was going, and three of the orphans were in the room with mc in the sixth grade. The transfer was made because of a change in the boundary line of the school districts. My Grandmother was elected to the Board because she enjoyed Boards, Committees, and the meetings of associations, and a former member of the Board had died at about that time."|"Collected Stories"|"Carson McCullers"
"ap 01:00"|one|"They had turned off the heat an hour before and the apartment was beginning to chill. She looked at the clock, the hands of which pointed to one. Not much heat anyway at that hour, she thought. No draughts, though; opalescent ribbons of smoke lay motionless close to the ceiling. Speculatively her glance shifted to the whiskey bottle and the confused chessmen on the card table. To a book that lay face downward on the floor—and a lettuce leaf lying forlornly in the corner since Marshall had lost it while waving his sandwich. To the dead little butts of cigarettes and the charred matches scattered."|"Collected Stories"|"Carson McCullers"
"ap 04:00"|"four o'clock"|"We would talk about our brother too. Dan's seventeen years old and was planning to take the co-op course at Tech in the fall. Dan had gotten older by this summer. One night he came in at four o'clock and he'd been drinking. Dad sure had it in for him the next week. So he hiked out to the country and camped with some boys for a few days. He used to talk to me and Sis about diesel motors and going away to South America and all that, but by this summer he was quiet and not saying much to anybody in the family. Dan's real tall and thin as a rail. He has bumps on his face now and is clumsy and not very good looking. At nights sometimes I know he wanders all around by himself, maybe going out beyond the city limits sign into the pine woods."|"Collected Stories"|"Carson McCullers"
"ap 01:30"|one-thirty|"""It's one-thirty, Marian,"" she said. ""You ought to get in before this."""|"Collected Stories"|"Carson McCullers"
"ap 23:55"|"five minutes of twelve"|"""Aren't you a little early?"" he asked, glancing at the clock on the mantelpiece that had pointed to five minutes of twelve for a month. ""Josef's in here. We're running over a little sonatina by someone he knows."""|"Collected Stories"|"Carson McCullers"
"ap 08:00"|eight|"That morning, after she had practiced from six until eight, her dad had made her sit down at the table with the family for breakfast. She hated breakfast; it gave her a sick feeling afterward. She would rather wait and get four chocolate bars with her twenty cents lunch money and munch them during school—bringing up little morsels from her pocket under cover of her handkerchief, stopping dead when the silver paper rattled. But this morning her dad had put a fried egg on her plate and she had known that if it burst—so that the slimy yellow oozed over the white—she would cry. And that had happened. The same feeling was upon her now. Gingerly she laid the magazine back on the table and closed her eyes."|"Collected Stories"|"Carson McCullers"
"ap 00:00"|twelve|"A Wunderkind —a Wunderkind. That was what Mister Bilderbach had called her when, at twelve, she first came to him. Older pupils had repeated the word."|"Collected Stories"|"Carson McCullers"
05:00|"five o'clock in the morning"|"In August of the year 1935 a Jew sat alone on one of the rear seats of a bus headed south. It was late afternoon and the Jew had been travelling since five o'clock in the morning. That is to say he had left New York at daybreak and except for a number of necessary brief stops he had been waiting patiently on his rear seat for the time when he would reach his destination. Behind him was the great city—that marvel of immensity and intricate design. And the Jew, who had set out at such an early hour on this journey, carried in him a last memory of a city strangely hollow and unreal. As the sun was rising he had walked alone in the unpeopled streets. As far ahead as he could see there were the skyscrapers, pastel mauve and yellow in color, clear and sharp as stalactites against the sky. He had listened to the sound of his own quiet footsteps and for the first time in that city he had heard on the streets the clear articulation of a single human voice. But even then there was the feeling of the multitude, some subtle warning of the raucous fury of the hours soon to come, the turmoil, the constant struggles around closing subway doors, the vast roaring of the city day. Such then was his last impression of the place he had left behind him. And now before him was the South."|"Collected Stories"|"Carson McCullers"
"ap 07:00"|"seven o'clock"|"At seven o'clock the long summer twilight had just begun. After a day of glare and heat the sky was now tempered to a restful greenish blue. The bus wound along a dusty unpaved road, flanked by deep fields of cotton. It was here that a halt was made to pick up a new passenger—a young man carrying a brand new cheap tin suitcase. After a moment of awkward hesitation the young man sat down beside the Jew."|"Collected Stories"|"Carson McCullers"
"ap 11:00"|"eleven o'clock"|"For a long time the Jew sat tense in his seat and rubbed his forehead. Then at eleven o'clock the bus made a scheduled stop. By turns the passengers hastily visited a cramped, stale urinal. Later in a café they gulped down drinks and ordered food that could be carried away and eaten with the hands. He had a beer and on his return to the bus prepared for sleep. He took from his pocket a fresh, unfolded handkerchief and, settling himself in his corner with his head resting in the crotch made by the side of the bus and the rounded back of his seat, he placed the handkerchief over his eyes to guard them from the light. He rested quietly with his legs crossed and his hands clasped loosely in his lap. By midnight he was sleeping."|"Collected Stories"|"Carson McCullers"
00:00|midnight|"For a long time the Jew sat tense in his seat and rubbed his forehead. Then at eleven o'clock the bus made a scheduled stop. By turns the passengers hastily visited a cramped, stale urinal. Later in a café they gulped down drinks and ordered food that could be carried away and eaten with the hands. He had a beer and on his return to the bus prepared for sleep. He took from his pocket a fresh, unfolded handkerchief and, settling himself in his corner with his head resting in the crotch made by the side of the bus and the rounded back of his seat, he placed the handkerchief over his eyes to guard them from the light. He rested quietly with his legs crossed and his hands clasped loosely in his lap. By midnight he was sleeping."|"Collected Stories"|"Carson McCullers"
00:00|midnight|"The young man at the table of the station lunch room knew neither the name nor the location of the town where he was, and he had no knowledge of the hour more exact than that it was some time between midnight and morning. He realized that he must already be in the south, but that there were many more hours journeying before he would reach home. For a long time he had sat at the table over a half finished bottle of beer, relaxed to a gangling position—with his thighs fallen loose apart and with one foot stepping on the other ankle. His hair needed cutting and hung down softly ragged over his forehead and his expression as he stared down at the table was absorbed, but mobile and quick to change with his shifting thoughts. The face was lean and suggestive of restlessness and a certain innocent, naked questioning. On the floor beside the boy were two suitcases and a packing box, each tagged neatly with a card on which was typewritten his name—Andrew Leander, and an address in one of the larger towns in Georgia."|"Collected Stories"|"Carson McCullers"
"ap ~ 00:00"|"about twelve"|"He was about twelve when the family got a radio and after that things began to change. They began to dial to symphony orchestras and programmes that were very different from the ones they had listened to before. In a way this music was strange to them and again it was like something they had been waiting for all of their lives. Then their Dad gave them a portable Victrola one Christmas and some Italian opera records. Over and over they would wind up their Victrola and finally they wore the records out—there began to be scratching noises in the music and the singers sounded like they were holding their noses. The next year they got some Wagner and Beethoven."|"Collected Stories"|"Carson McCullers"
"ap 10:00"|"ten o'clock"|"The truth came to him very suddenly, and the truth made everything perfectly clear, or at least clarified the situation. Mr. Brook had come home early and lighted a fire in the little grate in his sitting room. He felt comfortable and at peace that evening. He sat before the fire in his stocking feet, with a volume of William Blake on the table by his side, and he had poured himself a half-glass of apricot brandy. At ten o'clock he was drowsing cozily before the fire, his mind full of cloudy phrases of Mahler and floating half-thoughts. Then all at once, out of this delicate stupor, four words came to his mind: ""The King of Finland."" The words seemed familiar, but for the first moment he could not place them. Then all at once he tracked them down. He had been walking across the campus that afternoon when Madame Zilensky stopped him and began some preposterous rigmarole, to which he had only half listened; he was thinking about the stack of canons turned in by his counterpoint class. Now the words, the inflections of her voice, came back to him with insidious exactitude. Madame Zilensky had started off with the following remark: ""One day, when I was standing in front of a 
pâtisserie, the King of Finland came by in a sled."""|"Collected Stories"|"Carson McCullers"
"< 00:00"|"almost midnight"|"Mr. Brook finished off the rest of the brandy. And slowly, when it was almost midnight, a further understanding came to him. The reason for the lies of Madame Zilensky was painful and plain. All her life long Madame Zilensky had worked—at the piano, teaching, and writing those beautiful and immense twelve symphonies. Day and night she had drudged and struggled and thrown her soul into her work, and there was not much of her left over for anything else. Being human, she suffered from this lack and did what she could to make up for it. If she passed the evening bent over a table in the library and later declared that she had spent that time playing cards, it was as though she had managed to do both those things. Through the lies, she lived vicariously. The lie doubled the little of her existence that was left over from work and augmented the little rag end of her personal life."|"Collected Stories"|"Carson McCullers"
"ap 02:00"|"two o'clock"|"Later on he brushed his teeth and got into his pajamas. He must be practical. What did this clear up? That French, the Pole with the piccolo, Bagdad? And the children, Sigmund, Boris, and Sammy—who were they? Were they really her children after all, or had she simply rounded them up from somewhere? Mr. Brook polished his spectacles and put them on the table by his bed. He must come to an immediate understanding with her. Otherwise, there would exist in the department a situation which could become most problematical. It was two o'clock. He glanced out of his window and saw that the light in Madame Zilensky's workroom was still on. Mr. Brook got into bed, made terrible faces in the dark, and tried to plan what he would say next day."|"Collected Stories"|"Carson McCullers"
"ap 08:00"|"eight o'clock"|"Mr. Brook was in his office by eight o'clock. He sat hunched up behind his desk, ready to trap Madame Zilensky as she passed down the corridor. He did not have to wait long, and as soon as he heard her footsteps he called out her name."|"Collected Stories"|"Carson McCullers"
"ap 06:00"|"six o'clock"|"It was still raining outside in the street: a mild, gray, endless rain. The mill whistle blew for the six o'clock shift and the three spinners paid and went away. There was no one in the café but Leo, the old man, and the little paper boy."|"Collected Stories"|"Carson McCullers"
01:00|"one this morning"|"The twilight border between sleep and waking was a Roman one this morning: splashing fountains and arched, narrow streets, the golden lavish city of blossoms and age-soft stone. Sometimes in this semi-consciousness he sojourned again in Paris, or war German rubble, or Swiss skiing and a snow hotel. Sometimes, also, in a fallow Georgia field at hunting dawn. Rome it was this morning in the yearless region of dreams."|"Collected Stories"|"Carson McCullers"
"ap 11:00"|"eleven o'clock"|"Ferris poured himself a drink, although it was not yet eleven o'clock. He sprawled out in an armchair like a man exhausted, nursing his glass of bourbon and water. He had a full day ahead of him as he was leaving by plane the next morning for Paris. He checked over his obligations: take luggage to Air France, lunch with his boss, buy shoes and an overcoat. And something—wasn't there something else? Ferris finished his drink and opened the telephone directory."|"Collected Stories"|"Carson McCullers"
00:00|midnight|"At midnight Ferris was in a taxi crossing Paris. It was a clouded night and mist wreathed the lights of the Place de la Concorde. The midnight bistros gleamed on the wet pavements. As always after a transocean flight the change of continents was too sudden. New York at morning, this midnight Paris. Ferris glimpsed the disorder of his life: the succession of cities, of transitory loves; and time, the sinister glissando of the years, time always."|"Collected Stories"|"Carson McCullers"
"ap 07:00"|"seven o'clock"|"""It's because you don't have television. We put on our TV at seven o'clock and it stays on all day and night until we go to bed. Whether anybody's in the living room or not. There're plays and skits and gags going on continually."""|"Collected Stories"|"Carson McCullers"
"ap 04:00"|"four o'clock"|"All afternoon Ken Harris had been sitting before a blank page of the typewriter. It was winter and snowing. The snow muted traffic and the Village apartment was so quiet that the alarm clock bothered him. He worked in the bedroom as the room with his wife's things calmed him and made him feel less alone. His prelunch drink (or was it an eye opener?) had been dulled by the can of chili con carne he had eaten alone in the kitchen. At four o'clock he put the clock in the clothes hamper, then returned to the typewriter. The paper was still blank and the white page blanched his spirit. Yet there was a time (how long ago?) when a song at the corner, a voice from childhood, and the panorama of memory condensed the past so that the random and actual were transfigured into a novel, a story—there was a time when the empty page summoned and sorted memory and he felt that ghostly mastery of his art. A time, in short, when he was a writer and writing almost every day. Working hard, he carefully broke the backs of sentences, x'd out offending phrases and changed repeated words. Now he sat there, hunched and somehow fearful, a blond man in his late thirties, with circles under his oyster blue eyes and a full, pale mouth. It was the scalding wind of his Texas childhood he was thinking about as he gazed out of his window at the New York falling snow. Then suddenly a valve of memory opened and he said the words as he typed them:"|"Collected Stories"|"Carson McCullers"
"ap 06:00"|"six o'clock"|"Who has seen the wind?
 Neither you nor I;
 But when the trees bow down their heads
 The wind is passing by.The nursery verse seemed to him so sinister that as he sat thinking about it the sweat of tension dampened his palms. He jerked the page from the typewriter and, tearing it into many pieces, let it fall in the wastepaper basket. He was relieved that he was going to a party at six o'clock, glad to quit the silent apartment, the torn verse, and to walk in the cold but comforting street."|"Collected Stories"|"Carson McCullers"
12:00|noon|"He saw his wife enter from the vestibule. Marian was tall and slim with straight, short black hair, and she was wearing a plain black dress, an office-looking dress without ornament. They had married thirteen years ago, the year The Night had come out, and for a long time he had trembled with love. There were times he awaited her with the soaring wonder of the lover and the sweet trembling when at last he saw her. Those were the times when they made love almost every night and often in the early morning. That first year she had even occasionally come home from the office at her lunch hour and they had loved each other naked in the city daylight. At last desire had steadied and love no longer made his body tremble. He was working on a second book and the going was rough. Then he got a Guggenheim and they had gone to Mexico, as the war was on in Europe. His book was abandoned and, although the flush of success was still on him, he was unsatisfied. He wanted to write, to write, to write—but month after month passed and he wrote nothing. Marian said he was drinking too much and marking time and he threw a glass of rum in her face. Then he knelt on the floor and cried. He was for the first time in a foreign country and the time was automatically valuable because it was a foreign country. He would write of the blue of the noon sky, the Mexican shadows, the water-fresh mountain air. But day followed day—always of value because it was a foreign country—and he wrote nothing. He did not even learn Spanish, and it annoyed him when Marian talked to the cook and other Mexicans. (It was easier for a woman to pick up a foreign language and besides she knew French.) And the very cheapness of Mexico made life expensive; he spent money like trick money or stage money and the Guggenheim check was always spent in advance. But he was in a foreign country and sooner or later the Mexican days would be of value to him as a writer. Then a strange thing happened after eight months: with practically no warning Marian took a plane to New York. He had to interrupt his Guggenheim year to follow her. And then she would not live with him—or let him live in her apartment. She said it was like living with twenty Roman emperors rolled into one and she was through. Marian got a job as an assistant fiction editor on a fashion magazine and he lived in a cold-water flat—their marriage had failed and they were separated, although he still tried to follow her around. The Guggenheim people would not renew his fellowship and he soon spent the advance on his new book."|"Collected Stories"|"Carson McCullers"
"> 00:00"|"after midnight"|"The stranger hurried to the other side of the street, his brief case bouncing against his knees as he moved. Ken reached home after midnight."|"Collected Stories"|"Carson McCullers"
"ap 03:00"|"three o'clock"|"After a while he called the places he thought she might be, accused friends of interfering with their marriage or of hiding Marian ... When he called Mabel Goodley he had forgotten the episode of the early evening and he said he wanted to come around to see her. When she said it was three o'clock and she had to get up in the morning he asked what friends were for if not for times like this. And he accused her of hiding Marian, of interfering with their marriage and of being in cahoots with the evil psychiatrist..."|"Collected Stories"|"Carson McCullers"
"< 00:00"|"toward midnight"|"It was toward midnight on a soft quiet evening in April. The sky was the color of a blue swamp iris, the moon clear and bright. The crops that spring promised well and in the past weeks the mill had run a night shift. Down by the creek the square brick factory was yellow with light, and there was the faint, steady hum of the looms. It was such a night when it is good to hear from faraway, across the dark fields, the slow song of a Negro on his way to make love. Or when it is pleasant to sit quietly and pick up a guitar, or simply to rest alone and think of nothing at all. The street that evening was deserted, but Miss Amelia's store was lighted and on the porch outside there were five people. One of these was Stumpy MacPhail, a foreman with a red face and dainty, purplish hands. On the top step were two boys in overalls, the Rainey twins—both of them lanky and slow, with white hair and sleepy green eyes. The other man was Henry Macy, a shy and timid person with gentle manners and nervous ways, who sat on the edge of the bottom step. Miss Amelia herself stood leaning against the side of the open door, her feet crossed in their big swamp boots, patiently untying knots in a rope she had come across. They had not talked for a long time."|"Collected Stories"|"Carson McCullers"
00:00|midnight|"It was not a common thing to have an unknown hunchback walk to the store at midnight and then sit down and cry. Miss Amelia rubbed back her hair from her forehead and the men looked at each other uncomfortably. All around the town was very quiet."|"Collected Stories"|"Carson McCullers"
