00:00|midnight|"The whisky they drank that evening (two big bottles of it) is important. Otherwise, it would be hard to account for what followed. Perhaps without it there would never have been a café. For the liquor of Miss Amelia has a special quality of its own. It is clean and sharp on the tongue, but once down a man it glows inside him for a long time afterward. And that is not all. It is known that if a message is written with lemon juice on a clean sheet of paper there will be no sign of it. But if the paper is held for a moment to the fire then the letters turn brown and the meaning becomes clear. Imagine that the whisky is the ñre and that the message is that which is known only in the soul of a man—then the worth of Miss Amelia's liquor can be understood. Things that have gone unnoticed, thoughts that have been harbored far back in the dark mind, are suddenly recognized and comprehended. A spinner who has thought only of the loom, the dinner pail, the bed, and then the loom again—this spinner might drink some on a Sunday and come across a marsh lily. And in his palm he might hold this flower, examining the golden dainty cup, and in him suddenly might come a sweetness keen as pain. A weaver might look up suddenly and see for the first time the cold, weird radiance of midnight January sky, and a deep fright at his own smallness stop his heart. Such things as these, then, happen when a man has drunk Miss Amelia's liquor. He may suffer, or he may be spent with joy—but the experience has shown the truth; he has warmed his soul and seen the message hidden there."|"Collected Stories"|"Carson McCullers"
"> 00:00"|"past midnight"|"They drank until it was past midnight, and the moon was clouded over so that the night was cold and dark. The hunchback still sat on the bottom steps, bent over miserably with his forehead resting on his knee. Miss Amelia stood with her hands in her pockets, one foot resting on the second step of the stairs. She had been silent for a long time. Her face had the expression often seen in slightly cross-eyed persons who are thinking deeply, a look that appears to be both very wise and very crazy. At last she said: ""I don't know your name."""|"Collected Stories"|"Carson McCullers"
12:00|noon|"Miss Amelia came down at about dawn, as usual. She washed her head at the pump and very shortly set about her business. Later in the morning she saddled her mule and went to see about her property, planted with cotton, up near the Forks Falls Road. By noon, of course, everybody had heard about the hunchback who had come to the store in the middle of the night. But no one as yet had seen him. The day soon grew hot and the sky was a rich, midday blue. Still no one had laid an eye on this strange guest. A few people remembered that Miss Amelia's mother had had a half-sister—but there was some difference of opinion as to whether she had died or had run off with a tobacco stringer. As for the hunchback's claim, everyone thought it was a trumped-up business. And the town, knowing Miss Amelia, decided that surely she had put him out of the house after feeding him. But toward evening, when the sky had whitened, and the shift was done, a woman claimed to have seen a crooked face at the window of one of the rooms up over the store. Miss Amelia herself said nothing. She clerked in the store for a while, argued for an hour with a farmer over a plow shaft, mended some chicken wire, locked up near sundown, and went to her rooms. The town was left puzzled and talkative."|"Collected Stories"|"Carson McCullers"
12:00|midday|"Miss Amelia came down at about dawn, as usual. She washed her head at the pump and very shortly set about her business. Later in the morning she saddled her mule and went to see about her property, planted with cotton, up near the Forks Falls Road. By noon, of course, everybody had heard about the hunchback who had come to the store in the middle of the night. But no one as yet had seen him. The day soon grew hot and the sky was a rich, midday blue. Still no one had laid an eye on this strange guest. A few people remembered that Miss Amelia's mother had had a half-sister—but there was some difference of opinion as to whether she had died or had run off with a tobacco stringer. As for the hunchback's claim, everyone thought it was a trumped-up business. And the town, knowing Miss Amelia, decided that surely she had put him out of the house after feeding him. But toward evening, when the sky had whitened, and the shift was done, a woman claimed to have seen a crooked face at the window of one of the rooms up over the store. Miss Amelia herself said nothing. She clerked in the store for a while, argued for an hour with a farmer over a plow shaft, mended some chicken wire, locked up near sundown, and went to her rooms. The town was left puzzled and talkative."|"Collected Stories"|"Carson McCullers"
00:00|midnight|"He said this in a calm voice, as a statement of fact. And within an hour the news had swept through the town. It was a fierce and sickly tale the town built up that day. In it were all the things which cause the heart to shiver—a hunchback, a midnight burial in the swamp, the dragging of Miss Amelia through the streets of the town on the way to prison, the squabbles over what would happen to her property—all told in hushed voices and repeated with some fresh and weird detail. It rained and women forgot to bring in the washing from the lines. One or two mortals, who were in debt to Miss Amelia, even put on Sunday clothes as though it were a holiday. People clustered together on the main street, talking and watching the store."|"Collected Stories"|"Carson McCullers"
"ap 08:00"|eight|"The clocks in the town struck eight. Still nothing had happened. The bleak night, after the gruesome talk of the day, put a fear in some people, and they stayed home close to the fire. Others were gathered in groups together. Some eight or ten men had convened on the porch of Miss Amelia's store. They were silent and were indeed just waiting about. They themselves did not know what they were waiting for, but it was this: in times of tension, when some great action is impending, men gather and wait in this way. And after a time there will come a moment when all together they will act in unison, not from thought or from the will of any one man, but as though their instincts had merged together so that the decision belongs to no single one of them, but to the group as a whole. At such a time no individual hesitates. And whether the matter will be settled peaceably, or whether the joint action will result in ransacking, violence, and crime, depends on destiny. So the men waited soberly on the porch of Miss Amelia's store, not one of them realizing what they would do, but knowing inwardly that they must wait, and that the time had almost come."|"Collected Stories"|"Carson McCullers"
20:00|"eight o'clock that evening"|"Now the door to the store was open. Inside it was bright and natural-looking. To the left was the counter where slabs of white meat, rock candy, and tobacco were kept. Behind this were shelves of salted white meat and meal. The right side of the store was mostly filled with farm implements and such. At the back of the store, to the left, was the door leading up the stairs, and it was open. And at the far right of the store there was another door which led to a little room that Miss Amelia called her office. This door was also open. And at eight o'clock that evening Miss Amelia could be seen there sitting before her rolltop desk, figuring with a fountain pen and some pieces of paper."|"Collected Stories"|"Carson McCullers"
"ap 10:00"|"ten o'clock"|"She came out that evening at ten o'clock. And those who were expecting some drama at her entrance were disappointed. She opened the door and walked in with her slow, gangling swagger. There was a streak of ink on one side of her nose, and she had knotted the red handkerchief about her neck. She seemed to notice nothing unusual. Her gray, crossed eyes glanced over to the place where the hunchback was sitting, and for a moment lingered there. The rest of the crowd in her store she regarded with only a peaceable surprise."|"Collected Stories"|"Carson McCullers"
00:00|midnight|"This opening of the café came to an end at midnight. Everyone said good-bye to everyone else in a friendly fashion. Miss Amelia shut the front door of her premises, but forgot to bolt it. Soon everything—the main street with its three stores, the mill, the houses—ail the town, in fact—was dark and silent. And so ended three days and nights in which had come an arrival of a stranger, an unholy holiday, and the start of the café."|"Collected Stories"|"Carson McCullers"
"ap 00:00"|"twelve o'clock"|"Now time must pass. For the next four years are much alike. There are great changes, but these changes are brought about bit by bit, in simple steps which in themselves do not appear to be important. The hunchback continued to live with Miss Amelia. The café expanded in a gradual way. Miss Amelia began to sell her liquor by the drink, and some tables were brought into the store. There were customers every evening, and on Saturday a great crowd. Miss Amelia began to serve fried catfish suppers at fifteen cents a plate. The hunchback cajoled her into buying a fine mechanical piano. Within two years the place was a store no longer, but had been converted into a proper café, open every evening from six until twelve o'clock."|"Collected Stories"|"Carson McCullers"
"ap 11:00"|"eleven o'clock"|"They were wrong. The young boys who watched through the window on that night said that this is what actually happened: The bride and groom ate a grand supper prepared by Jeff, the old Negro who cooked for Miss Amelia. The bride took second servings of everything, but the groom picked with his food. Then the bride went about her ordinary business—reading the newspaper, finishing an inventory of the stock in the store, and so forth. The groom hung about in the doorway with a loose, foolish, blissful face and was not noticed. At eleven o'clock the bride took a lamp and went upstairs. The groom followed close behind her. So far all had gone decently enough, but what followed after was unholy."|"Collected Stories"|"Carson McCullers"
"< 12:00"|"toward noon"|"A groom is in a sorry fix when he is unable to bring his well-beloved bride to bed with him, and when the whole town knows it. Marvin Macy came down that day still in his wedding finery, and with a sick face. God knows how he had spent the night. He moped about the yard, watching Miss Amelia, but keeping some distance away from her. Then toward noon an idea came to him and he went off in the direction of Society City. He returned with presents—an opal ring, a pink enamel doreen of the sort which was then in fashion, a silver bracelet with two hearts on it, and a box of candy which had cost two dollars and a half. Miss Amelia looked over these fine gifts and opened the box of candy, for she was hungry. The rest of the presents she judged shrewdly for a moment to sum up their value—then she put them in the counter out for sale. The night was spent in much the same manner as the preceding one—except that Miss Amelia brought her feather mattress to make a pallet by the kitchen stove, and she slept fairly well."|"Collected Stories"|"Carson McCullers"
12:00|noon|"So let the slow years pass and come to a Saturday evening six years after the time when Cousin Lymon came first to the town. It was August and the sky had burned above the town like a sheet of flame all day. Now the green twilight was near and there was a feeling of repose. The street was coated an inch deep with dry golden dust and the little children ran about half-naked, sneezed often, sweated, and were fretful. The mill had closed down at noon. People in the houses along the main street sat resting on their steps and the women had palmetto fans. At Miss Amelia's there was a sign at the front of the premises saying 
CAFÉ. The back porch was cool with latticed shadows and there Cousin Lymon sat turning the ice-cream freezer—often he unpacked the salt and ice and removed the dasher to lick a bit and see how the work was coming on. Jeff cooked in the kitchen. Early that morning Miss Amelia had put a notice on the wall of the front porch reading: Chicken Dinner—Twenty Cents Tonite. The café was already open and Miss Amelia had just finished a period of work in her office. All the eight tables were occupied and from the mechanical piano came a jingling tune."|"Collected Stories"|"Carson McCullers"
00:00|midnight|"It was a typical Saturday night. An old couple who had come in from the country hesitated for a moment at the doorway, holding each other's hand, and finally decided to come inside. They had lived together so long, this old country couple, that they looked as similar as twins. They were brown, shriveled, and like two little walking peanuts. They left early, and by midnight most of the other customers were gone. Rosser Cline and Merlie Ryan still played checkers, and Stumpy MacPhail sat with a liquor bottle on his table (his wife would not allow it in the home) and carried on peaceable conversations with himself. Henry Macy had not yet gone away, and this was unusual, as he almost always went to bed soon after nightfall. Miss Amelia yawned sleepily, but Lymon was restless and she did not suggest that they close up for the night."|"Collected Stories"|"Carson McCullers"
"ap 01:00"|"one o'clock"|"Finally, at one o'clock, Henry Macy looked up at the corner of the ceiling and said quietly to Miss Amelia: ""I got a letter today."""|"Collected Stories"|"Carson McCullers"
"> 00:00"|"after midnight"|"There is one particular reason why this winter is remembered and sdll talked about. A great thing happened. People woke up on the second of January and found the whole world about them altogether changed. Little ignorant children looked out of the windows, and they were so puzzled that they began to cry. Old people harked back and could remember nothing in these parts to equal the phenomenon. For in the night it had snowed. In the dark hours after midnight the dim flakes started falling softly on the town. By dawn the ground was covered, and the strange snow banked the ruby windows of the church, and whitened the roofs of the houses. The snow gave the town a drawn, bleak look. The two-room houses near the mill were dirty, crooked, and seemed about to collapse, and somehow everything was dark and shrunken. But the snow itself—there was a beauty about it few people around here had ever known before. The snow was not white, as Northerners had pictured it to be; in the snow there were soft colors of blue and silver, the sky was a gentle shining gray. And the dreamy quietness of falling snow—when had the town been so silent?"|"Collected Stories"|"Carson McCullers"
"ap 06:00"|"six o'clock"|"Miss Amelia did not intend to serve a dinner. But when, at six o'clock, there was the sound of footsteps on the porch she opened the front door cautiously. It was Henry Ford Crimp, and though there was no food, she let him sit at a table and served him a drink. Others came. The evening was blue, bitter, and though the snow fell no longer there was a wind from the pine trees that swept up delicate flurries from the ground. Cousin Lymon did not come until after dark, with him Marvin Macy, and he carried his tin suitcase and his guitar."|"Collected Stories"|"Carson McCullers"
"ap 10:00"|"ten o'clock"|"The fight took place on Ground Hog Day, which is the second of February. The weather was favorable, being neither rainy nor sunny, and with a neutral temperature. There were several signs that this was the appointed day, and by ten o'clock the news spread all over the county. Early in the morning Miss Amelia went out and cut down her punching bag. Marvin Macy sat on the back step with a tin can of hog fat between his knees and carefully greased his arms and his legs. A hawk with a bloody breast flew over the town and circled twice around the property of Miss Amelia. The tables in the café were moved out to the back porch, so that the whole big room was cleared for the fight. There was every sign. Both Miss Amelia and Marvin Macy ate four helpings of half-raw roast for dinner, and then lay down in the afternoon to store up strength. Marvin Macy rested in the big room upstairs, while Miss Amelia stretched herself out on the bench in her office. It was plain from her white stiff face what a torment it was for her to be lying still and doing nothing, but she lay there quiet as a corpse with her eyes closed and her hands crossed on her chest."|"Collected Stories"|"Carson McCullers"
17:30|"five-thirty o'clock in the afternoon"|"Cousin Lymon finished his painting at five-thirty o'clock in the afternoon. The day had turned colder and there was a wet taste in the air. The wind came up from the pinewoods, rattling windows, blowing an old newspaper down the road until at last it caught upon a thorn tree. People began to come in from the country; packed automobiles that bristled with the poked-out heads of children, wagons drawn by old mules who seemed to smile in a weary, sour way and plodded along with their tired eyes half-closed. Three young boys came from Society City. All three of them wore yellow rayon shirts and caps put on backward—they were as much alike as triplets, and could always be seen at cockfights and camp meetings. At six o'clock the mill whistle sounded the end of the day's shift and the crowd was complete. Naturally, among the newcomers there were some riffraff, unknown characters, and so forth—but even so the gathering was quiet. A hush was on the town and the faces of people were strange in the fading light. Darkness hovered softly; for a moment the sky was a pale clear yellow against which the gables of the church stood out in dark and bare outline, then the sky died slowly and the darkness gathered into night."|"Collected Stories"|"Carson McCullers"
"ap 06:00"|"six o'clock"|"Cousin Lymon finished his painting at five-thirty o'clock in the afternoon. The day had turned colder and there was a wet taste in the air. The wind came up from the pinewoods, rattling windows, blowing an old newspaper down the road until at last it caught upon a thorn tree. People began to come in from the country; packed automobiles that bristled with the poked-out heads of children, wagons drawn by old mules who seemed to smile in a weary, sour way and plodded along with their tired eyes half-closed. Three young boys came from Society City. All three of them wore yellow rayon shirts and caps put on backward—they were as much alike as triplets, and could always be seen at cockfights and camp meetings. At six o'clock the mill whistle sounded the end of the day's shift and the crowd was complete. Naturally, among the newcomers there were some riffraff, unknown characters, and so forth—but even so the gathering was quiet. A hush was on the town and the faces of people were strange in the fading light. Darkness hovered softly; for a moment the sky was a pale clear yellow against which the gables of the church stood out in dark and bare outline, then the sky died slowly and the darkness gathered into night."|"Collected Stories"|"Carson McCullers"
"ap 07:00"|"seven o'clock"|"Seven is a popular number, and especially it was a favorite with Miss Amelia. Seven swallows of water for hiccups, seven runs around the millpond for cricks in the neck, seven doses of Amelia Miracle Mover as a worm cure—her treatment nearly always hinged on this number. It is a number of mingled possibilities, and all who love mystery and charms set store by it. So the fight was to take place at seven o'clock. This was known to everyone, not by announcement or words, but understood in the unquestioning way that rain is understood, or an evil odor from the swamp. So before seven o'clock everyone gathered gravely around the property of Miss Amelia. The cleverest got into the café itself and stood lining the walls of the room. Others crowded onto the front porch, or took a stand in the yard."|"Collected Stories"|"Carson McCullers"
"ap 06:59"|"one minute to seven o'clock"|"Miss Amelia and Marvin Macy had not yet shown themselves. Miss Amelia, after resting all afternoon on the office bench, had gone upstairs. On the other hand Cousin Lymon was at your elbow every minute, threading his way through the crowd, snapping his fingers nervously, and batting his eyes. At one minute to seven o'clock he squirmed his way into the café and climbed up on the counter. All was very quiet."|"Collected Stories"|"Carson McCullers"
"ap 07:00"|seven|"It must have been arranged in some manner beforehand. For just at the stroke of seven Miss Amelia showed herself at the head of the stairs. At the same instant Marvin Macy appeared in front of the café and the crowd made way for him silently. They walked toward each other with no haste, their fists already gripped, and their eyes like the eyes of dreamers. Miss Amelia had changed her red dress for her old overalls, and they were rolled up to the knees. She was barefooted and she had an iron strengthband around her right wrist. Marvin Macy had also rolled his trouser legs—he was naked to the waist and heavily greased; he wore the heavy shoes that had been issued him when he left the penitentiary. Stumpy MacPhail stepped forward from the crowd and slapped their hip pockets with the palm of his right hand to make sure there would be no sudden knives. They were alone in the cleared center of the bright café."|"Collected Stories"|"Carson McCullers"
12:00|noon|"It happened that green and crazy summer when Frankie was twelve years old. This was the summer when for a long time she had not been a member. She belonged to no club and was a member of nothing in the world. Frankie had become an unjoined person who hung around in doorways, and she was afraid. In June the trees were bright dizzy green, but later the leaves darkened, and the town turned black and shrunken under the glare of the sun. At first Frankie walked around doing one thing and another. The sidewalks of the town were gray in the early morning and at night, but the noon sun put a glaze on them, so that the cement burned and glittered like glass. The sidewalks finally became too hot for Frankie's feet, and also she got herself in trouble. She was in so much secret trouble that she thought it was better to stay at home—and at home there was only Berenice Sadie Brown and John Henry West. The three of them sat at the kitchen table, saying the same things over and over, so that by August the words began to rhyme with each other and sound strange. The world seemed to die each afternoon and nothing moved any longer. At last the summer was like a green sick dream, or like a silent crazy jungle under glass. And then, on the last Friday of August, all this was changed: it was so sudden that Frankie puzzled the whole blank afternoon, and still she did not understand."|"Collected Stories"|"Carson McCullers"
16:00|"four o'clock in the afternoon"|"Frankie herself almost admitted maybe so. It was four o'clock in the afternoon and the kitchen was square and gray and quiet. Frankie sat at the table with her eyes half closed, and she thought about a wedding. She saw a silent church, a strange snow slanting down against the colored windows. The groom in this wedding was her brother, and there was a brightness where his face should be. The bride was there in a long white train, and the bride also was faceless. There was something about this wedding that gave Frankie a feeling she could not name."|"Collected Stories"|"Carson McCullers"
"ap 05:45"|"quarter to six"|"The clock ticked very slowly on the shelf above the stove, and it was only quarter to six. The glare outside the window was still hard and yellow and bright. In the back yard the shade beneath the arbor was black and solid. Nothing moved. From somewhere far away came the sound of whistling, and it was a grieving August song that did not end. The minutes were very long."|"Collected Stories"|"Carson McCullers"
"ap 11:00"|"eleven o'clock"|"Frankie sat on the bottom step of the stairs to her room, staring into the kitchen. But although it gave her a kind of a pain, she had to think about the wedding. She remembered the way her brother and the bride had looked when she walked into the living room, that morning at eleven o'clock. There had been in the house a sudden silence, for Jarvis had turned off the radio when they came in; after the long summer, when the radio had gone on day and night, so that no one heard it any more, the curious silence had startled Frankie. She stood in the doorway, coming from the hall, and the first sight of her brother and the bride had shocked her heart. Together they made in her this feeling that she could not name. But it was like the feelings of the spring, only more sudden and more sharp. There was the same tightness and in the same queer way she was afraid. Frankie thought until her mind was dizzy and her foot had gone to sleep."|"Collected Stories"|"Carson McCullers"
"ap 06:00"|"six o'clock"|"While Frankie was thinking, Berenice had changed into her Sunday clothes, and now she sat reading a magazine. She was waiting for the people who were due to meet her at six o'clock, Honey and T. T. Williams; the three of them were going to eat supper at the New Metropolitan Tea Room and sashay together around the town. As Berenice read, she moved her lips to shape each word. Her dark eye looked up as Frankie spoke, but, since Berenice did not raise her head, the blue glass eye seemed to go on reading the magazine. This two-sighted expression bothered Frankie."|"Collected Stories"|"Carson McCullers"
