"ap 10:00"|"ten o'clock"|"She said: ""Farewell, old ugly house,"" as, wearing a dotted Swiss dress and carrying the suitcase, she passed through the hall at quarter to six. The wedding dress was in the suitcase, ready to be put on when she reached Winter Hill. At that still hour the sky was the dim silver of a mirror, and beneath it the gray town looked, not like a real town, but like an exact reflection of itself, and to this unreal town she also said farewell. The bus left the station at ten past six—and she sat proud, like an accustomed traveler, apart from her father, John Henry, and Berenice. But after a while a serious doubt came in her, which even the answers of the bus-driver could not quite satisfy. They were supposed to be traveling north, but it seemed to her rather that the bus was going south instead. The sky turned burning pale and the day blazed. They passed the fields of windless corn that had a blue look in the glare, red-furrowed cotton land, stretches of black pine woods. And mile by mile the countryside became more southern. The towns they passed—New City, Leeville, Cheehaw—each town seemed smaller than the one before, until at nine o'clock they reached the ugliest place of all, where they changed busses, called Flowering Branch. Despite its name there were no flowers and no branch—only a solitary country store, with a sad old shredded circus poster on the clapboard wall and a chinaberry tree beneath which stood an empty wagon and a sleeping mule. There they waited for the bus to Sweet Well, and, still doubting anxiously, Frances did not despise the box of lunch that had so shamed her at the first, because it made them look like family people who do not travel very much. The bus left at ten o'clock, and they were in Sweet Well by eleven. The next hours were unexplainable. The wedding was like a dream, for all that came about occurred in a world beyond her power; from the moment when, sedate and proper, she shook hands with the grown people until the time, the wrecked wedding over, when she watched the car with the two of them driving away from her, and, flinging herself down in the sizzling dust, she cried out for the last time: ""Take me! Take me!""—from the beginning to the end the wedding was unmanaged as a nightmare. By mid-afternoon it was all finished and the return bus left at four o'clock."|"Collected Stories"|"Carson McCullers"
"ap 04:00"|"four o'clock"|"She said: ""Farewell, old ugly house,"" as, wearing a dotted Swiss dress and carrying the suitcase, she passed through the hall at quarter to six. The wedding dress was in the suitcase, ready to be put on when she reached Winter Hill. At that still hour the sky was the dim silver of a mirror, and beneath it the gray town looked, not like a real town, but like an exact reflection of itself, and to this unreal town she also said farewell. The bus left the station at ten past six—and she sat proud, like an accustomed traveler, apart from her father, John Henry, and Berenice. But after a while a serious doubt came in her, which even the answers of the bus-driver could not quite satisfy. They were supposed to be traveling north, but it seemed to her rather that the bus was going south instead. The sky turned burning pale and the day blazed. They passed the fields of windless corn that had a blue look in the glare, red-furrowed cotton land, stretches of black pine woods. And mile by mile the countryside became more southern. The towns they passed—New City, Leeville, Cheehaw—each town seemed smaller than the one before, until at nine o'clock they reached the ugliest place of all, where they changed busses, called Flowering Branch. Despite its name there were no flowers and no branch—only a solitary country store, with a sad old shredded circus poster on the clapboard wall and a chinaberry tree beneath which stood an empty wagon and a sleeping mule. There they waited for the bus to Sweet Well, and, still doubting anxiously, Frances did not despise the box of lunch that had so shamed her at the first, because it made them look like family people who do not travel very much. The bus left at ten o'clock, and they were in Sweet Well by eleven. The next hours were unexplainable. The wedding was like a dream, for all that came about occurred in a world beyond her power; from the moment when, sedate and proper, she shook hands with the grown people until the time, the wrecked wedding over, when she watched the car with the two of them driving away from her, and, flinging herself down in the sizzling dust, she cried out for the last time: ""Take me! Take me!""—from the beginning to the end the wedding was unmanaged as a nightmare. By mid-afternoon it was all finished and the return bus left at four o'clock."|"Collected Stories"|"Carson McCullers"
"ap 02:00"|"two o'clock"|"They thought it was finished, but she would show them. The wedding had not included her, but she would still go into the world. Where she was going she did not know; however, she was leaving town that night. If she could not go in the way she had planned, safe with her brother and the bride, she would go, anyway. Even if she had to commit every crime. For the first time since the night before she thought about the soldier—but only in a glancing way, for her mind was busy with hasty plans. There was a train that passed through the town at two o'clock, and she would take it; the train went north in a general way, probably to Chicago or New York. If the train went to Chicago, she would go on to Hollywood and write shows or get a job as a movie starlet—or, if worse came to worst, even act in comedies. If the train went to New York, she would dress like a boy and give a false name and a false age and join the Marines. Meanwhile, she had to wait until her father was asleep, and she could still hear him moving in the kitchen. She sat at the typewriter and wrote a letter."|"Collected Stories"|"Carson McCullers"
"ap 02:00"|"two o'clock"|"All at once, alone there in the night-empty street, she realized she did not know how. It is easy to talk about hopping a freight train, but how did bums and people really do it? She was three blocks from the station and she walked toward it slowly. The station was closed and she went round it and stared at the platform, long and empty under the pale lights, with the Chiclet machines against the station wall and scraps of chewing-gum paper and candy wrappings on the platform. The train tracks gleamed silver and exact and some freight cars were off on a siding in the distance, but they were not hooked to any engine. The train would not come until two o'clock, and would she be able to hop a car, as she had read about, and get away? There was a red lantern a little way down the tracks, and against this colored light she saw a railroad man come walking slowly. She could not hang around like that until two o'clock—but as she left the station, one shoulder dragged down by the weight of the bag, she did not know where she should go."|"Collected Stories"|"Carson McCullers"
"> 00:00"|"after midnight"|"When she left the alley, it was a long time after midnight and she had reached the point where any sudden idea seemed a good idea. She had seized on first one notion and then another. To hitch-hike to Forks Falls and track down Honey, or to wire Evelyn Owen to meet her in Atlanta, or even to go back to the house and get John Henry, so that at least there would be somebody with her and she would not have to go into the world alone. But there was some objection to each of these ideas."|"Collected Stories"|"Carson McCullers"
"ap 05:00"|"five o'clock"|"The kitchen, done over and almost modern, had nothing that would bring to mind John Henry West. But nevertheless there were times when Frances felt his presence there, solemn and hovering and ghost-gray. And at those times there would come a hush—a hush quivered by voiceless words. A similar hush would come, also, when Honey was mentioned or brought to mind, for Honey was out on the road now with a sentence of eight years. Now the hush came that late November afternoon as Frances was making the sandwiches, cutting them into fancy shapes and taking great pains—for Mary Littlejohn was coming at five o'clock. Frances glanced at Berenice, who was sitting idle in a chair, wearing an old raveled sweater, her limp arms hanging at her sides. In her lap there was the thin little pinched fox fur that Ludie had given her many years ago. The fur was sticky and the sharp little face foxwise and sad. The fire from the red stove brushed the room with flickers of light and changing shadows."|"Collected Stories"|"Carson McCullers"
"ap 05:00"|"five o'clock"|"Mary was coming at five o'clock to take dinner, spend the night, and ride in the van to the new house tomorrow. Mary collected pictures of great masters and pasted them in an art book. They read poets like Tennyson together; and Mary was going to be a great painter and Frances a great poet—or else the foremost authority on radar. Mr. Littlejohn had been connected with a tractor company and before the war the Littlejohns had lived abroad. When Frances was sixteen and Mary eighteen, they were going around the world together. Frances placed the sandwiches on a plate, along with eight chocolates and some salted nuts; this was to be a midnight feast, to be eaten in the bed at twelve o'clock."|"Collected Stories"|"Carson McCullers"
00:00|midnight|"Mary was coming at five o'clock to take dinner, spend the night, and ride in the van to the new house tomorrow. Mary collected pictures of great masters and pasted them in an art book. They read poets like Tennyson together; and Mary was going to be a great painter and Frances a great poet—or else the foremost authority on radar. Mr. Littlejohn had been connected with a tractor company and before the war the Littlejohns had lived abroad. When Frances was sixteen and Mary eighteen, they were going around the world together. Frances placed the sandwiches on a plate, along with eight chocolates and some salted nuts; this was to be a midnight feast, to be eaten in the bed at twelve o'clock."|"Collected Stories"|"Carson McCullers"
"ap 00:00"|"twelve o'clock"|"Mary was coming at five o'clock to take dinner, spend the night, and ride in the van to the new house tomorrow. Mary collected pictures of great masters and pasted them in an art book. They read poets like Tennyson together; and Mary was going to be a great painter and Frances a great poet—or else the foremost authority on radar. Mr. Littlejohn had been connected with a tractor company and before the war the Littlejohns had lived abroad. When Frances was sixteen and Mary eighteen, they were going around the world together. Frances placed the sandwiches on a plate, along with eight chocolates and some salted nuts; this was to be a midnight feast, to be eaten in the bed at twelve o'clock."|"Collected Stories"|"Carson McCullers"
"ap < 05:00"|"almost five o'clock"|"Frances turned back to the window. It was almost five o'clock and the geranium glow had faded from the sky. The last pale colors were crushed and cold on the horizon. Dark, when it came, would come on quickly, as it does in wintertime. ""I am simply mad about—"" But the sentence was left unfinished for the hush was shattered when, with an instant shock of happiness, she heard the ringing of the bell."|"Collected Stories"|"Carson McCullers"
