"< 00:00"|"towards midnight"|"In my confidence in my own resources, I would willingly have taken Herbert’s expenses on myself; but Herbert was proud, and I could make no such proposal to him. So he got into difficulties in every direction, and continued to look about him. When we gradually fell into keeping late hours and late company, I noticed that he looked about him with a desponding eye at breakfast-time; that he began to look about him more hopefully about mid-day; that he drooped when he came into dinner; that he seemed to descry Capital in the distance, rather clearly, after dinner; that he all but realized Capital towards midnight; and that at about two o’clock in the morning, he became so deeply despondent again as to talk of buying a rifle and going to America, with a general purpose of compelling buffaloes to make his fortune."|"Great Expectations"|"Charles Dickens"
"~ 02:00"|"about two o’clock in the morning"|"In my confidence in my own resources, I would willingly have taken Herbert’s expenses on myself; but Herbert was proud, and I could make no such proposal to him. So he got into difficulties in every direction, and continued to look about him. When we gradually fell into keeping late hours and late company, I noticed that he looked about him with a desponding eye at breakfast-time; that he began to look about him more hopefully about mid-day; that he drooped when he came into dinner; that he seemed to descry Capital in the distance, rather clearly, after dinner; that he all but realized Capital towards midnight; and that at about two o’clock in the morning, he became so deeply despondent again as to talk of buying a rifle and going to America, with a general purpose of compelling buffaloes to make his fortune."|"Great Expectations"|"Charles Dickens"
18:20|"twenty minutes past six in the evening"|"The letter was signed Trabb & Co., and its contents were simply, that I was an honored sir, and that they begged to inform me that Mrs. J. Gargery had departed this life on Monday last at twenty minutes past six in the evening, and that my attendance was requested at the interment on Monday next at three o’clock in the afternoon."|"Great Expectations"|"Charles Dickens"
15:00|"three o’clock in the afternoon"|"The letter was signed Trabb & Co., and its contents were simply, that I was an honored sir, and that they begged to inform me that Mrs. J. Gargery had departed this life on Monday last at twenty minutes past six in the evening, and that my attendance was requested at the interment on Monday next at three o’clock in the afternoon."|"Great Expectations"|"Charles Dickens"
17:00|"five in the afternoon"|"I had taken care to have it well understood in Little Britain when my birthday was. On the day before it, I received an official note from Wemmick, informing me that Mr. Jaggers would be glad if I would call upon him at five in the afternoon of the auspicious day. This convinced us that something great was to happen, and threw me into an unusual flutter when I repaired to my guardian’s office, a model of punctuality."|"Great Expectations"|"Charles Dickens"
"ap < 02:00"|"towards two o’clock"|"I lay in that separate building across the courtyard. It was the first time I had ever lain down to rest in Satis House, and sleep refused to come near me. A thousand Miss Havishams haunted me. She was on this side of my pillow, on that, at the head of the bed, at the foot, behind the half-opened door of the dressing-room, in the dressing-room, in the room overhead, in the room beneath,— everywhere. At last, when the night was slow to creep on towards two o’clock, I felt that I absolutely could no longer bear the place as a place to lie down in, and that I must get up. I therefore got up and put on my clothes, and went out across the yard into the long stone passage, designing to gain the outer courtyard and walk there for the relief of my mind. But I was no sooner in the passage than I extinguished my candle; for I saw Miss Havisham going along it in a ghostly manner, making a low cry. I followed her at a distance, and saw her go up the staircase. She carried a bare candle in her hand, which she had probably taken from one of the sconces in her own room, and was a most unearthly object by its light. Standing at the bottom of the staircase, I felt the mildewed air of the feast-chamber, without seeing her open the door, and I heard her walking there, and so across into her own room, and so across again into that, never ceasing the low cry. After a time, I tried in the dark both to get out, and to go back, but I could do neither until some streaks of day strayed in and showed me where to lay my hands. During the whole interval, whenever I went to the bottom of the staircase, I heard her footstep, saw her light pass above, and heard her ceaseless low cry."|"Great Expectations"|"Charles Dickens"
"ap 11:00"|"eleven o’clock"|"I read with my watch upon the table, purposing to close my book at eleven o’clock. As I shut it, Saint Paul’s, and all the many church-clocks in the City—some leading, some accompanying, some following—struck that hour. The sound was curiously flawed by the wind; and I was listening, and thinking how the wind assailed and tore it, when I heard a footstep on the stair."|"Great Expectations"|"Charles Dickens"
"ap 05:00"|five|"He had rolled a handkerchief round his head, and his face was set and lowering in his sleep. But he was asleep, and quietly too, though he had a pistol lying on the pillow. Assured of this, I softly removed the key to the outside of his door, and turned it on him before I again sat down by the fire. Gradually I slipped from the chair and lay on the floor. When I awoke without having parted in my sleep with the perception of my wretchedness, the clocks of the Eastward churches were striking five, the candles were wasted out, the fire was dead, and the wind and rain intensified the thick black darkness."|"Great Expectations"|"Charles Dickens"
"ap 01:30"|"half-past one"|"Mr. Wopsle, the clerk at church, was to dine with us; and Mr. Hubble the wheelwright and Mrs. Hubble; and Uncle Pumblechook (Joe’s uncle, but Mrs. Joe appropriated him), who was a well-to-do cornchandler in the nearest town, and drove his own chaise-cart. The dinner hour was half-past one. When Joe and I got home, we found the table laid, and Mrs. Joe dressed, and the dinner dressing, and the front door unlocked (it never was at any other time) for the company to enter by, and everything most splendid. And still, not a word of the robbery."|"Great Expectations"|"Charles Dickens"
"ap ~ 11:00"|"about eleven o’clock"|"“The night being so bad, sir,” said the watchman, as he gave me back my glass, “uncommon few have come in at my gate. Besides them three gentlemen that I have named, I don’t call to mind another since about eleven o’clock, when a stranger asked for you.”"|"Great Expectations"|"Charles Dickens"
"ap 06:00"|six|"I lighted my fire, which burnt with a raw pale flare at that time of the morning, and fell into a doze before it. I seemed to have been dozing a whole night when the clocks struck six. As there was full an hour and a half between me and daylight, I dozed again; now, waking up uneasily, with prolix conversations about nothing, in my ears; now, making thunder of the wind in the chimney; at length, falling off into a profound sleep from which the daylight woke me with a start."|"Great Expectations"|"Charles Dickens"
15:00|"three in the afternoon"|"It would seem a simple matter to decide on these precautions; but in my dazed, not to say distracted, state, it took so long, that I did not get out to further them until two or three in the afternoon. He was to remain shut up in the chambers while I was gone, and was on no account to open the door."|"Great Expectations"|"Charles Dickens"
00:00|midnight|"Herbert said, “Certainly,” but looked as if there were no specific consolation in this, and remained perplexed and dismayed. We were anxious for the time when he would go to his lodging and leave us together, but he was evidently jealous of leaving us together, and sat late. It was midnight before I took him round to Essex Street, and saw him safely in at his own dark door. When it closed upon him, I experienced the first moment of relief I had known since the night of his arrival."|"Great Expectations"|"Charles Dickens"
05:00|"five in the morning"|"“I might a took warning by Arthur, but I didn’t; and I won’t pretend I was partick’ler—for where ‘ud be the good on it, dear boy and comrade? So I begun wi’ Compeyson, and a poor tool I was in his hands. Arthur lived at the top of Compeyson’s house (over nigh Brentford it was), and Compeyson kept a careful account agen him for board and lodging, in case he should ever get better to work it out. But Arthur soon settled the account. The second or third time as ever I see him, he come a tearing down into Compeyson’s parlor late at night, in only a flannel gown, with his hair all in a sweat, and he says to Compeyson’s wife, ‘Sally, she really is upstairs alonger me, now, and I can’t get rid of her. She’s all in white,’ he says, ‘wi’ white flowers in her hair, and she’s awful mad, and she’s got a shroud hanging over her arm, and she says she’ll put it on me at five in the morning.’"|"Great Expectations"|"Charles Dickens"
"ap < 05:00"|"a few minutes of five"|"“He rested pretty quiet till it might want a few minutes of five, and then he starts up with a scream, and screams out, ‘Here she is! She’s got the shroud again. She’s unfolding it. She’s coming out of the corner. She’s coming to the bed. Hold me, both on you—one of each side—don’t let her touch me with it. Hah! she missed me that time. Don’t let her throw it over my shoulders. Don’t let her lift me up to get it round me. She’s lifting me up. Keep me down!’ Then he lifted himself up hard, and was dead."|"Great Expectations"|"Charles Dickens"
"> 00:00"|"past midnight"|"It was past midnight when I crossed London Bridge. Pursuing the narrow intricacies of the streets which at that time tended westward near the Middlesex shore of the river, my readiest access to the Temple was close by the river-side, through Whitefriars. I was not expected till to-morrow; but I had my keys, and, if Herbert were gone to bed, could get to bed myself without disturbing him."|"Great Expectations"|"Charles Dickens"
"ap 07:00"|seven|"I had left directions that I was to be called at seven; for it was plain that I must see Wemmick before seeing any one else, and equally plain that this was a case in which his Walworth sentiments only could be taken. It was a relief to get out of the room where the night had been so miserable, and I needed no second knocking at the door to startle me from my uneasy bed."|"Great Expectations"|"Charles Dickens"
"ap 08:00"|"eight o’clock"|"The Castle battlements arose upon my view at eight o’clock. The little servant happening to be entering the fortress with two hot rolls, I passed through the postern and crossed the drawbridge in her company, and so came without announcement into the presence of Wemmick as he was making tea for himself and the Aged. An open door afforded a perspective view of the Aged in bed."|"Great Expectations"|"Charles Dickens"
"ap 09:00"|"nine o’clock"|"“Well, sir! Mr. Herbert threw himself into the business with a will, and by nine o’clock last night he housed Tom, Jack, or Richard,— whichever it may be,—you and I don’t want to know,—quite successfully. At the old lodgings it was understood that he was summoned to Dover, and, in fact, he was taken down the Dover road and cornered out of it. Now, another great advantage of all this is, that it was done without you, and when, if any one was concerning himself about your movements, you must be known to be ever so many miles off and quite otherwise engaged. This diverts suspicion and confuses it; and for the same reason I recommended that, even if you came back last night, you should not go home. It brings in more confusion, and you want confusion.”"|"Great Expectations"|"Charles Dickens"
"ap 08:00"|"Eight o’clock"|"Eight o’clock had struck before I got into the air, that was scented, not disagreeably, by the chips and shavings of the long-shore boat-builders, and mast, oar, and block makers. All that water-side region of the upper and lower Pool below Bridge was unknown ground to me; and when I struck down by the river, I found that the spot I wanted was not where I had supposed it to be, and was anything but easy to find. It was called Mill Pond Bank, Chinks’s Basin; and I had no other guide to Chinks’s Basin than the Old Green Copper Rope-walk."|"Great Expectations"|"Charles Dickens"
"ap 00:00"|twelve|"When Mr. Wopsle had imparted to me all that he could recall or I extract, and when I had treated him to a little appropriate refreshment, after the fatigues of the evening, we parted. It was between twelve and one o’clock when I reached the Temple, and the gates were shut. No one was near me when I went in and went home."|"Great Expectations"|"Charles Dickens"
"ap 01:00"|"one o’clock"|"When Mr. Wopsle had imparted to me all that he could recall or I extract, and when I had treated him to a little appropriate refreshment, after the fatigues of the evening, we parted. It was between twelve and one o’clock when I reached the Temple, and the gates were shut. No one was near me when I went in and went home."|"Great Expectations"|"Charles Dickens"
"< 00:00"|"Towards midnight"|"There was a stage, that evening, when she spoke collectedly of what had happened, though with a certain terrible vivacity. Towards midnight she began to wander in her speech; and after that it gradually set in that she said innumerable times in a low solemn voice, “What have I done!” And then, “When she first came, I meant to save her from misery like mine.” And then, “Take the pencil and write under my name, ‘I forgive her!’” She never changed the order of these three sentences, but she sometimes left out a word in one or other of them; never putting in another word, but always leaving a blank and going on to the next word."|"Great Expectations"|"Charles Dickens"
"ap ~ 06:00"|"about six o’clock"|"As I could do no service there, and as I had, nearer home, that pressing reason for anxiety and fear which even her wanderings could not drive out of my mind, I decided, in the course of the night that I would return by the early morning coach, walking on a mile or so, and being taken up clear of the town. At about six o’clock of the morning, therefore, I leaned over her and touched her lips with mine, just as they said, not stopping for being touched, “Take the pencil and write under my name, ‘I forgive her.’”"|"Great Expectations"|"Charles Dickens"
"ap ~ 02:30"|"just gone half past two"|"“Would you give me the time?” said the sergeant, addressing himself to Mr. Pumblechook, as to a man whose appreciative powers justified the inference that he was equal to the time.
“It’s just gone half past two.”
“That’s not so bad,” said the sergeant, reflecting; “even if I was forced to halt here nigh two hours, that’ll do. How far might you call yourselves from the marshes, hereabouts? Not above a mile, I reckon?”"|"Great Expectations"|"Charles Dickens"
"ap 01:00"|"one o’clock"|"Herbert assented to all this, and we went out immediately after breakfast to pursue our investigations. We found that a steamer for Hamburg was likely to suit our purpose best, and we directed our thoughts chiefly to that vessel. But we noted down what other foreign steamers would leave London with the same tide, and we satisfied ourselves that we knew the build and color of each. We then separated for a few hours: I, to get at once such passports as were necessary; Herbert, to see Startop at his lodgings. We both did what we had to do without any hindrance, and when we met again at one o’clock reported it done. I, for my part, was prepared with passports; Herbert had seen Startop, and he was more than ready to join."|"Great Expectations"|"Charles Dickens"
"ap > 09:00"|"past nine"|"It rose under my hand, and the door yielded. Looking in, I saw a lighted candle on a table, a bench, and a mattress on a truckle bedstead. As there was a loft above, I called, “Is there any one here?” but no voice answered. Then I looked at my watch, and, finding that it was past nine, called again, “Is there any one here?” There being still no answer, I went out at the door, irresolute what to do."|"Great Expectations"|"Charles Dickens"
"~ 00:00"|"About midnight"|"They kept me very quiet all day, and kept my arm constantly dressed, and gave me cooling drinks. Whenever I fell asleep, I awoke with the notion I had had in the sluice-house, that a long time had elapsed and the opportunity to save him was gone. About midnight I got out of bed and went to Herbert, with the conviction that I had been asleep for four-and-twenty hours, and that Wednesday was past. It was the last self-exhausting effort of my fretfulness, for after that I slept soundly."|"Great Expectations"|"Charles Dickens"
"ap 09:00"|"nine o’clock"|"“When it turns at nine o’clock,” said Herbert, cheerfully, “look out for us, and stand ready, you over there at Mill Pond Bank!”"|"Great Expectations"|"Charles Dickens"
"ap 08:30"|"half-past eight"|"We loitered down to the Temple stairs, and stood loitering there, as if we were not quite decided to go upon the water at all. Of course, I had taken care that the boat should be ready and everything in order. After a little show of indecision, which there were none to see but the two or three amphibious creatures belonging to our Temple stairs, we went on board and cast off; Herbert in the bow, I steering. It was then about high-water,— half-past eight."|"Great Expectations"|"Charles Dickens"
"ap 09:00"|nine|"Our plan was this. The tide, beginning to run down at nine, and being with us until three, we intended still to creep on after it had turned, and row against it until dark. We should then be well in those long reaches below Gravesend, between Kent and Essex, where the river is broad and solitary, where the water-side inhabitants are very few, and where lone public-houses are scattered here and there, of which we could choose one for a resting-place. There, we meant to lie by all night. The steamer for Hamburg and the steamer for Rotterdam would start from London at about nine on Thursday morning. We should know at what time to expect them, according to where we were, and would hail the first; so that, if by any accident we were not taken abroad, we should have another chance. We knew the distinguishing marks of each vessel."|"Great Expectations"|"Charles Dickens"
"ap 03:00"|three|"Our plan was this. The tide, beginning to run down at nine, and being with us until three, we intended still to creep on after it had turned, and row against it until dark. We should then be well in those long reaches below Gravesend, between Kent and Essex, where the river is broad and solitary, where the water-side inhabitants are very few, and where lone public-houses are scattered here and there, of which we could choose one for a resting-place. There, we meant to lie by all night. The steamer for Hamburg and the steamer for Rotterdam would start from London at about nine on Thursday morning. We should know at what time to expect them, according to where we were, and would hail the first; so that, if by any accident we were not taken abroad, we should have another chance. We knew the distinguishing marks of each vessel."|"Great Expectations"|"Charles Dickens"
"ap ~ 09:00"|"about nine"|"Our plan was this. The tide, beginning to run down at nine, and being with us until three, we intended still to creep on after it had turned, and row against it until dark. We should then be well in those long reaches below Gravesend, between Kent and Essex, where the river is broad and solitary, where the water-side inhabitants are very few, and where lone public-houses are scattered here and there, of which we could choose one for a resting-place. There, we meant to lie by all night. The steamer for Hamburg and the steamer for Rotterdam would start from London at about nine on Thursday morning. We should know at what time to expect them, according to where we were, and would hail the first; so that, if by any accident we were not taken abroad, we should have another chance. We knew the distinguishing marks of each vessel."|"Great Expectations"|"Charles Dickens"
"~ 13:00"|"about one in the afternoon"|"This dialogue made us all uneasy, and me very uneasy. The dismal wind was muttering round the house, the tide was flapping at the shore, and I had a feeling that we were caged and threatened. A four-oared galley hovering about in so unusual a way as to attract this notice was an ugly circumstance that I could not get rid of. When I had induced Provis to go up to bed, I went outside with my two companions (Startop by this time knew the state of the case), and held another council. Whether we should remain at the house until near the steamer’s time, which would be about one in the afternoon, or whether we should put off early in the morning, was the question we discussed. On the whole we deemed it the better course to lie where we were, until within an hour or so of the steamer’s time, and then to get out in her track, and drift easily with the tide. Having settled to do this, we returned into the house and went to bed."|"Great Expectations"|"Charles Dickens"
"~ 12:00"|"about noon"|"We were up early. As we walked to and fro, all four together, before breakfast, I deemed it right to recount what I had seen. Again our charge was the least anxious of the party. It was very likely that the men belonged to the Custom House, he said quietly, and that they had no thought of us. I tried to persuade myself that it was so,—as, indeed, it might easily be. However, I proposed that he and I should walk away together to a distant point we could see, and that the boat should take us aboard there, or as near there as might prove feasible, at about noon. This being considered a good precaution, soon after breakfast he and I set forth, without saying anything at the tavern."|"Great Expectations"|"Charles Dickens"
"ap 00:50"|"ten minutes of one o’clock"|"When he looked out from his shelter in the distance, and saw that I waved my hat to him to come up, he rejoined me, and there we waited; sometimes lying on the bank, wrapped in our coats, and sometimes moving about to warm ourselves, until we saw our boat coming round. We got aboard easily, and rowed out into the track of the steamer. By that time it wanted but ten minutes of one o’clock, and we began to look out for her smoke."|"Great Expectations"|"Charles Dickens"
"ap 01:30"|"half-past one"|"But, it was half-past one before we saw her smoke, and soon afterwards we saw behind it the smoke of another steamer. As they were coming on at full speed, we got the two bags ready, and took that opportunity of saying good by to Herbert and Startop. We had all shaken hands cordially, and neither Herbert’s eyes nor mine were quite dry, when I saw a four-oared galley shoot out from under the bank but a little way ahead of us, and row out into the same track."|"Great Expectations"|"Charles Dickens"
"ap 08:30"|"half past eight"|"He had done so much for me at various times, that this was very little to do for him. I said I could manage it,—would manage it,— and he was so very much pleased by my acquiescence, that I was pleased too. At his particular request, I appointed to call for him at the Castle at half past eight on Monday morning, and so we parted for the time."|"Great Expectations"|"Charles Dickens"
"ap 08:00"|Eight|"“However,” said Joe, rising to replenish the fire; “here’s the Dutch-clock a working himself up to being equal to strike Eight of ’em, and she’s not come home yet! I hope Uncle Pumblechook’s mare mayn’t have set a forefoot on a piece o’ ice, and gone down.”"|"Great Expectations"|"Charles Dickens"
"ap 08:00"|"eight o’clock"|"Mr. Pumblechook and I breakfasted at eight o’clock in the parlor behind the shop, while the shopman took his mug of tea and hunch of bread and butter on a sack of peas in the front premises. I considered Mr. Pumblechook wretched company. Besides being possessed by my sister’s idea that a mortifying and penitential character ought to be imparted to my diet,—besides giving me as much crumb as possible in combination with as little butter, and putting such a quantity of warm water into my milk that it would have been more candid to have left the milk out altogether,—his conversation consisted of nothing but arithmetic. On my politely bidding him Good morning, he said, pompously, “Seven times nine, boy?” And how should I be able to answer, dodged in that way, in a strange place, on an empty stomach! I was hungry, but before I had swallowed a morsel, he began a running sum that lasted all through the breakfast. “Seven?” “And four?” “And eight?” “And six?” “And two?” “And ten?” And so on. And after each figure was disposed of, it was as much as I could do to get a bite or a sup, before the next came; while he sat at his ease guessing nothing, and eating bacon and hot roll, in (if I may be allowed the expression) a gorging and gormandizing manner."|"Great Expectations"|"Charles Dickens"
