"ap 08:40"|"twenty minutes to nine"|"The passage was a long one, and seemed to pervade the whole square basement of the Manor House. We traversed but one side of the square, however, and at the end of it she stopped, and put her candle down and opened a door. Here, the daylight reappeared, and I found myself in a small paved courtyard, the opposite side of which was formed by a detached dwelling-house, that looked as if it had once belonged to the manager or head clerk of the extinct brewery. There was a clock in the outer wall of this house. Like the clock in Miss Havisham’s room, and like Miss Havisham’s watch, it had stopped at twenty minutes to nine."|"Great Expectations"|"Charles Dickens"
12:00|noon|"On the broad landing between Miss Havisham’s own room and that other room in which the long table was laid out, I saw a garden-chair,—a light chair on wheels, that you pushed from behind. It had been placed there since my last visit, and I entered, that same day, on a regular occupation of pushing Miss Havisham in this chair (when she was tired of walking with her hand upon my shoulder) round her own room, and across the landing, and round the other room. Over and over and over again, we would make these journeys, and sometimes they would last as long as three hours at a stretch. I insensibly fall into a general mention of these journeys as numerous, because it was at once settled that I should return every alternate day at noon for these purposes, and because I am now going to sum up a period of at least eight or ten months."|"Great Expectations"|"Charles Dickens"
22:00|"ten o’clock at night"|"When I got home at night, and delivered this message for Joe, my sister “went on the Rampage,” in a more alarming degree than at any previous period. She asked me and Joe whether we supposed she was door-mats under our feet, and how we dared to use her so, and what company we graciously thought she was fit for? When she had exhausted a torrent of such inquiries, she threw a candlestick at Joe, burst into a loud sobbing, got out the dustpan,—which was always a very bad sign,—put on her coarse apron, and began cleaning up to a terrible extent. Not satisfied with a dry cleaning, she took to a pail and scrubbing-brush, and cleaned us out of house and home, so that we stood shivering in the back-yard. It was ten o’clock at night before we ventured to creep in again, and then she asked Joe why he hadn’t married a Negress Slave at once? Joe offered no answer, poor fellow, but stood feeling his whisker and looking dejectedly at me, as if he thought it really might have been a better speculation."|"Great Expectations"|"Charles Dickens"
"< 12:00"|"almost noon"|"When we came to Pumblechook’s, my sister bounced in and left us. As it was almost noon, Joe and I held straight on to Miss Havisham’s house. Estella opened the gate as usual, and, the moment she appeared, Joe took his hat off and stood weighing it by the brim in both his hands; as if he had some urgent reason in his mind for being particular to half a quarter of an ounce."|"Great Expectations"|"Charles Dickens"
21:30|"half-past nine o’ clock that night"|"As I never assisted at any other representation of George Barnwell, I don’t know how long it may usually take; but I know very well that it took until half-past nine o’ clock that night, and that when Mr. Wopsle got into Newgate, I thought he never would go to the scaffold, he became so much slower than at any former period of his disgraceful career. I thought it a little too much that he should complain of being cut short in his flower after all, as if he had not been running to seed, leaf after leaf, ever since his course began. This, however, was a mere question of length and wearisomeness. What stung me, was the identification of the whole affair with my unoffending self. When Barnwell began to go wrong, I declare that I felt positively apologetic, Pumblechook’s indignant stare so taxed me with it. Wopsle, too, took pains to present me in the worst light. At once ferocious and maudlin, I was made to murder my uncle with no extenuating circumstances whatever; Millwood put me down in argument, on every occasion; it became sheer monomania in my master’s daughter to care a button for me; and all I can say for my gasping and procrastinating conduct on the fatal morning, is, that it was worthy of the general feebleness of my character. Even after I was happily hanged and Wopsle had closed the book, Pumblechook sat staring at me, and shaking his head, and saying, “Take warning, boy, take warning!” as if it were a well-known fact that I contemplated murdering a near relation, provided I could only induce one to have the weakness to become my benefactor."|"Great Expectations"|"Charles Dickens"
"ap 11:00"|"eleven o’clock"|"Thus, we came to the village. The way by which we approached it took us past the Three Jolly Bargemen, which we were surprised to find—it being eleven o’clock —in a state of commotion, with the door wide open, and unwonted lights that had been hastily caught up and put down scattered about. Mr. Wopsle dropped in to ask what was the matter (surmising that a convict had been taken), but came running out in a great hurry."|"Great Expectations"|"Charles Dickens"
"ap 08:15"|"quarter after eight o’clock"|"Joe had been at the Three Jolly Bargemen, smoking his pipe, from a quarter after eight o’clock to a quarter before ten. While he was there, my sister had been seen standing at the kitchen door, and had exchanged Good Night with a farm-laborer going home. The man could not be more particular as to the time at which he saw her (he got into dense confusion when he tried to be), than that it must have been before nine. When Joe went home at five minutes before ten, he found her struck down on the floor, and promptly called in assistance. The fire had not then burnt unusually low, nor was the snuff of the candle very long; the candle, however, had been blown out."|"Great Expectations"|"Charles Dickens"
"ap 09:45"|"quarter before ten"|"Joe had been at the Three Jolly Bargemen, smoking his pipe, from a quarter after eight o’clock to a quarter before ten. While he was there, my sister had been seen standing at the kitchen door, and had exchanged Good Night with a farm-laborer going home. The man could not be more particular as to the time at which he saw her (he got into dense confusion when he tried to be), than that it must have been before nine. When Joe went home at five minutes before ten, he found her struck down on the floor, and promptly called in assistance. The fire had not then burnt unusually low, nor was the snuff of the candle very long; the candle, however, had been blown out."|"Great Expectations"|"Charles Dickens"
"ap 09:00"|nine|"Joe had been at the Three Jolly Bargemen, smoking his pipe, from a quarter after eight o’clock to a quarter before ten. While he was there, my sister had been seen standing at the kitchen door, and had exchanged Good Night with a farm-laborer going home. The man could not be more particular as to the time at which he saw her (he got into dense confusion when he tried to be), than that it must have been before nine. When Joe went home at five minutes before ten, he found her struck down on the floor, and promptly called in assistance. The fire had not then burnt unusually low, nor was the snuff of the candle very long; the candle, however, had been blown out."|"Great Expectations"|"Charles Dickens"
"ap 09:55"|"five minutes before ten"|"Joe had been at the Three Jolly Bargemen, smoking his pipe, from a quarter after eight o’clock to a quarter before ten. While he was there, my sister had been seen standing at the kitchen door, and had exchanged Good Night with a farm-laborer going home. The man could not be more particular as to the time at which he saw her (he got into dense confusion when he tried to be), than that it must have been before nine. When Joe went home at five minutes before ten, he found her struck down on the floor, and promptly called in assistance. The fire had not then burnt unusually low, nor was the snuff of the candle very long; the candle, however, had been blown out."|"Great Expectations"|"Charles Dickens"
"ap 07:00"|"seven o’clock"|"After this memorable event, I went to the hatter’s, and the bootmaker’s, and the hosier’s, and felt rather like Mother Hubbard’s dog whose outfit required the services of so many trades. I also went to the coach-office and took my place for seven o’clock on Saturday morning. It was not necessary to explain everywhere that I had come into a handsome property; but whenever I said anything to that effect, it followed that the officiating tradesman ceased to have his attention diverted through the window by the High Street, and concentrated his mind upon me. When I had ordered everything I wanted, I directed my steps towards Pumblechook’s, and, as I approached that gentleman’s place of business, I saw him standing at his door."|"Great Expectations"|"Charles Dickens"
05:00|"five in the morning"|"I was to leave our village at five in the morning, carrying my little hand-portmanteau, and I had told Joe that I wished to walk away all alone. I am afraid—sore afraid—that this purpose originated in my sense of the contrast there would be between me and Joe, if we went to the coach together. I had pretended with myself that there was nothing of this taint in the arrangement; but when I went up to my little room on this last night, I felt compelled to admit that it might be so, and had an impulse upon me to go down again and entreat Joe to walk with me in the morning. I did not."|"Great Expectations"|"Charles Dickens"
"ap 07:53"|"seven to eight"|"It was Christmas Eve, and I had to stir the pudding for next day, with a copper-stick, from seven to eight by the Dutch clock. I tried it with the load upon my leg (and that made me think afresh of the man with the load on his leg), and found the tendency of exercise to bring the bread and butter out at my ankle, quite unmanageable. Happily I slipped away, and deposited that part of my conscience in my garret bedroom."|"Great Expectations"|"Charles Dickens"
"> 12:00"|"a little past midday"|"The journey from our town to the metropolis was a journey of about five hours. It was a little past midday when the four-horse stage-coach by which I was a passenger, got into the ravel of traffic frayed out about the Cross Keys, Wood Street, Cheapside, London."|"Great Expectations"|"Charles Dickens"
08:00|"eight in the morning"|"While I looked about me here, an exceedingly dirty and partially drunk minister of justice asked me if I would like to step in and hear a trial or so: informing me that he could give me a front place for half a crown, whence I should command a full view of the Lord Chief Justice in his wig and robes,—mentioning that awful personage like waxwork, and presently offering him at the reduced price of eighteen-pence. As I declined the proposal on the plea of an appointment, he was so good as to take me into a yard and show me where the gallows was kept, and also where people were publicly whipped, and then he showed me the Debtors’ Door, out of which culprits came to be hanged; heightening the interest of that dreadful portal by giving me to understand that “four on ’em” would come out at that door the day after to-morrow at eight in the morning, to be killed in a row. This was horrible, and gave me a sickening idea of London; the more so as the Lord Chief Justice’s proprietor wore (from his hat down to his boots and up again to his pocket-handkerchief inclusive) mildewed clothes which had evidently not belonged to him originally, and which I took it into my head he had bought cheap of the executioner. Under these circumstances I thought myself well rid of him for a shilling."|"Great Expectations"|"Charles Dickens"
12:00|midday|"“Dear me!” he exclaimed. “I am extremely sorry; but I knew there was a coach from your part of the country at midday, and I thought you would come by that one. The fact is, I have been out on your account,—not that that is any excuse,—for I thought, coming from the country, you might like a little fruit after dinner, and I went to Covent Garden Market to get it good.”"|"Great Expectations"|"Charles Dickens"
"ap 08:40"|"twenty minutes to nine"|"“Which she received,” I struck in, “when she was dressing for her marriage? At twenty minutes to nine?”"|"Great Expectations"|"Charles Dickens"
"ap 08:45"|"quarter before nine"|"On the Monday morning at a quarter before nine, Herbert went to the counting-house to report himself,—to look about him, too, I suppose,—and I bore him company. He was to come away in an hour or two to attend me to Hammersmith, and I was to wait about for him. It appeared to me that the eggs from which young Insurers were hatched were incubated in dust and heat, like the eggs of ostriches, judging from the places to which those incipient giants repaired on a Monday morning. Nor did the counting-house where Herbert assisted, show in my eyes as at all a good Observatory; being a back second floor up a yard, of a grimy presence in all particulars, and with a look into another back second floor, rather than a look out."|"Great Expectations"|"Charles Dickens"
12:00|noon|"I waited about until it was noon, and I went upon ‘Change, and I saw fluey men sitting there under the bills about shipping, whom I took to be great merchants, though I couldn’t understand why they should all be out of spirits. When Herbert came, we went and had lunch at a celebrated house which I then quite venerated, but now believe to have been the most abject superstition in Europe, and where I could not help noticing, even then, that there was much more gravy on the tablecloths and knives and waiters’ clothes, than in the steaks. This collation disposed of at a moderate price (considering the grease, which was not charged for), we went back to Barnard’s Inn and got my little portmanteau, and then took coach for Hammersmith. We arrived there at two or three o’clock in the afternoon, and had very little way to walk to Mr. Pocket’s house. Lifting the latch of a gate, we passed direct into a little garden overlooking the river, where Mr. Pocket’s children were playing about. And unless I deceive myself on a point where my interests or prepossessions are certainly not concerned, I saw that Mr. and Mrs. Pocket’s children were not growing up or being brought up, but were tumbling up."|"Great Expectations"|"Charles Dickens"
"ap 02:00"|two|"I waited about until it was noon, and I went upon ‘Change, and I saw fluey men sitting there under the bills about shipping, whom I took to be great merchants, though I couldn’t understand why they should all be out of spirits. When Herbert came, we went and had lunch at a celebrated house which I then quite venerated, but now believe to have been the most abject superstition in Europe, and where I could not help noticing, even then, that there was much more gravy on the tablecloths and knives and waiters’ clothes, than in the steaks. This collation disposed of at a moderate price (considering the grease, which was not charged for), we went back to Barnard’s Inn and got my little portmanteau, and then took coach for Hammersmith. We arrived there at two or three o’clock in the afternoon, and had very little way to walk to Mr. Pocket’s house. Lifting the latch of a gate, we passed direct into a little garden overlooking the river, where Mr. Pocket’s children were playing about. And unless I deceive myself on a point where my interests or prepossessions are certainly not concerned, I saw that Mr. and Mrs. Pocket’s children were not growing up or being brought up, but were tumbling up."|"Great Expectations"|"Charles Dickens"
15:00|"three o’clock in the afternoon"|"I waited about until it was noon, and I went upon ‘Change, and I saw fluey men sitting there under the bills about shipping, whom I took to be great merchants, though I couldn’t understand why they should all be out of spirits. When Herbert came, we went and had lunch at a celebrated house which I then quite venerated, but now believe to have been the most abject superstition in Europe, and where I could not help noticing, even then, that there was much more gravy on the tablecloths and knives and waiters’ clothes, than in the steaks. This collation disposed of at a moderate price (considering the grease, which was not charged for), we went back to Barnard’s Inn and got my little portmanteau, and then took coach for Hammersmith. We arrived there at two or three o’clock in the afternoon, and had very little way to walk to Mr. Pocket’s house. Lifting the latch of a gate, we passed direct into a little garden overlooking the river, where Mr. Pocket’s children were playing about. And unless I deceive myself on a point where my interests or prepossessions are certainly not concerned, I saw that Mr. and Mrs. Pocket’s children were not growing up or being brought up, but were tumbling up."|"Great Expectations"|"Charles Dickens"
"ap 06:00"|"six o’clock"|"I had not seen Mr. Wemmick for some weeks, when I thought I would write him a note and propose to go home with him on a certain evening. He replied that it would give him much pleasure, and that he would expect me at the office at six o’clock. Thither I went, and there I found him, putting the key of his safe down his back as the clock struck."|"Great Expectations"|"Charles Dickens"
"ap 09:00"|"nine o’clock"|"“At nine o’clock every night, Greenwich time,” said Wemmick, “the gun fires. There he is, you see! And when you hear him go, I think you’ll say he’s a Stinger.”"|"Great Expectations"|"Charles Dickens"
"ap < 09:00"|"almost nine o’clock"|"Of course I felt my good faith involved in the observance of his request. The punch being very nice, we sat there drinking it and talking, until it was almost nine o’clock. “Getting near gun-fire,” said Wemmick then, as he laid down his pipe; “it’s the Aged’s treat.”"|"Great Expectations"|"Charles Dickens"
"ap 08:30"|"half-past eight"|"Wemmick was up early in the morning, and I am afraid I heard him cleaning my boots. After that, he fell to gardening, and I saw him from my gothic window pretending to employ the Aged, and nodding at him in a most devoted manner. Our breakfast was as good as the supper, and at half-past eight precisely we started for Little Britain. By degrees, Wemmick got dryer and harder as we went along, and his mouth tightened into a post-office again. At last, when we got to his place of business and he pulled out his key from his coat-collar, he looked as unconscious of his Walworth property as if the Castle and the drawbridge and the arbor and the lake and the fountain and the Aged, had all been blown into space together by the last discharge of the Stinger."|"Great Expectations"|"Charles Dickens"
"ap 06:00"|"six o’clock"|"It fell out as Wemmick had told me it would, that I had an early opportunity of comparing my guardian’s establishment with that of his cashier and clerk. My guardian was in his room, washing his hands with his scented soap, when I went into the office from Walworth; and he called me to him, and gave me the invitation for myself and friends which Wemmick had prepared me to receive. “No ceremony,” he stipulated, “and no dinner dress, and say to-morrow.” I asked him where we should come to (for I had no idea where he lived), and I believe it was in his general objection to make anything like an admission, that he replied, “Come here, and I’ll take you home with me.” I embrace this opportunity of remarking that he washed his clients off, as if he were a surgeon or a dentist. He had a closet in his room, fitted up for the purpose, which smelt of the scented soap like a perfumer’s shop. It had an unusually large jack-towel on a roller inside the door, and he would wash his hands, and wipe them and dry them all over this towel, whenever he came in from a police court or dismissed a client from his room. When I and my friends repaired to him at six o’clock next day, he seemed to have been engaged on a case of a darker complexion than usual, for we found him with his head butted into this closet, not only washing his hands, but laving his face and gargling his throat. And even when he had done all that, and had gone all round the jack-towel, he took out his penknife and scraped the case out of his nails before he put his coat on."|"Great Expectations"|"Charles Dickens"
"ap 09:30"|"half-past nine"|"“At half-past nine, gentlemen,” said he, “we must break up. Pray make the best use of your time. I am glad to see you all. Mr. Drummle, I drink to you.”"|"Great Expectations"|"Charles Dickens"
"ap 09:30"|"half past nine"|"“Gentlemen,” said Mr. Jaggers, deliberately putting down the glass, and hauling out his gold repeater by its massive chain, “I am exceedingly sorry to announce that it’s half past nine.”"|"Great Expectations"|"Charles Dickens"
"ap 09:00"|"nine o’clock"|"“I write this by request of Mr. Gargery, for to let you know that he is going to London in company with Mr. Wopsle and would be glad if agreeable to be allowed to see you. He would call at Barnard’s Hotel Tuesday morning at nine o’clock, when if not agreeable please leave word. Your poor sister is much the same as when you left. We talk of you in the kitchen every night, and wonder what you are saying and doing. If now considered in the light of a liberty, excuse it for the love of poor old days. No more, dear Mr. Pip, from your ever obliged, and affectionate servant,"|"Great Expectations"|"Charles Dickens"
"ap 08:00"|eight|"This avenging phantom was ordered to be on duty at eight on Tuesday morning in the hall, (it was two feet square, as charged for floorcloth,) and Herbert suggested certain things for breakfast that he thought Joe would like. While I felt sincerely obliged to him for being so interested and considerate, I had an odd half-provoked sense of suspicion upon me, that if Joe had been coming to see him, he wouldn’t have been quite so brisk about it."|"Great Expectations"|"Charles Dickens"
"ap 02:00"|"two o’clock"|"It was the afternoon coach by which I had taken my place, and, as winter had now come round, I should not arrive at my destination until two or three hours after dark. Our time of starting from the Cross Keys was two o’clock. I arrived on the ground with a quarter of an hour to spare, attended by the Avenger,—if I may connect that expression with one who never attended on me if he could possibly help it."|"Great Expectations"|"Charles Dickens"
"ap 09:00"|"nine o’clock"|"We played until nine o’clock, and then it was arranged that when Estella came to London I should be forewarned of her coming and should meet her at the coach; and then I took leave of her, and touched her and left her."|"Great Expectations"|"Charles Dickens"
12:00|midday|"As we were going back together to London by the midday coach, and as I breakfasted under such terrors of Pumblechook that I could scarcely hold my cup, this gave me an opportunity of saying that I wanted a walk, and that I would go on along the London road while Mr. Jaggers was occupied, if he would let the coachman know that I would get into my place when overtaken. I was thus enabled to fly from the Blue Boar immediately after breakfast. By then making a loop of about a couple of miles into the open country at the back of Pumblechook’s premises, I got round into the High Street again, a little beyond that pitfall, and felt myself in comparative security."|"Great Expectations"|"Charles Dickens"
02:00|"two o’clock in the morning"|"Without distinctly knowing whether I should have been more sorry for Mr. Wopsle if he had been in despair, I was so sorry for him as it was, that I took the opportunity of his turning round to have his braces put on,—which jostled us out at the doorway,—to ask Herbert what he thought of having him home to supper? Herbert said he thought it would be kind to do so; therefore I invited him, and he went to Barnard’s with us, wrapped up to the eyes, and we did our best for him, and he sat until two o’clock in the morning, reviewing his success and developing his plans. I forget in detail what they were, but I have a general recollection that he was to begin with reviving the Drama, and to end with crushing it; inasmuch as his decease would leave it utterly bereft and without a chance or hope."|"Great Expectations"|"Charles Dickens"
12:00|midday|"“I am to come to London the day after to-morrow by the midday coach. I believe it was settled you should meet me? At all events Miss Havisham has that impression, and I write in obedience to it. She sends you her regard."|"Great Expectations"|"Charles Dickens"
"~ 12:00"|"about mid-day"|"In my confidence in my own resources, I would willingly have taken Herbert’s expenses on myself; but Herbert was proud, and I could make no such proposal to him. So he got into difficulties in every direction, and continued to look about him. When we gradually fell into keeping late hours and late company, I noticed that he looked about him with a desponding eye at breakfast-time; that he began to look about him more hopefully about mid-day; that he drooped when he came into dinner; that he seemed to descry Capital in the distance, rather clearly, after dinner; that he all but realized Capital towards midnight; and that at about two o’clock in the morning, he became so deeply despondent again as to talk of buying a rifle and going to America, with a general purpose of compelling buffaloes to make his fortune."|"Great Expectations"|"Charles Dickens"
