"ap 02:00"|02.00|"Rajkumar uttered a shrill sound of triumph. He opened the email program, a long list of messages in the inbox, the subject indecipherable. He chose one halfway down the list, speed read, saw references to the ship, nothing of use. Picked another one, scanned it, another:Shipment arrives Monday 23 Shawwal 1430A.H. at 02.00 (GMT +2).'Shit,' he said and looked up. Janina Mentz wasn't back yet.He read the next email.We agree with your assessment. Arrival of The Madeleine and Haidar ...'Haidar?' he said aloud. 'Two ships?'...now 24 hours earlier at 02.00 (GMT +2) on Sunday 22 Shawwal 1430 A.H.'Fuck,' said Rajhev Rajkumar, looked at the wall clock. 'Where? Tell me where?'He rose from behind the computer, he must go and get Mentz, he moved towards the door. He saw her approaching."|Trackers|"Deon Meyer"
06:50|"ten to seven in the morning"|"Margaret stood on the other side of the breakfast counter, ten to seven in the morning, already showered and dressed. Her long, reddish- brown hair in a plait, pale pink lipstick, an almost invisible sprinkling of freckles on her cheeks. A head shorter than he was, but tall for a woman. And full-bodied. With the slender forearms and delicate hands that now constructed the sandwiches with so much practised skill: a lick of mayonnaise, lettuce leaves, half peppadews, fine rounds of sweet cucumber and, finally, the slivers of roast chicken, before she sliced her creation cleanly with the knife, straight across, precisely in half."|Trackers|"Deon Meyer"
"ap 06:00"|six|"She went off to pay the 30,000 rand deposit to senior financial controller Fanus Delport while Joubert waited for her in his new office. He experienced a measure of tension within himself. For the first time in his career someone had to pay directly for his services. And it was six, seven years since he'd last done investigative work himself, in the front line. 'It's like riding a bicycle,' Jack Fischer had said two months ago during the recruitment interview, 'you just get back on again.'He hoped it was true.Tanya Flint appeared in the doorway. 'May I come in?''Of course,' he said, standing up, waiting for her to sit down. He saw her look around, take in her surroundings. The room was still bare, the dark wood wall units empty. The only personal items were the leather folder for his notepad, his briefcase with two sandwiches in it, and the framed photo on the desk.'It's my first day,' he said, by way of explanation.'Oh. Then I'm lucky.'He wasn't sure what she meant.She pointed at the photo. 'Your family?''My wife and my ... stepchildren.' He'd never liked the word.'She's very pretty.''I think so too.'An uncomfortable silence. He flipped open the leather folder in front of him. Inside it was a pen and an A4 writing pad. At the top of each page, in silver letters, stood Jack Fischer and Associates, pale, like a watermark. He slid the pen from its loop and clicked the nib out, at the ready.She unclasped her handbag, on her lap, and took out a photo and a notebook. She handed him the photo. Postcard size, in full colour, of a man in his thirties. The sandy hair trimmed in a short brush cut, braai tongs in one hand, bare chested, outside, laughing. An open, boyish face. There was a certain carefree air about him, someone who had managed to dodge most of life's blows. 'This is Danie,' she said."|Trackers|"Deon Meyer"
"ap ~ 03:30"|"about half past three"|"She wanted to start on the day that he'd vanished, but Joubert asked her to begin right from the beginning. 'I need all the background I can get.'She nodded, resolute. 'I understand.'And she told him. With a note of barely-suppressed nostalgia in her voice.She had met Danie Flint seven years ago, when she was twenty-six and he was twenty-eight, at a gathering of mutual friends in Bellville. Not love at first sight, but there was a connection, a natural ease with each other. She liked his sense of humour, the way he laughed, his respectfulness towards her, from the beginning. 'He was so considerate.' And, with a small longing laugh: 'His shirt was always hanging out, even though he tucked it in a hundred times a day.' Joubert noted the past tense and thought it was better that way. It meant that she was realistic, she had already weighed up all the possibilities in a country where disappearance and death generally went hand in hand.Flint was a route planner for the Atlantic Bus Company, the giant firm whose buses, with their bright yellow ABC against a navy blue background, were such a common and irritating presence on roads of the Cape Peninsula. He was doing a part-time diploma in Passenger Transport at the University of Johannesburg - hard-working, enthusiastic, ambitious.Back then she'd been marketing solar heating systems for swimming pools, knowing that it was temporary, a training ground before she began her own business.A suburban love affair, unremarkable, unsensational. Thirteen months after their first meeting, he asked her to marry him. She had said 'yes' with complete certainty.After the wedding they'd bought a townhouse in Table View. Later, with Danie's promotion to area manager at ABC, they'd chosen a small three-bedroom house in Parklands. Children, they agreed, would have to wait for now. He wanted to study, she had her dream of running her own business. 'I set up eighteen months ago in Montague Gardens. We manufacture plastic pool covers and leaf catchers,' she said, fishing a business card out of her handbag and passing it to Joubert. The black silhouette of a spy-like figure in a large hat superimposed over a kidney-shaped swimming pool icon. Undercover was the company name.'My business was just starting to get off the ground when the economic crisis hit. But Danie carried us, with his salary. We worked so hard ... And then, on the twenty-fifth of November, Danie disappeared. He was at work the whole day. We spoke on the telephone, must have been about half past three. Then he said he was going to the gym when he left work at five. He'd usually be home by half past six after that, he'd try to go to the gym four times a week. I found his car at the gym, eleven o'clock that night, but he was just gone ...''Mrs Flint, I have ...''Tanya,' she said.Joubert nodded. 'I need as much detail about that day as you can give me.'She opened the notebook in front of her. 'I wrote everything down ...''That's good,' Joubert encouraged her.She looked at her notes. 'I only got away from work at a quarter to six, then I stopped at the Spar for bread and milk and salad. I was probably at home by quarter past and wanted to get the food ready in time, because on Wednesdays we watched Boston
Legal, it was Danie's favourite, it starts at half past seven. Supper was ready around seven, but he wasn't at home yet. But with Danie ... Sometimes he'd get talking to someone, he's just so spontaneous, so now and then he'd be late. But then I called him, ten past seven, and his cellphone just rang. I didn't leave a message, because maybe he was still in the gym. But at twenty-five past I started to get worried, because he never misses Boston Legal, he was crazy about it, he always said, ""Danie Flint"", you know, like ""Denny Crane"". Then I called again, but he still didn't answer. So I left a message. I just said, call me, I'll tape the show for you, because perhaps his phone was on silent, perhaps he'd forgotten to switch it on. Eight o'clock I called again. You know how a cellphone rings for a shorter time when you've had a missed call or a voicemail you haven't listened to yet? Then I thought maybe he'd had a call-out, if one of the buses had been in an accident, or something like that, then they'd call him, then he'd have to go. So I called Neville Philander who works with him, and Neville said no, Danie left work at five, he doesn't know about any call-out, he'll try to find out. Then I started calling Danie's friends, and his mother, she lives in Panorama, but no one had seen him. Then I called his cellphone again and I got in my car and I drove to the gym to look for him, but...' She made a shrugging gesture that said he wasn't there.'The police station is right next to the gym in Table View. So I went in and I said my husband is missing and the guy said to me since when and I said he should have been at home at half past six, and he said, ""Ma'am, it's nine o'clock now,"" and I said he hadn't let me know. Then he asked, ""Did you have a fight?"" And I said no, and he said, ""Ma'am, you know men,"" and I said not my man. And then he said, ""He's probably with his girlfriend."" That's when I started crying.'"|Trackers|"Deon Meyer"
"ap 05:00"|five|"She wanted to start on the day that he'd vanished, but Joubert asked her to begin right from the beginning. 'I need all the background I can get.'She nodded, resolute. 'I understand.'And she told him. With a note of barely-suppressed nostalgia in her voice.She had met Danie Flint seven years ago, when she was twenty-six and he was twenty-eight, at a gathering of mutual friends in Bellville. Not love at first sight, but there was a connection, a natural ease with each other. She liked his sense of humour, the way he laughed, his respectfulness towards her, from the beginning. 'He was so considerate.' And, with a small longing laugh: 'His shirt was always hanging out, even though he tucked it in a hundred times a day.' Joubert noted the past tense and thought it was better that way. It meant that she was realistic, she had already weighed up all the possibilities in a country where disappearance and death generally went hand in hand.Flint was a route planner for the Atlantic Bus Company, the giant firm whose buses, with their bright yellow ABC against a navy blue background, were such a common and irritating presence on roads of the Cape Peninsula. He was doing a part-time diploma in Passenger Transport at the University of Johannesburg - hard-working, enthusiastic, ambitious.Back then she'd been marketing solar heating systems for swimming pools, knowing that it was temporary, a training ground before she began her own business.A suburban love affair, unremarkable, unsensational. Thirteen months after their first meeting, he asked her to marry him. She had said 'yes' with complete certainty.After the wedding they'd bought a townhouse in Table View. Later, with Danie's promotion to area manager at ABC, they'd chosen a small three-bedroom house in Parklands. Children, they agreed, would have to wait for now. He wanted to study, she had her dream of running her own business. 'I set up eighteen months ago in Montague Gardens. We manufacture plastic pool covers and leaf catchers,' she said, fishing a business card out of her handbag and passing it to Joubert. The black silhouette of a spy-like figure in a large hat superimposed over a kidney-shaped swimming pool icon. Undercover was the company name.'My business was just starting to get off the ground when the economic crisis hit. But Danie carried us, with his salary. We worked so hard ... And then, on the twenty-fifth of November, Danie disappeared. He was at work the whole day. We spoke on the telephone, must have been about half past three. Then he said he was going to the gym when he left work at five. He'd usually be home by half past six after that, he'd try to go to the gym four times a week. I found his car at the gym, eleven o'clock that night, but he was just gone ...''Mrs Flint, I have ...''Tanya,' she said.Joubert nodded. 'I need as much detail about that day as you can give me.'She opened the notebook in front of her. 'I wrote everything down ...''That's good,' Joubert encouraged her.She looked at her notes. 'I only got away from work at a quarter to six, then I stopped at the Spar for bread and milk and salad. I was probably at home by quarter past and wanted to get the food ready in time, because on Wednesdays we watched Boston
Legal, it was Danie's favourite, it starts at half past seven. Supper was ready around seven, but he wasn't at home yet. But with Danie ... Sometimes he'd get talking to someone, he's just so spontaneous, so now and then he'd be late. But then I called him, ten past seven, and his cellphone just rang. I didn't leave a message, because maybe he was still in the gym. But at twenty-five past I started to get worried, because he never misses Boston Legal, he was crazy about it, he always said, ""Danie Flint"", you know, like ""Denny Crane"". Then I called again, but he still didn't answer. So I left a message. I just said, call me, I'll tape the show for you, because perhaps his phone was on silent, perhaps he'd forgotten to switch it on. Eight o'clock I called again. You know how a cellphone rings for a shorter time when you've had a missed call or a voicemail you haven't listened to yet? Then I thought maybe he'd had a call-out, if one of the buses had been in an accident, or something like that, then they'd call him, then he'd have to go. So I called Neville Philander who works with him, and Neville said no, Danie left work at five, he doesn't know about any call-out, he'll try to find out. Then I started calling Danie's friends, and his mother, she lives in Panorama, but no one had seen him. Then I called his cellphone again and I got in my car and I drove to the gym to look for him, but...' She made a shrugging gesture that said he wasn't there.'The police station is right next to the gym in Table View. So I went in and I said my husband is missing and the guy said to me since when and I said he should have been at home at half past six, and he said, ""Ma'am, it's nine o'clock now,"" and I said he hadn't let me know. Then he asked, ""Did you have a fight?"" And I said no, and he said, ""Ma'am, you know men,"" and I said not my man. And then he said, ""He's probably with his girlfriend."" That's when I started crying.'"|Trackers|"Deon Meyer"
23:00|"eleven o'clock that night"|"She wanted to start on the day that he'd vanished, but Joubert asked her to begin right from the beginning. 'I need all the background I can get.'She nodded, resolute. 'I understand.'And she told him. With a note of barely-suppressed nostalgia in her voice.She had met Danie Flint seven years ago, when she was twenty-six and he was twenty-eight, at a gathering of mutual friends in Bellville. Not love at first sight, but there was a connection, a natural ease with each other. She liked his sense of humour, the way he laughed, his respectfulness towards her, from the beginning. 'He was so considerate.' And, with a small longing laugh: 'His shirt was always hanging out, even though he tucked it in a hundred times a day.' Joubert noted the past tense and thought it was better that way. It meant that she was realistic, she had already weighed up all the possibilities in a country where disappearance and death generally went hand in hand.Flint was a route planner for the Atlantic Bus Company, the giant firm whose buses, with their bright yellow ABC against a navy blue background, were such a common and irritating presence on roads of the Cape Peninsula. He was doing a part-time diploma in Passenger Transport at the University of Johannesburg - hard-working, enthusiastic, ambitious.Back then she'd been marketing solar heating systems for swimming pools, knowing that it was temporary, a training ground before she began her own business.A suburban love affair, unremarkable, unsensational. Thirteen months after their first meeting, he asked her to marry him. She had said 'yes' with complete certainty.After the wedding they'd bought a townhouse in Table View. Later, with Danie's promotion to area manager at ABC, they'd chosen a small three-bedroom house in Parklands. Children, they agreed, would have to wait for now. He wanted to study, she had her dream of running her own business. 'I set up eighteen months ago in Montague Gardens. We manufacture plastic pool covers and leaf catchers,' she said, fishing a business card out of her handbag and passing it to Joubert. The black silhouette of a spy-like figure in a large hat superimposed over a kidney-shaped swimming pool icon. Undercover was the company name.'My business was just starting to get off the ground when the economic crisis hit. But Danie carried us, with his salary. We worked so hard ... And then, on the twenty-fifth of November, Danie disappeared. He was at work the whole day. We spoke on the telephone, must have been about half past three. Then he said he was going to the gym when he left work at five. He'd usually be home by half past six after that, he'd try to go to the gym four times a week. I found his car at the gym, eleven o'clock that night, but he was just gone ...''Mrs Flint, I have ...''Tanya,' she said.Joubert nodded. 'I need as much detail about that day as you can give me.'She opened the notebook in front of her. 'I wrote everything down ...''That's good,' Joubert encouraged her.She looked at her notes. 'I only got away from work at a quarter to six, then I stopped at the Spar for bread and milk and salad. I was probably at home by quarter past and wanted to get the food ready in time, because on Wednesdays we watched Boston
Legal, it was Danie's favourite, it starts at half past seven. Supper was ready around seven, but he wasn't at home yet. But with Danie ... Sometimes he'd get talking to someone, he's just so spontaneous, so now and then he'd be late. But then I called him, ten past seven, and his cellphone just rang. I didn't leave a message, because maybe he was still in the gym. But at twenty-five past I started to get worried, because he never misses Boston Legal, he was crazy about it, he always said, ""Danie Flint"", you know, like ""Denny Crane"". Then I called again, but he still didn't answer. So I left a message. I just said, call me, I'll tape the show for you, because perhaps his phone was on silent, perhaps he'd forgotten to switch it on. Eight o'clock I called again. You know how a cellphone rings for a shorter time when you've had a missed call or a voicemail you haven't listened to yet? Then I thought maybe he'd had a call-out, if one of the buses had been in an accident, or something like that, then they'd call him, then he'd have to go. So I called Neville Philander who works with him, and Neville said no, Danie left work at five, he doesn't know about any call-out, he'll try to find out. Then I started calling Danie's friends, and his mother, she lives in Panorama, but no one had seen him. Then I called his cellphone again and I got in my car and I drove to the gym to look for him, but...' She made a shrugging gesture that said he wasn't there.'The police station is right next to the gym in Table View. So I went in and I said my husband is missing and the guy said to me since when and I said he should have been at home at half past six, and he said, ""Ma'am, it's nine o'clock now,"" and I said he hadn't let me know. Then he asked, ""Did you have a fight?"" And I said no, and he said, ""Ma'am, you know men,"" and I said not my man. And then he said, ""He's probably with his girlfriend."" That's when I started crying.'"|Trackers|"Deon Meyer"
"ap 05:45"|"quarter to six"|"She wanted to start on the day that he'd vanished, but Joubert asked her to begin right from the beginning. 'I need all the background I can get.'She nodded, resolute. 'I understand.'And she told him. With a note of barely-suppressed nostalgia in her voice.She had met Danie Flint seven years ago, when she was twenty-six and he was twenty-eight, at a gathering of mutual friends in Bellville. Not love at first sight, but there was a connection, a natural ease with each other. She liked his sense of humour, the way he laughed, his respectfulness towards her, from the beginning. 'He was so considerate.' And, with a small longing laugh: 'His shirt was always hanging out, even though he tucked it in a hundred times a day.' Joubert noted the past tense and thought it was better that way. It meant that she was realistic, she had already weighed up all the possibilities in a country where disappearance and death generally went hand in hand.Flint was a route planner for the Atlantic Bus Company, the giant firm whose buses, with their bright yellow ABC against a navy blue background, were such a common and irritating presence on roads of the Cape Peninsula. He was doing a part-time diploma in Passenger Transport at the University of Johannesburg - hard-working, enthusiastic, ambitious.Back then she'd been marketing solar heating systems for swimming pools, knowing that it was temporary, a training ground before she began her own business.A suburban love affair, unremarkable, unsensational. Thirteen months after their first meeting, he asked her to marry him. She had said 'yes' with complete certainty.After the wedding they'd bought a townhouse in Table View. Later, with Danie's promotion to area manager at ABC, they'd chosen a small three-bedroom house in Parklands. Children, they agreed, would have to wait for now. He wanted to study, she had her dream of running her own business. 'I set up eighteen months ago in Montague Gardens. We manufacture plastic pool covers and leaf catchers,' she said, fishing a business card out of her handbag and passing it to Joubert. The black silhouette of a spy-like figure in a large hat superimposed over a kidney-shaped swimming pool icon. Undercover was the company name.'My business was just starting to get off the ground when the economic crisis hit. But Danie carried us, with his salary. We worked so hard ... And then, on the twenty-fifth of November, Danie disappeared. He was at work the whole day. We spoke on the telephone, must have been about half past three. Then he said he was going to the gym when he left work at five. He'd usually be home by half past six after that, he'd try to go to the gym four times a week. I found his car at the gym, eleven o'clock that night, but he was just gone ...''Mrs Flint, I have ...''Tanya,' she said.Joubert nodded. 'I need as much detail about that day as you can give me.'She opened the notebook in front of her. 'I wrote everything down ...''That's good,' Joubert encouraged her.She looked at her notes. 'I only got away from work at a quarter to six, then I stopped at the Spar for bread and milk and salad. I was probably at home by quarter past and wanted to get the food ready in time, because on Wednesdays we watched Boston
Legal, it was Danie's favourite, it starts at half past seven. Supper was ready around seven, but he wasn't at home yet. But with Danie ... Sometimes he'd get talking to someone, he's just so spontaneous, so now and then he'd be late. But then I called him, ten past seven, and his cellphone just rang. I didn't leave a message, because maybe he was still in the gym. But at twenty-five past I started to get worried, because he never misses Boston Legal, he was crazy about it, he always said, ""Danie Flint"", you know, like ""Denny Crane"". Then I called again, but he still didn't answer. So I left a message. I just said, call me, I'll tape the show for you, because perhaps his phone was on silent, perhaps he'd forgotten to switch it on. Eight o'clock I called again. You know how a cellphone rings for a shorter time when you've had a missed call or a voicemail you haven't listened to yet? Then I thought maybe he'd had a call-out, if one of the buses had been in an accident, or something like that, then they'd call him, then he'd have to go. So I called Neville Philander who works with him, and Neville said no, Danie left work at five, he doesn't know about any call-out, he'll try to find out. Then I started calling Danie's friends, and his mother, she lives in Panorama, but no one had seen him. Then I called his cellphone again and I got in my car and I drove to the gym to look for him, but...' She made a shrugging gesture that said he wasn't there.'The police station is right next to the gym in Table View. So I went in and I said my husband is missing and the guy said to me since when and I said he should have been at home at half past six, and he said, ""Ma'am, it's nine o'clock now,"" and I said he hadn't let me know. Then he asked, ""Did you have a fight?"" And I said no, and he said, ""Ma'am, you know men,"" and I said not my man. And then he said, ""He's probably with his girlfriend."" That's when I started crying.'"|Trackers|"Deon Meyer"
