13:52|13.52|"The Pilatus PC-12 landed at Walvis Bay at 13.52. It was the 'Combi' model, fitted out for four passengers and considerable cargo - in this instance, 200 kilograms of computer hardware.The four men, respectively, two break-in specialists and two of Rajhev Rajkumar's best technicians, climbed out, offloaded the cratesof equipment and waited for Reinhard Rohn, who came towards them over the tarred surface, with an import permit in hand and two customs officers at his side.It took ten minutes to deal with the formalities. Rohn fetched his bakkie to transport the crates. Once they were loaded, the break-in specialists and technicians, each with an overnight bag slung over the shoulder, walked off to the car hire section. Rohn watched them go, noting the lean bodies, the brash self-confidence. I was like that too, he thought. Long ago.Operation ShawwalTranscription: Audio surveillance, J. Shabangu and L. Becker, cellphone conversationDate and Time: 27 September 2009. 17.21JS: I don't have your fucking money and I'm telling you now, if I get my
hands on you, you are going to bleed . . .LB: Ay, Ouboet, that won't get us anywhere. Who has my money then?JS: Fuck off.(Call terminated.)Operation ShawwalTranscription: Audio surveillance, J. Shabangu and L. Becker, cellphone conversationDate and Time: 27 September 2009. 17.29LB: Ouboet, what a surprise .. .JS: I'm going to tell you who has your money. Then you leave me alone.LB: On my word of honour.JS: Shaheed Latif Osman. Go and ask him.LB: Who is Shaheed Latif Osman?JS: He's a fuckin' isela, he lives in the Cape. He's got your money. Every fucking cent. I'm going to SMS you his number. You tell him, he and Tweety the Bird must give you your money. Tell him I said they should do it.LB: Ouboet, I thank you ...JS: Don't phone me again, fucking never again!At 23.00 Quinn went to the office to monitor the break-in and installation taking place in Walvis Bay.The operator had him listen to the conversation between Gauteng crime boss Julius Shabangu and the mysterious Lukas Becker. When it had finished Quinn shook his head in concern and disbelief. He wrote a quick email to Masilo and Rajkumar. He said that Becker was no longer just comic relief, since it was his call to Shabangu that had upset the Musina interception so dramatically. He was an unknown factor, with the potential to derail the whole operation. Consequently, they urgently needed to find out more, do an in-depth profile on him. And seriously consider intercepting him.He sent the email and went to the Ops Room. Fifteen minutes before the Walvis Bay break-in. He sent up an emergency prayer. Dear Lord, please don't let there be any mistakes tonight. Amen.28 September 2009. Monday.Twenty past twelve at night, Milla's cellphone dragged her from sleep and she stumbled to the sitting room with a feeling of foreboding. She saw it was Barend calling and her stomach contracted.'Are you OK?' was the first thing she asked.'It's Pa,' he said.Milla had to sit down suddenly. 'What happened?''He's been assaulted. He's in hospital.''Assaulted? Where?' She couldn't understand the reproach in her son's voice, it was not her fault.'In Jacobsdal, but the ambulance took them to Kimberley ...''Barend, how serious is it?''Serious. They broke his cheekbone and nose and his ribs ...''How do you know this? How did you hear about it?''He phoned me, just now ...''Your father phoned you?''Yes ...'Relief, and she nearly said, 'It can't be too bad then'. She sank back slowly on the couch. 'Who assaulted him? Why?''A bunch of guys just walked in and started beating them up ...''Them?''Oom Tjaart and Oom Langes and Oom Raynier, they were on the Harleys, they stopped in Jacobsdal to have a drink, then these freaks came into the bar and started beating them ...'That was why Barend had to go to his grandparents for the holiday. So Christo and friends could go on a Harley road trip. He was still not taking his fatherly duties seriously, he still put himself first. But she would have to restrain herself, her son needed her.'Does Granny know?''No.''I'll phone the hospital and find out how serious it is, then I'll call you back.''Ma, why don't you phone Pa?''A doctor would ... we need an expert opinion.'Only once she had rung off, did she realise Barend's question meant that he still had hope, that he saw the assault as an opportunity to bring her and Christo back together.Half an hour later she phoned Barend. 'I spoke to the ward nurse. She says none of their injuries are serious, they will all be discharged later today.''How will Pa get home, Ma? He can't ride his bike with broken ribs. Can't we go and fetch him?''There are regular flights between Kimberley and Cape Town, Barend ...''Ma, how can you be so unfeeling?'"|Trackers|"Deon Meyer"
23:00|23.00|"The Pilatus PC-12 landed at Walvis Bay at 13.52. It was the 'Combi' model, fitted out for four passengers and considerable cargo - in this instance, 200 kilograms of computer hardware.The four men, respectively, two break-in specialists and two of Rajhev Rajkumar's best technicians, climbed out, offloaded the cratesof equipment and waited for Reinhard Rohn, who came towards them over the tarred surface, with an import permit in hand and two customs officers at his side.It took ten minutes to deal with the formalities. Rohn fetched his bakkie to transport the crates. Once they were loaded, the break-in specialists and technicians, each with an overnight bag slung over the shoulder, walked off to the car hire section. Rohn watched them go, noting the lean bodies, the brash self-confidence. I was like that too, he thought. Long ago.Operation ShawwalTranscription: Audio surveillance, J. Shabangu and L. Becker, cellphone conversationDate and Time: 27 September 2009. 17.21JS: I don't have your fucking money and I'm telling you now, if I get my
hands on you, you are going to bleed . . .LB: Ay, Ouboet, that won't get us anywhere. Who has my money then?JS: Fuck off.(Call terminated.)Operation ShawwalTranscription: Audio surveillance, J. Shabangu and L. Becker, cellphone conversationDate and Time: 27 September 2009. 17.29LB: Ouboet, what a surprise .. .JS: I'm going to tell you who has your money. Then you leave me alone.LB: On my word of honour.JS: Shaheed Latif Osman. Go and ask him.LB: Who is Shaheed Latif Osman?JS: He's a fuckin' isela, he lives in the Cape. He's got your money. Every fucking cent. I'm going to SMS you his number. You tell him, he and Tweety the Bird must give you your money. Tell him I said they should do it.LB: Ouboet, I thank you ...JS: Don't phone me again, fucking never again!At 23.00 Quinn went to the office to monitor the break-in and installation taking place in Walvis Bay.The operator had him listen to the conversation between Gauteng crime boss Julius Shabangu and the mysterious Lukas Becker. When it had finished Quinn shook his head in concern and disbelief. He wrote a quick email to Masilo and Rajkumar. He said that Becker was no longer just comic relief, since it was his call to Shabangu that had upset the Musina interception so dramatically. He was an unknown factor, with the potential to derail the whole operation. Consequently, they urgently needed to find out more, do an in-depth profile on him. And seriously consider intercepting him.He sent the email and went to the Ops Room. Fifteen minutes before the Walvis Bay break-in. He sent up an emergency prayer. Dear Lord, please don't let there be any mistakes tonight. Amen.28 September 2009. Monday.Twenty past twelve at night, Milla's cellphone dragged her from sleep and she stumbled to the sitting room with a feeling of foreboding. She saw it was Barend calling and her stomach contracted.'Are you OK?' was the first thing she asked.'It's Pa,' he said.Milla had to sit down suddenly. 'What happened?''He's been assaulted. He's in hospital.''Assaulted? Where?' She couldn't understand the reproach in her son's voice, it was not her fault.'In Jacobsdal, but the ambulance took them to Kimberley ...''Barend, how serious is it?''Serious. They broke his cheekbone and nose and his ribs ...''How do you know this? How did you hear about it?''He phoned me, just now ...''Your father phoned you?''Yes ...'Relief, and she nearly said, 'It can't be too bad then'. She sank back slowly on the couch. 'Who assaulted him? Why?''A bunch of guys just walked in and started beating them up ...''Them?''Oom Tjaart and Oom Langes and Oom Raynier, they were on the Harleys, they stopped in Jacobsdal to have a drink, then these freaks came into the bar and started beating them ...'That was why Barend had to go to his grandparents for the holiday. So Christo and friends could go on a Harley road trip. He was still not taking his fatherly duties seriously, he still put himself first. But she would have to restrain herself, her son needed her.'Does Granny know?''No.''I'll phone the hospital and find out how serious it is, then I'll call you back.''Ma, why don't you phone Pa?''A doctor would ... we need an expert opinion.'Only once she had rung off, did she realise Barend's question meant that he still had hope, that he saw the assault as an opportunity to bring her and Christo back together.Half an hour later she phoned Barend. 'I spoke to the ward nurse. She says none of their injuries are serious, they will all be discharged later today.''How will Pa get home, Ma? He can't ride his bike with broken ribs. Can't we go and fetch him?''There are regular flights between Kimberley and Cape Town, Barend ...''Ma, how can you be so unfeeling?'"|Trackers|"Deon Meyer"
"> 00:00"|"past twelve at night"|"The Pilatus PC-12 landed at Walvis Bay at 13.52. It was the 'Combi' model, fitted out for four passengers and considerable cargo - in this instance, 200 kilograms of computer hardware.The four men, respectively, two break-in specialists and two of Rajhev Rajkumar's best technicians, climbed out, offloaded the cratesof equipment and waited for Reinhard Rohn, who came towards them over the tarred surface, with an import permit in hand and two customs officers at his side.It took ten minutes to deal with the formalities. Rohn fetched his bakkie to transport the crates. Once they were loaded, the break-in specialists and technicians, each with an overnight bag slung over the shoulder, walked off to the car hire section. Rohn watched them go, noting the lean bodies, the brash self-confidence. I was like that too, he thought. Long ago.Operation ShawwalTranscription: Audio surveillance, J. Shabangu and L. Becker, cellphone conversationDate and Time: 27 September 2009. 17.21JS: I don't have your fucking money and I'm telling you now, if I get my
hands on you, you are going to bleed . . .LB: Ay, Ouboet, that won't get us anywhere. Who has my money then?JS: Fuck off.(Call terminated.)Operation ShawwalTranscription: Audio surveillance, J. Shabangu and L. Becker, cellphone conversationDate and Time: 27 September 2009. 17.29LB: Ouboet, what a surprise .. .JS: I'm going to tell you who has your money. Then you leave me alone.LB: On my word of honour.JS: Shaheed Latif Osman. Go and ask him.LB: Who is Shaheed Latif Osman?JS: He's a fuckin' isela, he lives in the Cape. He's got your money. Every fucking cent. I'm going to SMS you his number. You tell him, he and Tweety the Bird must give you your money. Tell him I said they should do it.LB: Ouboet, I thank you ...JS: Don't phone me again, fucking never again!At 23.00 Quinn went to the office to monitor the break-in and installation taking place in Walvis Bay.The operator had him listen to the conversation between Gauteng crime boss Julius Shabangu and the mysterious Lukas Becker. When it had finished Quinn shook his head in concern and disbelief. He wrote a quick email to Masilo and Rajkumar. He said that Becker was no longer just comic relief, since it was his call to Shabangu that had upset the Musina interception so dramatically. He was an unknown factor, with the potential to derail the whole operation. Consequently, they urgently needed to find out more, do an in-depth profile on him. And seriously consider intercepting him.He sent the email and went to the Ops Room. Fifteen minutes before the Walvis Bay break-in. He sent up an emergency prayer. Dear Lord, please don't let there be any mistakes tonight. Amen.28 September 2009. Monday.Twenty past twelve at night, Milla's cellphone dragged her from sleep and she stumbled to the sitting room with a feeling of foreboding. She saw it was Barend calling and her stomach contracted.'Are you OK?' was the first thing she asked.'It's Pa,' he said.Milla had to sit down suddenly. 'What happened?''He's been assaulted. He's in hospital.''Assaulted? Where?' She couldn't understand the reproach in her son's voice, it was not her fault.'In Jacobsdal, but the ambulance took them to Kimberley ...''Barend, how serious is it?''Serious. They broke his cheekbone and nose and his ribs ...''How do you know this? How did you hear about it?''He phoned me, just now ...''Your father phoned you?''Yes ...'Relief, and she nearly said, 'It can't be too bad then'. She sank back slowly on the couch. 'Who assaulted him? Why?''A bunch of guys just walked in and started beating them up ...''Them?''Oom Tjaart and Oom Langes and Oom Raynier, they were on the Harleys, they stopped in Jacobsdal to have a drink, then these freaks came into the bar and started beating them ...'That was why Barend had to go to his grandparents for the holiday. So Christo and friends could go on a Harley road trip. He was still not taking his fatherly duties seriously, he still put himself first. But she would have to restrain herself, her son needed her.'Does Granny know?''No.''I'll phone the hospital and find out how serious it is, then I'll call you back.''Ma, why don't you phone Pa?''A doctor would ... we need an expert opinion.'Only once she had rung off, did she realise Barend's question meant that he still had hope, that he saw the assault as an opportunity to bring her and Christo back together.Half an hour later she phoned Barend. 'I spoke to the ward nurse. She says none of their injuries are serious, they will all be discharged later today.''How will Pa get home, Ma? He can't ride his bike with broken ribs. Can't we go and fetch him?''There are regular flights between Kimberley and Cape Town, Barend ...''Ma, how can you be so unfeeling?'"|Trackers|"Deon Meyer"
00:00|midnight|"1 October 2009. Thursday.Past midnight, when he was deeply, soundly asleep, Quinn's cellphone rang.The noise - and his wife's elbow in his ribs - woke him. He got up hurriedly, confused, fumbled for the phone twice, and scrambled groggily down the passage peering blearily at the screen. It was his bureau chief in Johannesburg.'Yes,' he said.'I'm really sorry, but it's Inkunzi Shabangu. He's been killed. Massive bloodbath at his house. I thought you'd want to know right away.' 'When?''About an hour ago.''How?''Looks like Shabangu was killed with a shotgun, some of his people with a handgun.''How did you find out so quickly?''We were the first on the scene. One of our cellular surveillance vehicles saw a white male coming past him at high speed in Shabangu's BMW, and went to the house. Everything was open, the gate, the garage door ... Then the security company arrived, and went in. My guy called me, and I told him to follow the security man inside. They found three bodies, Shabangu and two cronies.''Are the police there?''They arrived ten minutes later. Place is now swarming.'Quinn was wide awake now. 'Tell me about the white male.''Not much to tell. He went past at high speed. Surveillance guy can't give a description. There's a bulletin out on the BMW ...''OK,' said Quinn. 'How are your police connections?''Pretty good. I'll keep you posted.''Thanks.'Quinn went to the kitchen, sat on the high stool in the breakfast corner, his brain racing.Ouboet, should I rather come to your house. I know where you live. Becker had said something like that to Shabangu last week over the phone.Becker. He had phoned the number he got from Shabangu, day before yesterday, the number for Supreme Committee member Shaheed Latif Osman. And he had been told it was the wrong number.Did he go to Shabangu's house last night? His patience exhausted?What had Shabangu said to him before The Bull was shot? About Osman and the Committee.Quinn picked up his cellphone and called the PIA office, got the Ops operator on night shift. 'I want a general and comprehensive red flag warning for a Lukas Becker, his ID and credit card details are on the system. If he moves an inch I want to know about it. And phone the Bureau in Bloemfontein. Tell him I want all his people on the Becker investigation. Now.'Quinn propped his elbows on the kitchen counter and rubbed his eyes. This had suddenly become quite complicated. They had intelligence on a serious crime. Someone would have to decide what they shared with the police. And when.Not his problem. Time to disturb the Advocate's sleep as well.The red flag was digitally hoisted at seven o'clock that morning, at the Oliver Tambo Airport when Lukas Becker used his credit card at the l time airline counter to buy a ticket for flight 1 T 103 to Kaapstad.'It departs at 09.25 and arrives at 11.35,' Quinn told Masilo over the phone, '1 time has agreed to an IFI, I'm sending my best teams to begin observation once he lands.''Good,' said Masilo.'And the police?''The risk to the operation is too great. We say nothing. But you must not let Becker out of your sight. Not for a second.'"|Trackers|"Deon Meyer"
07:00|"seven o'clock that morning"|"1 October 2009. Thursday.Past midnight, when he was deeply, soundly asleep, Quinn's cellphone rang.The noise - and his wife's elbow in his ribs - woke him. He got up hurriedly, confused, fumbled for the phone twice, and scrambled groggily down the passage peering blearily at the screen. It was his bureau chief in Johannesburg.'Yes,' he said.'I'm really sorry, but it's Inkunzi Shabangu. He's been killed. Massive bloodbath at his house. I thought you'd want to know right away.' 'When?''About an hour ago.''How?''Looks like Shabangu was killed with a shotgun, some of his people with a handgun.''How did you find out so quickly?''We were the first on the scene. One of our cellular surveillance vehicles saw a white male coming past him at high speed in Shabangu's BMW, and went to the house. Everything was open, the gate, the garage door ... Then the security company arrived, and went in. My guy called me, and I told him to follow the security man inside. They found three bodies, Shabangu and two cronies.''Are the police there?''They arrived ten minutes later. Place is now swarming.'Quinn was wide awake now. 'Tell me about the white male.''Not much to tell. He went past at high speed. Surveillance guy can't give a description. There's a bulletin out on the BMW ...''OK,' said Quinn. 'How are your police connections?''Pretty good. I'll keep you posted.''Thanks.'Quinn went to the kitchen, sat on the high stool in the breakfast corner, his brain racing.Ouboet, should I rather come to your house. I know where you live. Becker had said something like that to Shabangu last week over the phone.Becker. He had phoned the number he got from Shabangu, day before yesterday, the number for Supreme Committee member Shaheed Latif Osman. And he had been told it was the wrong number.Did he go to Shabangu's house last night? His patience exhausted?What had Shabangu said to him before The Bull was shot? About Osman and the Committee.Quinn picked up his cellphone and called the PIA office, got the Ops operator on night shift. 'I want a general and comprehensive red flag warning for a Lukas Becker, his ID and credit card details are on the system. If he moves an inch I want to know about it. And phone the Bureau in Bloemfontein. Tell him I want all his people on the Becker investigation. Now.'Quinn propped his elbows on the kitchen counter and rubbed his eyes. This had suddenly become quite complicated. They had intelligence on a serious crime. Someone would have to decide what they shared with the police. And when.Not his problem. Time to disturb the Advocate's sleep as well.The red flag was digitally hoisted at seven o'clock that morning, at the Oliver Tambo Airport when Lukas Becker used his credit card at the l time airline counter to buy a ticket for flight 1 T 103 to Kaapstad.'It departs at 09.25 and arrives at 11.35,' Quinn told Masilo over the phone, '1 time has agreed to an IFI, I'm sending my best teams to begin observation once he lands.''Good,' said Masilo.'And the police?''The risk to the operation is too great. We say nothing. But you must not let Becker out of your sight. Not for a second.'"|Trackers|"Deon Meyer"
"ap 09:25"|09.25|"1 October 2009. Thursday.Past midnight, when he was deeply, soundly asleep, Quinn's cellphone rang.The noise - and his wife's elbow in his ribs - woke him. He got up hurriedly, confused, fumbled for the phone twice, and scrambled groggily down the passage peering blearily at the screen. It was his bureau chief in Johannesburg.'Yes,' he said.'I'm really sorry, but it's Inkunzi Shabangu. He's been killed. Massive bloodbath at his house. I thought you'd want to know right away.' 'When?''About an hour ago.''How?''Looks like Shabangu was killed with a shotgun, some of his people with a handgun.''How did you find out so quickly?''We were the first on the scene. One of our cellular surveillance vehicles saw a white male coming past him at high speed in Shabangu's BMW, and went to the house. Everything was open, the gate, the garage door ... Then the security company arrived, and went in. My guy called me, and I told him to follow the security man inside. They found three bodies, Shabangu and two cronies.''Are the police there?''They arrived ten minutes later. Place is now swarming.'Quinn was wide awake now. 'Tell me about the white male.''Not much to tell. He went past at high speed. Surveillance guy can't give a description. There's a bulletin out on the BMW ...''OK,' said Quinn. 'How are your police connections?''Pretty good. I'll keep you posted.''Thanks.'Quinn went to the kitchen, sat on the high stool in the breakfast corner, his brain racing.Ouboet, should I rather come to your house. I know where you live. Becker had said something like that to Shabangu last week over the phone.Becker. He had phoned the number he got from Shabangu, day before yesterday, the number for Supreme Committee member Shaheed Latif Osman. And he had been told it was the wrong number.Did he go to Shabangu's house last night? His patience exhausted?What had Shabangu said to him before The Bull was shot? About Osman and the Committee.Quinn picked up his cellphone and called the PIA office, got the Ops operator on night shift. 'I want a general and comprehensive red flag warning for a Lukas Becker, his ID and credit card details are on the system. If he moves an inch I want to know about it. And phone the Bureau in Bloemfontein. Tell him I want all his people on the Becker investigation. Now.'Quinn propped his elbows on the kitchen counter and rubbed his eyes. This had suddenly become quite complicated. They had intelligence on a serious crime. Someone would have to decide what they shared with the police. And when.Not his problem. Time to disturb the Advocate's sleep as well.The red flag was digitally hoisted at seven o'clock that morning, at the Oliver Tambo Airport when Lukas Becker used his credit card at the l time airline counter to buy a ticket for flight 1 T 103 to Kaapstad.'It departs at 09.25 and arrives at 11.35,' Quinn told Masilo over the phone, '1 time has agreed to an IFI, I'm sending my best teams to begin observation once he lands.''Good,' said Masilo.'And the police?''The risk to the operation is too great. We say nothing. But you must not let Becker out of your sight. Not for a second.'"|Trackers|"Deon Meyer"
