"ap 05:30"|"half past five"|"At a quarter to four I was still sitting on the ground, only the thin tree trunk between me and the pitiless sun. My cellphone rang. I got to my feet and took it out of my trouser pocket, hoping it was Diederik Brand. There was a lot I had to say to him.It was Oom Joe van Wyk. Of Loxton. 'Lemmer, ou maat, I hear Diederik has got you into something.''Yes, Oom,' addressing him in the Karoo vernacular.'Did he pay you up front?''I don't know, Oom Joe, he's working through my employer.''Oh. No, that's all right then. And what must you do for him?''I'm not at liberty to say.''Ay, that Diederik,' he laughed his happy laugh. 'Well then, sterkte, Lemmer, ou maat,' he wished me well as his 'old friend'. 'Tante Anna sends her regards.'At ten to four my phone rang again. Oom Ben Bruwer, the builder in Loxton, the man who I had consulted about my rotting roof. 'So, you're working for Diederik Brand.' A reproach.'Only for a day or two, Oom.'He chewed over the information. 'Nonetheless, if I were you I would ask for a deposit. Fifty per cent up front.''He's negotiating with my boss, Oom Ben.''Nonetheless, I would ask for fifty per cent up front. Have a good day.' And he was gone.Loxton was waking from its afternoon nap. News was spreading like a virus.At half past five the eccentric Antjie Barnard called, seventy years old, a retired international cellist who smoked and drank as if she were twenty. 'Emma is sitting with me here on my veranda, we're drinking gin and tonics and missing you,' she said in her ever-sensual voice.And here I stood sweating in the Limpopo sun, all my patience exhausted, waiting. I swallowed that thought. 'I miss you both too.''She says you are working for Diederik, but she's very secretive.''That's my Emma. Always an enigma.'Antjie giggled. That meant she was on her third gin. 'You know how you deal with Diederik?''Take your money up front?''Aah, Joe has phoned you already.''And Oom Ben.''The town is concerned about you.''I appreciate that.''Do you want to talk to Emma?' So that Antjie could listen and pick up clues to what I was doing for Diederik.This was not the right time to speak to Emma.'I'm a little busy, Antjie, tell Emma I'll call her later.'At ten to five a lorry drove up the tar road. The logo of Nicola's Wildlife Services on the door of the white cab, and a massive bull bar in front. I walked to the edge of the road and waved my arms. If he drove past I was going to take the shotgun and shoot out a tyre.He stopped.As I opened the door, swung the bag up and climbed in, Lourens le Riche said: 'I thought Oom would be at the airfield?'I said nothing. Slammed the door harder than necessary.'I'm Lourens, Oom,' he put out his hand. 'Have you been waiting long, Oom?'The le Riche family were a Loxton legend.My knowledge was limited, from bits of stories told here and there. They farmed out on the Pampoenpoort Road, merino
sheep on 6,000 hectares, no labourers on the farm. The family did everything themselves - father, mother, two sons and a daughter. Like their parents, the children were sinewy and tough.Lourens, the oldest, was a final-year agricultural student at Stellenbosch. He paid for his own studies, taking every possible opportunity to earn a few rand. Like this one. I wondered if he had got his money up front. But I didn't ask because I was sticky with sweat, hot and angry.'Oom Diederik said you would be here around five o'clock,' he explained his time of arrival as he pulled away. 'So I took a nap, because we're going to pull an all-nighter.' His face was angular: high forehead, a determined chin, easy smile. 'Did you have a good flight, Oom?'It was the innocence in his voice that stopped me from taking out my frustration on him. I felt the refreshing air conditioning, angled the vent in the instrument panel towards me, turned the knob of the fan up and said, 'No, not really. And you don't have to call me Oom.''OK, Oom.'I shifted the sports bag into the space behind the seats, put on my seat belt and settled into the seat.'Diederik was a bit vague about our schedule.''We are going to get something to eat in town now, Oom, because we are loading tonight after dark. Round about eight. And then we are on our way.'As the Mercedes diesel growled up the main street of Musina, Lourens le Riche said: 'You must be lekker hungry, Oom, shall we go and get a steak?'"|Trackers|"Deon Meyer"
"ap 04:50"|"ten to five"|"At a quarter to four I was still sitting on the ground, only the thin tree trunk between me and the pitiless sun. My cellphone rang. I got to my feet and took it out of my trouser pocket, hoping it was Diederik Brand. There was a lot I had to say to him.It was Oom Joe van Wyk. Of Loxton. 'Lemmer, ou maat, I hear Diederik has got you into something.''Yes, Oom,' addressing him in the Karoo vernacular.'Did he pay you up front?''I don't know, Oom Joe, he's working through my employer.''Oh. No, that's all right then. And what must you do for him?''I'm not at liberty to say.''Ay, that Diederik,' he laughed his happy laugh. 'Well then, sterkte, Lemmer, ou maat,' he wished me well as his 'old friend'. 'Tante Anna sends her regards.'At ten to four my phone rang again. Oom Ben Bruwer, the builder in Loxton, the man who I had consulted about my rotting roof. 'So, you're working for Diederik Brand.' A reproach.'Only for a day or two, Oom.'He chewed over the information. 'Nonetheless, if I were you I would ask for a deposit. Fifty per cent up front.''He's negotiating with my boss, Oom Ben.''Nonetheless, I would ask for fifty per cent up front. Have a good day.' And he was gone.Loxton was waking from its afternoon nap. News was spreading like a virus.At half past five the eccentric Antjie Barnard called, seventy years old, a retired international cellist who smoked and drank as if she were twenty. 'Emma is sitting with me here on my veranda, we're drinking gin and tonics and missing you,' she said in her ever-sensual voice.And here I stood sweating in the Limpopo sun, all my patience exhausted, waiting. I swallowed that thought. 'I miss you both too.''She says you are working for Diederik, but she's very secretive.''That's my Emma. Always an enigma.'Antjie giggled. That meant she was on her third gin. 'You know how you deal with Diederik?''Take your money up front?''Aah, Joe has phoned you already.''And Oom Ben.''The town is concerned about you.''I appreciate that.''Do you want to talk to Emma?' So that Antjie could listen and pick up clues to what I was doing for Diederik.This was not the right time to speak to Emma.'I'm a little busy, Antjie, tell Emma I'll call her later.'At ten to five a lorry drove up the tar road. The logo of Nicola's Wildlife Services on the door of the white cab, and a massive bull bar in front. I walked to the edge of the road and waved my arms. If he drove past I was going to take the shotgun and shoot out a tyre.He stopped.As I opened the door, swung the bag up and climbed in, Lourens le Riche said: 'I thought Oom would be at the airfield?'I said nothing. Slammed the door harder than necessary.'I'm Lourens, Oom,' he put out his hand. 'Have you been waiting long, Oom?'The le Riche family were a Loxton legend.My knowledge was limited, from bits of stories told here and there. They farmed out on the Pampoenpoort Road, merino
sheep on 6,000 hectares, no labourers on the farm. The family did everything themselves - father, mother, two sons and a daughter. Like their parents, the children were sinewy and tough.Lourens, the oldest, was a final-year agricultural student at Stellenbosch. He paid for his own studies, taking every possible opportunity to earn a few rand. Like this one. I wondered if he had got his money up front. But I didn't ask because I was sticky with sweat, hot and angry.'Oom Diederik said you would be here around five o'clock,' he explained his time of arrival as he pulled away. 'So I took a nap, because we're going to pull an all-nighter.' His face was angular: high forehead, a determined chin, easy smile. 'Did you have a good flight, Oom?'It was the innocence in his voice that stopped me from taking out my frustration on him. I felt the refreshing air conditioning, angled the vent in the instrument panel towards me, turned the knob of the fan up and said, 'No, not really. And you don't have to call me Oom.''OK, Oom.'I shifted the sports bag into the space behind the seats, put on my seat belt and settled into the seat.'Diederik was a bit vague about our schedule.''We are going to get something to eat in town now, Oom, because we are loading tonight after dark. Round about eight. And then we are on our way.'As the Mercedes diesel growled up the main street of Musina, Lourens le Riche said: 'You must be lekker hungry, Oom, shall we go and get a steak?'"|Trackers|"Deon Meyer"
"ap ~ 05:00"|"around five o'clock"|"At a quarter to four I was still sitting on the ground, only the thin tree trunk between me and the pitiless sun. My cellphone rang. I got to my feet and took it out of my trouser pocket, hoping it was Diederik Brand. There was a lot I had to say to him.It was Oom Joe van Wyk. Of Loxton. 'Lemmer, ou maat, I hear Diederik has got you into something.''Yes, Oom,' addressing him in the Karoo vernacular.'Did he pay you up front?''I don't know, Oom Joe, he's working through my employer.''Oh. No, that's all right then. And what must you do for him?''I'm not at liberty to say.''Ay, that Diederik,' he laughed his happy laugh. 'Well then, sterkte, Lemmer, ou maat,' he wished me well as his 'old friend'. 'Tante Anna sends her regards.'At ten to four my phone rang again. Oom Ben Bruwer, the builder in Loxton, the man who I had consulted about my rotting roof. 'So, you're working for Diederik Brand.' A reproach.'Only for a day or two, Oom.'He chewed over the information. 'Nonetheless, if I were you I would ask for a deposit. Fifty per cent up front.''He's negotiating with my boss, Oom Ben.''Nonetheless, I would ask for fifty per cent up front. Have a good day.' And he was gone.Loxton was waking from its afternoon nap. News was spreading like a virus.At half past five the eccentric Antjie Barnard called, seventy years old, a retired international cellist who smoked and drank as if she were twenty. 'Emma is sitting with me here on my veranda, we're drinking gin and tonics and missing you,' she said in her ever-sensual voice.And here I stood sweating in the Limpopo sun, all my patience exhausted, waiting. I swallowed that thought. 'I miss you both too.''She says you are working for Diederik, but she's very secretive.''That's my Emma. Always an enigma.'Antjie giggled. That meant she was on her third gin. 'You know how you deal with Diederik?''Take your money up front?''Aah, Joe has phoned you already.''And Oom Ben.''The town is concerned about you.''I appreciate that.''Do you want to talk to Emma?' So that Antjie could listen and pick up clues to what I was doing for Diederik.This was not the right time to speak to Emma.'I'm a little busy, Antjie, tell Emma I'll call her later.'At ten to five a lorry drove up the tar road. The logo of Nicola's Wildlife Services on the door of the white cab, and a massive bull bar in front. I walked to the edge of the road and waved my arms. If he drove past I was going to take the shotgun and shoot out a tyre.He stopped.As I opened the door, swung the bag up and climbed in, Lourens le Riche said: 'I thought Oom would be at the airfield?'I said nothing. Slammed the door harder than necessary.'I'm Lourens, Oom,' he put out his hand. 'Have you been waiting long, Oom?'The le Riche family were a Loxton legend.My knowledge was limited, from bits of stories told here and there. They farmed out on the Pampoenpoort Road, merino
sheep on 6,000 hectares, no labourers on the farm. The family did everything themselves - father, mother, two sons and a daughter. Like their parents, the children were sinewy and tough.Lourens, the oldest, was a final-year agricultural student at Stellenbosch. He paid for his own studies, taking every possible opportunity to earn a few rand. Like this one. I wondered if he had got his money up front. But I didn't ask because I was sticky with sweat, hot and angry.'Oom Diederik said you would be here around five o'clock,' he explained his time of arrival as he pulled away. 'So I took a nap, because we're going to pull an all-nighter.' His face was angular: high forehead, a determined chin, easy smile. 'Did you have a good flight, Oom?'It was the innocence in his voice that stopped me from taking out my frustration on him. I felt the refreshing air conditioning, angled the vent in the instrument panel towards me, turned the knob of the fan up and said, 'No, not really. And you don't have to call me Oom.''OK, Oom.'I shifted the sports bag into the space behind the seats, put on my seat belt and settled into the seat.'Diederik was a bit vague about our schedule.''We are going to get something to eat in town now, Oom, because we are loading tonight after dark. Round about eight. And then we are on our way.'As the Mercedes diesel growled up the main street of Musina, Lourens le Riche said: 'You must be lekker hungry, Oom, shall we go and get a steak?'"|Trackers|"Deon Meyer"
"ap 05:00"|five-o'clock|"I was expecting a clandestine smuggling rendezvous in the dark, with people sneaking about and urgent whispering somewhere in the thick bush. What we got was the brightly lit, busy yard of an irrigation farm on the banks of the Limpopo River.A dozen black labourers sat and talked loudly on the concrete edge of a long steel shed, waiting. On the tailgate of a white Land Cruiser sat two white men in khaki shorts, khaki-and-green shirts, long socks, short work boots. As we drove into the yard, they jumped off. One was young, early twenties, the other well into his forties.Lourens stopped. We climbed out. The white men approached. 'Lourens?' asked the older, and stretched out his hand.'That's me, Oom.''Wickus Swanepoel,' he pronounced the 'W' as a 'V', 'and this is my son, Swannie.''And this is Oom Lemmer ...'We shook hands. They were two big men with five-o'clock-shadows, farmers' tans, identical snub noses, and bushy eyebrows. Pa Wickus's leather belt was slung low to accommodate a beer belly.'Their truck is waiting at the border, over there,' he said, and pointed north. 'Are you ready?''Yes, we're ready, Oom.'Wickus looked at his son. 'Tell them they can come. Make sure they have deflated the tyres. And that they know about the poles.'Swannie took a cellphone out of his shorts pocket and phoned. His father said, 'We thought it better to wait for dark before they came across. Just in case.'Just in case, I thought. Diederik's words.The son was talking on the cellphone: 'Cornel, you can come across, they are here. Have you let air out of your tyres?''Turn your truck around so long,' Wickus said to Lourens. 'And open the back doors.''Right, Oom,' Lourens said. 'How long will it take?''They are just here, across the river, in the orchards on the Zim side. If they don't get stuck in the bloody sand they will be here now-now.'Lourens got into the Mercedes.'They're coming, Pa,' said Swannie, the son.'Did you tell them to look out for the marker poles?''No, Pa. But they say they can see our lights.''No, oh Koot, that's just like a woman, the lights won't help fuck all if they don't watch the markers.''Don't worry, Pa.'Lourens turned the Mercedes around so the nose pointed back in the direction we had come. Wickus Swanepoel walked over to where the labourers sat talking. He gave orders in their language. They stood up and came closer. Wickus gave more orders and pointed at some thick metal bars that lay in the doorway of the shed. Half of the labourers went over and got them.Lourens switched off the Mercedes, jumped down and slid open the bolts of the rearmost grey steel doors.'I hear they have a Bedford, might be a little lower than your load bed, if so we will get out the pulleys,' said Wickus.'I hear them, Pa,' said Swannie.The rumble of a diesel engine could be heard out of the darkness, at high revs.'Oh hell,' said Wickus, 'I hope the bugger knows how to drive in sand.'Lourens came closer. We stood four in a row, eyes to the north in the direction of the noise. 'Sand is loose this time of year,' said Wickus. 'Soft. Powder. River is dry. If they haven't let down the tyres they will get stuck. Then we're stuffed.''Don't worry, Pa.''Someone has to fokken worry.''Listen, they're through.'The engine's revs were lower now, more controlled.'So why doesn't he put his lights on?''Don't worry, Pa.''Stop saying that to me.''But we don't have to worry, Pa. We have all the permits this side.''Those people still have to bugger off back to Zim tonight, and they don't have papers.'Then we saw the lorry, an old Bedford, appear out of the dark at the furthest extent of the lighted circle.'Thank God,' said Wickus Swanepoel. 'It's an old RL.''Pa?''Was about the only Bedford with four-wheel drive,' his father said, as the lorry stopped in front of us. It looked like an old military vehicle, the green paint bleached and worn, but there was nothing wrong with the engine. A black driver sat behind the wheel, yellow vest, muscular arms, cigarette in mouth.The passenger door opened. A woman jumped down lightly. She ignored us, moved straight to the back of the vehicle, which was covered by a dirty grey tarpaulin. She began untying ropes.'Hell's bells!' said Pa Wickus, fervent, but under his breath. Because at first sight she was spectacular. Shoulders, arms and legs had the muscular definition of an athlete. Pitch black hair pulled back in a careless ponytail, the neck long and elegant, a fine sheen of perspiration on the honey skin, her face dominated by strong, high cheekbones. Lara Croft of the Limpopo, in boots, tight khaki shorts, and a sleeveless white T-shirt that clearly displayed her generous breasts.'Cornel?' asked Swannie, the son. He sounded overjoyed to connect the voice on the telephone with this apparition.She looked at him. 'Come and help,' she ordered.Swannie didn't move at once. 'Flea?' he asked astonished. 'Flea van Jaarsveld?'She bristled. 'I don't know you.''We were in primary school together,' said Swannie, with a tone of deep gratitude that he had a connection to her. 'Jissie, Flea, you've changed.''My name's Cornel. Are you going to help, or just stand there looking?' she said, and turned her attention back to removing the tarpaulin.'Man, it's so great to see you again.' And Swannie went right over to help her."|Trackers|"Deon Meyer"
"ap 09:40"|"twenty to ten"|"We got away at twenty to ten. Flea threw a blood-red travel bag and the doctor's bag in the cab, climbed up after them, and made herself at home in the passenger seat. As I climbed up after her, she looked at me. 'Are you coming too?' Not exactly jubilant about the possibility.'This is Oom Lemmer,' was all that Lourens
said. Then he took out two big soft cushions and put them over the hump between the two seats, stowed her baggage, arranged the cushions properly, one on her seat and one behind her back.The Swanepoels stood outside, beside my window, with eyes only for her. 'You know where we are now, Cornel. Come and visit,' Wickus Swanepoel called out hopefully. Beside him, his son approved the invitation with a vigorously nodding head, the bushy brows raised high in enthusiasm. Then they waved one last time and we drove away into the darkness."|Trackers|"Deon Meyer"
"ap 01:30"|"half past one"|"Her scent drifted through the cab of the Mercedes, an interesting blend of soap, shampoo and sweat. She sat with her legs tucked up, arms wrapped around her knees, her body language showing she was dissatisfied, that she didn't have the luxury of personal space and a proper seat.Lourens called Nicola, said we were on our way.Flea consulted the digital watch on her arm. 'Between half past one and two I have to inject them again,' she instructed Lourens.I sat and waited for his reaction. How would a Karoo boy handle this ... phenomenon?He took papers out of his door panel and handed them to her, his movements slow and measured. 'The top one is the route book, the lower one is a map. By two o'clock we should be 300 kilometres from here, maybe a bit more ...'She took them in silence, lowered her legs, and studied the uppermost document, a white sheet of paper with columns of places and distances. She unfolded the map and compared the two, her slender finger finding direction on the spider web of roads over Vaalwater, Rustenburg, Ventersdorp ... until she looked up at him. I couldn't see her face, but I could hear the frown in her voice: 'This is one helluva obscure route. Why don't we just take the Nl?'For the first time I saw the ghostly line of an old scar on her neck. It curled from below her left ear and under her hair, a fine pattern like the outline of a bird's wing, only one shade lighter than her skin.'Oom Diederik wants us to stay off the main routes. And ...''Why?' Sharp and accusatory.'Weighbridges,' Lourens said, but calm and controlled.'Weighbridges?''Long distances are all about average speed, and nothing breaks your average speed like a weighbridge. At every weighbridge you lose plus-minus an hour, and there are five between Musina and Kimberley if we take the N1 and the N12. In any case, this route is almost a hundred kilometres shorter.'I was proud of him: he would not let himself be intimidated, his tone of voice was relaxed, he was not looking for her approval, merely giving information courteously and pleasantly. Impressive for a young man already blindly in love.She traced the route with her finger again, shook her head. 'No. We will have to drive via Bela-Bela. I need light when I sedate them.'He looked where her finger pointed. 'All right,' he said. 'We'll stop there.'She folded up the map, smugly, as if she had won this round. She put it on top of the dashboard, in the hollow behind the cup holders, drew her legs up again and dropped her head onto her knees to discourage further communication.It was going to be an interesting trip.The cornerstone of my profession was the art of reading people. To identify threats, to understand the one you protected, to predict situations and prevent them. It had become a habit, a ritual, sometimes a game, to watch and listen and patch the bits of incidental information together into a profile that was continually adapted and expanded, every time one step closer to the truth. The problem, I had learned over two decades, was that we are deceitful animals. We skilfully weave a false front, often extensive and complex, fact and fiction in a delicate blend to accentuate the good and acceptable, and to hide the bad.The art was to analyse the front as well, since that largely exposed what was hidden behind it.There was a great deal that betrayed Flea van Jaarsveld: this attitude of irritable superiority. The deliberate distance she maintained between herself and us. The exaggerated use of learned medical terminology. Her nickname. The insistence that she was now Cornel - ten to one her own twisting of Cornelia, as it sounded much more dignified. Add to that the choice of clothing that needlessly accentuated her assets. Because she was pretty, despite the slight deficiencies. Or perhaps because of those negligible imperfections.The majority of Body Armour's clientele were attractive people who had grown up in wealth. They generally had an effortless assumption of privilege, a natural distance from the common crowd, an ease with, and often a concealing of, beauty.In shrill contrast with Flea. Therefore I guessed her background was lower middle-class, blue-collar domestic, mine or factory worker, naive, down-to-earth, a little rough.Poverty is not necessarily a negative formative element. The problems begin when the desire to escape it becomes all-consuming. In primary school she would already have shown the academic promise that would eventually enable her to be selected for veterinary school. 'You're clever,' her humble, but inherently good parents would have urged her. 'You must get an education. Make something of yourself.' Another way of saying 'you can get out of this'.But it was the physical flowering that would have been the breakthrough. By inference from Swannie's 'Jissie, you've changed,' she must have been ordinary at fourteen, dull even, with no great expectation that she would be so genetically lucky. So the metamorphosis, somewhere between fifteen and sixteen, would have taken her by surprise, causing her to change gears swiftly in order to reconsider the potential of it all. Clever and pretty is a strong platform from which to launch yourself.And she had.So she would have advanced to this point with fierce determination, and now had the realistic expectation of a Good Catch. She would dream of a fairy tale wedding with the filthy rich owner of an exclusive private game reserve, where she could manage the breeding programme of some exotic threatened species, and occasionally pose photogenically on the cover of conservation magazines, with her attractive, somewhat older husband's arm around her, her own arms protectively cradling a cheetah cub.But I knew from personal experience: you can't escape your past. It lives in you, woven into every cell. You could say you had lost contact with your parents, you could provide vague answers if Emma le Roux asked, 'What was it like growing up in Sea Point?', you could hide yourself away in Loxton, but sooner or later it catches up with you.I believe Flea van Jaarsveld knew this, somehow. It was the fear of exposure that drove her, ate at her, it was the mechanism that had turned her into this aggressive, determined young woman.It was a sentiment I understood. So I would let her be. Accommodate her.But should I warn Lourens le Riche? Flea would break his heart. No. Lemmer's First Law."|Trackers|"Deon Meyer"
