00:00|midnight|"Before the Austrasian army retreated from Auvergne, Theodoric exacted some pledges of the future loyalty of a people, whose just hatred could be restrained only by their fear. A select band of noble youths, the sons of the principal senators, was delivered to the conqueror, as the hostages of the faith of Childebert, and of their countrymen. On the first rumor of war, or conspiracy, these guiltless youths were reduced to a state of servitude; and one of them, Attalus, whose adventures are more particularly related, kept his master's horses in the diocese of Treves. After a painful search, he was discovered, in this unworthy occupation, by the emissaries of his grandfather, Gregory bishop of Langres; but his offers of ransom were sternly rejected by the avarice of the Barbarian, who required an exorbitant sum of ten pounds of gold for the freedom of his noble captive. His deliverance was effected by the hardy stratagem of Leo, a slave belonging to the kitchens of the bishop of Langres. An unknown agent easily introduced him into the same family. The Barbarian purchased Leo for the price of twelve pieces of gold; and was pleased to learn that he was deeply skilled in the luxury of an episcopal table: ""Next Sunday,"" said the Frank, ""I shall invite my neighbors and kinsmen. Exert thy art, and force them to confess, that they have never seen, or tasted, such an entertainment, even in the king's house."" Leo assured him, that if he would provide a sufficient quantity of poultry, his wishes should be satisfied. The master who already aspired to the merit of elegant hospitality, assumed, as his own, the praise which the voracious guests unanimously bestowed on his cook; and the dexterous Leo insensibly acquired the trust and management of his household. After the patient expectation of a whole year, he cautiously whispered his design to Attalus, and exhorted him to prepare for flight in the ensuing night. At the hour of midnight, the intemperate guests retired from the table; and the Frank's son-in-law, whom Leo attended to his apartment with a nocturnal potation, condescended to jest on the facility with which he might betray his trust. The intrepid slave, after sustaining this dangerous raillery, entered his master's bedchamber; removed his spear and shield; silently drew the fleetest horses from the stable; unbarred the ponderous gates; and excited Attalus to save his life and liberty by incessant diligence. Their apprehensions urged them to leave their horses on the banks of the Meuse; they swam the river, wandered three days in the adjacent forest, and subsisted only by the accidental discovery of a wild plum-tree. As they lay concealed in a dark thicket, they heard the noise of horses; they were terrified by the angry countenance of their master, and they anxiously listened to his declaration, that, if he could seize the guilty fugitives, one of them he would cut in pieces with his sword, and would expose the other on a gibbet. At length, Attalus and his faithful Leo reached the friendly habitation of a presbyter of Rheims, who recruited their fainting strength with bread and wine, concealed them from the search of their enemy, and safely conducted them beyond the limits of the Austrasian kingdom, to the episcopal palace of Langres. Gregory embraced his grandson with tears of joy, gratefully delivered Leo, with his whole family, from the yoke of servitude, and bestowed on him the property of a farm, where he might end his days in happiness and freedom. Perhaps this singular adventure, which is marked with so many circumstances of truth and nature, was related by Attalus himself, to his cousin or nephew, the first historian of the Franks. Gregory of Tours was born about sixty years after the death of Sidonius Apollinaris; and their situation was almost similar, since each of them was a native of Auvergne, a senator, and a bishop. The difference of their style and sentiments may, therefore, express the decay of Gaul; and clearly ascertain how much, in so short a space, the human mind had lost of its energy and refinement."|"The History of the Decline and Fall of the Roman Empire, Volume 3"|"Edward Gibbon"
00:00|midnight|"By the revolution of Britain, the limits of science, as well as of empire, were contracted. The dark cloud, which had been cleared by the Phoenician discoveries, and finally dispelled by the arms of Cæsar, again settled on the shores of the Atlantic, and a Roman province was again lost among the fabulous Islands of the Ocean. One hundred and fifty years after the reign of Honorius, the gravest historian of the times describes the wonders of a remote isle, whose eastern and western parts are divided by an antique wall, the boundary of life and death, or, more properly, of truth and fiction. The east is a fair country, inhabited by a civilized people: the air is healthy, the waters are pure and plentiful, and the earth yields her regular and fruitful increase. In the west, beyond the wall, the air is infectious and mortal; the ground is covered with serpents; and this dreary solitude is the region of departed spirits, who are transported from the opposite shores in substantial boats, and by living rowers. Some families of fishermen, the subjects of the Franks, are excused from tribute, in consideration of the mysterious office which is performed by these Charons of the ocean. Each in his turn is summoned, at the hour of midnight, to hear the voices, and even the names, of the ghosts: he is sensible of their weight, and he feels himself impelled by an unknown, but irresistible power. After this dream of fancy, we read with astonishment, that the name of this island is Brittia; that it lies in the ocean, against the mouth of the Rhine, and less than thirty miles from the continent; that it is possessed by three nations, the Frisians, the Angles, and the Britons; and that some Angles had appeared at Constantinople, in the train of the French ambassadors. From these ambassadors Procopius might be informed of a singular, though not improbable, adventure, which announces the spirit, rather than the delicacy, of an English heroine. She had been betrothed to Radiger, king of the Varni, a tribe of Germans who touched the ocean and the Rhine; but the perfidious lover was tempted, by motives of policy, to prefer his father's widow, the sister of Theodebert, king of the Franks. The forsaken princess of the Angles, instead of bewailing, revenged her disgrace. Her warlike subjects are said to have been ignorant of the use, and even of the form, of a horse; but she boldly sailed from Britain to the mouth of the Rhine, with a fleet of four hundred ships, and an army of one hundred thousand men. After the loss of a battle, the captive Radiger implored the mercy of his victorious bride, who generously pardoned his offence, dismissed her rival, and compelled the king of the Varni to discharge with honor and fidelity the duties of a husband. This gallant exploit appears to be the last naval enterprise of the Anglo-Saxons. The arts of navigation, by which they acquired the empire of Britain and of the sea, were soon neglected by the indolent Barbarians, who supinely renounced all the commercial advantages of their insular situation. Seven independent kingdoms were agitated by perpetual discord; and the British world was seldom connected, either in peace or war, with the nations of the Continent."|"The History of the Decline and Fall of the Roman Empire, Volume 3"|"Edward Gibbon"
12:00|noonday|"IV. As the objects of religion were gradually reduced to the standard of the imagination, the rites and ceremonies were introduced that seemed most powerfully to affect the senses of the vulgar. If, in the beginning of the fifth century, Tertullian, or Lactantius, had been suddenly raised from the dead, to assist at the festival of some popular saint, or martyr, they would have gazed with astonishment, and indignation, on the profane spectacle, which had succeeded to the pure and spiritual worship of a Christian congregation. As soon as the doors of the church were thrown open, they must have been offended by the smoke of incense, the perfume of flowers, and the glare of lamps and tapers, which diffused, at noonday, a gaudy, superfluous, and, in their opinion, a sacrilegious light. If they approached the balustrade of the altar, they made their way through the prostrate crowd, consisting, for the most part, of strangers and pilgrims, who resorted to the city on the vigil of the feast; and who already felt the strong intoxication of fanaticism, and, perhaps, of wine. Their devout kisses were imprinted on the walls and pavement of the sacred edifice; and their fervent prayers were directed, whatever might be the language of their church, to the bones, the blood, or the ashes of the saint, which were usually concealed, by a linen or silken veil, from the eyes of the vulgar. The Christians frequented the tombs of the martyrs, in the hope of obtaining, from their powerful intercession, every sort of spiritual, but more especially of temporal, blessings. They implored the preservation of their health, or the cure of their infirmities; the fruitfulness of their barren wives, or the safety and happiness of their children. Whenever they undertook any distant or dangerous journey, they requested, that the holy martyrs would be their guides and protectors on the road; and if they returned without having experienced any misfortune, they again hastened to the tombs of the martyrs, to celebrate, with grateful thanksgivings, their obligations to the memory and relics of those heavenly patrons. The walls were hung round with symbols of the favors which they had received; eyes, and hands, and feet, of gold and silver: and edifying pictures, which could not long escape the abuse of indiscreet or idolatrous devotion, represented the image, the attributes, and the miracles of the tutelar saint. The same uniform original spirit of superstition might suggest, in the most distant ages and countries, the same methods of deceiving the credulity, and of affecting the senses of mankind: but it must ingenuously be confessed, that the ministers of the Catholic church imitated the profane model, which they were impatient to destroy. The most respectable bishops had persuaded themselves that the ignorant rustics would more cheerfully renounce the superstitions of Paganism, if they found some resemblance, some compensation, in the bosom of Christianity. The religion of Constantine achieved, in less than a century, the final conquest of the Roman empire: but the victors themselves were insensibly subdued by the arts of their vanquished rivals."|"The History of the Decline and Fall of the Roman Empire, Volume 3"|"Edward Gibbon"
00:00|midnight|"In the passage of the emperor through Bologna, a mutiny of the guards was excited and appeased by the secret policy of Stilicho; who announced his instructions to decimate the guilty, and ascribed to his own intercession the merit of their pardon. After this tumult, Honorius embraced, for the last time, the minister whom he now considered as a tyrant, and proceeded on his way to the camp of Pavia; where he was received by the loyal acclamations of the troops who were assembled for the service of the Gallic war. On the morning of the fourth day, he pronounced, as he had been taught, a military oration in the presence of the soldiers, whom the charitable visits, and artful discourses, of Olympius had prepared to execute a dark and bloody conspiracy. At the first signal, they massacred the friends of Stilicho, the most illustrious officers of the empire; two Prætorian præfects, of Gaul and of Italy; two masters-general of the cavalry and infantry; the master of the offices; the quæstor, the treasurer, and the count of the domestics. Many lives were lost; many houses were plundered; the furious sedition continued to rage till the close of the evening; and the trembling emperor, who was seen in the streets of Pavia without his robes or diadem, yielded to the persuasions of his favorite; condemned the memory of the slain; and solemnly approved the innocence and fidelity of their assassins. The intelligence of the massacre of Pavia filled the mind of Stilicho with just and gloomy apprehensions; and he instantly summoned, in the camp of Bologna, a council of the confederate leaders, who were attached to his service, and would be involved in his ruin. The impetuous voice of the assembly called aloud for arms, and for revenge; to march, without a moment's delay, under the banners of a hero, whom they had so often followed to victory; to surprise, to oppress, to extirpate the guilty Olympius, and his degenerate Romans; and perhaps to fix the diadem on the head of their injured general. Instead of executing a resolution, which might have been justified by success, Stilicho hesitated till he was irrecoverably lost. He was still ignorant of the fate of the emperor; he distrusted the fidelity of his own party; and he viewed with horror the fatal consequences of arming a crowd of licentious Barbarians against the soldiers and people of Italy. The confederates, impatient of his timorous and doubtful delay, hastily retired, with fear and indignation. At the hour of midnight, Sarus, a Gothic warrior, renowned among the Barbarians themselves for his strength and valor, suddenly invaded the camp of his benefactor, plundered the baggage, cut in pieces the faithful Huns, who guarded his person, and penetrated to the tent, where the minister, pensive and sleepless, meditated on the dangers of his situation. Stilicho escaped with difficulty from the sword of the Goths and, after issuing a last and generous admonition to the cities of Italy, to shut their gates against the Barbarians, his confidence, or his despair, urged him to throw himself into Ravenna, which was already in the absolute possession of his enemies. Olympius, who had assumed the dominion of Honorius, was speedily informed, that his rival had embraced, as a suppliant the altar of the Christian church. The base and cruel disposition of the hypocrite was incapable of pity or remorse; but he piously affected to elude, rather than to violate, the privilege of the sanctuary. Count Heraclian, with a troop of soldiers, appeared, at the dawn of day, before the gates of the church of Ravenna. The bishop was satisfied by a solemn oath, that the Imperial mandate only directed them to secure the person of Stilicho: but as soon as the unfortunate minister had been tempted beyond the holy threshold, he produced the warrant for his instant execution. Stilicho supported, with calm resignation, the injurious names of traitor and parricide; repressed the unseasonable zeal of his followers, who were ready to attempt an ineffectual rescue; and, with a firmness not unworthy of the last of the Roman generals, submitted his neck to the sword of Heraclian."|"The History of the Decline and Fall of the Roman Empire, Volume 3"|"Edward Gibbon"
00:00|midnight|"The degradation of Attalus removed the only real obstacle to the conclusion of the peace; and Alaric advanced within three miles of Ravenna, to press the irresolution of the Imperial ministers, whose insolence soon returned with the return of fortune. His indignation was kindled by the report, that a rival chieftain, that Sarus, the personal enemy of Adolphus, and the hereditary foe of the house of Balti, had been received into the palace. At the head of three hundred followers, that fearless Barbarian immediately sallied from the gates of Ravenna; surprised, and cut in pieces, a considerable body of Goths; reentered the city in triumph; and was permitted to insult his adversary, by the voice of a herald, who publicly declared that the guilt of Alaric had forever excluded him from the friendship and alliance of the emperor. The crime and folly of the court of Ravenna was expiated, a third time, by the calamities of Rome. The king of the Goths, who no longer dissembled his appetite for plunder and revenge, appeared in arms under the walls of the capital; and the trembling senate, without any hopes of relief, prepared, by a desperate resistance, to defray the ruin of their country. But they were unable to guard against the secret conspiracy of their slaves and domestics; who, either from birth or interest, were attached to the cause of the enemy. At the hour of midnight, the Salarian gate was silently opened, and the inhabitants were awakened by the tremendous sound of the Gothic trumpet. Eleven hundred and sixty-three years after the foundation of Rome, the Imperial city, which had subdued and civilized so considerable a part of mankind, was delivered to the licentious fury of the tribes of Germany and Scythia."|"The History of the Decline and Fall of the Roman Empire, Volume 3"|"Edward Gibbon"
00:00|midnight|"The Roman world was deeply interested in the education of its master. A regular course of study and exercise was judiciously instituted; of the military exercises of riding, and shooting with the bow; of the liberal studies of grammar, rhetoric, and philosophy: the most skilful masters of the East ambitiously solicited the attention of their royal pupil; and several noble youths were introduced into the palace, to animate his diligence by the emulation of friendship. Pulcheria alone discharged the important task of instructing her brother in the arts of government; but her precepts may countenance some suspicions of the extent of her capacity, or of the purity of her intentions. She taught him to maintain a grave and majestic deportment; to walk, to hold his robes, to seat himself on his throne, in a manner worthy of a great prince; to abstain from laughter; to listen with condescension; to return suitable answers; to assume, by turns, a serious or a placid countenance: in a word, to represent with grace and dignity the external figure of a Roman emperor. But Theodosius was never excited to support the weight and glory of an illustrious name: and, instead of aspiring to support his ancestors, he degenerated (if we may presume to measure the degrees of incapacity) below the weakness of his father and his uncle. Arcadius and Honorius had been assisted by the guardian care of a parent, whose lessons were enforced by his authority and example. But the unfortunate prince, who is born in the purple, must remain a stranger to the voice of truth; and the son of Arcadius was condemned to pass his perpetual infancy encompassed only by a servile train of women and eunuchs. The ample leisure which he acquired by neglecting the essential duties of his high office, was filled by idle amusements and unprofitable studies. Hunting was the only active pursuit that could tempt him beyond the limits of the palace; but he most assiduously labored, sometimes by the light of a midnight lamp, in the mechanic occupations of painting and carving; and the elegance with which he transcribed religious books entitled the Roman emperor to the singular epithet of Calligraphes, or a fair writer. Separated from the world by an impenetrable veil, Theodosius trusted the persons whom he loved; he loved those who were accustomed to amuse and flatter his indolence; and as he never perused the papers that were presented for the royal signature, the acts of injustice the most repugnant to his character were frequently perpetrated in his name. The emperor himself was chaste, temperate, liberal, and merciful; but these qualities, which can only deserve the name of virtues when they are supported by courage and regulated by discretion, were seldom beneficial, and they sometimes proved mischievous, to mankind. His mind, enervated by a royal education, was oppressed and degraded by abject superstition: he fasted, he sung psalms, he blindly accepted the miracles and doctrines with which his faith was continually nourished. Theodosius devoutly worshipped the dead and living saints of the Catholic church; and he once refused to eat, till an insolent monk, who had cast an excommunication on his sovereign, condescended to heal the spiritual wound which he had inflicted."|"The History of the Decline and Fall of the Roman Empire, Volume 3"|"Edward Gibbon"
