02:30|vigils|"The theory of persecution was established by Theodosius, whose justice and piety have been applauded by the saints: but the practice of it, in the fullest extent, was reserved for his rival and colleague, Maximus, the first, among the Christian princes, who shed the blood of his Christian subjects on account of their religious opinions. The cause of the Priscillianists, a recent sect of heretics, who disturbed the provinces of Spain, was transferred, by appeal, from the synod of Bordeaux to the Imperial consistory of Treves; and by the sentence of the Prætorian præfect, seven persons were tortured, condemned, and executed. The first of these was Priscillian himself, bishop of Avila, in Spain; who adorned the advantages of birth and fortune, by the accomplishments of eloquence and learning. Two presbyters, and two deacons, accompanied their beloved master in his death, which they esteemed as a glorious martyrdom; and the number of religious victims was completed by the execution of Latronian, a poet, who rivalled the fame of the ancients; and of Euchrocia, a noble matron of Bordeaux, the widow of the orator Delphidius. Two bishops who had embraced the sentiments of Priscillian, were condemned to a distant and dreary exile; and some indulgence was shown to the meaner criminals, who assumed the merit of an early repentance. If any credit could be allowed to confessions extorted by fear or pain, and to vague reports, the offspring of malice and credulity, the heresy of the Priscillianists would be found to include the various abominations of magic, of impiety, and of lewdness. Priscillian, who wandered about the world in the company of his spiritual sisters, was accused of praying stark naked in the midst of the congregation; and it was confidently asserted, that the effects of his criminal intercourse with the daughter of Euchrocia had been suppressed, by means still more odious and criminal. But an accurate, or rather a candid, inquiry will discover, that if the Priscillianists violated the laws of nature, it was not by the licentiousness, but by the austerity, of their lives. They absolutely condemned the use of the marriage-bed; and the peace of families was often disturbed by indiscreet separations. They enjoyed, or recommended, a total abstinence from all anima food; and their continual prayers, fasts, and vigils, inculcated a rule of strict and perfect devotion. The speculative tenets of the sect, concerning the person of Christ, and the nature of the human soul, were derived from the Gnostic and Manichæan system; and this vain philosophy, which had been transported from Egypt to Spain, was ill adapted to the grosser spirits of the West. The obscure disciples of Priscillian suffered languished, and gradually disappeared: his tenets were rejected by the clergy and people, but his death was the subject of a long and vehement controversy; while some arraigned, and others applauded, the justice of his sentence. It is with pleasure that we can observe the humane inconsistency of the most illustrious saints and bishops, Ambrose of Milan, and Martin of Tours, who, on this occasion, asserted the cause of toleration. They pitied the unhappy men, who had been executed at Treves; they refused to hold communion with their episcopal murderers; and if Martin deviated from that generous resolution, his motives were laudable, and his repentance was exemplary. The bishops of Tours and Milan pronounced, without hesitation, the eternal damnation of heretics; but they were surprised, and shocked, by the bloody image of their temporal death, and the honest feelings of nature resisted the artificial prejudices of theology. The humanity of Ambrose and Martin was confirmed by the scandalous irregularity of the proceedings against Priscillian and his adherents. The civil and ecclesiastical ministers had transgressed the limits of their respective provinces. The secular judge had presumed to receive an appeal, and to pronounce a definitive sentence, in a matter of faith, and episcopal jurisdiction. The bishops had disgraced themselves, by exercising the functions of accusers in a criminal prosecution. The cruelty of Ithacius, who beheld the tortures, and solicited the death, of the heretics, provoked the just indignation of mankind; and the vices of that profligate bishop were admitted as a proof, that his zeal was instigated by the sordid motives of interest. Since the death of Priscillian, the rude attempts of persecution have been refined and methodized in the holy office, which assigns their distinct parts to the ecclesiastical and secular powers. The devoted victim is regularly delivered by the priest to the magistrate, and by the magistrate to the executioner; and the inexorable sentence of the church, which declares the spiritual guilt of the offender, is expressed in the mild language of pity and intercession."|"The History of the Decline and Fall of the Roman Empire, Volume 3"|"Edward Gibbon"
02:30|vigils|"The laws of the empire, some of which were inscribed with the name of Valentinian, still condemned the Arian heresy, and seemed to excuse the resistance of the Catholics. By the influence of Justina, an edict of toleration was promulgated in all the provinces which were subject to the court of Milan; the free exercise of their religion was granted to those who professed the faith of Rimini; and the emperor declared, that all persons who should infringe this sacred and salutary constitution, should be capitally punished, as the enemies of the public peace. The character and language of the archbishop of Milan may justify the suspicion, that his conduct soon afforded a reasonable ground, or at least a specious pretence, to the Arian ministers; who watched the opportunity of surprising him in some act of disobedience to a law which he strangely represents as a law of blood and tyranny. A sentence of easy and honorable banishment was pronounced, which enjoined Ambrose to depart from Milan without delay; whilst it permitted him to choose the place of his exile, and the number of his companions. But the authority of the saints, who have preached and practised the maxims of passive loyalty, appeared to Ambrose of less moment than the extreme and pressing danger of the church. He boldly refused to obey; and his refusal was supported by the unanimous consent of his faithful people. They guarded by turns the person of their archbishop; the gates of the cathedral and the episcopal palace were strongly secured; and the Imperial troops, who had formed the blockade, were unwilling to risk the attack, of that impregnable fortress. The numerous poor, who had been relieved by the liberality of Ambrose, embraced the fair occasion of signalizing their zeal and gratitude; and as the patience of the multitude might have been exhausted by the length and uniformity of nocturnal vigils, he prudently introduced into the church of Milan the useful institution of a loud and regular psalmody. While he maintained this arduous contest, he was instructed, by a dream, to open the earth in a place where the remains of two martyrs, Gervasius and Protasius, had been deposited above three hundred years. Immediately under the pavement of the church two perfect skeletons were found, with the heads separated from their bodies, and a plentiful effusion of blood. The holy relics were presented, in solemn pomp, to the veneration of the people; and every circumstance of this fortunate discovery was admirably adapted to promote the designs of Ambrose. The bones of the martyrs, their blood, their garments, were supposed to contain a healing power; and the præternatural influence was communicated to the most distant objects, without losing any part of its original virtue. The extraordinary cure of a blind man, and the reluctant confessions of several dæmoniacs, appeared to justify the faith and sanctity of Ambrose; and the truth of those miracles is attested by Ambrose himself, by his secretary Paulinus, and by his proselyte, the celebrated Augustin, who, at that time, professed the art of rhetoric in Milan. The reason of the present age may possibly approve the incredulity of Justina and her Arian court; who derided the theatrical representations which were exhibited by the contrivance, and at the expense, of the archbishop. Their effect, however, on the minds of the people, was rapid and irresistible; and the feeble sovereign of Italy found himself unable to contend with the favorite of Heaven. The powers likewise of the earth interposed in the defence of Ambrose: the disinterested advice of Theodosius was the genuine result of piety and friendship; and the mask of religious zeal concealed the hostile and ambitious designs of the tyrant of Gaul."|"The History of the Decline and Fall of the Roman Empire, Volume 3"|"Edward Gibbon"
02:30|vigils|"When Attila declared his resolution of supporting the cause of his allies, the Vandals and the Franks, at the same time, and almost in the spirit of romantic chivalry, the savage monarch professed himself the lover and the champion of the princess Honoria. The sister of Valentinian was educated in the palace of Ravenna; and as her marriage might be productive of some danger to the state, she was raised, by the title of Augusta, above the hopes of the most presumptuous subject. But the fair Honoria had no sooner attained the sixteenth year of her age, than she detested the importunate greatness which must forever exclude her from the comforts of honorable love; in the midst of vain and unsatisfactory pomp, Honoria sighed, yielded to the impulse of nature, and threw herself into the arms of her chamberlain Eugenius. Her guilt and shame (such is the absurd language of imperious man) were soon betrayed by the appearances of pregnancy; but the disgrace of the royal family was published to the world by the imprudence of the empress Placidia who dismissed her daughter, after a strict and shameful confinement, to a remote exile at Constantinople. The unhappy princess passed twelve or fourteen years in the irksome society of the sisters of Theodosius, and their chosen virgins; to whose crown Honoria could no longer aspire, and whose monastic assiduity of prayer, fasting, and vigils, she reluctantly imitated. Her impatience of long and hopeless celibacy urged her to embrace a strange and desperate resolution. The name of Attila was familiar and formidable at Constantinople; and his frequent embassies entertained a perpetual intercourse between his camp and the Imperial palace. In the pursuit of love, or rather of revenge, the daughter of Placidia sacrificed every duty and every prejudice; and offered to deliver her person into the arms of a Barbarian, of whose language she was ignorant, whose figure was scarcely human, and whose religion and manners she abhorred. By the ministry of a faithful eunuch, she transmitted to Attila a ring, the pledge of her affection; and earnestly conjured him to claim her as a lawful spouse, to whom he had been secretly betrothed. These indecent advances were received, however, with coldness and disdain; and the king of the Huns continued to multiply the number of his wives, till his love was awakened by the more forcible passions of ambition and avarice. The invasion of Gaul was preceded, and justified, by a formal demand of the princess Honoria, with a just and equal share of the Imperial patrimony. His predecessors, the ancient Tanjous, had often addressed, in the same hostile and peremptory manner, the daughters of China; and the pretensions of Attila were not less offensive to the majesty of Rome. A firm, but temperate, refusal was communicated to his ambassadors. The right of female succession, though it might derive a specious argument from the recent examples of Placidia and Pulcheria, was strenuously denied; and the indissoluble engagements of Honoria were opposed to the claims of her Scythian lover. On the discovery of her connection with the king of the Huns, the guilty princess had been sent away, as an object of horror, from Constantinople to Italy: her life was spared; but the ceremony of her marriage was performed with some obscure and nominal husband, before she was immured in a perpetual prison, to bewail those crimes and misfortunes, which Honoria might have escaped, had she not been born the daughter of an emperor."|"The History of the Decline and Fall of the Roman Empire, Volume 3"|"Edward Gibbon"
"ap ~ 08:00"|"About eight"|"Theodoric, to whom Avitus was indebted for the purple, had acquired the Gothic sceptre by the murder of his elder brother Torismond; and he justified this atrocious deed by the design which his predecessor had formed of violating his alliance with the empire. Such a crime might not be incompatible with the virtues of a Barbarian; but the manners of Theodoric were gentle and humane; and posterity may contemplate without terror the original picture of a Gothic king, whom Sidonius had intimately observed, in the hours of peace and of social intercourse. In an epistle, dated from the court of Thoulouse, the orator satisfies the curiosity of one of his friends, in the following description: ""By the majesty of his appearance, Theodoric would command the respect of those who are ignorant of his merit; and although he is born a prince, his merit would dignify a private station. He is of a middle stature, his body appears rather plump than fat, and in his well-proportioned limbs agility is united with muscular strength. If you examine his countenance, you will distinguish a high forehead, large shaggy eyebrows, an aquiline nose, thin lips, a regular set of white teeth, and a fair complexion, that blushes more frequently from modesty than from anger. The ordinary distribution of his time, as far as it is exposed to the public view, may be concisely represented. Before daybreak, he repairs, with a small train, to his domestic chapel, where the service is performed by the Arian clergy; but those who presume to interpret his secret sentiments, consider this assiduous devotion as the effect of habit and policy. The rest of the morning is employed in the administration of his kingdom. His chair is surrounded by some military officers of decent aspect and behavior: the noisy crowd of his Barbarian guards occupies the hall of audience; but they are not permitted to stand within the veils or curtains that conceal the council-chamber from vulgar eyes. The ambassadors of the nations are successively introduced: Theodoric listens with attention, answers them with discreet brevity, and either announces or delays, according to the nature of their business, his final resolution. About eight (the second hour) he rises from his throne, and visits either his treasury or his stables. If he chooses to hunt, or at least to exercise himself on horseback, his bow is carried by a favorite youth; but when the game is marked, he bends it with his own hand, and seldom misses the object of his aim: as a king, he disdains to bear arms in such ignoble warfare; but as a soldier, he would blush to accept any military service which he could perform himself. On common days, his dinner is not different from the repast of a private citizen, but every Saturday, many honorable guests are invited to the royal table, which, on these occasions, is served with the elegance of Greece, the plenty of Gaul, and the order and diligence of Italy. The gold or silver plate is less remarkable for its weight than for the brightness and curious workmanship: the taste is gratified without the help of foreign and costly luxury; the size and number of the cups of wine are regulated with a strict regard to the laws of temperance; and the respectful silence that prevails, is interrupted only by grave and instructive conversation. After dinner, Theodoric sometimes indulges himself in a short slumber; and as soon as he wakes, he calls for the dice and tables, encourages his friends to forget the royal majesty, and is delighted when they freely express the passions which are excited by the incidents of play. At this game, which he loves as the image of war, he alternately displays his eagerness, his skill, his patience, and his cheerful temper. If he loses, he laughs; he is modest and silent if he wins. Yet, notwithstanding this seeming indifference, his courtiers choose to solicit any favor in the moments of victory; and I myself, in my applications to the king, have derived some benefit from my losses. About the ninth hour (three o'clock) the tide of business again returns, and flows incessantly till after sunset, when the signal of the royal supper dismisses the weary crowd of suppliants and pleaders. At the supper, a more familiar repast, buffoons and pantomimes are sometimes introduced, to divert, not to offend, the company, by their ridiculous wit: but female singers, and the soft, effeminate modes of music, are severely banished, and such martial tunes as animate the soul to deeds of valor are alone grateful to the ear of Theodoric. He retires from table; and the nocturnal guards are immediately posted at the entrance of the treasury, the palace, and the private apartments."""|"The History of the Decline and Fall of the Roman Empire, Volume 3"|"Edward Gibbon"
"ap 03:00"|"three o'clock"|"Theodoric, to whom Avitus was indebted for the purple, had acquired the Gothic sceptre by the murder of his elder brother Torismond; and he justified this atrocious deed by the design which his predecessor had formed of violating his alliance with the empire. Such a crime might not be incompatible with the virtues of a Barbarian; but the manners of Theodoric were gentle and humane; and posterity may contemplate without terror the original picture of a Gothic king, whom Sidonius had intimately observed, in the hours of peace and of social intercourse. In an epistle, dated from the court of Thoulouse, the orator satisfies the curiosity of one of his friends, in the following description: ""By the majesty of his appearance, Theodoric would command the respect of those who are ignorant of his merit; and although he is born a prince, his merit would dignify a private station. He is of a middle stature, his body appears rather plump than fat, and in his well-proportioned limbs agility is united with muscular strength. If you examine his countenance, you will distinguish a high forehead, large shaggy eyebrows, an aquiline nose, thin lips, a regular set of white teeth, and a fair complexion, that blushes more frequently from modesty than from anger. The ordinary distribution of his time, as far as it is exposed to the public view, may be concisely represented. Before daybreak, he repairs, with a small train, to his domestic chapel, where the service is performed by the Arian clergy; but those who presume to interpret his secret sentiments, consider this assiduous devotion as the effect of habit and policy. The rest of the morning is employed in the administration of his kingdom. His chair is surrounded by some military officers of decent aspect and behavior: the noisy crowd of his Barbarian guards occupies the hall of audience; but they are not permitted to stand within the veils or curtains that conceal the council-chamber from vulgar eyes. The ambassadors of the nations are successively introduced: Theodoric listens with attention, answers them with discreet brevity, and either announces or delays, according to the nature of their business, his final resolution. About eight (the second hour) he rises from his throne, and visits either his treasury or his stables. If he chooses to hunt, or at least to exercise himself on horseback, his bow is carried by a favorite youth; but when the game is marked, he bends it with his own hand, and seldom misses the object of his aim: as a king, he disdains to bear arms in such ignoble warfare; but as a soldier, he would blush to accept any military service which he could perform himself. On common days, his dinner is not different from the repast of a private citizen, but every Saturday, many honorable guests are invited to the royal table, which, on these occasions, is served with the elegance of Greece, the plenty of Gaul, and the order and diligence of Italy. The gold or silver plate is less remarkable for its weight than for the brightness and curious workmanship: the taste is gratified without the help of foreign and costly luxury; the size and number of the cups of wine are regulated with a strict regard to the laws of temperance; and the respectful silence that prevails, is interrupted only by grave and instructive conversation. After dinner, Theodoric sometimes indulges himself in a short slumber; and as soon as he wakes, he calls for the dice and tables, encourages his friends to forget the royal majesty, and is delighted when they freely express the passions which are excited by the incidents of play. At this game, which he loves as the image of war, he alternately displays his eagerness, his skill, his patience, and his cheerful temper. If he loses, he laughs; he is modest and silent if he wins. Yet, notwithstanding this seeming indifference, his courtiers choose to solicit any favor in the moments of victory; and I myself, in my applications to the king, have derived some benefit from my losses. About the ninth hour (three o'clock) the tide of business again returns, and flows incessantly till after sunset, when the signal of the royal supper dismisses the weary crowd of suppliants and pleaders. At the supper, a more familiar repast, buffoons and pantomimes are sometimes introduced, to divert, not to offend, the company, by their ridiculous wit: but female singers, and the soft, effeminate modes of music, are severely banished, and such martial tunes as animate the soul to deeds of valor are alone grateful to the ear of Theodoric. He retires from table; and the nocturnal guards are immediately posted at the entrance of the treasury, the palace, and the private apartments."""|"The History of the Decline and Fall of the Roman Empire, Volume 3"|"Edward Gibbon"
00:00|midnight|"According to their faith and zeal, they might employ the day, which they passed in their cells, either in vocal or mental prayer: they assembled in the evening, and they were awakened in the night, for the public worship of the monastery. The precise moment was determined by the stars, which are seldom clouded in the serene sky of Egypt; and a rustic horn, or trumpet, the signal of devotion, twice interrupted the vast silence of the desert. Even sleep, the last refuge of the unhappy, was rigorously measured: the vacant hours of the monk heavily rolled along, without business or pleasure; and, before the close of each day, he had repeatedly accused the tedious progress of the sun. In this comfortless state, superstition still pursued and tormented her wretched votaries. The repose which they had sought in the cloister was disturbed by a tardy repentance, profane doubts, and guilty desires; and, while they considered each natural impulse as an unpardonable sin, they perpetually trembled on the edge of a flaming and bottomless abyss. From the painful struggles of disease and despair, these unhappy victims were sometimes relieved by madness or death; and, in the sixth century, a hospital was founded at Jerusalem for a small portion of the austere penitents, who were deprived of their senses. Their visions, before they attained this extreme and acknowledged term of frenzy, have afforded ample materials of supernatural history. It was their firm persuasion, that the air, which they breathed, was peopled with invisible enemies; with innumerable demons, who watched every occasion, and assumed every form, to terrify, and above all to tempt, their unguarded virtue. The imagination, and even the senses, were deceived by the illusions of distempered fanaticism; and the hermit, whose midnight prayer was oppressed by involuntary slumber, might easily confound the phantoms of horror or delight, which had occupied his sleeping and his waking dreams."|"The History of the Decline and Fall of the Roman Empire, Volume 3"|"Edward Gibbon"
