"~ 16:30"|Vespers|"“Madam,” said Brother Paul, making the best of a disadvantaged position, “I was about to tell you, sadly, that we must be going. I have no authority to let Richard stay here with you, we are expected back for Vespers. I pray you pardon us.”"|"The Hermit of Eyton Forest"|"Ellis Peters"
12:00|midday|"The middle of the great court was, perhaps, a little too conspicuous for lengthy confidences, and Richard was sufficiently taken with the unmistakably secular stranger to find him a pleasing novelty among these monastic surroundings, and meant to get to know all about him now that he had the opportunity. Moreover, very shortly chapter would be ending, and it would not do to invite Prior Robert’s too close attention in such circumstances, or court Brother Jerome’s busybody interference. With hasty confidence he caught Hyacinth by the hand, and towed him away up the court to the retired wicket that led through the enclave to the mill. There on the grass above the pool they were private, with the wall at their backs and the thick, springy turf under them, and the midday sun still faintly warm on them through the diaphanous veil of haze."|"The Hermit of Eyton Forest"|"Ellis Peters"
"~ 16:30"|Vespers|"It was about the hour for Vespers when Cadfael dismounted within the low pale of Eilmund’s garden, and the girl flung open the door and came out eagerly to meet him."|"The Hermit of Eyton Forest"|"Ellis Peters"
"~ 18:00"|Compline|"It was in Cadfael’s mind that the groom from Bosiet might be too much in fear of his master to venture out by night, even when his lord was sleeping. But come he did, slipping out furtively just as the brothers came out from Compline. Cadfael led him out through the gardens to the workshop in the herbarium, and there kindled a lamp to examine the lacerated wound that marred the man’s face."|"The Hermit of Eyton Forest"|"Ellis Peters"
"ap 01:00"|one|"“He seldom stops at one,” said the groom grimly. “He does after his kind. There are some worse than him, God help all those who serve them. His son’s another made to the same pattern. What else could we look for, when he’s lived so from birth? In a day or so he’s to join us here, and if he has not got his hands on Brand by then—God forbid!—the hunt will go on.”"|"The Hermit of Eyton Forest"|"Ellis Peters"
"~ 16:30"|Vespers|"They cared for the dead man together, and together emerged into the great court to arrange for his body to be carried to the mortuary chapel. And then there was a small matter of Brother Paul’s youngest schoolboy, who had missed his footing in haste on the day stairs and rolled down half the flight, bloodying his knees on the cobbles of the court, and had to be picked up and bathed and bandaged, and despatched to his play with an apple by way of reward for his bravery in denying stoutly that he was hurt. Only then could Cadfael repair to the stable and saddle the horse assigned to him, and by then it was almost time for Vespers."|"The Hermit of Eyton Forest"|"Ellis Peters"
"~ 16:30"|Vespers|"Richard had been out all afternoon with the other boys in the main abbey gardens beside the river, where the last pears were just being harvested. The children were allowed to help, and within reason to sample, though the fruit had still to ripen after gathering. But these, the last, had hung so long on the tree that they were already eatable. It had been a good day, with sun, and freedom, and some dabbling in the river where there were safe shallows, and he was reluctant to go indoors to Vespers at the end of it, and then to supper and bed. He loitered at the end of the procession winding its way along the riverside path, and up the green, bushy slope to the Foregate. In the stillness of late afternoon there were still clouds of midges dancing over the water, and fish rising to them lazily. Under the bridge the flow looked almost motionless though he knew it was fast and deep. There had been a boatmill moored there once, powered by the stream."|"The Hermit of Eyton Forest"|"Ellis Peters"
"~ 16:30"|Vespers|"Nine-year-old Edwin, his devoted ally, loitered with him, but a little anxiously, casting a glance over his shoulder to see how the distance between them and the tailend of the procession lengthened. He had been praised for his stoicism after his fall, and was in no mind to lose the warm sense of virtue the incident had left with him by being late for Vespers. But neither could he lightly desert his bosom friend. He hovered, rubbing at a bandaged knee that still smarted a little."|"The Hermit of Eyton Forest"|"Ellis Peters"
"~ 16:30"|"about Vespers"|"It had never been in Richard’s mind to play truant, but his game seduced him as each cast bettered the previous one, and he began to hunt for smoother and flatter pebbles under the bank, ambitious to reach the opposite shore. And then one of the town boys who had been swimming under the green sweep of turf that climbed to the town wall took up the challenge, and began to return the shower of dancing stones, splashing naked in the shallows. So absorbed was Richard in the contest that he forgot all about Vespers, and only the small, distant chime of the bell startled him back to his duty. Then he did drop his stone, abandon the field to his rival, and scramble hastily ashore to snatch up his discarded shoes and run like a hart for the Foregate and the abbey. He had left it too late. The moment he arrived breathless at the gatehouse, and sidled in cautiously by the wicket to avoid notice, he heard the chanting of the first psalm from within the church."|"The Hermit of Eyton Forest"|"Ellis Peters"
"~ 16:30"|Vespers|"Well, it was not so great a sin to miss a service, but for all that, he did not wish to add it to his score at this time, when he was preoccupied with grave family matters outside the cloister. By good fortune the children of the stewards and the lay servants were also accustomed to attend Vespers, which so conveniently augmented the numbers of the schoolboys that one small truant might not be missed, and if he could slip back into their enveloping ranks as they left the church afterwards it might be assumed that he had been among them all along. It was the best course he could think of. Accordingly he slipped into the cloister, and installed himself in the first carrel of the south walk, curled up in the corner, where he could see the south door of the church, by which brothers, guests and boys would all emerge when the service ended. Once the obedientiaries and choir monks had passed, it should not be difficult to worm his way in among the boys without being noticed."|"The Hermit of Eyton Forest"|"Ellis Peters"
"> 16:30"|"After Vespers"|"“After Vespers. I heard them talking—Brother Jerome told him there was a young man newly come into this country, who might be the one he’s looking for. He told him where to find you, and he’s coming to look for you at the hermitage now, this very night. An awful man, big and loud-mouthed. I ran to get my pony while they were still talking, I got away before him. But you mustn’t go back to Cuthred, you must get away quickly and hide.”"|"The Hermit of Eyton Forest"|"Ellis Peters"
"~ 18:00"|Compline|"Cadfael rode without haste through the darkening wood. The moon was already up, and bright where it could penetrate the thickness of the trees. Compline must be long over by now, and the brothers making ready for sleep. The boys would be in their beds long ago. It was cool and fresh in the green-scented forest, pleasant to ride alone and at leisure, and have time to think of timeless things that could not be accommodated in the bustle of the day, sometimes not even during the holy office or the quiet times of prayer, where by rights they belonged. There was more room for them here under this night sky still faintly luminous round the rims of vision. Cadfael rode in a deep content of mind through the thickest part of the woodland growth, with a glimmer of light from the open fields ahead before him."|"The Hermit of Eyton Forest"|"Ellis Peters"
00:00|midnight|"Delay could not harm Drogo now, and daylight might show at least some trace to lead to his murderer. Best leave him so, and take word to the castle, where there was always a guard waking, and leave a message for Hugh, to be delivered as soon as there was light. At midnight the brothers would rise for Matins, and the same grim news could and should be delivered then to Abbot Radulfus. The dead man was the abbey’s guest, and his son expected within a few days, and to the abbey he must be taken for proper and reverent care."|"The Hermit of Eyton Forest"|"Ellis Peters"
02:30|Matins|"Delay could not harm Drogo now, and daylight might show at least some trace to lead to his murderer. Best leave him so, and take word to the castle, where there was always a guard waking, and leave a message for Hugh, to be delivered as soon as there was light. At midnight the brothers would rise for Matins, and the same grim news could and should be delivered then to Abbot Radulfus. The dead man was the abbey’s guest, and his son expected within a few days, and to the abbey he must be taken for proper and reverent care."|"The Hermit of Eyton Forest"|"Ellis Peters"
00:00|midnight|"No, there was nothing more to be done for Drogo Bosiet, but at least he could get the horse back to his stable. Cadfael mounted, and gathered the loose bridle in his left hand, and the horse came with him docilely. There was no haste. He had until midnight. No need to save time, since even if he reached his bed before Matins, sleep would be impossible. Better take care of the horses and then wait for the bell."|"The Hermit of Eyton Forest"|"Ellis Peters"
"< 02:30"|"before Matins"|"No, there was nothing more to be done for Drogo Bosiet, but at least he could get the horse back to his stable. Cadfael mounted, and gathered the loose bridle in his left hand, and the horse came with him docilely. There was no haste. He had until midnight. No need to save time, since even if he reached his bed before Matins, sleep would be impossible. Better take care of the horses and then wait for the bell."|"The Hermit of Eyton Forest"|"Ellis Peters"
02:30|Matins|"Abbot Radulfus came early to the church for Matins, to find Cadfael waiting for him in the south porch as he crossed from his lodging. The bell in the dortoir was only just sounding. It takes but a few moments to say bluntly that a man is dead, and by an act of man, not of God."|"The Hermit of Eyton Forest"|"Ellis Peters"
12:00|midday|"By the time they emerged on to the highroad at Wroxeter the sun was well up, and the mist clearing from its face, though the fields still swam in pearly vapour. They made good speed from there along the road to Shrewsbury, and rode in at the gatehouse after the end of High Mass, when the brothers were dispersing to their work until the hour of the midday meal."|"The Hermit of Eyton Forest"|"Ellis Peters"
"~ 18:00"|Compline|"“No, Father, not yet, they will be following us, but on foot it will take some time. It is just as Brother Cadfael reported it to you in the night. The man was stabbed in the back, probably as he was leading his horse, the path there being narrow and overgrown. You will know already that his saddle-roll was cut loose and stolen. By what Brother Cadfael observed of the body when he found it, the thing must have been done about the time of Compline, perhaps a little before. There’s nothing to show by whom. By the hour, he must have been on his way back here to your guest hall. By the way he faced as he fell, also, for the body was not moved, or his ring would have been taken, and he still wears it. But as to where he had been in those parts, there’s no knowing.”"|"The Hermit of Eyton Forest"|"Ellis Peters"
"~ 16:30"|Vespers|"“He came when I was saying Vespers, here in the chapel. He entered and said that he had come to see the boy who runs my errands, and that I might find I had been deceived into taking a villain into my employ. For he was seeking a runaway serf, and had been told that there was one here of the right age, newly come and a stranger to all, who might well be his man. He told me whence he came, and in what direction he had reason to believe his fugitive had fled. These things, and the time, fitted all too well for my peace of mind with the time and place where first I met and pitied Hyacinth. But it was not put to the test,” said Cuthred simply. “The boy was not here. A good hour earlier I had sent him on an errand to Eaton. He did not come back. He has not come back even today. Now I doubt much if he ever will.”"|"The Hermit of Eyton Forest"|"Ellis Peters"
"~ 18:00"|Compline|"It was a strange moment for Cadfael’s mind to wander, as though some corner of his consciousness had made even more of one remembered moment than he had realised, for he found himself thinking suddenly of Annet coming into her father’s house radiant and roused and mysterious, with an oak leaf in her disordered hair. A little flushed and breathing as though she had been running. And past the hour of Compline, at a time when surely Drogo of Bosiet already lay dead more than a mile away on the track to Shrewsbury. True, Annet had gone out dutifully to shut up the hens and the cow for the night, but she had been a very long time about it, and come back with the high colour and triumphant eyes of a girl returning from her lover. And had she not made occasion to say a good word for Hyacinth, and taken pleasure in hearing her father praise him?"|"The Hermit of Eyton Forest"|"Ellis Peters"
"> 16:30"|"after Vespers"|"And it came out in a flood, between hectic sniffs and sobs. “It was yesterday, after Vespers. I saw him, he took his pony and rode out along the Foregate. I thought he’d come back, but he didn’t, and we were frightened—We didn’t want him to be caught, he’d be in such terrible trouble—We didn’t want to tell, we thought he’d come back and no one need know…”"|"The Hermit of Eyton Forest"|"Ellis Peters"
"> 16:30"|"After Vespers"|"“And all of you knew this? You three? Did you never think that he might be hurt somewhere, or in danger? Would he stay out all night willingly? Oh, child, why did you not tell me? All this time we’ve lost!” But the boy was frightened enough already, there was nothing to be done with him but hush and reassure and comfort him, where reassurance and comfort were very hard to find. “Now, tell me—you saw him go, mounted. After Vespers? Did he not say what he intended?”"|"The Hermit of Eyton Forest"|"Ellis Peters"
"~ 16:30"|Vespers|"Edwin, very drearily, gathered what sense he had left and fumbled out the rest of it. “He came too late for Vespers. We were down on the Gaye, by the river, he didn’t want to come in, and when he did run after us it was too late. I think he waited to try and slip in with us when we came out of church, but Brother Jerome was standing talking to—to that man, the one who…”"|"The Hermit of Eyton Forest"|"Ellis Peters"
"> 16:30"|"after Vespers"|"“Doubtless he had his reasons,” said Cadfael, scrubbing thoughtfully at his blunt brown nose. “But back to the lady? I doubt it! No, if he went off in such haste it was something new and urgent that sent him running. Last night after Vespers, you said?”"|"The Hermit of Eyton Forest"|"Ellis Peters"
"~ 16:30"|Vespers|"“Edwin tells me Richard dawdled too long by the river, and came too late for Vespers, and must have been lurking in the cloister to slip in among the rest of the boys when they came out. But he could not do it because Jerome stood there in the archway, waiting to speak to Bosiet, who had attended among the guests. But when Edwin looked back he saw Richard come running out down to the stables, and then out at the gate in a hurry.”"|"The Hermit of Eyton Forest"|"Ellis Peters"
"~ 18:00"|Compline|"“I’ve been missing too many services, these last days, I’d best get back to my duty, and at least put in an appearance for Compline tonight. I’ll come in and see you the day after tomorrow. You take care how you go. And, Annet, don’t let him stay on his feet too long. If he gives you trouble, take his props away from him.”"|"The Hermit of Eyton Forest"|"Ellis Peters"
"~ 16:30"|Vespers|"It was long past time for Vespers. Even if he started back now he would be too late for Compline, but still he sat stubbornly going over this whole new situation in his mind, looking for the best way forward, where there seemed to be nothing to be done but wait, and continue to evade the hunt. He was grateful that Hyacinth was no murderer, that at least was a gain. But how to keep him out of the hands of Bosiet was another matter."|"The Hermit of Eyton Forest"|"Ellis Peters"
"~ 18:00"|Compline|"It was long past time for Vespers. Even if he started back now he would be too late for Compline, but still he sat stubbornly going over this whole new situation in his mind, looking for the best way forward, where there seemed to be nothing to be done but wait, and continue to evade the hunt. He was grateful that Hyacinth was no murderer, that at least was a gain. But how to keep him out of the hands of Bosiet was another matter."|"The Hermit of Eyton Forest"|"Ellis Peters"
"~ 16:30"|Vespers|"The bell for Vespers called him out of his musings, and he went gladly to answer it, out through the gardens and across the court to the cloister and the south door of the church, to be early in his place. In the past few days he had missed all too many services, he was in need of the reassurance of brotherhood."|"The Hermit of Eyton Forest"|"Ellis Peters"
"~ 16:30"|Vespers|"There were always a few of the people of the Foregate at Vespers, the devout old women who inhabited some of the abbey’s grace houses, elderly couples retired and happy to fill up their leisure and meet their friends at church, and often guests of the house coming back from the activities of the day. Cadfael heard them stirring beyond the parish altar, in the vast spaces of the nave. Rafe of Coventry, he noted, had come in from the cloister and chosen a place from which he could see within, past the parish altar and into the choir. Kneeling at prayer, he had still that quiet composure about him, a man secure and at peace with his own body, and wearing his inscrutable face rather as a shield than as a mask. So he had not yet moved on to contact those suppliers of his in Wales. He was the only worshipper from the guest hall. Aymer Bosiet must be still about his funereal business in the town, or else beating the coverts in field and forest somewhere after his runaway."|"The Hermit of Eyton Forest"|"Ellis Peters"
"~ 16:30"|Vespers|"At the end of Vespers Cadfael lingered in his stall, letting the procession of brothers and novices file out into the cloister without him. The office had its beauty and consolation, but the solitude afterwards was also salutary in its silence, after the echoes of the music had all died away, and to be here alone in this evening hour had a special beneficence, whether because of the soft, dove-coloured light or the sense of enlargement that seemed to swell the soul to inhabit and fill the last arches of the vault, as a single drop of water becomes the ocean into which it falls. There was no better time for profound prayer, and Cadfael felt the need of it. For the boy in particular, equally solitary somewhere, perhaps afraid. It was to Saint Winifred Cadfael addressed his plea, a Welshman invoking a Welsh saint, and one to whom he felt very close, and for whom he had an almost family affection. Herself hardly more than a child at her martyrdom, she would not let harm come to another threatened child."|"The Hermit of Eyton Forest"|"Ellis Peters"
"< 16:30"|"just before Vespers"|"“I have seen him,” said Rafe. “He came back from the town just before Vespers. By the look and the sound of him he’s done none too well, either, with whatever he’s about. I suppose it’s a man he’s after?”"|"The Hermit of Eyton Forest"|"Ellis Peters"
"> 16:30"|"after Vespers"|"It was about the same hour that Cadfael and Rafe of Coventry emerged from the church after Vespers, when Hyacinth stole out from Eilmund’s cottage, and made his way through the deepest cover towards the river. He had been all that day pinned close within doors, for there had again been men of the garrison sweeping through the forest, and though their passage was rapid and cursory, for the aim was to carry the search further afield, and though they knew Eilmund, and felt no compulsion to investigate his holding a second time, they were still liable to look in on him in neighbourly fashion as they passed, and ask him casually if anything of note had come to his attention. Hyacinth did not take kindly to being shut within doors, nor, indeed, to hiding. By the evening he was chafing at his confinement, but by then the hunters were on their way back, abandoning the chase until the morrow, and he was free to do a little hunting of his own."|"The Hermit of Eyton Forest"|"Ellis Peters"
00:00|midnight|"He went on his homeward way without haste, content with his night’s work. There was now no urgency, he could afford to go slowly, mindful that he himself was still hunted. For the boy was alive, well fed, well cared for, and in good spirits. No actual harm had come to him, none would come, however he chafed at being a prisoner. And in the end he would have the laugh of his captors. Hyacinth made his way blithely through the soft, chilly night scented with the rising mist of the water meadows, and the deep, dank leaf mould of the woods. The moon rose, but so veiled that it gave only a dim grey light. By midnight he would be safely back in his sanctuary in Eyton forest. And in the morning, by some means Annet would contrive for the purpose, Hugh Beringar should learn exactly where to look for Brother Paul’s lost schoolboy."|"The Hermit of Eyton Forest"|"Ellis Peters"
"< 12:00"|"before noon"|"Once convinced, it was she who made the plans. She knew the house and the servants, and as long as there was no suspicion of her subservience she had the entry everywhere, and could give orders to grooms and maids as she pleased. “Best wait until after they’ve brought your dinner and taken away the dish again. It will be a longer time then before anyone comes in to you again. There’s a back gate through the pale, from the stable out into the paddock. I could tell Jehan to turn your pony out to grass, he’s been shut in too long to be liking it. There are some bushes in the field there, round behind the stable, close to the wicket. I’ll make shift to hide your saddle and harness there before noon. I can get you out of here through the undercroft, while they’re all busy in hall and kitchens.”"|"The Hermit of Eyton Forest"|"Ellis Peters"
"> 00:00"|"past midnight"|"The women had been washing linen, and had it spread on the low bushes to dry, and since the day was not cold, and since they had been joined by a young and not unattractive companion, they were in no hurry to leave the shore. Richard did not know the women, but the man he knew only too well, though not his name. This big, red-haired, strutting young gamecock was Astley’s foreman on the demesne farm, and one of the two who had encountered and recognised Richard in the woods, trotting home to the abbey in haste, and taken advantage of the hour and the solitude to do their lord a favour. Those same muscular arms which were now making free with one of the giggling laundresses had hoisted Richard ignominiously out of the saddle, and held him kicking and raging over a thick shoulder that might have been made of oak for all the effect his belabouring fists had on it, until the other miscreant had stopped the boy’s mouth with his own capuchon, and pinioned his arms with his own reins. That same night, when it was fully dark, past midnight and all honest folk in their beds, the same trusted pair had bundled him away to the more distant manor for safekeeping. Richard remembered these indignities bitterly. And now here was this very fellow getting in his way once again, for he could not ride out of cover and make for the ford without passing close and being recognised, and almost certainly recaptured."|"The Hermit of Eyton Forest"|"Ellis Peters"
"~ 16:30"|"Vespers that evening"|"At Vespers that evening there were several worshippers from the guest hall, as Cadfael noted from his place in the choir. Rafe of Coventry was present, taciturn and unobtrusive as ever, and even Aymer Bosiet, after his day’s activities in pursuit of his elusive property, had put in a morose and grim appearance, possibly to pray for a reliable lead from heaven. By the look of him he had weighty matters on his mind, since he was frowning over them all through Vespers, like a man trying to make up his mind. Perhaps the necessity to remain on good terms with his mother’s powerful kin was urging him to hasten home at once with Drogo’s body, and show some signs of family piety. Perhaps the thought of a subtle younger brother, there on the spot and fully capable of mischief for his own advancement, might also be arguing for the abandonment of a wild-goose chase in favour of a certain inheritance."|"The Hermit of Eyton Forest"|"Ellis Peters"
