"~ 16:30"|Vespers|"At Vespers that evening there were several worshippers from the guest hall, as Cadfael noted from his place in the choir. Rafe of Coventry was present, taciturn and unobtrusive as ever, and even Aymer Bosiet, after his day’s activities in pursuit of his elusive property, had put in a morose and grim appearance, possibly to pray for a reliable lead from heaven. By the look of him he had weighty matters on his mind, since he was frowning over them all through Vespers, like a man trying to make up his mind. Perhaps the necessity to remain on good terms with his mother’s powerful kin was urging him to hasten home at once with Drogo’s body, and show some signs of family piety. Perhaps the thought of a subtle younger brother, there on the spot and fully capable of mischief for his own advancement, might also be arguing for the abandonment of a wild-goose chase in favour of a certain inheritance."|"The Hermit of Eyton Forest"|"Ellis Peters"
"> 07:30"|"after Prime"|"“Then will you not meet with me at the hermitage, as early as may be after Prime? It is fair we should both hear what Cuthred has to say. I am well sure,” he said with truth, having seen the effect of Richard’s outburst, “that you believed implicitly the man was a priest, with full rights to marry and bury. That is not in dispute. Richard has cause to hold to the contrary. Let us put it to the test.”"|"The Hermit of Eyton Forest"|"Ellis Peters"
"> 07:30"|"after Prime"|"“So we are all agreed,” said Radulfus, “and Sir Fulke has contracted to meet with me tomorrow after Prime at the hermitage, and hear what the man himself has to say. I was about to send to you, my lord sheriff, and tell you how this thing stands, and ask you to ride with me tomorrow. This scene,” he said, casting an authoritative glance round at his all too attentive flock, “need not be prolonged, I think. If you will sup with me, Hugh, you shall hear all that has happened. Robert, have the brothers proceed. I am sorry our evening should have been so rudely disrupted. And, Paul…” He looked down at Richard, who had one fist tightly clenched on a fold of Paul’s habit, ready to hold fast had his tenure been threatened. “Take him away, Paul, clean him up, feed him, and bring him to me after supper. He has a great deal to tell us that has not been told yet. There, you may disperse, all, there is no more here to see.”"|"The Hermit of Eyton Forest"|"Ellis Peters"
"~ 12:00"|"about noon this day"|"“She let him out, of course,” said Hugh as soon as the door had closed after the boy. “She was a victim no less than he. Now I begin to see a pattern. Richard is seized as he rides back through Eyton forest, and what is there in Eyton forest and along that path but Eilmund’s cottage and the hermitage? And to the hermitage we know he did not go. And who should walk into Shrewsbury about noon this day and send me off hotfoot to Leighton, which otherwise I should not have reached before tomorrow, but Eilmund’s girl? And where she got the news she never clearly said, but some passing villager had said he’d seen a boy there who might well be Richard. And Richard, more forthrightly, will not say why he went off there alone, nor who told him the hermit is no true priest. Father, it seems to me that someone—let’s not go so far as to name him!—has very good friends among our acquaintance. I hope they are as good judges! Well, tomorrow, at any rate, there’ll be no hunting. Richard is safely home with you. And to tell truth, I doubt the other quarry will ever be flushed out of cover. Tomorrow our morning business is laid down for us. Let’s first see that resolved.”"|"The Hermit of Eyton Forest"|"Ellis Peters"
12:00|noon|"“I remember, soothe lord abbot told me. So this is the man! I never went to him again, what use if the lad he kept was gone?” He looked curiously down at the shrouded figure. The bearers had laid down their burden, awaiting orders where to take the dead. Aymer stooped and turned back the brychan from Cuthred’s face. They had drawn back the wild fell of hair from his temples, and brushed down his bushy beard into order, and the full light of noon shone over the lean countenance, the deep-set eyes, the lofty lids a little bruised and bluish now, the long, straight, patrician nose and full lips within the dark beard. The glare of the half-open eyes was now veiled, the snarl on the drawn-back lips carefully smoothed out to restore his harsh comeliness. Aymer leaned closer, startled and disbelieving."|"The Hermit of Eyton Forest"|"Ellis Peters"
"> 07:30"|"after Prime"|"“Well, I thank you! Very well! Tomorrow morning, after Prime,” he said, turning to face Cadfael fully, and his voice as always measured and composed, “I shall be leaving. I have already told Brother Denis so.”"|"The Hermit of Eyton Forest"|"Ellis Peters"
"< 18:00"|"before Compline"|"On his way down the court to the stables, leading his horse, and with the better part of an hour left before Compline, Cadfael saw Dame Dionisia coming from the abbot’s lodging, and walking with sober step and decorously covered head towards the guest hall. Her back was as erect as ever, her gait as firm and proud, but somewhat slower than was her wont, and the draped head was lowered, with eyes on the ground rather than fixed challengingly into the distance before her. Not a word would ever be said concerning her confession, but Cadfael doubted if she had left anything out. She was not one to do things by halves. There would be no more attempts to extract Richard from the abbot’s care. Dionisia had suffered too profound a reverse to take any such risks again until time had dimmed the recollection of sudden unshriven death coming to meet her."|"The Hermit of Eyton Forest"|"Ellis Peters"
"~ 18:00"|Compline|"He was gone, out into the gathering darkness, his step firm and even on the gravel path, silent when he reached the grass beyond. And sharp upon the last slight sound of his going, the bell rang distantly for Compline."|"The Hermit of Eyton Forest"|"Ellis Peters"
12:00|noonday|"They were sitting together, as so often they had sat at the last ebb of a crisis, weary but eased, on the seat against the north wall of the herbarium, where the warmth of noonday lingered and the light wind was shut out. In another week or two it would be too cold and bleak for comfort here. This prolonged mild autumn could not last much longer, the weather-wise were beginning to sniff the air and foretell the first hard frost, and plentiful snow to come in December."|"The Hermit of Eyton Forest"|"Ellis Peters"
12:00|noon|"The worst of the winter came early, that year of 1142. After the prolonged autumn of mild, moist, elegiac days, December came in with heavy skies and dark, brief days that sagged upon the rooftrees and lay like oppressive hands upon the heart. In the scriptorium there was barely light enough at noon to form the letters, and the colors could not be used with any certainty, since the unrelenting and untimely dusk sapped all their brightness."|"The Hermit of Eyton Forest"|"Ellis Peters"
02:30|Matins|"The monastic timetable, divided into canonical hours, or offices, of Matins, Lauds, Prime, Terce, Sext, None, Vespers and Compline"|"The Hermit of Eyton Forest"|"Ellis Peters"
05:00|Lauds|"The monastic timetable, divided into canonical hours, or offices, of Matins, Lauds, Prime, Terce, Sext, None, Vespers and Compline"|"The Hermit of Eyton Forest"|"Ellis Peters"
"~ 09:00"|Terce|"The monastic timetable, divided into canonical hours, or offices, of Matins, Lauds, Prime, Terce, Sext, None, Vespers and Compline"|"The Hermit of Eyton Forest"|"Ellis Peters"
12:00|Sext|"The monastic timetable, divided into canonical hours, or offices, of Matins, Lauds, Prime, Terce, Sext, None, Vespers and Compline"|"The Hermit of Eyton Forest"|"Ellis Peters"
"~ 16:30"|Vespers|"The monastic timetable, divided into canonical hours, or offices, of Matins, Lauds, Prime, Terce, Sext, None, Vespers and Compline"|"The Hermit of Eyton Forest"|"Ellis Peters"
"~ 18:00"|Compline|"The monastic timetable, divided into canonical hours, or offices, of Matins, Lauds, Prime, Terce, Sext, None, Vespers and Compline"|"The Hermit of Eyton Forest"|"Ellis Peters"
