08:00|"eight o’clock in the morning"|"Love

THE REMAINS OF THE Cold Storage fire were still visible as a party of schoolteachers arrived from St. Louis, accompanied by a young reporter. The twenty-four teachers had won a contest held by the St. Louis Republic that entitled them to a free stay at the fair at the newspaper’s expense. Along with assorted friends and family members—for a total of forty travelers—they had piled into a luxurious sleeper car, named Benares, provided by the Chicago & Alton Railroad. They arrived at Chicago’s Union Depot on Monday, July 17, at eight o’clock in the morning and went immediately by carriage to their hotel, the Varsity, located close enough to the fair that from its second-floor balcony the teachers could see the Ferris Wheel, the top of the Manufactures and Liberal Arts Building, and Big Mary’s gilded head."|"The Devil in the White City Murder, Magic and Madness at the Fair That Changed America"|"Erik Larson"
"ap 05:00"|five|"Despite the wheel’s inherent romantic potential, however, rides at night never became popular. The favorite hour was the golding time between five and six in the evening."|"The Devil in the White City Murder, Magic and Madness at the Fair That Changed America"|"Erik Larson"
18:00|"six in the evening"|"Despite the wheel’s inherent romantic potential, however, rides at night never became popular. The favorite hour was the golding time between five and six in the evening."|"The Devil in the White City Murder, Magic and Madness at the Fair That Changed America"|"Erik Larson"
21:15|"nine-fifteen that night"|"At nine-fifteen that night Citizen Train—dressed in his usual white, but now for some reason carrying an armful of blooming sweet pea—led the procession of exotics, many barefoot, down the stairway of the Natatorium to the ballroom below. He held the hand of a ten-year-old Mexican ballerina and was followed by scores of men and women in the customary clothing of their native cultures. Sol Bloom kept order on the ballroom floor."|"The Devil in the White City Murder, Magic and Madness at the Fair That Changed America"|"Erik Larson"
04:30|"four-thirty A.M."|"The ball ended at four-thirty A.M. The exotics walked slowly back to the Midway. The guests climbed into their carriages and slept or softly sang “After the Ball”—the hit song of the day—as their liverymen drove them home over empty streets that echoed with the plosive rhythm of hooves on granite."|"The Devil in the White City Murder, Magic and Madness at the Fair That Changed America"|"Erik Larson"
10:00|"TEN O’CLOCK IN THE MORNING"|"Toward Triumph

BY TEN O’CLOCK IN THE MORNING on Monday, October 9, 1893, the day Frank Millet had designated as Chicago Day, ticket-takers at the fair’s Sixty-fourth Street gate made an informal count of the morning’s sales thus far and found that this one gate had recorded 60,000 paid admissions. The men knew from experience that on any ordinary day sales at this gate accounted for about one-fifth of the total admissions to the fair for any given time, and so came up with an estimate that some 300,000 paid visitors already had entered Jackson Park—more than any other full day’s total and close to the world’s record of 397,000 held by the Paris exposition. Yet the morning had barely begun. The ticket-takers sensed that something odd was happening. The pace of admissions seemed to be multiplying by the hour. In some ticket booths the volume grew so great, so quickly, that silver coins began piling on the floors and burying the ticket-takers’ shoes."|"The Devil in the White City Murder, Magic and Madness at the Fair That Changed America"|"Erik Larson"
12:00|noon|"No one, however, expected the sheer crush of visitors that actually did arrive. By noon the chief of admissions, Horace Tucker, wired a message to fair headquarters, “The Paris record is broken to smithereens, and the people are still coming.” A single ticket-seller, L. E. Decker, a nephew of Buffalo Bill who had sold tickets for Bill’s Wild West for eight years, sold 17,843 tickets during his shift, the most by any one man, and won Horace Tucker’s prize of a box of cigars. Lost children filled every chair at the headquarters of the Columbian Guard; nineteen spent the night and were claimed by their parents the next day. Five people were killed in or near the fair, including a worker obliterated while helping prepare the night’s fireworks and a visitor who stepped from one grip-car into the path of another. A woman lost her foot when a surging crowd knocked her from a train platform. George Ferris, riding his wheel that day, looked down and gasped, “There must be a million people down there.”"|"The Devil in the White City Murder, Magic and Madness at the Fair That Changed America"|"Erik Larson"
"ap 08:00"|"eight o’clock"|"The fireworks began at eight o’clock sharp. Millet had planned an elaborate series of explosive “set pieces,” fireworks affixed to large metal frames shaped to depict various portraits and tableaus. The first featured the Great Fire of 1871, including an image of Mrs. O’Leary’s cow kicking over a lantern. The night boomed and hissed. For the finale the fair’s pyrotechnicians launched five thousand rockets all at once into the black sky over the lake."|"The Devil in the White City Murder, Magic and Madness at the Fair That Changed America"|"Erik Larson"
01:45|"one forty-five A.M."|"The true climax occurred after the grounds closed, however. In the silence, with the air still scented with exploded powder, collectors accompanied by armed guards went to each ticket booth and collected the accumulated silver, three tons of it. They counted the money under heavy guard. By one forty-five A.M., they had an exact total."|"The Devil in the White City Murder, Magic and Madness at the Fair That Changed America"|"Erik Larson"
"ap 02:00"|"two o’clock"|"At two o’clock on American Cities Day Prendergast left his mother’s house and walked to a shoe dealer on Milwaukee Avenue. He paid the dealer four dollars for a used six-chamber revolver. He knew that revolvers of this particular model had a penchant for accidental discharge when bumped or dropped, so he loaded it with only five cartridges and kept the empty chamber under the hammer."|"The Devil in the White City Murder, Magic and Madness at the Fair That Changed America"|"Erik Larson"
"ap 03:00"|"three o’clock"|"At three o’clock, about the time Harrison was giving his speech, Prendergast walked into the Unity Building in central Chicago where Governor John P. Altgeld had an office."|"The Devil in the White City Murder, Magic and Madness at the Fair That Changed America"|"Erik Larson"
"ap 07:00"|"seven o’clock"|"It was nearly dark when Harrison left Jackson Park and drove north through the cold smoky evening toward his mansion on Ashland Avenue. Temperatures had fallen sharply over the week, down to the thirties at night, and the sky seemed perpetually overcast. Harrison reached his home by seven o’clock. He tinkered with a first-floor window, then sat down to supper with two of his children, Sophie and Preston. He had other children, but they were grown and gone. The meal, of course, included watermelon."|"The Devil in the White City Murder, Magic and Madness at the Fair That Changed America"|"Erik Larson"
"ap ~ 07:30"|"approximately seven-thirty"|"In the midst of supper, at approximately seven-thirty, someone rang the bell at the front door. Mary Hanson, the parlor maid, answered and found a gaunt young man with a smooth-shaven face and close-cut black hair. He looked ill. He asked to see the mayor."|"The Devil in the White City Murder, Magic and Madness at the Fair That Changed America"|"Erik Larson"
"ap < 08:00"|"Shortly before eight o’clock"|"The day had been an exciting one for the mayor but also exhausting. He fell asleep at the table. Shortly before eight o’clock his son left the dining room to go up to his room and dress for an engagement in the city later that night. Sophie also went upstairs, to write a letter. The house was cozy and well lit. Mary Hanson and the other servants gathered in the kitchen for their own supper."|"The Devil in the White City Murder, Magic and Madness at the Fair That Changed America"|"Erik Larson"
"ap 08:00"|"eight o’clock"|"At precisely eight o’clock the front bell again rang, and again Hanson answered it."|"The Devil in the White City Murder, Magic and Madness at the Fair That Changed America"|"Erik Larson"
"ap ~ 08:00"|"about eight o’clock"|"“It must have been about eight o’clock when I heard a noise,” Harrison’s son Preston said. “I was startled; it sounded like a picture falling.” Sophie heard it, too, and heard her father cry out. “I thought nothing of it,” she said, “because I thought it was some screens falling on the floor near the back hall. Father’s voice I took to be a yawn. He had a way of yawning very loud.”"|"The Devil in the White City Murder, Magic and Madness at the Fair That Changed America"|"Erik Larson"
19:30|"seven-thirty P.M."|"Detective Geyer reached Cincinnati at seven-thirty P.M. on Thursday, June 27. He checked into the Palace Hotel. The next morning he went to police headquarters to brief the city’s police superintendent on his mission. The superintendent assigned a detective to assist him, Detective John Schnooks, an old friend of Geyer’s."|"The Devil in the White City Murder, Magic and Madness at the Fair That Changed America"|"Erik Larson"
"ap 09:00"|"nine o’clock"|"He occupied a cell that measured nine by fourteen feet, with a narrow barred window high in its outer wall and a single electric lamp, which guards extinguished at nine o’clock each night. The walls were whitewashed. The stone construction of the prison helped blunt the extreme heat that had settled on the city and much of the country, but nothing could keep out the humidity for which Philadelphia was notorious. It clung to Holmes and his fellow prisoners like a cloak of moist wool, yet this too he seemed not to mind. Holmes became a model prisoner—became in fact the model of a model prisoner. He made a game of using his charm to gain concessions from his keepers. He was allowed to wear his own clothes “and to keep my watch and other small belongings.” He discovered also that he could pay to have food, newspapers, and magazines brought in from outside. He read of his increasing national notoriety. He read too that Frank Geyer, a Philadelphia police detective who had interviewed him in June, was now in the Midwest searching for Pitezel’s children. The search delighted Holmes. It satisfied his profound need for attention and gave him a sense of power over the detective. He knew that Geyer’s search would be in vain."|"The Devil in the White City Murder, Magic and Madness at the Fair That Changed America"|"Erik Larson"
"ap 07:00"|seven|"Holmes inserted into his memoir a “prison diary” that he claimed to have kept since the day he arrived at Moyamensing. It is more likely that he invented the diary expressly for the memoir, intending it as a vehicle for reinforcing his claims of innocence by fostering the impression that he was a man of warmth and piety. He claimed in the diary to have established a daily schedule aimed at personal betterment. He would wake at six-thirty each day and take his “usual sponge bath,” then clean his cell. He would breakfast at seven. “I shall eat no more meat of any kind while I am so closely confined.” He planned to exercise and read the morning newspapers until ten o’clock. “From 10 to 12 and 2 to 4 six days in the week, I shall confine myself to my old medical works and other college studies including stenography, French and German.” The rest of the day he would devote to reading various periodicals and library books."|"The Devil in the White City Murder, Magic and Madness at the Fair That Changed America"|"Erik Larson"
"ap 10:00"|"ten o’clock"|"Holmes inserted into his memoir a “prison diary” that he claimed to have kept since the day he arrived at Moyamensing. It is more likely that he invented the diary expressly for the memoir, intending it as a vehicle for reinforcing his claims of innocence by fostering the impression that he was a man of warmth and piety. He claimed in the diary to have established a daily schedule aimed at personal betterment. He would wake at six-thirty each day and take his “usual sponge bath,” then clean his cell. He would breakfast at seven. “I shall eat no more meat of any kind while I am so closely confined.” He planned to exercise and read the morning newspapers until ten o’clock. “From 10 to 12 and 2 to 4 six days in the week, I shall confine myself to my old medical works and other college studies including stenography, French and German.” The rest of the day he would devote to reading various periodicals and library books."|"The Devil in the White City Murder, Magic and Madness at the Fair That Changed America"|"Erik Larson"
"ap 23:50"|"10 to 12"|"Holmes inserted into his memoir a “prison diary” that he claimed to have kept since the day he arrived at Moyamensing. It is more likely that he invented the diary expressly for the memoir, intending it as a vehicle for reinforcing his claims of innocence by fostering the impression that he was a man of warmth and piety. He claimed in the diary to have established a daily schedule aimed at personal betterment. He would wake at six-thirty each day and take his “usual sponge bath,” then clean his cell. He would breakfast at seven. “I shall eat no more meat of any kind while I am so closely confined.” He planned to exercise and read the morning newspapers until ten o’clock. “From 10 to 12 and 2 to 4 six days in the week, I shall confine myself to my old medical works and other college studies including stenography, French and German.” The rest of the day he would devote to reading various periodicals and library books."|"The Devil in the White City Murder, Magic and Madness at the Fair That Changed America"|"Erik Larson"
"ap 02:00"|2|"Holmes inserted into his memoir a “prison diary” that he claimed to have kept since the day he arrived at Moyamensing. It is more likely that he invented the diary expressly for the memoir, intending it as a vehicle for reinforcing his claims of innocence by fostering the impression that he was a man of warmth and piety. He claimed in the diary to have established a daily schedule aimed at personal betterment. He would wake at six-thirty each day and take his “usual sponge bath,” then clean his cell. He would breakfast at seven. “I shall eat no more meat of any kind while I am so closely confined.” He planned to exercise and read the morning newspapers until ten o’clock. “From 10 to 12 and 2 to 4 six days in the week, I shall confine myself to my old medical works and other college studies including stenography, French and German.” The rest of the day he would devote to reading various periodicals and library books."|"The Devil in the White City Murder, Magic and Madness at the Fair That Changed America"|"Erik Larson"
"ap 08:30"|eight-thirty|"In his memoir Holmes contended that the news did shock him. His newspaper came that morning at eight-thirty as it always did, he wrote, “and I had hardly opened it before I saw in large headlines the announcement of the finding of the children in Toronto. For the moment it seemed so impossible, that I was inclined to think it one of the frequent newspaper excitements that had attended the earlier part of the case. . . .” But suddenly, he wrote, he realized what must have happened. Minnie Williams had killed them or had ordered them killed. Holmes knew she had an unsavory associate named “Hatch.” He guessed that Williams had suggested the killings and Hatch had carried them out. It was all too horrible to comprehend: “I gave up trying to read the article, and saw instead the two little faces as they had looked when I hurriedly left them—felt the innocent child’s kiss so timidly given and heard again their earnest words of farewell, and I realized that I had received another burden to carry to my grave. . . . I think at this time I should have lost my senses utterly had I not been hurriedly called to prepare to be taken to the District Attorney’s office.”"|"The Devil in the White City Murder, Magic and Madness at the Fair That Changed America"|"Erik Larson"
02:00|"two in the morning"|"Olmsted died at two in the morning on August 28, 1903. His funeral was spare, family only. His wife, who had seen this great man disappear before her eyes, did not attend."|"The Devil in the White City Murder, Magic and Madness at the Fair That Changed America"|"Erik Larson"
14:28|"2:28 P.M."|"Prendergast’s lawyers tried to prove Prendergast was insane, but a jury of angry, grieving Chicagoans believed otherwise. One important piece of evidence tending to support the prosecution’s case for sanity was the care Prendergast had taken to keep an empty chamber under the hammer of his revolver as he carried it in his pocket. At 2:28 P.M. on December 29, after conferring for an hour and three minutes, the jury found him guilty. The judge sentenced him to death. Throughout his trial and subsequent appeal, he continued to send Trude postcards. He wrote on February 21, 1894, “No one should be put to death no matter who it is, if it can be avoided, it is demoralizing to society to be barbarous.”"|"The Devil in the White City Murder, Magic and Madness at the Fair That Changed America"|"Erik Larson"
17:00|"5 P.M."|"His description of killing Alice and Nellie rang true, however. He said he placed the girls in a large trunk and made an opening in its top. “Here I left them until I could return and at my leisure kill them. At 5 P.M. I borrowed a spade of a neighbor and at the same time called on Mrs. Pitezel at her hotel. I then returned to my hotel and ate my dinner, and at 7:00 P.M. I again returned to the house where the children were imprisoned, and ended their lives by connecting the gas with the trunk, then came the opening of the trunk and the viewing of their little blackened and distorted faces, then the digging of their shallow graves in the basement of the house.”"|"The Devil in the White City Murder, Magic and Madness at the Fair That Changed America"|"Erik Larson"
19:00|"7:00 P.M."|"His description of killing Alice and Nellie rang true, however. He said he placed the girls in a large trunk and made an opening in its top. “Here I left them until I could return and at my leisure kill them. At 5 P.M. I borrowed a spade of a neighbor and at the same time called on Mrs. Pitezel at her hotel. I then returned to my hotel and ate my dinner, and at 7:00 P.M. I again returned to the house where the children were imprisoned, and ended their lives by connecting the gas with the trunk, then came the opening of the trunk and the viewing of their little blackened and distorted faces, then the digging of their shallow graves in the basement of the house.”"|"The Devil in the White City Murder, Magic and Madness at the Fair That Changed America"|"Erik Larson"
"< 10:00"|"Shortly before ten A.M."|"Shortly before ten A.M. on May 7, 1896, after a breakfast of boiled eggs, dry toast, and coffee, Holmes was escorted to the gallows at Moyamensing Prison. This was a difficult moment for his guards. They liked Holmes. They knew he was a killer, but he was a charming killer. The assistant superintendent, a man named Richardson, seemed nervous as he readied the noose. Holmes turned to him and smiled, and said, “Take your time, old man.” At 10:13 Richardson released the trap and hanged him."|"The Devil in the White City Murder, Magic and Madness at the Fair That Changed America"|"Erik Larson"
"ap 10:13"|10:13|"Shortly before ten A.M. on May 7, 1896, after a breakfast of boiled eggs, dry toast, and coffee, Holmes was escorted to the gallows at Moyamensing Prison. This was a difficult moment for his guards. They liked Holmes. They knew he was a killer, but he was a charming killer. The assistant superintendent, a man named Richardson, seemed nervous as he readied the noose. Holmes turned to him and smiled, and said, “Take your time, old man.” At 10:13 Richardson released the trap and hanged him."|"The Devil in the White City Murder, Magic and Madness at the Fair That Changed America"|"Erik Larson"
"ap 01:24"|1:24|"“probably not equaled: Miller, 321.
“our originality: Moore, Burnham, Architect, 1:24.
“if,” he said, “the earth: Ibid., 1:321."|"The Devil in the White City Murder, Magic and Madness at the Fair That Changed America"|"Erik Larson"
"ap 01:00"|one|"Two hours before: Moore, McKim, 113; Chicago Tribune, January 11, 1891.
“It was one: Moore, Burnham Interview, 3.
“they gazed: Burnham, Design, 24."|"The Devil in the White City Murder, Magic and Madness at the Fair That Changed America"|"Erik Larson"
00:00|midnight|"At night, after the first-floor stores: This is speculation, but I base it on the following: In Mooers Holmes was known to pace at midnight, suggesting he was not a restful sleeper. Psychopaths need stimulation. The kiln would have been an irresistible attraction. Admiring it and igniting its flames would have reinforced his sense of power and control over the occupants above."|"The Devil in the White City Murder, Magic and Madness at the Fair That Changed America"|"Erik Larson"
"ap 00:08"|12:08|"“As by a touch: Badger, xii.
At precisely 12:08: Chicago Tribune, May 2, 1893.
Jane Addams realized: Badger, xi; Miller, 490."|"The Devil in the White City Murder, Magic and Madness at the Fair That Changed America"|"Erik Larson"
15:30|"three-thirty P.M."|"At Last
At three-thirty P.M.: Anderson, 62; Barnes, 180.
“No crank will have: Alleghenian, July 1, 1893."|"The Devil in the White City Murder, Magic and Madness at the Fair That Changed America"|"Erik Larson"
"ap 09:00"|"nine o’clock"|"At nine o’clock: For details about the night’s fireworks displays see Chicago Tribune, July 5, 1895; Burg, 43; Gilbert, 40."|"The Devil in the White City Murder, Magic and Madness at the Fair That Changed America"|"Erik Larson"
21:15|"nine-fifteen that night"|"“Chicago built the fair: Chicago Tribune, August 16, 1893.
At nine-fifteen that night: Chicago Tribune, August 17, 1893.
It was hot: Ibid."|"The Devil in the White City Murder, Magic and Madness at the Fair That Changed America"|"Erik Larson"
"ap 10:00"|"ten o’clock"|"Toward Triumph
By ten o’clock: Dybwad and Bliss, 38–40.
“The Paris record: Ibid., 38."|"The Devil in the White City Murder, Magic and Madness at the Fair That Changed America"|"Erik Larson"
"ap 02:00"|"two o’clock"|"“Look at it now: Abbot, 228.
At two o’clock: Chicago Tribune, October 29, 1893.
At three o’clock: Chicago Tribute, December 20, 1893."|"The Devil in the White City Murder, Magic and Madness at the Fair That Changed America"|"Erik Larson"
"ap 03:00"|"three o’clock"|"“Look at it now: Abbot, 228.
At two o’clock: Chicago Tribune, October 29, 1893.
At three o’clock: Chicago Tribute, December 20, 1893."|"The Devil in the White City Murder, Magic and Madness at the Fair That Changed America"|"Erik Larson"
"ap 02:00"|"two o’clock"|"At two o’clock: Chicago Tribune, October 29, 1893.
At three o’clock: Chicago Tribute, December 20, 1893.
In the midst of supper: Chicago Times, December 14, 1893, McGoorty Papers."|"The Devil in the White City Murder, Magic and Madness at the Fair That Changed America"|"Erik Larson"
"ap 03:00"|"three o’clock"|"At two o’clock: Chicago Tribune, October 29, 1893.
At three o’clock: Chicago Tribute, December 20, 1893.
In the midst of supper: Chicago Times, December 14, 1893, McGoorty Papers."|"The Devil in the White City Murder, Magic and Madness at the Fair That Changed America"|"Erik Larson"
