07:00|"seven in the morning"|"The heat of the day had changed, somehow, until it was a burnished darkness crushing down upon a devastated land. Over his head the blue circles of ominous uncharted suns, of unnumbered centres of fire, revolved interminably before his eyes as though he were lying constantly exposed to the hot light and in a state of feverish coma. At seven in the morning something phantasmal, something almost absurdly unreal that he knew was his mortal body, went out with seven other prisoners and two guards to work on the camp roads. One day they loaded and unloaded quantities of gravel, spread it, raked it—the next day they worked with huge barrels of red-hot tar, flooding the gravel with black, shining pools of molten heat. At night, locked up in the guard-house, he would lie without thought, without courage to compass thought, staring at the irregular beams of the ceiling overhead until about three o’clock, when he would slip into a broken, troubled sleep."|"The Beautiful and Damned"|"F. Scott Fitzgerald"
"ap ~ 03:00"|"about three o’clock"|"The heat of the day had changed, somehow, until it was a burnished darkness crushing down upon a devastated land. Over his head the blue circles of ominous uncharted suns, of unnumbered centres of fire, revolved interminably before his eyes as though he were lying constantly exposed to the hot light and in a state of feverish coma. At seven in the morning something phantasmal, something almost absurdly unreal that he knew was his mortal body, went out with seven other prisoners and two guards to work on the camp roads. One day they loaded and unloaded quantities of gravel, spread it, raked it—the next day they worked with huge barrels of red-hot tar, flooding the gravel with black, shining pools of molten heat. At night, locked up in the guard-house, he would lie without thought, without courage to compass thought, staring at the irregular beams of the ceiling overhead until about three o’clock, when he would slip into a broken, troubled sleep."|"The Beautiful and Damned"|"F. Scott Fitzgerald"
12:00|noon|"The case is coming to trial late in November. Can you possibly get leave?I’ve tried to write you again and again but it just seems to make things worse. I want to see you about several matters, but you know that you have once prevented me from coming and I am disinclined to try again. In view of a number of things it seems necessary that we have a conference. I’m very glad about your appointment.GLORIAHe was too tired to try to understand—or to care. Her phrases, her intentions, were all very far away in an incomprehensible past. At the second letter he scarcely glanced; it was from Dot—an incoherent, tear-swollen scrawl, a flood of protest, endearment, and grief. After a page he let it slip from his inert hand and drowsed back into a nebulous hinterland of his own. At drill-call he awoke with a high fever and fainted when he tried to leave his tent—at noon he was sent to the base hospital with influenza."|"The Beautiful and Damned"|"F. Scott Fitzgerald"
"ap 07:00"|seven|"The camp itself was a dreary muddle, cold, wind-swept, and filthy, with the accumulated dirt incident to the passage through of many divisions. Their train came in at seven one night, and they waited in line until one while a military tangle was straightened out somewhere ahead. Officers ran up and down ceaselessly, calling orders and making a great uproar. It turned out that the trouble was due to the colonel, who was in a righteous temper because he was a West Pointer, and the war was going to stop before he could get overseas. Had the militant governments realized the number of broken hearts among the older West Pointers during that week, they would indubitably have prolonged the slaughter another month. The thing was pitiable!"|"The Beautiful and Damned"|"F. Scott Fitzgerald"
12:00|noon|"At noon Anthony set off at a run for the nearest canteen telephone. As he approached what corresponded to the down-town of the camp, he noticed that many other soldiers were running also, that a man near him had suddenly leaped into the air and clicked his heels together. The tendency to run became general, and from little excited groups here and there came the sounds of cheering. He stopped and listened—over the cold country whistles were blowing and the chimes of the Garden City churches broke suddenly into reverberatory sound."|"The Beautiful and Damned"|"F. Scott Fitzgerald"
"ap 06:00"|"six o’clock"|"That evening in the opaque gloom of six o’clock Anthony slipped between two freight-cars, and once over the railroad, followed the track along to Garden City, where he caught an electric train for New York. He stood some chance of apprehension—he knew that the military police were often sent through the cars to ask for passes, but he imagined that tonight the vigilance would be relaxed. But, in any event, he would have tried to slip through, for he had been unable to locate Gloria by telephone, and another day of suspense would have been intolerable."|"The Beautiful and Damned"|"F. Scott Fitzgerald"
"ap 02:00"|"Two o’clock"|"... I can almost look down the tracks and see you going but without you, dearest, dearest, I can’t see or hear or feel or think. Being apart—whatever has happened or will happen to us—is like begging for mercy from a storm, Anthony; it’s like growing old. I want to kiss you so—in the back of your neck where your old black hair starts. Because I love you and whatever we do or say to each other, or have done, or have said, you’ve got to feel how much I do, how inanimate I am when you’re gone. I can’t even hate the damnable presence of PEOPLE, those people in the station who haven’t any right to live—I can’t resent them even though they’re dirtying up our world, because I’m engrossed in wanting you so.If you hated me, if you were covered with sores like a leper, if you ran away with another woman or starved me or beat me—how absurd this sounds—I’d still want you, I’d still love you. I KNOW, my darling.It’s late—I have all the windows open and the air outside is just as soft as spring, yet, somehow, much more young and frail than spring. Why do they make spring a young girl, why does that illusion dance and yodel its way for three months through the world’s preposterous barrenness. Spring is a lean old plough-horse with its ribs showing—it’s a pile of refuse in a field, parched by the sun and the rain to an ominous cleanliness.In a few hours you’ll wake up, my darling—and you’ll be miserable, and disgusted with life. You’ll be in Delaware or Carolina or somewhere and so unimportant. I don’t believe there’s any one alive who can contemplate themselves as an impermanent institution, as a luxury or an unnecessary evil. Very few of the people who accentuate the futility of life remark the futility of themselves. Perhaps they think that in proclaiming the evil of living they somehow salvage their own worth from the ruin—but they don’t, even you and I....... Still I can see you. There’s blue haze about the trees where you’ll be passing, too beautiful to be predominant. No, the fallow squares of earth will be most frequent—they’ll be along beside the track like dirty coarse brown sheets drying in the sun, alive, mechanical, abominable. Nature, slovenly old hag, has been sleeping in them with every old farmer or negro or immigrant who happened to covet her....So you see that now you’re gone I’ve written a letter all full of contempt and despair. And that just means that I love you, Anthony, with all there is to love with in yourGLORIA.When she had addressed the letter she went to her twin bed and lay down upon it, clasping Anthony’s pillow in her arms as though by sheer force of emotion she could metamorphize it into his warm and living body. Two o’clock saw her dry-eyed, staring with steady persistent grief into the darkness, remembering, remembering unmercifully, blaming herself for a hundred fancied unkindnesses, making a likeness of Anthony akin to some martyred and transfigured Christ. For a time she thought of him as he, in his more sentimental moments, probably thought of himself."|"The Beautiful and Damned"|"F. Scott Fitzgerald"
"ap 05:00"|five|"At five she was still awake. A mysterious grinding noise that went on every morning across the areaway told her the hour. She heard an alarm-clock ring, and saw a light make a yellow square on an illusory blank wall opposite. With the half-formed resolution of following him South immediately, her sorrow grew remote and unreal, and moved off from her as the dark moved westward. She fell asleep."|"The Beautiful and Damned"|"F. Scott Fitzgerald"
12:00|noon|"Nevertheless, at noon when she had called up several of her acquaintances, including the martial Muriel, and found each one engaged for lunch, she gave way to a quiet pity for herself and her loneliness. Curled on the bed with pencil and paper she wrote Anthony another letter."|"The Beautiful and Damned"|"F. Scott Fitzgerald"
"ap 11:00"|"eleven o’clock"|"At eleven o’clock to her great surprise, she was in the minority for staying out. The others wanted to return to Rachael’s apartment—to get some more liquor, they said. Gloria argued persistently that Captain Collins’s flask was half full—she had just seen it—then catching Rachael’s eye she received an unmistakable wink. She deduced, confusedly, that her hostess wanted to get rid of the officers and assented to being bundled into a taxicab outside."|"The Beautiful and Damned"|"F. Scott Fitzgerald"
13:00|"one o’clock that afternoon"|"YOU CAN SELL!!!Why not earn while you learn?

Our salesmen make $50—$200 weekly.There followed an address on Madison Avenue, and instructions to appear at one o’clock that afternoon. Gloria, glancing over his shoulder after one of their usual late breakfasts, saw him regarding it idly."|"The Beautiful and Damned"|"F. Scott Fitzgerald"
"ap 01:00"|"one o’clock"|"At her urging he went at one o’clock to the appointed address, where he found himself one of a dense miscellany of men waiting in front of the door. They ranged from a messenger-boy evidently misusing his company’s time to an immemorial individual with a gnarled body and a gnarled cane. Some of the men were seedy, with sunken cheeks and puffy pink eyes—others were young, possibly still in high school. After a jostled fifteen minutes during which they all eyed one another with apathetic suspicion there appeared a smart young shepherd clad in a “waist-line” suit and wearing the manner of an assistant rector who herded them up-stairs into a large room, which resembled a schoolroom and contained innumerable desks. Here the prospective salesmen sat down—and again waited. After an interval a platform at the end of the hall was clouded with half a dozen sober but sprightly men who, with one exception, took seats in a semi-circle facing the audience."|"The Beautiful and Damned"|"F. Scott Fitzgerald"
"ap 05:00"|"five o’clock"|"After another drink he conceived the brilliant plan of selling the stock to the bartenders along Lexington Avenue. This occupied several hours, for it was necessary to take a few drinks in each place in order to get the proprietor in the proper frame of mind to talk business. But the bartenders one and all contended that if they had any money to buy bonds they would not be bartenders. It was as though they had all convened and decided upon that rejoinder. As he approached a dark and soggy five o’clock he found that they were developing a still more annoying tendency to turn him off with a jest."|"The Beautiful and Damned"|"F. Scott Fitzgerald"
"ap 05:00"|five|"At five, then, with a tremendous effort at concentration he decided that he must put more variety into his canvassing. He selected a medium-sized delicatessen store, and went in. He felt, illuminatingly, that the thing to do was to cast a spell not only over the store-keeper but over all the customers as well—and perhaps through the psychology of the herd instinct they would buy as an astounded and immediately convinced whole."|"The Beautiful and Damned"|"F. Scott Fitzgerald"
12:00|noon|"One day in the midst of Gloria’s illness there occurred a curious incident that puzzled Miss McGovern, the trained nurse, for some time afterward. It was noon, but the room in which the patient lay was dark and quiet. Miss McGovern was standing near the bed mixing some medicine, when Mrs. Patch, who had apparently been sound asleep, sat up and began to speak vehemently:"|"The Beautiful and Damned"|"F. Scott Fitzgerald"
"ap 03:00"|"three o’clock"|"He assured her that it was merely a question of when she wanted the trial. Any time? Well, he’d phone later in the day and let her know a convenient hour. The conversation closed with conventional padding on both sides. Then from three o’clock to five she sat close to the telephone—with no result."|"The Beautiful and Damned"|"F. Scott Fitzgerald"
"ap 10:00"|"ten o’clock"|"MY DEAR GLORIA:
Just by luck a matter came to my attention that I think will be just suited to you. I would like to see you start with something that would bring you notice. At the same time if a very beautiful girl of your sort is put directly into a picture next to one of the rather shop-worn stars with which every company is afflicted, tongues would very likely wag. But there is a “flapper” part in a Percy B. Debris production that I think would be just suited to you and would bring you notice. Willa Sable plays opposite Gaston Mears in a sort of character part and your part I believe would be her younger sister.Anyway Percy B. Debris who is directing the picture says if you’ll come to the studios day after to-morrow (Thursday) he will run off a test. If ten o’clock is suited to you I will meet you there at that time.With all good wishes
Ever faithfully 
JOSEPH BLACK.Gloria had decided that Anthony was to know nothing of this until she had obtained a definite position, and accordingly she was dressed and out of the apartment next morning before he awoke. Her mirror had given her, she thought, much the same account as ever. She wondered if there were any lingering traces of her sickness. She was still slightly under weight, and she had fancied, a few days before, that her cheeks were a trifle thinner—but she felt that those were merely transitory conditions and that on this particular day she looked as fresh as ever. She had bought and charged a new hat, and as the day was warm she had left the leopard-skin coat at home."|"The Beautiful and Damned"|"F. Scott Fitzgerald"
"ap > 01:00"|"after one o’clock"|"It was after one o’clock and she had breakfasted at eleven, so, deciding to forego luncheon, she started for a walk in the Park. At three there would be a mail. She would be back by three."|"The Beautiful and Damned"|"F. Scott Fitzgerald"
"ap 11:00"|eleven|"It was after one o’clock and she had breakfasted at eleven, so, deciding to forego luncheon, she started for a walk in the Park. At three there would be a mail. She would be back by three."|"The Beautiful and Damned"|"F. Scott Fitzgerald"
"ap 03:00"|three|"It was after one o’clock and she had breakfasted at eleven, so, deciding to forego luncheon, she started for a walk in the Park. At three there would be a mail. She would be back by three."|"The Beautiful and Damned"|"F. Scott Fitzgerald"
"ap 02:00"|"Two o’clock"|"Two o’clock by her little gold watch. She should have a new watch, one made in a platinum oblong and incrusted with diamonds—but those cost even more than squirrel coats and of course they were out of her reach now, like everything else—unless perhaps the right letter was awaiting her... in about an hour... fifty-eight minutes exactly. Ten to get there left forty-eight ... forty-seven now..."|"The Beautiful and Damned"|"F. Scott Fitzgerald"
"~ 00:00"|"about midnight"|"“Oh, yes. Frequently. He’ll come in about midnight—and weep and ask me to forgive him.”"|"The Beautiful and Damned"|"F. Scott Fitzgerald"
"ap 07:30"|seven-thirty|"“Gloria, dear, I wish we could have dinner together, but I promised a man—and it’s seven-thirty already. I’ve got to tear.”"|"The Beautiful and Damned"|"F. Scott Fitzgerald"
"ap 08:00"|"eight o’clock"|"She looked at her watch—it was eight o’clock. She had been pleased for a part of the day—the early afternoon—in walking along that Broadway of Harlem, One Hundred and Twenty-fifth Street, with her nostrils alert to many odors, and her mind excited by the extraordinary beauty of some Italian children. It affected her curiously—as Fifth Avenue had affected her once, in the days when, with the placid confidence of beauty, she had known that it was all hers, every shop and all it held, every adult toy glittering in a window, all hers for the asking. Here on One Hundred and Twenty-fifth Street there were Salvation Army bands and spectrum-shawled old ladies on door-steps and sugary, sticky candy in the grimy hands of shiny-haired children—and the late sun striking down on the sides of the tall tenements. All very rich and racy and savory, like a dish by a provident French chef that one could not help enjoying, even though one knew that the ingredients were probably left-overs...."|"The Beautiful and Damned"|"F. Scott Fitzgerald"
"ap > 06:00"|"just after six o’clock"|"Down at Sammy’s he found Parker Allison and Pete Lytell sitting alone at a table, drinking whiskey sours. It was just after six o’clock, and Sammy, or Samuele Bendiri, as he had been christened, was sweeping an accumulation of cigarette butts and broken glass into a corner."|"The Beautiful and Damned"|"F. Scott Fitzgerald"
"ap ~ 11:00"|"about eleven o’clock"|"“Pretty good,” said Allison. He winked at Pete Lytell. “Too bad you’re a married man. We’ve got some pretty good stuff lined up for about eleven o’clock, when the shows let out. Oh, boy! Yes, sir—too bad he’s married—isn’t it, Pete?”"|"The Beautiful and Damned"|"F. Scott Fitzgerald"
"ap 07:30"|"half past seven"|"At half past seven, when they had completed the six rounds, Anthony found that his intentions were giving audience to his desires. He was happy and cheerful now—thoroughly enjoying himself. It seemed to him that the story which Pete had just finished telling was unusually and profoundly humorous—and he decided, as he did every day at about this point, that they were “damn good fellows, by golly!” who would do a lot more for him than any one else he knew. The pawnshops would remain open until late Saturday nights, and he felt that if he took just one more drink he would attain a gorgeous rose-colored exhilaration."|"The Beautiful and Damned"|"F. Scott Fitzgerald"
"ap > 09:00"|"Just after nine o’clock"|"Just after nine o’clock Anthony staggered to his feet and, bidding them a thick good night, walked unsteadily to the door, handing Sammy one of his two quarters as he passed out. Once in the street he hesitated uncertainly and then started in the direction of Sixth Avenue, where he remembered to have frequently passed several loan-offices. He went by a news-stand and two drug-stores—and then he realized that he was standing in front of the place which he sought, and that it was shut and barred. Unperturbed he continued; another one, half a block down, was also closed—so were two more across the street, and a fifth in the square below. Seeing a faint light in the last one, he began to knock on the glass door; he desisted only when a watchman appeared in the back of the shop and motioned him angrily to move on. With growing discouragement, with growing befuddlement, he crossed the street and walked back toward Forty-third. On the corner near Sammy’s he paused undecided—if he went back to the apartment, as he felt his body required, he would lay himself open to bitter reproach; yet, now that the pawnshops were closed, he had no notion where to get the money. He decided finally that he might ask Parker Allison, after all—but he approached Sammy’s only to find the door locked and the lights out. He looked at his watch; nine-thirty. He began walking."|"The Beautiful and Damned"|"F. Scott Fitzgerald"
"ap 09:30"|nine-thirty|"Just after nine o’clock Anthony staggered to his feet and, bidding them a thick good night, walked unsteadily to the door, handing Sammy one of his two quarters as he passed out. Once in the street he hesitated uncertainly and then started in the direction of Sixth Avenue, where he remembered to have frequently passed several loan-offices. He went by a news-stand and two drug-stores—and then he realized that he was standing in front of the place which he sought, and that it was shut and barred. Unperturbed he continued; another one, half a block down, was also closed—so were two more across the street, and a fifth in the square below. Seeing a faint light in the last one, he began to knock on the glass door; he desisted only when a watchman appeared in the back of the shop and motioned him angrily to move on. With growing discouragement, with growing befuddlement, he crossed the street and walked back toward Forty-third. On the corner near Sammy’s he paused undecided—if he went back to the apartment, as he felt his body required, he would lay himself open to bitter reproach; yet, now that the pawnshops were closed, he had no notion where to get the money. He decided finally that he might ask Parker Allison, after all—but he approached Sammy’s only to find the door locked and the lights out. He looked at his watch; nine-thirty. He began walking."|"The Beautiful and Damned"|"F. Scott Fitzgerald"
"ap < 10:00"|"nearly ten"|"Anthony got his five cents change and started for the Boul’ Mich‘, a popular dancing resort on Forty-fifth Street. It was nearly ten but the streets were dark and sparsely peopled until the theatres should eject their spawn an hour later. Anthony knew the Boul’ Mich’, for he had been there with Gloria during the year before, and he remembered the existence of a rule that patrons must be in evening dress. Well, he would not go up-stairs—he would send a boy up for Bloeckman and wait for him in the lower hall. For a moment he did not doubt that the whole project was entirely natural and graceful. To his distorted imagination Bloeckman had become simply one of his old friends."|"The Beautiful and Damned"|"F. Scott Fitzgerald"
16:00|"four that afternoon"|"Three weeks later the trial came to an end. The seemingly endless spool of legal red tape having unrolled over a period of four and a half years, suddenly snapped off. Anthony and Gloria and, on the other side, Edward Shuttleworth and a platoon of beneficiaries testified and lied and ill-behaved generally in varying degrees of greed and desperation. Anthony awoke one morning in March realizing that the verdict was to be given at four that afternoon, and at the thought he got up out of his bed and began to dress. With his extreme nervousness there was mingled an unjustified optimism as to the outcome. He believed that the decision of the lower court would be reversed, if only because of the reaction, due to excessive prohibition, that had recently set in against reforms and reformers. He counted more on the personal attacks that they had levelled at Shuttleworth than on the more sheerly legal aspects of the proceedings."|"The Beautiful and Damned"|"F. Scott Fitzgerald"
"ap 02:00"|"two o’clock"|"At two o’clock Richard Caramel’s car arrived at the door and, when he phoned up, Anthony took Gloria down in the elevator and walked with her to the curb."|"The Beautiful and Damned"|"F. Scott Fitzgerald"
"ap 04:00"|four|"“We won’t come back,” she answered, “we’ll meet you down there at four.”"|"The Beautiful and Damned"|"F. Scott Fitzgerald"
