02:30|vigils|"To Malone the sense of latent mystery in existence was always present. 
In youth  he had felt the hidden beauty and ecstasy of things, and had 
been a poet; but  poverty and sorrow and exile had turned his gaze in 
darker directions, and he  had thrilled at the imputations of evil in 
the world around. Daily life had fur  him come to be a phantasmagoria 
of macabre shadow-studies; now glittering and  leering with concealed 
rottenness as in Beardsley's best manner, now hinting  terrors behind 
the commonest shapes and objects as in the subtler and less  obvious 
work of Gustave Dor . He would often regard it as merciful that most 
 persons of high Intelligence jeer at the inmost mysteries; for, he 
argued, if  superior minds were ever placed in fullest contact with the 
secrets preserved by  ancient and lowly cults, the resultant 
abnormalities would soon not only wreck  the world, but threaten the 
very integrity of the universe. All this reflection  was no doubt 
morbid, but keen logic and a deep sense of humour ably offset it. 

      Malone was satisfied to let his notions remain as half-spied and 
forbidden  visions to be lightly played with; and hysteria came only 
when duty flung him  into a hell of revelation too sudden and insidious 
to escape. 

      He had for some time been detailed to the Butler Street station in 
Brooklyn when  the Red Hook matter came to his notice. Red Hook is a 
maze of hybrid squalor  near the ancient waterfront opposite Governor's 
Island, with dirty highways  climbing the hill from the wharves to that 
higher ground where the decayed  lengths of Clinton and Court Streets 
lead off toward the Borough Hall. Its  houses are mostly of brick, 
dating from the first quarter to the middle of the  nineteenth century, 
and some of the obscurer alleys and byways have that  alluring antique 
flavour which conventional reading leads us to call  'Dickensian'. The 
population is a hopeless tangle and enigma; Syrian, Spanish,  Italian, 
and Negro elements impinging upon one another, and fragments of 
 Scandinavian and American belts lying not far distant.. It is a babel 
of sound  and filth, and sends out strange cries to answer the lapping 
oily waves at its  grimy piers and the monstrous organ litanies of the 
harbour whistles. Here long  ago a brighter picture dwelt, with 
clear-eyed mariners on the lower streets and  homes of taste and 
substance where the larger houses line the hill. One can  trace the 
relics of this former happiness in the trim shapes of the buildings, 
 the occasional graceful churches, and the evidences of original art 
and  background in bits of detail here and there—a worn flight of 
steps, a battered  doorway, a wormy pair of decorative columns or 
pilasters, or a fragment of once  green space with bent and rusted iron 
railing. The houses are generally in solid  blocks, and now and then a 
many-windowed cupola arises to tell of days when the  households of 
captains and ship-owners watched the sea. 

      From this tangle of material and spiritual putrescence the 
blasphemies of an  hundred dialects assail the sky. Hordes of prowlers 
reel shouting and singing  along the lanes and thoroughfares, 
occasional furtive hands suddenly extinguish  lights and pull down 
curtains, and swarthy, sin-pitted faces disappear from  windows when 
visitors pick their way through. Policemen despair of order or  reform, 
and seek rather to erect barriers protecting the outside world from the 
 contagion. The clang of the patrol is answered by a kind of spectral 
silence,  and such prisoners as are taken are never communicative. 
Visible offences are as  varied as the local dialects, and run the 
gamut from the smuggling of rum and  prohibited aliens through diverse 
stages of lawlessness and obscure vice to  murder and mutilation in 
their most abhorrent guises. That these visible affairs  are not more 
frequent is not to the neighbourhood's credit, unless the power of 
 concealment be an art demanding credit. More people enter Red Hook 
than leave it —or at least, than leave it by the landward side—and 
those who are not  loquacious are the likeliest to leave. 

      Malone found in this state of things a faint stench of secrets more 
terrible  than any of the sins denounced by citizens and bemoaned by 
priests and  philanthropists. He was conscious, as one who united 
imagination with scientific  knowledge, that modern people under 
lawless conditions tend uncannily to repeat  the darkest instinctive 
patterns of primitive half-ape savagery in their daily  life and ritual 
observances; and he had often viewed with an anthropologist's  shudder 
the chanting, cursing processions of blear-eyed and pockmarked young 
men  which wound their way along in the dark small hours of morning. 
One saw groups  of these youths incessantly; sometimes in leering 
vigils on street corners,  sometimes in doorways playing eerily on 
cheap instruments of music, sometimes in  stupefied dozes or indecent 
dialogues around cafeteria tables near Borough Hall,  and sometimes in 
whispering converse around dingy taxicabs drawn up at the high  stoops 
of crumbling and closely shuttered old houses. They chilled and 
 fascinated him more than he dared confess to his associates on the 
force, for he  seemed to see in them some monstrous thread of secret 
continuity; some fiendish,  cryptical, and ancient pattern utterly 
beyond and below the sordid mass of facts  and habits and haunts listed 
with such conscientious technical care by the  police. They must be, he 
felt inwardly, the heirs of some shocking and  primordial tradition; 
the sharers of debased and broken scraps from cults and  ceremonies 
older than mankind. Their coherence and definiteness suggested it,  and 
it shewed in the singular suspicion of order which lurked beneath their 
 squalid disorder. He had not read in vain such treatises as Miss 
Murray's  Witch-Cult in Western Europe; and knew that up to recent 
years there had  certainly survived among peasants and furtive folk a 
frightful and clandestine  system of assemblies and orgies descended 
from dark religions antedating the  Aryan world, and appearing in 
popular legends as Black Masses and Witches'

 Sabbaths. That these hellish vestiges of old Turanian-Asiatic 
magic and  fertility cults were even now wholly dead he could not for a 
moment suppose, and  he frequently wondered how much older and how much 
blacker than the very worst  of the muttered tales some of them might 
really be."|"The Horror at Red Hook"|"H. P. Lovecraft"
"~ 12:00"|"about high noon"|"Then came the June wedding and the great sensation. Flatbush was gay 
for the  hour about high noon, and pennanted motors thronged the 
streets near the old  Dutch church where an awning stretched from door 
to highway. No local event ever  surpassed the Suydam-Gerritsen 
nuptials in tone and scale, and the party which  escorted bride and 
groom to the Cunard Pier was, if not exactly the smartest, at  least a 
solid page from the Social Register. At five o'clock adieux were waved, 
 and the ponderous liner edged away from the long pier, slowly turned 
its nose  seaward, discarded its tug, and headed for the widening water 
spaces that led to  old world wonders. By night the outer harbour was 
cleared, and late passengers  watched the stars twinkling above an 
unpolluted ocean. 

      Whether the tramp steamer or the scream was first to gain 
attention, no one can  say. Probably they were simultaneous, but it is 
of no use to calculate. The  scream came from the Suydam stateroom, and 
the sailor who broke down the door  could perhaps have told frightful 
things if he had not forthwith gone completely  mad—as it is, he 
shrieked more loudly than the first victims, and thereafter  ran 
simpering about the vessel till caught and put in irons. The ship's 
doctor  who entered the stateroom and turned on the lights a moment 
later did not go  mad, but told nobody what he saw till afterward, when 
he corresponded with  Malone in Chepachet. It was murder—
strangulation—but one need not say that  the claw-mark on Mrs. 
Suydam's throat could not have come from her husband's or  any other 
human hand, or that upon the white wall there flickered for an instant 
 in hateful red a legend which, later copied from memory, seems to have 
been  nothing less than the fearsome Chaldee letters of the word 
'LILITH'. One need  not mention these things because they vanished so 
quickly—as for Suydam, one  could at least bar others from the room 
until one knew what to think oneself. 

      The doctor has distinctly assured Malone that he did not see IT. 
The open  porthole, just before he turned on the lights, was clouded 
for a second with a  certain phosphorescence, and for a moment there 
seemed to echo in the night  outside the suggestion of a faint and 
hellish tittering; but no real outline met  the eye. As proof, the 
doctor points to his continued sanity. 

      Then the tramp steamer claimed all attention. A boat put off, and a 
horde of  swart, insolent ruffians in officers' dress swarmed aboard 
the temporarily  halted Cunarder. They wanted Suydam or his body—they 
had known of his trip,  and for certain reasons were sure he would die. 
The captain's deck was almost a  pandemonium; for at the instant, 
between the doctor's report from the stateroom  and the demands of the 
men from the tramp, not even the wisest and gravest  seaman could think 
what to do. Suddenly the leader of the visiting mariners, an  Arab with 
a hatefully negroid mouth, pulled forth a dirty, crumpled paper and 
 handed it to the captain. It was signed by Robert Suydam, and bore the 
following  odd message. 

      In case of sudden or unexplained accident or death on my part, 
please deliver  me or my body unquestioningly into the hands of the 
bearer and his associates. 

      Everything, for me, and perhaps for you, depends on absolute 
compliance. 

      Explanations can come later—do not fail me now. 

     —ROBERT SUYDAM

      Captain and doctor looked at each other, and the latter whispered 
something to  the former. Finally they nodded rather helplessly and led 
the way to the Suydam  stateroom. The doctor directed the captain's 
glance away as he unlocked the door  and admitted the strange seamen, 
nor did he breathe easily till they filed out  with their burden after 
an unaccountably long period of preparation. It was  wrapped in bedding 
from the berths, and the doctor was glad that the outlines  were not 
very revealing. Somehow the men got the thing over the side and away to 
 their tramp steamer without uncovering it. The Cunarder started again, 
and the  doctor and a ship's undertaker sought out the Suydam 
stateroorn to perform what  last services they could. Once more the 
physician was forced to reticence and  even to mendacity, for a hellish 
thing had happened. When the undertaker asked  him why he had drained 
off all of Mrs. Suydam's blood, he neglected to affirm  that he had not 
done so; nor did he point to the vacant bottle-spaces on the  rack, or 
to the odour in the sink which shewed the hasty disposition of the 
 bottles' original contents. The pockets of those men—if men they 
were—had  bulged damnably when they left the ship. Two hours later, 
and the world knew by  radio all that it ought to know of the horrible 
affair."|"The Horror at Red Hook"|"H. P. Lovecraft"
"ap 05:00"|"five o'clock"|"Then came the June wedding and the great sensation. Flatbush was gay 
for the  hour about high noon, and pennanted motors thronged the 
streets near the old  Dutch church where an awning stretched from door 
to highway. No local event ever  surpassed the Suydam-Gerritsen 
nuptials in tone and scale, and the party which  escorted bride and 
groom to the Cunard Pier was, if not exactly the smartest, at  least a 
solid page from the Social Register. At five o'clock adieux were waved, 
 and the ponderous liner edged away from the long pier, slowly turned 
its nose  seaward, discarded its tug, and headed for the widening water 
spaces that led to  old world wonders. By night the outer harbour was 
cleared, and late passengers  watched the stars twinkling above an 
unpolluted ocean. 

      Whether the tramp steamer or the scream was first to gain 
attention, no one can  say. Probably they were simultaneous, but it is 
of no use to calculate. The  scream came from the Suydam stateroom, and 
the sailor who broke down the door  could perhaps have told frightful 
things if he had not forthwith gone completely  mad—as it is, he 
shrieked more loudly than the first victims, and thereafter  ran 
simpering about the vessel till caught and put in irons. The ship's 
doctor  who entered the stateroom and turned on the lights a moment 
later did not go  mad, but told nobody what he saw till afterward, when 
he corresponded with  Malone in Chepachet. It was murder—
strangulation—but one need not say that  the claw-mark on Mrs. 
Suydam's throat could not have come from her husband's or  any other 
human hand, or that upon the white wall there flickered for an instant 
 in hateful red a legend which, later copied from memory, seems to have 
been  nothing less than the fearsome Chaldee letters of the word 
'LILITH'. One need  not mention these things because they vanished so 
quickly—as for Suydam, one  could at least bar others from the room 
until one knew what to think oneself. 

      The doctor has distinctly assured Malone that he did not see IT. 
The open  porthole, just before he turned on the lights, was clouded 
for a second with a  certain phosphorescence, and for a moment there 
seemed to echo in the night  outside the suggestion of a faint and 
hellish tittering; but no real outline met  the eye. As proof, the 
doctor points to his continued sanity. 

      Then the tramp steamer claimed all attention. A boat put off, and a 
horde of  swart, insolent ruffians in officers' dress swarmed aboard 
the temporarily  halted Cunarder. They wanted Suydam or his body—they 
had known of his trip,  and for certain reasons were sure he would die. 
The captain's deck was almost a  pandemonium; for at the instant, 
between the doctor's report from the stateroom  and the demands of the 
men from the tramp, not even the wisest and gravest  seaman could think 
what to do. Suddenly the leader of the visiting mariners, an  Arab with 
a hatefully negroid mouth, pulled forth a dirty, crumpled paper and 
 handed it to the captain. It was signed by Robert Suydam, and bore the 
following  odd message. 

      In case of sudden or unexplained accident or death on my part, 
please deliver  me or my body unquestioningly into the hands of the 
bearer and his associates. 

      Everything, for me, and perhaps for you, depends on absolute 
compliance. 

      Explanations can come later—do not fail me now. 

     —ROBERT SUYDAM

      Captain and doctor looked at each other, and the latter whispered 
something to  the former. Finally they nodded rather helplessly and led 
the way to the Suydam  stateroom. The doctor directed the captain's 
glance away as he unlocked the door  and admitted the strange seamen, 
nor did he breathe easily till they filed out  with their burden after 
an unaccountably long period of preparation. It was  wrapped in bedding 
from the berths, and the doctor was glad that the outlines  were not 
very revealing. Somehow the men got the thing over the side and away to 
 their tramp steamer without uncovering it. The Cunarder started again, 
and the  doctor and a ship's undertaker sought out the Suydam 
stateroorn to perform what  last services they could. Once more the 
physician was forced to reticence and  even to mendacity, for a hellish 
thing had happened. When the undertaker asked  him why he had drained 
off all of Mrs. Suydam's blood, he neglected to affirm  that he had not 
done so; nor did he point to the vacant bottle-spaces on the  rack, or 
to the odour in the sink which shewed the hasty disposition of the 
 bottles' original contents. The pockets of those men—if men they 
were—had  bulged damnably when they left the ship. Two hours later, 
and the world knew by  radio all that it ought to know of the horrible 
affair."|"The Horror at Red Hook"|"H. P. Lovecraft"
