"ap 04:40"|"twenty minutes of five"|"The General, perceiving how her eye was employed, began to talk of the smallness of the room and simplicity of the furniture, where every thing being for daily use, pretended only to comfort, &c., flattering himself however that there were some apartments in the Abbey not unworthy her notice—and was proceeding to mention the costly gildingfj of one in particular, when taking out his watch, he stopped short, to pronounce it with surprize within twenty minutes of five!4 This seemed the word of separation, and Catherine found herself hurried away by Miss Tilney, in such a manner as convinced her that the strictest punctuality to the family hours would be expected at Northanger."|"Northanger Abbey"|"Jane Austen"
00:00|midnight|"The night was stormy; the wind had been rising at intervals the whole afternoon; and by the time the party broke up, it blew and rained violently. Catherine, as she crossed the hall, listened to the tempest with sensations of awe; and, when she heard it rage round a corner of the ancient building and close with sudden fury a distant door, felt for the first time that she was really in an Abbey.—Yes, these were characteristic sounds;—they brought to her recollection a countless variety of dreadful situations and horrid scenes, which such buildings had witnessed, and such storms ushered in; and most heartily did she rejoice in the happier circumstances attending her entrance within walls so solemn!—She had nothing to dread from midnight assassins or drunken gallants. Henry had certainly been only in jest in  what he had told her that morning. In a house so furnished, and so guarded, she could have nothing to explore or to suffer; and might go to her bedroom as securely as if it had been her own chamber at Fullerton. Thus wisely fortifying her mind, as she proceeded up stairs, she was enabled, especially on perceiving that Miss Tilney slept only two doors from her, to enter her room with a tolerably stout heart; and her spirits were immediately assisted by the cheerful blaze of a wood fire. “How much better is this,” said she, as she walked to the fenderfm—“how much better to find a fire ready lit, than to have to wait shivering in the cold till all the family are in bed, as so many poor girls have been obliged to do, and then to have a faithful old servant frightening one by coming in with a faggot!fn How glad I am that Northanger is what it is! If it had been like some other places, I do not know that, in such a night as this, I could have answered for my courage:—but now, to be sure, there is nothing to alarm one.”"|"Northanger Abbey"|"Jane Austen"
"ap 08:00"|"eight o‘clock"|"The housemaid’s folding back her window-shutters at eight o‘clock the next day was the sound which first roused Catherine; and she opened her eyes, wondering that they could ever have been closed, on objects of cheerfulness; her fire was already burning, and a bright morning had succeeded the tempest of the night. Instantaneously with the consciousness of existence, returned her recollection of the manuscript; and springing from the bed in the very moment of the maid’s going away, she eagerly collected every scattered sheet which had burst from the roll on its falling to the ground, and flew back to enjoy the luxury of their perusal on her pillow. She now plainly saw that she must not expect a manuscript of equal length with the generality of what she had shuddered over in books, for the roll, seeming to consist entirely of small disjointed sheets, was altogether but of trifling size, and much less than she had supposed it to be at first."|"Northanger Abbey"|"Jane Austen"
"ap 05:00"|"five o‘clock"|"From the dining-room of which, though already seen, and always to be seen at five o‘clock, the General could not forego the pleasure of pacing out the length, for the more certain information of Miss Morland, as to what she neither doubted nor cared for, they proceeded by quick communication to the kitchen—the ancient kitchen of the convent, rich in the massy walls and smoke of former days, and in the stoves and hot closets gi of the present. The General’s improving hand had not loitered here: every modern invention to facilitate the labour of the cooks, had been adopted within this, their spacious theatre; and, when the genius of others had failed, his own had often produced the perfection wanted. His endowments of this spot alone might at any time have placed him high among the benefactors of the convent."|"Northanger Abbey"|"Jane Austen"
00:00|midnight|"The side of the quadrangle, in which she supposed the guilty scene to be acting, being, according to her belief, just opposite her own, it struck her that, if judiciously watched, some rays of light from the General’s lamp might glimmer  through the lower windows, as he passed to the prison of his wife; and, twice before she stepped into bed, she stole gently from her room to the corresponding window in the gallery, to see if it appeared; but all abroad was dark, and it must yet be too early. The various ascending noises convinced her that the servants must still be up. Till midnight, she supposed it would be in vain to watch; but then, when the clock had struck twelve, and all was quiet, she would, if not quite appalled by darkness, steal out and look once more. The clock struck twelve—and Catherine had been half an hour asleep."|"Northanger Abbey"|"Jane Austen"
"ap 00:00"|twelve|"The side of the quadrangle, in which she supposed the guilty scene to be acting, being, according to her belief, just opposite her own, it struck her that, if judiciously watched, some rays of light from the General’s lamp might glimmer  through the lower windows, as he passed to the prison of his wife; and, twice before she stepped into bed, she stole gently from her room to the corresponding window in the gallery, to see if it appeared; but all abroad was dark, and it must yet be too early. The various ascending noises convinced her that the servants must still be up. Till midnight, she supposed it would be in vain to watch; but then, when the clock had struck twelve, and all was quiet, she would, if not quite appalled by darkness, steal out and look once more. The clock struck twelve—and Catherine had been half an hour asleep."|"Northanger Abbey"|"Jane Austen"
"ap 06:00"|six|"The next day afforded no opportunity for the proposed examination of the mysterious apartments. It was Sunday, and the whole time between morning and afternoon servicego was required by the General in exercise abroadgp  or eating cold meat at home; and great as was Catherine’s curiosity, her courage was not equal to a wish of exploring them after dinner, either by the fading light of the sky between six and seven o‘clock, or by the yet more partial though stronger illumination of a treacherous lamp. The day was unmarked therefore by any thing to interest her imagination beyond the sight of a very elegant monument to the memory of Mrs. Tilney, which immediately fronted the family pew.gq By that her eye was instantly caught and long retained; and the perusal of the highly-strained epitaph,gr in which every virtue was ascribed to her by the inconsolable husband, who must have been in some way or other her destroyer, affected her even to tears."|"Northanger Abbey"|"Jane Austen"
"ap 07:00"|"seven o‘clock"|"The next day afforded no opportunity for the proposed examination of the mysterious apartments. It was Sunday, and the whole time between morning and afternoon servicego was required by the General in exercise abroadgp  or eating cold meat at home; and great as was Catherine’s curiosity, her courage was not equal to a wish of exploring them after dinner, either by the fading light of the sky between six and seven o‘clock, or by the yet more partial though stronger illumination of a treacherous lamp. The day was unmarked therefore by any thing to interest her imagination beyond the sight of a very elegant monument to the memory of Mrs. Tilney, which immediately fronted the family pew.gq By that her eye was instantly caught and long retained; and the perusal of the highly-strained epitaph,gr in which every virtue was ascribed to her by the inconsolable husband, who must have been in some way or other her destroyer, affected her even to tears."|"Northanger Abbey"|"Jane Austen"
"ap 04:00"|"four o‘clock"|"In the course of this morning’s reflections, she came to a resolution of making her next attempt on the forebidden door alone. It would be much better in every respect that Eleanor should know nothing of the matter. To involve her in the danger of a second detection, to court her into an apartment which must wring her heart, could not be the office of a friend. The General’s utmost anger could not be to herself what it might be to a daughter; and, besides, she thought the examination itself would be more satisfactory, if made without any companion. It  would be impossible to explain to Eleanor the suspicions, from which the other had, in all likelihood, been hitherto happily exempt; nor could she therefore, in her presence, search for those proofs of the General’s cruelty, which however they might yet have escaped discovery, she felt confident of somewhere drawing forth, in the shape of some fragmented journal, continued to the last gasp. Of the way to the apartment she was now perfectly mistress; and as she wished to get it over before Henry’s return, who was expected on the morrow, there was no time to be lost. The day was bright, her courage high; at four o‘clock, the sun was now two hours above the horizon, and it would be only her retiring to dress half an hour earlier than usual."|"Northanger Abbey"|"Jane Austen"
"ap 04:15"|"quarter past four"|"“It is only a quarter past four—(shewing his watch)—and you are not now in Bath. No theatre, no rooms to prepare for. Half an hour at Northanger must be enough.”"|"Northanger Abbey"|"Jane Austen"
"ap 05:00"|five|"The visions of romance were over. Catherine was completely awakened. Henry’s address, short as it had been, had more thoroughly opened her eyes to the extravagance of her late fancies than all their several disappointments had done. Most grievously was she humbled. Most bitterly did she cry. It was not only with herself that she was sunk—but with Henry. Her folly, which now seemed even criminal, was all exposed to him, and he must despise her for ever. The liberty which her imagination had dared to take with the character of his father, could he ever forgive it? The absurdity of her curiosity and her fears, could they ever be forgotten? She hated herself more than she could express. He had—she thought he had, once or twice before this fatal morning, shewn something like affection for her.—But now—in short, she made herself as miserable as possible for about half an hour, went down when the clock struck five, with a broken heart, and could scarcely give an intelligible answer to Eleanor’s inquiry, if she was well. The formidable Henry soon followed her into the room, and the only difference in his behaviour to her, was that he paid her rather more attention than usual. Catherine had never wanted comfort more, and he looked as if he was aware of it."|"Northanger Abbey"|"Jane Austen"
"ap ~ 00:45"|"about a quarter before one"|"“Well, well, we will take our chance some one of those days. There is no need to fix. You are not to put yourself at all out of your way. Whatever you may happen to have in the house will be enough. I think I can answer for the young ladies making allowance for a bachelor’s table. Let me see; Monday will be a busy day with you, we will not come on Monday; and Tuesday will be a busy one with me. I expect my surveyor from Brock-ham hc with his report in the morning; and afterwards I cannot in decency fail attending the club. I really could not face my acquaintance if I staid away now; for, as I am known to be in the country, it would be taken exceedingly amiss; and it is a rule with me, Miss Morland, never to give offence to any of my neighbours if a small sacrifice of time and attention can prevent it. They are a set of very worthy men. They have half a buckhd from Northanger twice a year; and I dine with them whenever I can. Tuesday, therefore, we may say, is out of the question. But on Wednesday, I think, Henry, you may expect us; and we shall be with you early, that we may have time to look about us. Two hours and three-quarters will carry us to Woodston, I suppose; we shall be in the carriage by ten; so, about a quarter before one on Wednesday, you may look for us.”"|"Northanger Abbey"|"Jane Austen"
"ap 10:00"|"ten o‘ clock"|"It did come, and exactly when it might be reasonably looked for. It came—it was fine—and Catherine trod on air. By ten o‘ clock, the chaise-and-four conveyed the trio from the Abbey; and, after an agreeable drive of almost twenty miles, they entered Woodston, a large and populous village, in a situation not unpleasant. Catherine was ashamed to say how pretty she thought it, as the General seemed to think an apology necessary for the flatness of the country, and the size of the village; but in her heart she preferred it to any place she had ever been at, and looked with great admiration at every neat house above the rank of a cottage, and at all the little chandler’s shopshe  which they passed. At the further end of the village, and tolerably disengaged from the rest of it, stood the Parsonage, a new-built substantial stone house, with its semicircular sweep and green gates; and, as they drove up to the door, Henry, with the friends of his solitude, a large Newfoundland puppy and two or three terriers, was ready to receive and make much of them."|"Northanger Abbey"|"Jane Austen"
"ap 04:00"|"four o‘clock"|"A saunter into other meadows, and through part of the village, with a visit to the stables to examine some improvements, and a charming game of play with a litter of puppies just able to roll about, brought them to four o‘clock, when Catherine scarcely thought it would be three. At four they were to dine, and at six to set off on their return. Never had any day passed so quickly!"|"Northanger Abbey"|"Jane Austen"
"ap 04:00"|four|"A saunter into other meadows, and through part of the village, with a visit to the stables to examine some improvements, and a charming game of play with a litter of puppies just able to roll about, brought them to four o‘clock, when Catherine scarcely thought it would be three. At four they were to dine, and at six to set off on their return. Never had any day passed so quickly!"|"Northanger Abbey"|"Jane Austen"
"ap 06:00"|six|"A saunter into other meadows, and through part of the village, with a visit to the stables to examine some improvements, and a charming game of play with a litter of puppies just able to roll about, brought them to four o‘clock, when Catherine scarcely thought it would be three. At four they were to dine, and at six to set off on their return. Never had any day passed so quickly!"|"Northanger Abbey"|"Jane Austen"
"ap 06:00"|"six o‘clock"|"At six o‘clock, the General having taken his coffee, the carriage again received them; and so gratifying had been the tenor of his conduct throughout the whole visit, so well assured was her mind on the subject of his expectations, that, could she have felt equally confident of the wishes of his son, Catherine would have quitted Woodston with little anxiety as to the How or the When she might return to it."|"Northanger Abbey"|"Jane Austen"
"ap 11:00"|"eleven o‘clock"|"Henry was not able to obey his father’s injunction of remaining wholly at Northanger, in attendance on the ladies, during his absence in London; the engagements of his curatehl at Woodston obliging him to leave them on Saturday for a couple of nights. His loss was not now what it had been while the General was at home; it lessened their gaiety, but did not ruin their comfort; and the two girls, agreeing in occupation, and improving in intimacy, found themselves so well-sufficient for the time to themselves, that it was eleven o‘clock, rather a late hour at the Abbey, before they quitted the supper-room on the day of Henry’s departure. They had just reached the head of the stairs, when it seemed, as far as the thickness of the walls would allow them to judge, that a carriage was driving up to the door, and the next moment confirmed the idea by the loud noise of the house-bell. After the first perturbation of surprize had passed away, in a “Good Heaven! what can be the matter?” it was quickly decided by Eleanor to be her eldest brother, whose arrival was often as sudden, if not quite so unseasonable, and accordingly she hurried down to welcome him."|"Northanger Abbey"|"Jane Austen"
"ap 07:00"|"seven o‘clock"|"“Ah, Catherine! were it settled so, it would be somewhat less intolerable, though in such common attentions you would have received but half what you ought. But—how can I tell you?—To-morrow morning is fixed for your leaving us, and not even the hour is left to your choice; the very carriage is ordered, and will be here at seven o‘clock, and no servant will be offered you.”"|"Northanger Abbey"|"Jane Austen"
"ap 06:00"|six|"With these feelings, she rather dreaded than sought for the first view of that well-known spire which would announce her within twenty miles of home. Salisbury she had known to be her point on leaving Northanger; but after the first stage she had been indebted to the post-mastershm for the names of the places which were then to conduct her to it; so great had been her ignorance of her route. She met with nothing, however, to distress or frighten her. Her youth, civil manners and liberal pay, procured her all the attention that a traveller like herself could require; and stopping only to change horses, she travelled on for about eleven hours without accident or alarm, and between six and seven o‘clock in the evening found herself entering Fullerton.2"|"Northanger Abbey"|"Jane Austen"
19:00|"seven o‘clock in the evening"|"With these feelings, she rather dreaded than sought for the first view of that well-known spire which would announce her within twenty miles of home. Salisbury she had known to be her point on leaving Northanger; but after the first stage she had been indebted to the post-mastershm for the names of the places which were then to conduct her to it; so great had been her ignorance of her route. She met with nothing, however, to distress or frighten her. Her youth, civil manners and liberal pay, procured her all the attention that a traveller like herself could require; and stopping only to change horses, she travelled on for about eleven hours without accident or alarm, and between six and seven o‘clock in the evening found herself entering Fullerton.2"|"Northanger Abbey"|"Jane Austen"
"ap 00:50"|"ten to one"|"“If so, my dear, I dare say you will meet again some time or other; do not be uneasy. It is ten to one but you are thrown together again in the course of a few years; and then what a pleasure it will be!”"|"Northanger Abbey"|"Jane Austen"
12:00|noon|"But Crosby was not an editor in the modern sense, so Austen had no one to help her eliminate inconsistencies from  her manuscript, as we see in the opening of chapter IX, where, in one paragraph, Catherine Morland vows to be somewhere at noon and promptly decides to read at home until one. Even so, Austen was not a literary lamp burning in the provincial darkness. She could and clearly did test her products on her immediate family by reading her work aloud to them. Fortunately, her relations were both literate—at a time when the vast majority of people could neither write nor read—and literary; that is, they had cultivated literary tastes."|"Northanger Abbey"|"Jane Austen"
"ap 01:00"|one|"But Crosby was not an editor in the modern sense, so Austen had no one to help her eliminate inconsistencies from  her manuscript, as we see in the opening of chapter IX, where, in one paragraph, Catherine Morland vows to be somewhere at noon and promptly decides to read at home until one. Even so, Austen was not a literary lamp burning in the provincial darkness. She could and clearly did test her products on her immediate family by reading her work aloud to them. Fortunately, her relations were both literate—at a time when the vast majority of people could neither write nor read—and literary; that is, they had cultivated literary tastes."|"Northanger Abbey"|"Jane Austen"
00:00|Midnight|"4   (p. 34) ”here they are, in my pocket-book. Castle of Wolfenbach, Clermont, Mysterious Warnings, Necromancer of the Black Forest, Midnight Bell, Orphan of the Rhine, and Horrid Mysteries“: Catherine is reciting a list of popular romance novels of the period: Eliza Parson’s Castle of Wolfenbach (1793); Clermont: A Tale (1798), by Regina Maria Roche;  Mysterious Warnings (1796), also by Eliza Parsons; The Necromancer; Or, the Tale of the Black Forest: Founded on Facts (1794), by Lawrence Flammenberg; The Midnight Bell: A German Story Founded on Incidents in Real Life (1798), by Francis Lathom; Eleanor Sleath’s The  Orphan of the Rhine: A Romance (1798); and Horrid Mysteries: A Story from the German of the Marquis of Grosse (1796), by Carl Grosse."|"Northanger Abbey"|"Jane Austen"
"ap 01:00"|one|"1   (p. 55) she sat quietly down to her book after breakfast, resolving to remain in the same place and the same employment till the clock struck one:  Note the textual muddle: Just a few lines above, Catherine vows to be in the Pump-room at noon."|"Northanger Abbey"|"Jane Austen"
12:00|noon|"1   (p. 55) she sat quietly down to her book after breakfast, resolving to remain in the same place and the same employment till the clock struck one:  Note the textual muddle: Just a few lines above, Catherine vows to be in the Pump-room at noon."|"Northanger Abbey"|"Jane Austen"
"ap 04:40"|"twenty  minutes of five"|"4   (p. 152) he stopped short, to pronounce it with surprize within twenty  minutes of five!: General Tilney eats his dinner at five, so everyone must hurry to dress for dinner."|"Northanger Abbey"|"Jane Austen"
"ap 05:00"|five|"4   (p. 152) he stopped short, to pronounce it with surprize within twenty  minutes of five!: General Tilney eats his dinner at five, so everyone must hurry to dress for dinner."|"Northanger Abbey"|"Jane Austen"
00:00|midnight|"1   (p. 153) when her eye suddenly fell on a large high chest: Here is yet another fixture of gothic literature, the mysterious chest, this one borrowed from Radcliffe’s The Romance of the Forest (1791). The phrase ”midnight assassins or drunken gallants“ on page 156 derives from Radcliffe’s The Mysteries of Udolpho."|"Northanger Abbey"|"Jane Austen"
"ap 06:00"|six|"2   (p. 218) she travelled on for about eleven hours ... and between six and seven o’clock in the evening found herself entering Fullerton: In  other words, Catherine left Northanger Abbey at about seven A.M. and spent more than eleven hours in traveling 70 miles."|"Northanger Abbey"|"Jane Austen"
19:00|"seven o’clock in the evening"|"2   (p. 218) she travelled on for about eleven hours ... and between six and seven o’clock in the evening found herself entering Fullerton: In  other words, Catherine left Northanger Abbey at about seven A.M. and spent more than eleven hours in traveling 70 miles."|"Northanger Abbey"|"Jane Austen"
"~ 07:00"|"about seven A.M."|"2   (p. 218) she travelled on for about eleven hours ... and between six and seven o’clock in the evening found herself entering Fullerton: In  other words, Catherine left Northanger Abbey at about seven A.M. and spent more than eleven hours in traveling 70 miles."|"Northanger Abbey"|"Jane Austen"
