00:00|Midnight|"In chapter VI (p. 34), Isabella lists for Catherine her favorite gothic novels, a group of titles that has become known as the Northanger Canon: Radcliffe’s The Mysteries of Udolpho and The Italian; Or, the Confessional of the Black Penitents ( 1797) ; The Castle of Wolfenbach (1793) and Mysterious Warnings (1796), by Eliza Parsons; Clermont: A Tale (1798), by Regina Maria Roche; The Necromancer; Or, the Tale of the Black Forest: Founded on Facts  (1794), by Lawrence Flammenberg; The Midnight Bell: A German Story Founded on Incidents in Real Life (1798), by Francis Lathom; The Orphan of the Rhine: A Romance 1798) , by Eleanor Sleath; and Horrid Mysteries: A Story from the German of the Marquis of Grosse (1796) , by Carl Grosse."|"Northanger Abbey"|"Jane Austen"
"ap 10:00"|ten|"Such was Catherine Morland at ten. At fifteen appearances were mending; she began to curl her hair and long for balls; her complexion improved, her features were softened by plumpness and colour, her eyes gained more animation, and her figure more consequence. Her love of dirt gave way to an inclination for finery, and she grew clean as she grew smart; she had now the pleasure of sometimes hearing her father and mother remark on her personal improvement. “Catherine grows quite a good-looking girl,—she is almost pretty to-day,” were words which caught her ears now and then; and how welcome were the sounds! To look almost pretty is an acquisition of higher delight to a girl who has been looking plain the first fifteen years of her life, than a beauty from her cradle can ever receive."|"Northanger Abbey"|"Jane Austen"
"ap 09:00"|nine|"“Bath is a charming place, sir; there are so many good shops here. We are sadly off in the country; not but what we have very good shops in Salisbury,ab but it is so far to go;—eight miles is a long way; Mr. Allen says it is nine, measured nine; but I am sure it cannot be more than eight; and it is such a fagac—I come back tired to death. Now here one can step out of doors and get a thing in five minutes.”"|"Northanger Abbey"|"Jane Austen"
00:00|Midnight|"“I will read you their names directly; here they are, in my pocket-book.av Castle of Wolfenbach, Clermont, Mysterious Warnings, Necromancer of the Black Forest, Midnight Bell, Orphan of the Rhine, and Horrid Mysteries.4 Those will last us some time.”"|"Northanger Abbey"|"Jane Austen"
"ap 01:30"|"half after one"|"“Three-and-twenty!” cried Thorpe; “five-and-twenty if it is an inch.” Morland remonstrated, pleaded the authority of road-books, innkeepers, and milestones; but his friend disregarded them all; he had a surer test of distance. “I know it must be five-and-twenty,” said he, “by the time we have been doing it. It is now half after one; we drove out of the inn-yard at Tetbury as the town-clock struck eleven; and I defy any man in England to make my horse go less than ten miles in harness; that makes it exactly twenty-five.”"|"Northanger Abbey"|"Jane Austen"
"ap 11:00"|eleven|"“Three-and-twenty!” cried Thorpe; “five-and-twenty if it is an inch.” Morland remonstrated, pleaded the authority of road-books, innkeepers, and milestones; but his friend disregarded them all; he had a surer test of distance. “I know it must be five-and-twenty,” said he, “by the time we have been doing it. It is now half after one; we drove out of the inn-yard at Tetbury as the town-clock struck eleven; and I defy any man in England to make my horse go less than ten miles in harness; that makes it exactly twenty-five.”"|"Northanger Abbey"|"Jane Austen"
"ap 10:00"|"ten o‘clock"|"“You have lost an hour,” said Morland; “it was only ten o‘clock when we came from Tetbury.”"|"Northanger Abbey"|"Jane Austen"
"ap 10:00"|"Ten o‘clock"|"“Ten o‘clock! it was eleven, upon my soul! I counted every stroke. This brother of yours would persuade me out of my senses, Miss Morland; do but look at my horse; did you ever see an animal so made for speed in your life?” (The servant had just mounted the carriage and was driving off.) “Such true blood! Three hours and a half indeed coming only three and twenty miles! look at that creature, and suppose it possible if you can.”"|"Northanger Abbey"|"Jane Austen"
"ap 11:00"|eleven|"“Ten o‘clock! it was eleven, upon my soul! I counted every stroke. This brother of yours would persuade me out of my senses, Miss Morland; do but look at my horse; did you ever see an animal so made for speed in your life?” (The servant had just mounted the carriage and was driving off.) “Such true blood! Three hours and a half indeed coming only three and twenty miles! look at that creature, and suppose it possible if you can.”"|"Northanger Abbey"|"Jane Austen"
"ap 03:30"|"Three hours and a half"|"“Ten o‘clock! it was eleven, upon my soul! I counted every stroke. This brother of yours would persuade me out of my senses, Miss Morland; do but look at my horse; did you ever see an animal so made for speed in your life?” (The servant had just mounted the carriage and was driving off.) “Such true blood! Three hours and a half indeed coming only three and twenty miles! look at that creature, and suppose it possible if you can.”"|"Northanger Abbey"|"Jane Austen"
12:00|noon|"The progress of Catherine’s unhappiness from the events of the evening, was as follows. It appeared first in a general dissatisfaction with every body about her, while she remained in the rooms, which speedily brought on considerable weariness and a violent desire to go home. This, on arriving in Pulteney-street took the direction of extraordinary hunger, and when that was appeased, changed into an earnest longing to be in bed; such was the extreme point of her distress; for when there she immediately fell into a sound sleep which lasted nine hours, and from which she awoke perfectly revived, in excellent spirits, with fresh hopes and fresh schemes. The first wish of her heart was to improve her acquaintance with Miss Tilney, and almost her first resolution, to seek her for that purpose, in the Pump-room at noon. In the Pump-room, one so newly arrived in Bath must be met with, and that building she had already found so favourable for the discovery of female excellence, and the completion of female intimacy, so admirably adapted for secret discourses and unlimited confidence, that she was most reasonably encouraged to expect another friend from within its walls. Her plan for the morning thus settled, she sat quietly down to her book after breakfast, resolving to remain in the same place and the same employment till the clock struck one;1  and from habitude very little incommoded by the remarks and ejaculations of Mrs. Allen, whose vacancy of mind and incapacity for thinking were such, that as she never talked a great deal, so she could never be entirely silent; and, therefore, while she sat at her work, if she lost her needle or broke her thread, if she heard a carriage in the street, or saw a speck upon her gown, she must observe it aloud, whether there were any one at  leisure to answer her or not. At about half past twelve, a remarkably loud rap drew her in haste to the window, and scarcely had she time to inform Catherine of there being two open carriages at the door, in the first only a servant, her brother driving Miss Thorpe in the second, before John Thorpe came running up stairs, calling out, “Well, Miss Morland, here I am. Have you been waiting long? We could not come before, the old devil of a coachmaker was such an eternity finding out a thing fit to be got into, and now it is ten thousand to one, but they break down before we are out of the street. How do you do, Mrs. Allen? a famous bv ball last night, was not it? Come, Miss Morland, be quick, for the others are in a confounded hurry to be off. They want to get their tumble over.”"|"Northanger Abbey"|"Jane Austen"
"ap 01:00"|one|"The progress of Catherine’s unhappiness from the events of the evening, was as follows. It appeared first in a general dissatisfaction with every body about her, while she remained in the rooms, which speedily brought on considerable weariness and a violent desire to go home. This, on arriving in Pulteney-street took the direction of extraordinary hunger, and when that was appeased, changed into an earnest longing to be in bed; such was the extreme point of her distress; for when there she immediately fell into a sound sleep which lasted nine hours, and from which she awoke perfectly revived, in excellent spirits, with fresh hopes and fresh schemes. The first wish of her heart was to improve her acquaintance with Miss Tilney, and almost her first resolution, to seek her for that purpose, in the Pump-room at noon. In the Pump-room, one so newly arrived in Bath must be met with, and that building she had already found so favourable for the discovery of female excellence, and the completion of female intimacy, so admirably adapted for secret discourses and unlimited confidence, that she was most reasonably encouraged to expect another friend from within its walls. Her plan for the morning thus settled, she sat quietly down to her book after breakfast, resolving to remain in the same place and the same employment till the clock struck one;1  and from habitude very little incommoded by the remarks and ejaculations of Mrs. Allen, whose vacancy of mind and incapacity for thinking were such, that as she never talked a great deal, so she could never be entirely silent; and, therefore, while she sat at her work, if she lost her needle or broke her thread, if she heard a carriage in the street, or saw a speck upon her gown, she must observe it aloud, whether there were any one at  leisure to answer her or not. At about half past twelve, a remarkably loud rap drew her in haste to the window, and scarcely had she time to inform Catherine of there being two open carriages at the door, in the first only a servant, her brother driving Miss Thorpe in the second, before John Thorpe came running up stairs, calling out, “Well, Miss Morland, here I am. Have you been waiting long? We could not come before, the old devil of a coachmaker was such an eternity finding out a thing fit to be got into, and now it is ten thousand to one, but they break down before we are out of the street. How do you do, Mrs. Allen? a famous bv ball last night, was not it? Come, Miss Morland, be quick, for the others are in a confounded hurry to be off. They want to get their tumble over.”"|"Northanger Abbey"|"Jane Austen"
"ap ~ 00:30"|"about half past twelve"|"The progress of Catherine’s unhappiness from the events of the evening, was as follows. It appeared first in a general dissatisfaction with every body about her, while she remained in the rooms, which speedily brought on considerable weariness and a violent desire to go home. This, on arriving in Pulteney-street took the direction of extraordinary hunger, and when that was appeased, changed into an earnest longing to be in bed; such was the extreme point of her distress; for when there she immediately fell into a sound sleep which lasted nine hours, and from which she awoke perfectly revived, in excellent spirits, with fresh hopes and fresh schemes. The first wish of her heart was to improve her acquaintance with Miss Tilney, and almost her first resolution, to seek her for that purpose, in the Pump-room at noon. In the Pump-room, one so newly arrived in Bath must be met with, and that building she had already found so favourable for the discovery of female excellence, and the completion of female intimacy, so admirably adapted for secret discourses and unlimited confidence, that she was most reasonably encouraged to expect another friend from within its walls. Her plan for the morning thus settled, she sat quietly down to her book after breakfast, resolving to remain in the same place and the same employment till the clock struck one;1  and from habitude very little incommoded by the remarks and ejaculations of Mrs. Allen, whose vacancy of mind and incapacity for thinking were such, that as she never talked a great deal, so she could never be entirely silent; and, therefore, while she sat at her work, if she lost her needle or broke her thread, if she heard a carriage in the street, or saw a speck upon her gown, she must observe it aloud, whether there were any one at  leisure to answer her or not. At about half past twelve, a remarkably loud rap drew her in haste to the window, and scarcely had she time to inform Catherine of there being two open carriages at the door, in the first only a servant, her brother driving Miss Thorpe in the second, before John Thorpe came running up stairs, calling out, “Well, Miss Morland, here I am. Have you been waiting long? We could not come before, the old devil of a coachmaker was such an eternity finding out a thing fit to be got into, and now it is ten thousand to one, but they break down before we are out of the street. How do you do, Mrs. Allen? a famous bv ball last night, was not it? Come, Miss Morland, be quick, for the others are in a confounded hurry to be off. They want to get their tumble over.”"|"Northanger Abbey"|"Jane Austen"
"ap > 03:00"|"Past three o‘clock"|"When they arrived at Mrs. Allen’s door, the astonishment of Isabella was hardly to be expressed, on finding that it was too late in the day for them to attend her friend into the  house:—“Past three o‘clock!” it was inconceivable, incredible, impossible! and she would neither believe her own watch, nor her brother’s, nor the servant’s; she would believe no assurance of it founded on reason or reality, till Morland produced his watch, and ascertained the fact; to have doubted a moment longer then, would have been equally inconceivable, incredible, and impossible; and she could only protest, over and over again, that no two hours and a half had ever gone off so swiftly before, as Catherine was called on to confirm; Catherine could not tell a falsehood even to please Isabella; but the latter was spared the misery of her friend’s dissenting voice, by not waiting for her answer. Her own feelings entirely engrossed her; her wretchedness was most acute on finding herself obliged to go directly home.—It was ages since she had had a moment’s conversation with her dearest Catherine; and, though she had such thousands of things to say to her, it appeared as if they were never to be together again; so, with smiles of most exquisite misery, and the laughing eye of utter despondency, she bade her friend adieu and went on."|"Northanger Abbey"|"Jane Austen"
"ap 02:30"|"two hours and a half"|"When they arrived at Mrs. Allen’s door, the astonishment of Isabella was hardly to be expressed, on finding that it was too late in the day for them to attend her friend into the  house:—“Past three o‘clock!” it was inconceivable, incredible, impossible! and she would neither believe her own watch, nor her brother’s, nor the servant’s; she would believe no assurance of it founded on reason or reality, till Morland produced his watch, and ascertained the fact; to have doubted a moment longer then, would have been equally inconceivable, incredible, and impossible; and she could only protest, over and over again, that no two hours and a half had ever gone off so swiftly before, as Catherine was called on to confirm; Catherine could not tell a falsehood even to please Isabella; but the latter was spared the misery of her friend’s dissenting voice, by not waiting for her answer. Her own feelings entirely engrossed her; her wretchedness was most acute on finding herself obliged to go directly home.—It was ages since she had had a moment’s conversation with her dearest Catherine; and, though she had such thousands of things to say to her, it appeared as if they were never to be together again; so, with smiles of most exquisite misery, and the laughing eye of utter despondency, she bade her friend adieu and went on."|"Northanger Abbey"|"Jane Austen"
"ap 00:00"|"twelve o’clock"|"In chatting with Miss Tilney before the evening concluded, a new source of felicity arose to her. She had never taken a country walk since her arrival in Bath. Miss Tilney, to whom all the commonly-frequented environs were familiar, spoke of them in terms which made her all eagerness to know them too; and on her openly fearing that she might find nobody to go with her, it was proposed by the brother and sister that they should join in a walk, some morning or other. “I shall like it,” she cried, “beyond any thing in the world; and do not let us put it off—let us go to-morrow.” This was readily agreed to, with only a proviso of Miss Tilney‘s, that it did not rain, which Catherine was sure it would not. At twelve o’clock, they were to call for her in Pulteney-street—and “remember—twelve o‘clock,” was her parting speech to her new friend. Of her other, her older, her more established friend, Isabella, of whose fidelity and worth she had enjoyed a fortnight’sch experience, she scarcely saw any thing during the evening. Yet, though longing to make her acquainted with her happiness, she cheerfully submitted to the wish of Mr. Allen, which took them rather early away, and her spirits danced within her, as she danced in her chairci all the way home."|"Northanger Abbey"|"Jane Austen"
"ap 00:00"|"twelve o‘clock"|"In chatting with Miss Tilney before the evening concluded, a new source of felicity arose to her. She had never taken a country walk since her arrival in Bath. Miss Tilney, to whom all the commonly-frequented environs were familiar, spoke of them in terms which made her all eagerness to know them too; and on her openly fearing that she might find nobody to go with her, it was proposed by the brother and sister that they should join in a walk, some morning or other. “I shall like it,” she cried, “beyond any thing in the world; and do not let us put it off—let us go to-morrow.” This was readily agreed to, with only a proviso of Miss Tilney‘s, that it did not rain, which Catherine was sure it would not. At twelve o’clock, they were to call for her in Pulteney-street—and “remember—twelve o‘clock,” was her parting speech to her new friend. Of her other, her older, her more established friend, Isabella, of whose fidelity and worth she had enjoyed a fortnight’sch experience, she scarcely saw any thing during the evening. Yet, though longing to make her acquainted with her happiness, she cheerfully submitted to the wish of Mr. Allen, which took them rather early away, and her spirits danced within her, as she danced in her chairci all the way home."|"Northanger Abbey"|"Jane Austen"
"ap ~ 11:00"|"about eleven o‘clock"|"At about eleven o‘clock, however, a few specks of small rain upon the windows caught Catherine’s watchful eye, and “Oh! dear, I do believe it will be wet,” broke from her in a most desponding tone."|"Northanger Abbey"|"Jane Austen"
"ap 00:00"|twelve|"“No walk for me to-day,” sighed Catherine;—“but perhaps it may come to nothing, or it may hold up before twelve.”"|"Northanger Abbey"|"Jane Austen"
"ap 00:00"|twelve|"The rain continued—fast though not heavy. Catherine went every five minutes to the clock, threatening on each return that, if it still kept on raining another five minutes, she would give up the matter as hopeless. The clock struck twelve, and it still rained.—“You will not be able to go, my dear.”"|"Northanger Abbey"|"Jane Austen"
"ap 00:15"|"quarter after twelve"|"“I do not quite despair yet. I shall not give it up till a quarter after twelve. This is just the time of day for it to clear up, and I do think it looks a little lighter. There, it is twenty minutes after twelve, and now I shall give it up entirely. Oh! that we had such weather here as they had at Udolpho,1 or at least in Tuscany and the South of France!—the night that poor St. Aubin2 died!—such beautiful weather!”"|"Northanger Abbey"|"Jane Austen"
"ap 00:20"|"twenty minutes after twelve"|"“I do not quite despair yet. I shall not give it up till a quarter after twelve. This is just the time of day for it to clear up, and I do think it looks a little lighter. There, it is twenty minutes after twelve, and now I shall give it up entirely. Oh! that we had such weather here as they had at Udolpho,1 or at least in Tuscany and the South of France!—the night that poor St. Aubin2 died!—such beautiful weather!”"|"Northanger Abbey"|"Jane Austen"
"ap 00:30"|"half past twelve"|"At half past twelve, when Catherine’s anxious attention to the weather was over, and she could no longer claim any merit from its amendment, the sky began voluntarily to clear. A gleam of sunshine took her quite by surprize; she looked round; the clouds were parting, and she instantly returned to the window to watch over and encourage the happy appearance. Ten minutes more made it certain that a bright afternoon would succeed, and justified the opinion of Mrs. Allen, who had “always thought it would clear up.” But whether Catherine might still expect her friends, whether there had not been too much rain for Miss Tilney to venture, must yet be a question."|"Northanger Abbey"|"Jane Austen"
"ap 00:00"|twelve|"“I cannot go, because”—(looking down as she spoke, fearful of Isabella’s smile) “I expect Miss Tilney and her brother to call on me to take a country walk. They promised to come at twelve, only it rained; but now, as it is so fine, I dare say they will be here soon.”"|"Northanger Abbey"|"Jane Austen"
08:00|"eight this morning"|"The morning had passed away so charmingly as to banish all her friendship and natural affection; for no thought of Isabella or James crossed her during their walk. When the Tilneys were gone, she became amiable again, but she was amiable for some  time to little effect; Mrs. Allen had no intelligence to give that could relieve her anxiety, she had heard nothing of any of them. Towards the end of the morning however, Catherine having occasion for some indispensable yard of ribbon which must be bought without a moment’s delay, walked out into the town, and in Bond-street overtook the second Miss Thorpe, as she was loitering towards Edgar’s Buildings between two of the sweetest girls in the world, who had been her dear friends all the morning. From her, she soon learned that the party to Clifton had taken place. “They set off at eight this morning,” said Miss Anne, “and I am sure I do not envy them their drive. I think you and I are very well off to be out of the scrape.—It must be the dullest thing in the world, for there is not a soul at Clifton at this time of the year. Belle went with your brother, and John drove Maria.”"|"Northanger Abbey"|"Jane Austen"
"ap 10:00"|ten|"The bustle of going was not pleasant.—The clock struck ten while the trunks were carrying down, and the General had fixed to be out of Milsom-street by that hour. His great coat, instead of being brought for him to put on directly, was spread out in the curricle in which he was to accompany his son. The middle seateu of the chaiseev was not drawn out, though there were three people to go in it, and his daughter’s maid had so crowded it with parcels, that Miss Morland would not have room to sit; and, so much was he influenced by this apprehension when he handed her in, that she had some difficulty in saving her own new writing-deskew from being thrown out into the street.—At last, however, the door was closed upon the three females, and they set off at the sober pace in which the hand some, highly-fed four horses of a gentleman usually perform a journey of thirty miles: such was the distance of Northanger from Bath, to be now divided into two equal stages. Catherine’s spirits revived as they drove from the door; for with Miss Tilney she felt no restraint; and, with the interest of a road entirely new to her, of an abbey before, and a curricle behind, she caught the last view of Bath without any regret, and met with every mile-stone before she expected it. The tediousness of a two hours’ wait at Petty-France,ex in which there was nothing to be done but to eat without being hungry, and loiter about without any thing to see, next followed—and her admiration of the style in which they travelled, of the fashionable chaise-and-four, postillionsey handsomely liveried,ez rising so regularly in their stirrups, and numerous outridersfa properly mounted, sunk a little under this consequent inconvenience. Had their party been perfectly agreeable, the delay would have been nothing; but General Tilney, though so charming a man, seemed always a check upon his children’s spirits, and scarcely any thing was said but by himself; the observation of which, with his discontent at whatever the inn afforded, and his angry impatience at the waiters, made Catherine grow every moment more in awe of him, and appeared to lengthen the two hours into four.—At last, however, the order of release was given; and much was Catherine then surprized by the General’s proposal of her taking his place in his son’s curricle for the rest of the journey:—“the day was fine, and he was anxious for her seeing as much of the country as possible.”"|"Northanger Abbey"|"Jane Austen"
