12:00|noon|"He reached the village of Burdlaki an hour after sunrise. His sister and his brother-in-law were already out in the fields. He entered his father’s hut, where they lived. The children were still asleep in the cradles, which hung from thick ropes winding around iron hooks attached to the ceiling. He got a spade and a rake from the small vegetable patch in the rear and went off in quest of the third willow to the left of the hut. First he stood with his back to the door and his eyes on the horizon. It took him awhile to convince himself that his right arm was his right, his left arm his left; then he headed left, toward his neighbor Nikofor, to the third willow. Here he began to dig. From time to time he glanced around to make sure no one was watching. No! Nobody saw what he was doing. He dug and dug. The sun rose so fast in the sky that he thought it was already noon. But it was only 9 A.M."|"The Radetzky March"|"Joseph Roth"
09:00|"9 A.M."|"He reached the village of Burdlaki an hour after sunrise. His sister and his brother-in-law were already out in the fields. He entered his father’s hut, where they lived. The children were still asleep in the cradles, which hung from thick ropes winding around iron hooks attached to the ceiling. He got a spade and a rake from the small vegetable patch in the rear and went off in quest of the third willow to the left of the hut. First he stood with his back to the door and his eyes on the horizon. It took him awhile to convince himself that his right arm was his right, his left arm his left; then he headed left, toward his neighbor Nikofor, to the third willow. Here he began to dig. From time to time he glanced around to make sure no one was watching. No! Nobody saw what he was doing. He dug and dug. The sun rose so fast in the sky that he thought it was already noon. But it was only 9 A.M."|"The Radetzky March"|"Joseph Roth"
12:00|noontime|"The district captain started out immediately. He took a fiacre. It was noontime. He hadn’t eaten. He stopped at the café and drank a brandy."|"The Radetzky March"|"Joseph Roth"
"ap 09:00"|nine|"And so by nine the next morning the district captain was stationed outside Hasselbrunner’s door in the Office of the Court Comptroller. He learned that Hasselbrunner was out of town but might return that afternoon. By coincidence along came Smetana, whom the district captain had been unable to locate yesterday. And Smetana, swiftly clued in and quick-witted as ever, was full of ideas. Hasselbrunner might be out of town, but Lang was sitting next door. And Lang was a nice fellow. And so the indefatigable district captain began his odyssey from office to office."|"The Radetzky March"|"Joseph Roth"
"~ 18:00"|"around 6 P.M."|"He walked through cloisters and patios, up to the third floor, the fourth, back to the first, then the ground floor. And then he decided to wait for Hasselbrunner. He waited till afternoon, when he learned that Hasselbrunner was not really out of town; he had merely stayed home. And the undaunted champion of the honor of the Trottas forced his way into Hasselbrunner’s presence. Here at last he found a faint glint of hope. They drove from person to person, Hasselbrunner and old Herr von Trotta. Their goal was to forge all the way to Montenuovo. And finally, around 6 P.M., they succeeding in tracking down a friend of Montenuovo’s in that renowned patisserie where the empire’s lighthearted, sweet-toothed dignitaries occasionally dropped by in the afternoon. For the fifteenth time that day the district captain was told that his plan was impossible. But he remained unshakable. And the silvery dignity of his years and the slightly bizarre and somewhat crazy determination with which he spoke about his son and the danger threatening his name, the solemnity with which he called his forgotten father “the Hero of Solferino” and nothing else, with which he called the Kaiser “His Majesty” and nothing else—all these things struck such deep chords in the listeners that they gradually found Herr von Trotta’s plan to be perfectly fair and natural."|"The Radetzky March"|"Joseph Roth"
"ap 08:30"|eight-thirty|"He did not feel the slightest fatigue. He stepped back to the window like a man on a far shore. And he yearned for morning the way that man looks forward to a ship that will carry him home. Yes, he was homesick for the Kaiser. He stood at the window until the gray shimmer of dawn brightened the sky, the morning star died, and the confused voices of birds announced the rising of the sun. Then he switched out the lights in the room. He rang the bell by the door. He sent for the barber. He slipped off his coat. He sat down. He had himself shaved. “Twice,” he told the groggy young man, “and against the grain!” Now his chin glistened bluish between his silvery whiskers. The alum tingled, the powder cooled his throat. His audience was scheduled for eight-thirty. Once again he brushed his black-and-green coat. He repeated in front of the mirror, “Your Majesty, I beg for clemency for my son!” Then he closed the door behind him."|"The Radetzky March"|"Joseph Roth"
12:00|noon|"The high white gilt-edged double door was flanked by two giant sentries, like dead statues. The brownish-yellow parquet floor, with only its center covered by a strip of red carpeting, hazily mirrored the lower part of Herr von Trotta’s body: the black trousers, the gilt tip of the scabbard, and also the billowing shadow of the coattails. Herr von Trotta rose. He walked across the carpet with timid, soundless steps. His heart pounded. But his soul was tranquil. At this moment, five minutes before his audience with his Kaiser, Herr von Trotta felt as if he had been frequenting this place for years, as if he were accustomed to reporting to His Majesty Kaiser Franz Joseph I every morning and supplying his personal account of all the previous day’s incidents in the Moravian district of W. The Herr District Captain felt thoroughly at home in his Kaiser’s palace. At most he was bothered by the thought that he might need to run his fingers once more through his whiskers but had no time to pull off his white gloves. No minister of the Kaiser’s, not even the Comptroller himself, could have felt more at home here than Herr von Trotta. From time to time the wind billowed the sunny yellow curtains on the high arched windows, and a touch of summery green stole into the district captain’s field of vision. The birds kept warbling louder and louder. A few heavy flies were buzzing in the foolish and premature belief that it was already noon, and the summer heat was gradually becoming palpable."|"The Radetzky March"|"Joseph Roth"
"ap 09:00"|nine|"Then he waited for his comptroller’s daily visit. The clock was already striking nine. Now he came."|"The Radetzky March"|"Joseph Roth"
13:00|"1 P.M."|"The celebration began at 1 P.M. with an hour-long parade on the drilling grounds. They had borrowed two military bands from larger garrisons. They performed in two round, open, wooden malls in the Little Forest. The ladies sat in canvas-covered baggage wagons, wearing summer frocks over stiff corsets and wheel-size hats on which stuffed birds nested. Although the ladies were hot they smiled, each lady a cheerful breeze. They smiled with lips and eyes, with breasts trapped in airy tight-hooked frocks, with ajourisé lace gloves that reached up to their elbows, with tiny handkerchiefs that they held in their hands, sometimes dabbing their noses—but gently, gently to avoid tattering the lace. Vendors sold candy, champagne, and tickets for the wheel of fortune, which was handled personally by the superintendent, and colored pouches of confetti, which was poured on all of them and which they tried to puff away by coquettishly pursing their lips. Nor was there any lack of paper streamers. They coiled around necks and legs and dangled from the trees, instantly turning all natural pines into man-made ones. For they were denser and more convincing than the green of nature."|"The Radetzky March"|"Joseph Roth"
"> 00:00"|"past midnight"|"It was long past midnight. But in the small town the people were still standing in front of their houses, talking on the wooden sidewalks. They fell silent when the lieutenant walked past."|"The Radetzky March"|"Joseph Roth"
"ap 10:00"|ten|"The next morning at ten, Lieutenant Trotta entered the district headquarters. His father was sitting in his den. As soon as the lieutenant opened the door, he saw him. His father sat opposite the door, next to the window. Through the green blinds the sun traced thin stripes on the dark-red carpet. A fly buzzed, a clock ticked on the wall. The room was cool, shady, and filled with summery hush, as it had been long ago during vacations. Nevertheless a vague new glow clung to all the objects here. One couldn’t tell where it came from. The district captain stood up. He himself emanated the new shimmer. The pure silver of his beard tinged the greenish light of the day and the reddish glow of the carpet. It exhaled the radiant mildness of an unknown, perhaps otherworldly day that was already dawning in the midst of Herr von Trotta’s earthly life, just as the mornings of this world begin to dawn while the stars of the night are still shining. Many years ago, when the boy had come from Hranice to spend his vacation, his father’s whiskers had been a small black cloud divided in two."|"The Radetzky March"|"Joseph Roth"
23:51|"9 to 12 A.M."|"“Sit down!” said the old man, pointing to the armchair where Carl Joseph had sat as a cadet on those Sundays, from 9 to 12 A.M., his cap on his knees and his radiant snow-white gloves on the cap."|"The Radetzky March"|"Joseph Roth"
"ap 23:51"|"nine to twelve"|"Summer vacation began around this time. Carl Joseph von Trotta, the fifteen-year-old son of the district captain, a pupil at the Cavalry Military School in Hranice, Moravia, regarded his native town as a summery place; it was as much the summer’s home as his own. Christmas and Easter he spent at his uncle’s. He came home only during summer holidays. He always arrived on a Sunday. This accorded with the wishes of his father, Herr District Captain Franz, Baron von Trotta und Sipolje. At home, summer vacation, no matter when it commenced at school, had to begin on a Saturday. On Sundays, Herr von Trotta was off duty. He reserved the entire morning, from nine to twelve, for his son. Punctually at ten minutes to nine, a quarter hour after early mass, the boy stood in his Sunday uniform outside his father’s door. At five minutes to nine, Jacques, in his gray butler’s livery, came down the stairs and said, “Young master, your Herr Papá is coming.” Carl Joseph gave his coat a last tug, adjusted the waist belt, took off the cap, and, as prescribed by regulations, propped it against his hip."|"The Radetzky March"|"Joseph Roth"
"ap 08:50"|"ten minutes to nine"|"Summer vacation began around this time. Carl Joseph von Trotta, the fifteen-year-old son of the district captain, a pupil at the Cavalry Military School in Hranice, Moravia, regarded his native town as a summery place; it was as much the summer’s home as his own. Christmas and Easter he spent at his uncle’s. He came home only during summer holidays. He always arrived on a Sunday. This accorded with the wishes of his father, Herr District Captain Franz, Baron von Trotta und Sipolje. At home, summer vacation, no matter when it commenced at school, had to begin on a Saturday. On Sundays, Herr von Trotta was off duty. He reserved the entire morning, from nine to twelve, for his son. Punctually at ten minutes to nine, a quarter hour after early mass, the boy stood in his Sunday uniform outside his father’s door. At five minutes to nine, Jacques, in his gray butler’s livery, came down the stairs and said, “Young master, your Herr Papá is coming.” Carl Joseph gave his coat a last tug, adjusted the waist belt, took off the cap, and, as prescribed by regulations, propped it against his hip."|"The Radetzky March"|"Joseph Roth"
"ap 08:55"|"five minutes to nine"|"Summer vacation began around this time. Carl Joseph von Trotta, the fifteen-year-old son of the district captain, a pupil at the Cavalry Military School in Hranice, Moravia, regarded his native town as a summery place; it was as much the summer’s home as his own. Christmas and Easter he spent at his uncle’s. He came home only during summer holidays. He always arrived on a Sunday. This accorded with the wishes of his father, Herr District Captain Franz, Baron von Trotta und Sipolje. At home, summer vacation, no matter when it commenced at school, had to begin on a Saturday. On Sundays, Herr von Trotta was off duty. He reserved the entire morning, from nine to twelve, for his son. Punctually at ten minutes to nine, a quarter hour after early mass, the boy stood in his Sunday uniform outside his father’s door. At five minutes to nine, Jacques, in his gray butler’s livery, came down the stairs and said, “Young master, your Herr Papá is coming.” Carl Joseph gave his coat a last tug, adjusted the waist belt, took off the cap, and, as prescribed by regulations, propped it against his hip."|"The Radetzky March"|"Joseph Roth"
"ap 00:00"|twelve|"“As soon as,” the old man rectified. “As soon as the latter takes command.”
Carl Joseph heaved a sigh of relief. The clock struck twelve.
Only now did his vacation begin. Another quarter hour, and he heard the first rattling drumroll from the band leaving the barracks. Every Sunday at noontime it played outside the official residence of the district captain, who, in this little town, represented no lesser personage than His Majesty the Emperor. Carl Joseph, concealed behind the dense foliage of the vines on the balcony, received the playing of the military band as a tribute. He felt slightly related to the Hapsburgs, whose might his father represented and defended here and for whom he himself would some day go off to war and death. He knew the names of all the members of the Imperial Royal House. He loved them all sincerely, with a child’s devoted heart—more than anyone else the Kaiser, who was kind and great, sublime and just, infinitely remote and very close, and particularly fond of the officers in the army. It would be best to die for him amid military music, easiest with “The Radetzky March.” The swift bullets whistled in cadence around Carl Joseph’s ears, his naked saber flashed, and, his heart and head brimming with the lovely briskness of the march, he sank into the drumming intoxication of the music, and his blood oozed out in a thin dark-red trickle upon the glistening gold of the trumpets, the deep black of the drums, and the victorious silver of the cymbals."|"The Radetzky March"|"Joseph Roth"
12:00|noontime|"“As soon as,” the old man rectified. “As soon as the latter takes command.”
Carl Joseph heaved a sigh of relief. The clock struck twelve.
Only now did his vacation begin. Another quarter hour, and he heard the first rattling drumroll from the band leaving the barracks. Every Sunday at noontime it played outside the official residence of the district captain, who, in this little town, represented no lesser personage than His Majesty the Emperor. Carl Joseph, concealed behind the dense foliage of the vines on the balcony, received the playing of the military band as a tribute. He felt slightly related to the Hapsburgs, whose might his father represented and defended here and for whom he himself would some day go off to war and death. He knew the names of all the members of the Imperial Royal House. He loved them all sincerely, with a child’s devoted heart—more than anyone else the Kaiser, who was kind and great, sublime and just, infinitely remote and very close, and particularly fond of the officers in the army. It would be best to die for him amid military music, easiest with “The Radetzky March.” The swift bullets whistled in cadence around Carl Joseph’s ears, his naked saber flashed, and, his heart and head brimming with the lovely briskness of the march, he sank into the drumming intoxication of the music, and his blood oozed out in a thin dark-red trickle upon the glistening gold of the trumpets, the deep black of the drums, and the victorious silver of the cymbals."|"The Radetzky March"|"Joseph Roth"
12:00|noontime|"Only now did his vacation begin. Another quarter hour, and he heard the first rattling drumroll from the band leaving the barracks. Every Sunday at noontime it played outside the official residence of the district captain, who, in this little town, represented no lesser personage than His Majesty the Emperor. Carl Joseph, concealed behind the dense foliage of the vines on the balcony, received the playing of the military band as a tribute. He felt slightly related to the Hapsburgs, whose might his father represented and defended here and for whom he himself would some day go off to war and death. He knew the names of all the members of the Imperial Royal House. He loved them all sincerely, with a child’s devoted heart—more than anyone else the Kaiser, who was kind and great, sublime and just, infinitely remote and very close, and particularly fond of the officers in the army. It would be best to die for him amid military music, easiest with “The Radetzky March.” The swift bullets whistled in cadence around Carl Joseph’s ears, his naked saber flashed, and, his heart and head brimming with the lovely briskness of the march, he sank into the drumming intoxication of the music, and his blood oozed out in a thin dark-red trickle upon the glistening gold of the trumpets, the deep black of the drums, and the victorious silver of the cymbals."|"The Radetzky March"|"Joseph Roth"
"ap 07:00"|seven|"A bell-tower clock struck seven. The sun was nearing the hills, which were now as blue as the sky and barely distinguishable from clouds. Sweet fragrance flowed from the trees along the way. The evening wind combed the small grasses of the sloping meadows on both sides of the road; he could see the grasses quivering and billowing under the wind’s broad, quiet, invisible hand. In distant marshes, the frogs began to croak. At an open window of a bright yellow cottage on the edge of town, a young woman stared at the empty road. Although Carl Joseph had never seen her before, he greeted her, stiff and reverential. She nodded back, rather surprised and grateful. It was as if he had said goodbye to Frau Slama only now. The strange, familiar woman stood at the window like a border guard between love and life. After greeting her, he felt restored to the world. He quickened his pace. At the stroke of seven-forty-five he was home, announcing his return to his father, pale, terse, and resolute, as is appropriate for men."|"The Radetzky March"|"Joseph Roth"
"ap 07:45"|seven-forty-five|"A bell-tower clock struck seven. The sun was nearing the hills, which were now as blue as the sky and barely distinguishable from clouds. Sweet fragrance flowed from the trees along the way. The evening wind combed the small grasses of the sloping meadows on both sides of the road; he could see the grasses quivering and billowing under the wind’s broad, quiet, invisible hand. In distant marshes, the frogs began to croak. At an open window of a bright yellow cottage on the edge of town, a young woman stared at the empty road. Although Carl Joseph had never seen her before, he greeted her, stiff and reverential. She nodded back, rather surprised and grateful. It was as if he had said goodbye to Frau Slama only now. The strange, familiar woman stood at the window like a border guard between love and life. After greeting her, he felt restored to the world. He quickened his pace. At the stroke of seven-forty-five he was home, announcing his return to his father, pale, terse, and resolute, as is appropriate for men."|"The Radetzky March"|"Joseph Roth"
16:00|"four in the afternoon"|"The sergeant had patrol duty every other day. Every other day, he came to the district captain’s headquarters with a stack of documents. He never ran into the district captain’s son. Every other day at four in the afternoon, Carl Joseph marched to the constabulary headquarters. He left it at 7 P.M. The fragrance he brought along from Frau Slama blended with the smells of the dry summer evenings, lingering on his hands day and night. At meals, he made sure never to get closer to his father than necessary."|"The Radetzky March"|"Joseph Roth"
19:00|"7 P.M."|"The sergeant had patrol duty every other day. Every other day, he came to the district captain’s headquarters with a stack of documents. He never ran into the district captain’s son. Every other day at four in the afternoon, Carl Joseph marched to the constabulary headquarters. He left it at 7 P.M. The fragrance he brought along from Frau Slama blended with the smells of the dry summer evenings, lingering on his hands day and night. At meals, he made sure never to get closer to his father than necessary."|"The Radetzky March"|"Joseph Roth"
"ap 03:00"|three|"Lieutenant Trotta went to the hotel. He slowly changed clothes. First he unbuckled his sword, the weapon and emblem of his honor. He had dreaded this moment. He was surprised that he felt no melancholy. A bottle of 180 Proof stood on the table, but he didn’t need a drink. Chojnicki came to pick him up. His riding crop cracked downstairs—and now he was in the room. He sat and watched. It was afternoon, the church clock struck three. All the mellow voices of summer poured in through the open window. Summer itself was calling Lieutenant Trotta. Chojnicki, in a light-gray suit with yellow stripes, his yellow crop in his hand, was an envoy of summer. The lieutenant rubbed his sleeve across the dull scabbard, drew the sword, puffed on it, wiped the steel with his handkerchief, and placed the weapon in a case. It was like preparing a corpse for its funeral. Before strapping the sword case to the trunk, he balanced it once again on his palm. Then he buried Max Demant’s sword next to it. He read the inscription scratched under the hilt. “Leave the army!” Demant had said. Now he was leaving…."|"The Radetzky March"|"Joseph Roth"
"ap 10:00"|ten|"The trunk was still open. Trotta’s military personality lay inside it, a corpse folded according to army regulations. It was time to close the trunk. Now the lieutenant felt a sudden stab of pain. His throat tightened, and tears came to his eyes; he turned to Chojnicki, trying to speak. At the age of seven Trotta had started boarding school, at ten military school. He had been a soldier all his life. Trotta the soldier had to be buried and mourned. You didn’t lower a corpse into the ground without weeping. It was good that Chojnicki was there."|"The Radetzky March"|"Joseph Roth"
00:00|midnight|"That night he got no sleep. At midnight he heard the hoarse shrieks of the wild geese. He dressed. He stepped outdoors. Stepaniuk, in his shirt, lay in front of the threshold, his pipe gleaming reddish. He lay flat on the ground and said without moving, “Can’t sleep tonight.”"|"The Radetzky March"|"Joseph Roth"
12:00|Noon|"Their thirst grew fiercer. Noon came. They heard shots and lay flat on the ground. The enemy must have overtaken them. They now wormed their way along the ground. Soon they noticed that the road was widening. A deserted railroad station shone nearby. That was where the tracks began. The battalion ran to the station—they were safe here; for a few miles they would be covered on either side by the embankments. The enemy, perhaps a sotnia of galloping Cossacks, must be across from them on the other side. Silent and dejected, they marched between the embankments."|"The Radetzky March"|"Joseph Roth"
"ap ~ 09:00"|"around nine"|"“I always got on fine with him. I wasn’t so young when I came to the farm. I never married; the baron wouldn’t have liked that. He never cared much for women, aside from his own Frau Baroness, but she soon died—her lungs. Everyone knew he had saved the Kaiser’s life at the Battle of Solferino, but he kept mum about it, never a peep out of him. That was why they wrote ‘The Hero of Solferino’ on his gravestone. He wasn’t so old when he died; it was in the evening, around nine, in November. It was already snowing. That afternoon he’d been standing in the courtyard, and he said, ‘Jacques, where did you put my fur-lined boots?’ I didn’t know where, but I said, ‘I’ll get them, Herr Baron.’ ‘Tomorrow’s soon enough!’ he says—and tomorrow he no longer needed them. I never got married.”"|"The Radetzky March"|"Joseph Roth"
"ap 02:15"|two-fifteen|"The deep evening had already settled in the streets; the hotel lobby was also dark. The district captain, dimming into the twilight, sat in the leather chair, the room key in his hand, his cane and silk hat at his side. His son halted at a respectful distance as if wanting to submit an official report on the resolution of the Moser affair. The lamps were not lit as yet. Out of the twilit silence came the old man’s voice. “We’re leaving tomorrow afternoon at two-fifteen.”"|"The Radetzky March"|"Joseph Roth"
