15:00|"3 P.M."|"When I arrived at Alder Creek it wasn’t yet 3 P.M. and already cars, pickups, even bicycles were parked everywhere in the drive and on the grassy lawn. So many! What was Mom thinking of, calling this a family reunion? Scram, Mom’s and Sable’s antic beagle, came rushing at me, barking and sniffing excitedly, tail thumping. The first people I ran into were the Plucketts, hauling enormous watermelons up the drive—Jimmy Ray and Nanci and their three freckle-faced teenagers so alike in appearance I could never tell them apart—but the Plucketts, sunny, good-hearted people, wouldn’t have expected me to remember their names, just called out, all smiles, “Judd, hello! Happy Fourth of July!” The next people I ran into were my gorgeous sister-in-law Vicky, Mrs. Mike Mulvaney Jr. with the caramel-colored hair—very pregnant—again—and her little girl Chrissy, my firstborn niece, for whom my heart always gave a lurch. Vicky cried, “Judd, aren’t you looking handsome!” standing on tiptoe to give me a breathy little kiss, her basketball-belly poking against me, and I lifted Chrissy in my arms with a mock grunt—four years old already, what if she’d forgotten her Uncle Judd she hadn’t seen in a year?—but she hadn’t. And where was Mike?—playing softball, Vicky said, in the goat pasture. And there were damp smeary kiddy-kisses from two-year-old Davy, Mike and Vicky’s other child, and there came rushing at me my sister Marianne in STUMP CREEK HILL yellow T-shirt and shorts, baby Molly Ellen in her arms, and three-year-old Willy toddling behind, and we hugged, and kissed, clutching at each other as always as if in the other’s absence each of us had imagined catastrophes, and these phantoms to be laughed eagerly away, dispelled like bad dreams in daylight, and we exchanged a minute’s quick news, and I saw that Marianne was in the prime of her young womanhood, the color restored to her skin, a fullness to her face, the stress lines eased, the liquidy yearning in the eyes eased, now she was thirty-four years old, and married, and a mother, and a devoted worker at Stump Creek Hill Animal Shelter & Hospital, and her life independent of all Mulvaneys if she should wish it. And what a husband she had!—I didn’t always get along with bluff opinionated Whit West, but I admired him immensely. I asked, “Where’s Whit? I don’t hear him,” and Marianne laughed, poked me reprovingly in the chest, and said, “He’s on the phone. We haven’t been here an hour—have we, Willy?—and already Whit is checking back. He was up late doing emergency surgery on Smoke—remember Smoke?—one of our black bears—an appendectomy. Oh but Judd,” Marianne said, just remembering, “—he’s here, he’s actually here. And he has a girl.” Marianne pointed toward the pasture where a rowdy game of softball was in progress."|"We Were the Mulvaneys"|"Joyce Carol Oates"
18:30|"6:30 P.M."|"It was nearing 6:30 P.M. but still bright as midday except in the shadows beneath the tall chestnut trees where picnic tables had been set, covered in bright American-flag paper runners. Fourth of July but no fireworks, no “explosive devices”—Mom and Sable had insisted. Just red-white-and-blue napkins, streamers. Tiny American flags fluttering from the veranda. Scram, in a delirium of joy at so many children, so much loving attention, wore an American-flag kerchief around his neck."|"We Were the Mulvaneys"|"Joyce Carol Oates"
12:00|midday|"It was nearing 6:30 P.M. but still bright as midday except in the shadows beneath the tall chestnut trees where picnic tables had been set, covered in bright American-flag paper runners. Fourth of July but no fireworks, no “explosive devices”—Mom and Sable had insisted. Just red-white-and-blue napkins, streamers. Tiny American flags fluttering from the veranda. Scram, in a delirium of joy at so many children, so much loving attention, wore an American-flag kerchief around his neck."|"We Were the Mulvaneys"|"Joyce Carol Oates"
06:00|"6 A.M."|"Wonder why? Weekdays at High Point Farm never began later than 6 A.M. when Mom hollered up the stairs, “WAKE UP! RISE ’N’ SHINE, KIDDOS!” And maybe whistled, or banged a pot. Barn chores before breakfast (my God it could take as long as an hour to wash the cows’ filth-encrusted milk-swollen udders, hook up the milking machine to each cow, drain their heavy milk bags dry, empty the milkers into pails) and barn chores after school (horses, mainly—as much work, but at least I loved our horses), approximately 4:30 P.M. to 6 P.M. And then supper—in our family, intense. Just to hold my own around our table, for a kid like me, the youngest of the Mulvaneys, used up energy, and staying power, like keeping on your toes through twelve rounds of a featherweight boxing match—it might look almost easy to outsiders but it isn’t easy, for sure. And after supper an hour or so of homework, also intense (Mom insisted that Patrick or Marianne oversee my efforts: worrying I wasn’t the high-nineties student it was her conviction I should be) and more excitement among the family, watching TV for a while if something “worthwhile, educational” was on: history, science and biography documentaries on public television were favored by our parents. And we’d discuss them during, and afterward—we Mulvaneys were a family who talked. So when around 10 P.M. I staggered upstairs to bed it was with the gravity of a stone sinking slowly through deep, dark water. Sometimes I fell asleep half in my pajamas, lying sideways on my bed, and Little Boots curled up happily beside me. Sometimes I fell asleep in the bathroom, sitting on the toilet. “Oh, Judd! Goodness! Wake up, honey!” Mom might cry, having pushed open the door I’d neglected to lock."|"We Were the Mulvaneys"|"Joyce Carol Oates"
"~ 16:30"|"approximately 4:30 P.M."|"Wonder why? Weekdays at High Point Farm never began later than 6 A.M. when Mom hollered up the stairs, “WAKE UP! RISE ’N’ SHINE, KIDDOS!” And maybe whistled, or banged a pot. Barn chores before breakfast (my God it could take as long as an hour to wash the cows’ filth-encrusted milk-swollen udders, hook up the milking machine to each cow, drain their heavy milk bags dry, empty the milkers into pails) and barn chores after school (horses, mainly—as much work, but at least I loved our horses), approximately 4:30 P.M. to 6 P.M. And then supper—in our family, intense. Just to hold my own around our table, for a kid like me, the youngest of the Mulvaneys, used up energy, and staying power, like keeping on your toes through twelve rounds of a featherweight boxing match—it might look almost easy to outsiders but it isn’t easy, for sure. And after supper an hour or so of homework, also intense (Mom insisted that Patrick or Marianne oversee my efforts: worrying I wasn’t the high-nineties student it was her conviction I should be) and more excitement among the family, watching TV for a while if something “worthwhile, educational” was on: history, science and biography documentaries on public television were favored by our parents. And we’d discuss them during, and afterward—we Mulvaneys were a family who talked. So when around 10 P.M. I staggered upstairs to bed it was with the gravity of a stone sinking slowly through deep, dark water. Sometimes I fell asleep half in my pajamas, lying sideways on my bed, and Little Boots curled up happily beside me. Sometimes I fell asleep in the bathroom, sitting on the toilet. “Oh, Judd! Goodness! Wake up, honey!” Mom might cry, having pushed open the door I’d neglected to lock."|"We Were the Mulvaneys"|"Joyce Carol Oates"
18:00|"6 P.M."|"Wonder why? Weekdays at High Point Farm never began later than 6 A.M. when Mom hollered up the stairs, “WAKE UP! RISE ’N’ SHINE, KIDDOS!” And maybe whistled, or banged a pot. Barn chores before breakfast (my God it could take as long as an hour to wash the cows’ filth-encrusted milk-swollen udders, hook up the milking machine to each cow, drain their heavy milk bags dry, empty the milkers into pails) and barn chores after school (horses, mainly—as much work, but at least I loved our horses), approximately 4:30 P.M. to 6 P.M. And then supper—in our family, intense. Just to hold my own around our table, for a kid like me, the youngest of the Mulvaneys, used up energy, and staying power, like keeping on your toes through twelve rounds of a featherweight boxing match—it might look almost easy to outsiders but it isn’t easy, for sure. And after supper an hour or so of homework, also intense (Mom insisted that Patrick or Marianne oversee my efforts: worrying I wasn’t the high-nineties student it was her conviction I should be) and more excitement among the family, watching TV for a while if something “worthwhile, educational” was on: history, science and biography documentaries on public television were favored by our parents. And we’d discuss them during, and afterward—we Mulvaneys were a family who talked. So when around 10 P.M. I staggered upstairs to bed it was with the gravity of a stone sinking slowly through deep, dark water. Sometimes I fell asleep half in my pajamas, lying sideways on my bed, and Little Boots curled up happily beside me. Sometimes I fell asleep in the bathroom, sitting on the toilet. “Oh, Judd! Goodness! Wake up, honey!” Mom might cry, having pushed open the door I’d neglected to lock."|"We Were the Mulvaneys"|"Joyce Carol Oates"
"~ 22:00"|"around 10 P.M."|"Wonder why? Weekdays at High Point Farm never began later than 6 A.M. when Mom hollered up the stairs, “WAKE UP! RISE ’N’ SHINE, KIDDOS!” And maybe whistled, or banged a pot. Barn chores before breakfast (my God it could take as long as an hour to wash the cows’ filth-encrusted milk-swollen udders, hook up the milking machine to each cow, drain their heavy milk bags dry, empty the milkers into pails) and barn chores after school (horses, mainly—as much work, but at least I loved our horses), approximately 4:30 P.M. to 6 P.M. And then supper—in our family, intense. Just to hold my own around our table, for a kid like me, the youngest of the Mulvaneys, used up energy, and staying power, like keeping on your toes through twelve rounds of a featherweight boxing match—it might look almost easy to outsiders but it isn’t easy, for sure. And after supper an hour or so of homework, also intense (Mom insisted that Patrick or Marianne oversee my efforts: worrying I wasn’t the high-nineties student it was her conviction I should be) and more excitement among the family, watching TV for a while if something “worthwhile, educational” was on: history, science and biography documentaries on public television were favored by our parents. And we’d discuss them during, and afterward—we Mulvaneys were a family who talked. So when around 10 P.M. I staggered upstairs to bed it was with the gravity of a stone sinking slowly through deep, dark water. Sometimes I fell asleep half in my pajamas, lying sideways on my bed, and Little Boots curled up happily beside me. Sometimes I fell asleep in the bathroom, sitting on the toilet. “Oh, Judd! Goodness! Wake up, honey!” Mom might cry, having pushed open the door I’d neglected to lock."|"We Were the Mulvaneys"|"Joyce Carol Oates"
03:25|"3:25 A.M."|"It was 3:25 A.M. A strange thrill, to think I was the only Mulvaney awake in the house."|"We Were the Mulvaneys"|"Joyce Carol Oates"
04:00|"four in the morning"|"I was terrified the hot-water pipe would make its high-shrieking noise and wake my parents. What the hell are you doing downstairs, Judd?—I could hear Dad’s voice, not angry so much as baffled. Going on four in the morning?"|"We Were the Mulvaneys"|"Joyce Carol Oates"
06:00|"6 A.M."|"Before Mom saw, coming downstairs at 6 A.M. Whistling, singing to herself."|"We Were the Mulvaneys"|"Joyce Carol Oates"
04:05|"4:05 A.M."|"The wind had picked up. Leaves were being blown against my window. It was 4:05 A.M. The moon had shifted in the sky, glaring through a clotted mass of clouds like a candled egg."|"We Were the Mulvaneys"|"Joyce Carol Oates"
08:00|"8 A.M."|"The previous fall, one of the popular football players was injured at a game, hospitalized with a concussion, and Marianne Mulvaney had been one of the leaders of a fervent all-night prayer vigil on the field. The injured boy had been admitted to intensive care at Mt. Ephraim General but by the time the prayer vigil ended next morning at 8 A.M., doctors declared him “out of immediate danger.”"|"We Were the Mulvaneys"|"Joyce Carol Oates"
17:00|"5 P.M."|"By 5 P.M. the sky was streaked in dusk. Plum-colored crevices in patches of cloud. Blowing, flying high overhead. Patrick tried not to be spooked by the sight of snow-covered vehicles on the roadside, abandoned days before during a blizzard. The Haggartsville Road was fair driving but High Point was basically a single crudely plowed lane. He’d gotten out, so he supposed he could get back. And school again in the morning. That damned school bus he was bored by the sight of."|"We Were the Mulvaneys"|"Joyce Carol Oates"
"> 02:00"|"after 2 A.M"|"A decent guy, and even, if you knew him better, a Christian—sort of. His mother Corinne Mulvaney was a devout churchgoer, at this time a member of the South Lebanon United Methodist congregation. Mule went less and less frequently with her and the others to church services now he was older, but still it rubs off on you. You have to know deep in your heart Do unto others as you would they would do unto you is just plain common sense. So he was beginning to get a little scared. Not seriously scared, but a little. Mixing warm Molson with vodka and whiskey didn’t help. After the big party at the MacIntyres’ (this really cool ranch-style house on the golf course) they’d piled into cars and driven six miles out to the funky County Line Tavern, where there was the possibility, unwarranted as it turned out, of some after-hours drinking, and some “girls.” Then word got out that T-T MacIntyre had picked up Della Rae Duncan, the poor bitch was dumb enough and drunk enough to imagine he “liked” her and wanted to be her “steady.” They were in Jamie Klinger’s van, this gang of guys. Cruising Route 119 as far south as the river, then turning back to Mt. Ephraim. Cruising Main Street, where (it’s after 2 A.M.) everything is dead—the Majestic, the Checkerboard Diner. Then into the cemetery off Iroquois. Which was where Frankie Kreigner trailed them. Though not turning into the cemetery but circling the block. Mule Mulvaney was saying, “Maybe we should check them out?—they might be hurting her, or something.” Another time he said, like pleading, “Shit, Della Rae, that poor mutt, that’s like shooting fish in a barrel.” The other guys were divided. Maybe yes, maybe no. There was something exciting about this. Knowing Della Rae was putting out for their buddies, or anyway guessing so. Though they didn’t want to investigate, exactly. Della Rae was a pig and she was smashed out of her skull and you didn’t want to think about it, Mule felt blood rush into his cock like a faucet turned on: hot."|"We Were the Mulvaneys"|"Joyce Carol Oates"
"ap 06:00"|six|"So it was not Time at High Point Farm but times. As many times as there were clocks, distinct and confusing and combative. When the hand-painted 1850s “banjo” clock in the front hall was musically striking the hour of six, the 1889 “Reformed Gothic” grandfather clock on the first-floor landing of the stairs was clearing its throat preparing to strike the quarter hour after one. On the parlor mantel were a Chautauqua Valley “steeple” pendulum clock of the 1890s and a Dutch-style painted walnut pendulum clock of the 1850s, one about to strike the hour of nine and the other importantly chiming the hour of eleven-thirty. In the family room was a crudely fashioned 1850s eight-day clock with a tarnished brass eagle at its top, that clanged the hour, half hour, and quarter hour with a jazzy beat; in the dining room, a mantel clock of golden pine with a river scene hand-painted (and now badly faded) on its glass case, of the 1870s, and a delicately carved mahogany Chautauqua Valley grandmother clock of the turn of the century, with ethereal chimes. Scattered through the house were numerous other antique clocks of Corinne’s, each a treasure, a bargain, a particular triumph. If there wasn’t an excess of competing noise from radio, TV, tapes, records, raised voices or barking dogs you could move through the house in a trance of tick-tick-ticking."|"We Were the Mulvaneys"|"Joyce Carol Oates"
"ap 09:00"|nine|"So it was not Time at High Point Farm but times. As many times as there were clocks, distinct and confusing and combative. When the hand-painted 1850s “banjo” clock in the front hall was musically striking the hour of six, the 1889 “Reformed Gothic” grandfather clock on the first-floor landing of the stairs was clearing its throat preparing to strike the quarter hour after one. On the parlor mantel were a Chautauqua Valley “steeple” pendulum clock of the 1890s and a Dutch-style painted walnut pendulum clock of the 1850s, one about to strike the hour of nine and the other importantly chiming the hour of eleven-thirty. In the family room was a crudely fashioned 1850s eight-day clock with a tarnished brass eagle at its top, that clanged the hour, half hour, and quarter hour with a jazzy beat; in the dining room, a mantel clock of golden pine with a river scene hand-painted (and now badly faded) on its glass case, of the 1870s, and a delicately carved mahogany Chautauqua Valley grandmother clock of the turn of the century, with ethereal chimes. Scattered through the house were numerous other antique clocks of Corinne’s, each a treasure, a bargain, a particular triumph. If there wasn’t an excess of competing noise from radio, TV, tapes, records, raised voices or barking dogs you could move through the house in a trance of tick-tick-ticking."|"We Were the Mulvaneys"|"Joyce Carol Oates"
"ap 11:30"|eleven-thirty|"So it was not Time at High Point Farm but times. As many times as there were clocks, distinct and confusing and combative. When the hand-painted 1850s “banjo” clock in the front hall was musically striking the hour of six, the 1889 “Reformed Gothic” grandfather clock on the first-floor landing of the stairs was clearing its throat preparing to strike the quarter hour after one. On the parlor mantel were a Chautauqua Valley “steeple” pendulum clock of the 1890s and a Dutch-style painted walnut pendulum clock of the 1850s, one about to strike the hour of nine and the other importantly chiming the hour of eleven-thirty. In the family room was a crudely fashioned 1850s eight-day clock with a tarnished brass eagle at its top, that clanged the hour, half hour, and quarter hour with a jazzy beat; in the dining room, a mantel clock of golden pine with a river scene hand-painted (and now badly faded) on its glass case, of the 1870s, and a delicately carved mahogany Chautauqua Valley grandmother clock of the turn of the century, with ethereal chimes. Scattered through the house were numerous other antique clocks of Corinne’s, each a treasure, a bargain, a particular triumph. If there wasn’t an excess of competing noise from radio, TV, tapes, records, raised voices or barking dogs you could move through the house in a trance of tick-tick-ticking."|"We Were the Mulvaneys"|"Joyce Carol Oates"
06:00|"6 A.M."|"Up in Marianne’s room were several more of Mom’s clocks, of which only one “kept time” and that fitfully: a small cream-colored ceramic mantel clock with garlands of tiny painted rosebuds, golden pendulum and delicate hands, a chime like the sweetest of birdcalls. It was turn-of-the-century and a genuine antique, Mom insisted. But its time couldn’t be trusted, of course. So Marianne kept a windup alarm clock with a plastic face, luminous green hands and numerals that glowed in the dark. Five nights a week Marianne set the alarm for 6 A.M. though it had been years since she’d needed an alarm to actually wake her. Even in the pitch-dark of winter."|"We Were the Mulvaneys"|"Joyce Carol Oates"
"~ 04:30"|"about 4:30 A.M."|"At the LaPortes’ she’d bathed twice. The first time at about 4:30 A.M. which she couldn’t remember very clearly and the second time at 9:30 A.M. and Trisha had still been asleep in her bed, or pretending to be asleep. The gentle tick-ticking of a bedside clock. Hours of that clock, hours unmoving beneath the covers of a bed not her own, in a house not her own. Toward dawn, a sound of plumbing somewhere in the house, then again silence, and after a long time the first church bells ringing, hollow-sounding chimes Marianne guessed came from St. Ann’s the Roman Catholic church on Mercer Avenue. Then Mrs. LaPorte knocking softly at Trisha’s bedroom door at about 9 A.M. asking, in a lowered voice, “Girls? Anyone interested in going to church with me?” Trisha groaned without stirring from her bed and Marianne lay very still, still as death, and made no reply at all."|"We Were the Mulvaneys"|"Joyce Carol Oates"
09:30|"9:30 A.M."|"At the LaPortes’ she’d bathed twice. The first time at about 4:30 A.M. which she couldn’t remember very clearly and the second time at 9:30 A.M. and Trisha had still been asleep in her bed, or pretending to be asleep. The gentle tick-ticking of a bedside clock. Hours of that clock, hours unmoving beneath the covers of a bed not her own, in a house not her own. Toward dawn, a sound of plumbing somewhere in the house, then again silence, and after a long time the first church bells ringing, hollow-sounding chimes Marianne guessed came from St. Ann’s the Roman Catholic church on Mercer Avenue. Then Mrs. LaPorte knocking softly at Trisha’s bedroom door at about 9 A.M. asking, in a lowered voice, “Girls? Anyone interested in going to church with me?” Trisha groaned without stirring from her bed and Marianne lay very still, still as death, and made no reply at all."|"We Were the Mulvaneys"|"Joyce Carol Oates"
"~ 09:00"|"about 9 A.M."|"At the LaPortes’ she’d bathed twice. The first time at about 4:30 A.M. which she couldn’t remember very clearly and the second time at 9:30 A.M. and Trisha had still been asleep in her bed, or pretending to be asleep. The gentle tick-ticking of a bedside clock. Hours of that clock, hours unmoving beneath the covers of a bed not her own, in a house not her own. Toward dawn, a sound of plumbing somewhere in the house, then again silence, and after a long time the first church bells ringing, hollow-sounding chimes Marianne guessed came from St. Ann’s the Roman Catholic church on Mercer Avenue. Then Mrs. LaPorte knocking softly at Trisha’s bedroom door at about 9 A.M. asking, in a lowered voice, “Girls? Anyone interested in going to church with me?” Trisha groaned without stirring from her bed and Marianne lay very still, still as death, and made no reply at all."|"We Were the Mulvaneys"|"Joyce Carol Oates"
22:00|"10 P.M."|"At Trisha’s she’d bathed twice and a third time since returning home that afternoon and now at 10 P.M. yet a fourth time cautiously lowering herself, her clumsy numb body, into water so hot it made her whimper aloud. The bathroom was filled with steam so she could barely see. The tub was an enormous old-fashioned claw-footed vessel of heavy chipped white porcelain. As a child, Marianne had been lost in it, giggling just slightly frightened as the buoyancy of the water lifted her feet and legs, tilting her backward. Mom had bathed her in this tub, careful not to run too much water into it, and to keep the water from getting too hot. Scalding water issued from the right-hand faucet, cold water from the left. You would not want to lift your foot experimentally to that right-hand faucet."|"We Were the Mulvaneys"|"Joyce Carol Oates"
"ap 05:00"|Five|"Finally Mike was allowed to speak, pleading, “But I wasn’t with those guys, Dad! I d-didn’t know anything about it until afterward.” Dad asked skeptically, “Oh yes? How long afterward?” and Mike said, “I—don’t know, exactly.” “An hour? Five minutes?” “Gosh no, Dad—the next day, I guess.” Mike’s voice was weak and scared and I’d guess he might be lying. Or maybe Dad just scared him so, he was breaking down. It was fascinating to me to hear my big brother Mule speaking to our father like a small child—like me, aged ten. The thought came to me Don’t we ever grow up? For some weird reason this was consoling."|"We Were the Mulvaneys"|"Joyce Carol Oates"
