"< 18:00"|"almost 6 P.M."|"By the time Patrick drove to the bus station, parked his Jeep and rushed into the Trailways waiting room it was almost 6 P.M. As in one of his nightmares, he’d arrived so late!—and he’d been thinking uneasily of Marianne all day, in fact for days, since they’d made arrangements the week before. What would she think, that Patrick had forgotten her after all? He’d told her not to take a taxi, not to spend the money, he wanted to pick her up, he’d be there."|"We Were the Mulvaneys"|"Joyce Carol Oates"
18:00|"6 P.M."|"Prowling the bus-boarding area, circling the depot to check all the buses in sight. Thinking just possibly he’d gotten the time wrong and Marianne was only now due, 6 P.M.?—but she wasn’t here, wasn’t anywhere. He stared grimly as a northbound bus, up from Binghamton en route to Syracuse, discharged passengers. All strangers. The Erie, Pennsylvania bus, with its Kilburn connection, had obviously come and gone an hour ago. Patrick saw an Ithaca patrolman talking with a security guard and approached them to ask if they’d seen Marianne but at the last moment he passed on by, he was too confused. He could not think how to describe his sister! His mind had gone blank and his last clear memory of her was of the radiantly smiling cheerleader in the maroon jumper and long-sleeved perfectly starched white cotton blouse, eyes shining, curly-brown hair bouncing as in an advertisement for American happiness itself. “Button” Mulvaney. Immortalized on Mom’s bulletin board."|"We Were the Mulvaneys"|"Joyce Carol Oates"
17:05|"5:05 P.M."|"Patrick pushed through the swinging doors into the waiting room another time and to the ticket counter. Asked the severely frowning middle-aged woman behind the counter if she’d happened to see a girl come into the waiting room, after the 5:05 P.M., bus from Erie? A girl about nineteen? The woman said no, not that she recalled, with a shrug of one shoulder to indicate she wasn’t trying very hard to recall, Patrick’s question was naive. “Well, she’d look younger, I guess,” Patrick said, faltering. “My sister. But she doesn’t look much like me, she’s sort of—” Again his mind went blank. It was like a blackboard carelessly erased, by hand. The ticket-counter woman shook her head, whether meaning “no” or in bemused pity of Patrick who was visibly perspiring, glasses sliding down his nose."|"We Were the Mulvaneys"|"Joyce Carol Oates"
18:07|"6:07 P.M."|"It was 6:07 P.M. And then it was 6:12 P.M. Patrick had Marianne’s number to call at the Green Isle Co-op, Kilburn, New York but he dreaded making the call, as always there would be happy frantic mealtime-sounding noises, and whoever would answer, male or female he couldn’t always determine, would yell Mari-anne! Hey Mari-anne! Who’s seen Mari-anne! Telephone for Mari-anne! and he’d shut his eyes tight bitterly resenting this stranger who so familiarly called his sister’s name; resisting the impulse to imagine her life there amid young and presumably attractive, idealistic men and women like herself, in the Co-op’s residence which Marianne had described to Patrick as a big old ramshackle inn with several greenhouses, two acres of good rich soil where they grew their own vegetables, communally-owned cars and a pickup truck. The residence, in “condemned condition,” had been bought by Kilburn College, then leased to the Co-op for a token payment, one hundred dollars yearly; the Co-op members had repaired it, furnished it, made it “like home.” No, Patrick didn’t want to call the Green Isle Co-op just now."|"We Were the Mulvaneys"|"Joyce Carol Oates"
18:12|"6:12 P.M."|"It was 6:07 P.M. And then it was 6:12 P.M. Patrick had Marianne’s number to call at the Green Isle Co-op, Kilburn, New York but he dreaded making the call, as always there would be happy frantic mealtime-sounding noises, and whoever would answer, male or female he couldn’t always determine, would yell Mari-anne! Hey Mari-anne! Who’s seen Mari-anne! Telephone for Mari-anne! and he’d shut his eyes tight bitterly resenting this stranger who so familiarly called his sister’s name; resisting the impulse to imagine her life there amid young and presumably attractive, idealistic men and women like herself, in the Co-op’s residence which Marianne had described to Patrick as a big old ramshackle inn with several greenhouses, two acres of good rich soil where they grew their own vegetables, communally-owned cars and a pickup truck. The residence, in “condemned condition,” had been bought by Kilburn College, then leased to the Co-op for a token payment, one hundred dollars yearly; the Co-op members had repaired it, furnished it, made it “like home.” No, Patrick didn’t want to call the Green Isle Co-op just now."|"We Were the Mulvaneys"|"Joyce Carol Oates"
18:20|"6:20 P.M."|"It was 6:20 P.M. Patrick circled the waiting room, asked a woman if she’d go into the women’s rest room to check if his sister was inside but of course she was not. His lips moved silently. Marianne. Marianne! He should have sought out Zachary Lundt, long ago, and killed him. In his fantasy, a smart-boy A-student fantasy, he’d force his sister’s rapist to swallow poison—Lysol: flaming agony, mouth, esophagus, stomach, liver. It would look like suicide! And not detectable, as the hydrogen sulfide stink bomb, the proudest project of Patrick Mulvaney’s high school career, had not been detected, so far as he knew. (No, Patrick hadn’t made any inquiries about who the prankster might be. That was what guilty parties always did: couldn’t resist. But Patrick, who was smarter than smart, could resist, for all his life. Just watch!) Weak, breathless, he leaned against the badly scratched wall of lockers, too shaky to continue pacing yet not wanting to sit down amid the shabby, torn plastic seats and relinquish his advantage which was the advantage of height. But his left eye, which always betrayed him, was dimming with fatigue. The day had begun so long ago, in a rainy, snow-gritty twilight before dawn, in dreams in which Marianne and his Biology of Organisms lab were mixed together—he could scarcely remember. Awake before dawn in his third-floor room in the stucco house on Cook Street, waking beneath the eaves of his dormer bedroom, as at High Point Farm, his quick-pulsing nerved-up body waking him in lieu of an alarm. Sometimes in this strange place in Ithaca hundreds of miles from home he heard in his sleep a rooster crowing, and another rooster crowing in reply. Now it was spring, the early-morning cries of red-winged blackbirds, cardinals. And Wake up kiddos! Wake-up time kiddos! and Mom’s friendly whistle. Smelled frying bacon, for always Mom insisted upon good, solid, hot breakfasts, no going with just cereal dumped in a bowl, breakfast was the most important meal of the day Mom and Dad both insisted. He’d hear the dogs’ toenails excitedly clicking on the kitchen floor as quickly he descended the stairs, Mom whistling to Feathers who trilled and warbled in return. And that damned radio station, out of Yewville, the announcer Mom swore by, her favorite. And Marianne would be downstairs already in the kitchen helping Mom get breakfast on the table, the two of them talking and laughing together, almost if he shut his eyes very tight he could see her: his lost sister."|"We Were the Mulvaneys"|"Joyce Carol Oates"
"ap 01:14"|114|"Cook Street, in heterogeneous Collegetown, near an edge of the gigantic Cornell campus, was one of Ithaca’s numerous steep-banked streets: Patrick estimated it at about seventy degrees. His two-room apartment at 114 Cook was at the top of a moldering stucco house long ago partitioned into “apartments” for students, mainly foreign graduate students. Patrick had moved there the previous summer, from an even shabbier place on College Avenue. His fellow tenants were all young men, from India, China, Pakistan, studying science or engineering; they were as fanatic as he about work and quiet, shyly friendly with him but not inquisitive—not very real to Patrick as, he guessed, he wasn’t very real to them. Patrick might have lived more conveniently in a residence hall on campus, within closer walking distance of his classes, but he valued privacy, relative isolation. And he couldn’t tolerate his fellow undergraduates’ juvenile behavior, noise at all hours, binge-drinking, vomiting and brawling, ceaseless rock music."|"We Were the Mulvaneys"|"Joyce Carol Oates"
"> 00:00"|"after midnight"|"Seeing Marianne’s quizzical smile, Patrick quickly added that he didn’t always work, of course. He had a few friends, he’d gone out with a few girls. No one special, but—he didn’t always work. Sometimes when he got restless he went running—across Cascadilla Creek and down Central Avenue below the hill and over to Fall Creek, to the gorge (he would show her the gorge tomorrow: the famous suspension bridge from which suicidal students threw themselves) and across and around Lake Beebe and back to Cook Street—how many miles, he didn’t know. He ran in a kind of trance, his mind stilled. In rapid motion, his body seemed to catch up with his metabolism, he felt right. And he didn’t mind bad weather—“Reminds me of home.” Other nights he’d go downtown, to State Street, where there was a cheap movie house, old and crummy and smelling of rancid popcorn, he’d see whatever was playing, the last show ended after midnight and he’d return home and work for maybe another hour or two—by the time he hiked up from State Street, the movie would have faded from his consciousness. He loved how unreal movies were, like certain people."|"We Were the Mulvaneys"|"Joyce Carol Oates"
"ap > 10:00"|"past ten o’clock"|"It was late, past ten o’clock. Not late by Patrick’s usual schedule but it felt late, the visit with Marianne had drained so much energy from both. Yet, unpredictably, Marianne jumped up from the sofa saying she had a surprise for Patrick she’d almost forgotten—in fact, two surprises."|"We Were the Mulvaneys"|"Joyce Carol Oates"
17:20|"5:20 P.M."|"How could Patrick put his sister back on the Trailways bus tomorrow afternoon at 5:20 P.M.? How could he surrender her to—whatever was there, in Kilburn, in the Green Isle Co-op? Yet he knew he was going to."|"We Were the Mulvaneys"|"Joyce Carol Oates"
"> 18:00"|"shortly after 6 P.M."|"So one day, one hour, he’s had enough. Walking into the bar at the Mt. Ephraim Country Club, shortly after 6 P.M., a Friday. Yankee Doodle Tap Room: men only. Removing his dark glasses to adjust his eyes to the dimness. And glancing around to check out who’s here, twelve, fifteen men approximately, at the bar and in the booths, all familiar faces, and there’s Ben Breuer in one of the red-leather booths, and Charley MacIntyre, the two exchanging a quick startled glance—a look of warning, caution passing between them—and there’s a third man, his back to Michael, Michael doesn’t recognize at first then sees it’s Gerry Kirkland, the district court judge. Kirkland is about sixty, solidly built, with a square-ruddy face creased from a career of hard smiling. His hair, the color of pewter, is thinning patchily at the crown exactly like Michael Mulvaney’s. Michael knows Kirkland from the Club mainly, just well enough to shake the man’s hand, exchange friendly greetings and inquiries after their respective families. Michael always asks after Jeannette Kirkland and in turn Kirkland asks after—is it Carol? Coralee?—never can quite remember Corinne Mulvaney’s name, and why is that? Fucker."|"We Were the Mulvaneys"|"Joyce Carol Oates"
"> 23:00"|"after 11 P.M."|"This time, though, when Patrick called, and it was late, after 11 P.M. of a weekday, I picked up the phone on the first ring (just happened to be downstairs, in the family room switching through TV channels, volume low so Mom upstairs in bed wouldn’t hear) and right away he was serious, none of the Pinch-crap. First thing he asked was, ‘D’you think anyone else is on the line?” and I’m surprised as hell, I say, “What? Who?”—because it could only be Mom or Dad, as far as Patrick would know. (He couldn’t have known that Dad was in Marsena on business, staying the night.) So right away Patrick backs off a little, saying he just wanted to be sure. And there’s this beat or two, just silence; I’m holding the receiver to my ear not hearing a thing. I wonder if he’s hung up. “Patrick? Is something wrong?”"|"We Were the Mulvaneys"|"Joyce Carol Oates"
"~ 18:30"|"about 6:30 P.M."|"Around suppertime, anyway what used to be suppertime at High Point Farm. But now if it’s just Mom and me not knowing for sure when Dad might show up we don’t exactly sit down at the table as in the old days because Mom says it makes us nervous, as Mom says it’s just as easy to eat standing up or somewhere not the kitchen at all. This is about 6:30 P.M. and the phone rings and Mom answers quick and worried as she does when Dad’s out but—it’s Patrick!—and I hear her talking with him—talking and laughing—for ten, fifteen minutes! Trying not to eavesdrop, hanging around the kitchen with the dogs and cats nudging their heads against my legs and it’s amazing to me how Mom and Patrick seem to be talking, Mom so relaxed telling Patrick about her latest plans for “expanding” High Point Antiques so that she can bring in serious income, now that Dad is negotiating to sell his property in Mt. Ephraim and “relocate” the business in Marsena and of course they’d be selling the farm—“relocating”—maybe Patrick had heard of the Marsena Antique & Flea Market at the fairgrounds there, every weekend in good weather? one of the oldest and largest markets in the Valley? antique dealers and well-to-do customers come from as far away as Rochester, Port Oriskany, Buffalo? And—"|"We Were the Mulvaneys"|"Joyce Carol Oates"
"ap 03:40"|"Three hours and forty minutes"|"Three hours and forty minutes driving to Kilburn in the extreme southwest corner of New York State, most of the trip along two-lane country highways (sometime stuck behind snowplows moving at twenty miles per hour); almost that long again, driving back home that evening. Mom was anxious about staying overnight in Kilburn—“At this time of year, you can’t tell what the weather might do.” It was a snowy windswept landscape, the air bright and glittering with cold. No immediate snow was predicted but Mom envisioned the two of us snowbound in Kilburn, trapped until the spring thaw."|"We Were the Mulvaneys"|"Joyce Carol Oates"
11:20|"11:20 A.M."|"The former inn, painted mint-green with white trim, that was the Green Isle Co-op hadn’t changed much since Mom’s and my last visit. There were Christmas decorations in all the windows and, in the front room which was a combination parlor and office, a lopsided evergreen tree trimmed with handmade paper, tinsel, and cloth ornaments in primary colors. The mood of the Co-op at 11:20 A.M. of a weekday was busy, bustling, even frantic—people rushing about, up and down the stairs, a telephone ringing and a dog barking excitedly. This was an atmosphere hospitable to my mother who wandered inside, smiling and calling, “Marianne? Marianne?” until someone yelled, “Marianne! Visitors!” and Marianne appeared out of the rear of the house where she’d been working in the kitchen, wiping her hands on her apron. She wore baggy khaki pants, a red-plaid flannel shirt with sleeves rolled to the elbows, an oversized stained apron. When Marianne and Mom hugged they began to cry in a soundless way you’d almost mistake for laughter; then Marianne hugged me, her thin, surprisingly strong arms around me as I stood self-conscious, embarrassed—a clumsy kid of sixteen not knowing what to do or say. “My goodness, Judd, you keep growing! You’ve actually grown inches!” Marianne cried breathlessly. Her bones seemed light as a sparrow’s and her hair was cut shorter than mine; her skin looked sallow, grainy. But her eyes, glistening with tears, were my sister’s beautiful eyes—I almost couldn’t bear to look into."|"We Were the Mulvaneys"|"Joyce Carol Oates"
12:00|midday|"Marianne had to hurry downstairs to finish preparing the midday meal, as it was called, where we’d be guests of course, but before she rushed off Mom explained awkwardly that we wouldn’t be staying the night in Kilburn and Marianne said, hurt, “Oh, but I thought—you were planning to, this time? There’s a choral concert some of us are singing in—at my church—I told the minister my mom and brother were coming, and—” Mom said hurriedly, “Yes, honey, but it’s the weather, you know—you just don’t know what weather this time of year will do. And, well—” her voice faltered, her eyes searched Marianne’s face, “—we’re expected back home tonight.”"|"We Were the Mulvaneys"|"Joyce Carol Oates"
12:00|noon|"Promptly at noon a gong sounded and Mom and I trooped downstairs and into the dining room for a cheerful, noisy, confused meal at a long table with as many as twenty-five people (their numbers kept shifting as people arrived, departed). Marianne introduced Mom and me and one by one around the table the members of the Co-op gave their names and said “Welcome!” and “Happy holidays!” Even as these smiling strangers, young men and women in their twenties, called out their names, I was forgetting their names, awkwardly self-conscious in their midst. They were so friendly. They were so inquisitive. Mom was in her element in such boisterous company, jumping up every few minutes to accompany Marianne back into the kitchen, insisting upon helping serve the meal even as others cried, “No, no! Mrs. Mulvaney, you’re a guest.” Mom basked in the attention, loving every moment. It was clear that Marianne was much liked by her friends but she seemed oddly shy; it would have been easy to overlook her. But not Mom, who announced to the table, “When I was a young mother, mealtimes at our house—we have a farm, in Mt. Ephraim—maybe Marianne told you—were wild, I mean wild. At harvesttime there’d be as many at my table as—right here! We had our own babies of course and visitors would come to the farm with their babies and I remember one Sunday supper we had three high chairs at the table—or was it four, Marianne?” Laughing then, slapping her hand against her forehead like a TV comic, “Oh!—Marianne wouldn’t know, she was one of the babies.”"|"We Were the Mulvaneys"|"Joyce Carol Oates"
"ap 04:00"|four|"Promptly at noon a gong sounded and Mom and I trooped downstairs and into the dining room for a cheerful, noisy, confused meal at a long table with as many as twenty-five people (their numbers kept shifting as people arrived, departed). Marianne introduced Mom and me and one by one around the table the members of the Co-op gave their names and said “Welcome!” and “Happy holidays!” Even as these smiling strangers, young men and women in their twenties, called out their names, I was forgetting their names, awkwardly self-conscious in their midst. They were so friendly. They were so inquisitive. Mom was in her element in such boisterous company, jumping up every few minutes to accompany Marianne back into the kitchen, insisting upon helping serve the meal even as others cried, “No, no! Mrs. Mulvaney, you’re a guest.” Mom basked in the attention, loving every moment. It was clear that Marianne was much liked by her friends but she seemed oddly shy; it would have been easy to overlook her. But not Mom, who announced to the table, “When I was a young mother, mealtimes at our house—we have a farm, in Mt. Ephraim—maybe Marianne told you—were wild, I mean wild. At harvesttime there’d be as many at my table as—right here! We had our own babies of course and visitors would come to the farm with their babies and I remember one Sunday supper we had three high chairs at the table—or was it four, Marianne?” Laughing then, slapping her hand against her forehead like a TV comic, “Oh!—Marianne wouldn’t know, she was one of the babies.”"|"We Were the Mulvaneys"|"Joyce Carol Oates"
12:00|midday|"It wasn’t a thought I could hold on to. The table was being cleared for dessert, platters of date-nut brownies (baked by Marianne that morning) were being brought in, pots of herbal tea. And Abelove, the Co-op director, had just hurried in, late for the midday meal, no time for the midday meal, but taking time to shake hands with Marianne’s mom and kid brother—“Welcome to Kilburn! Great to see you!” Abelove was like one of our teachers at the high school, a youngish guy exuding “personality.” He was in his mid-thirties maybe, stockily built, a round head and thick neck and pale blond hair, goatee and shimmering locks to his shoulders like a blond Jesus Christ. The kind of guy you resent like hell until he singles you out for attention, lets his hand fall on your shoulder (as he did with me calling me “Judd” as if we were old friends, and equals), at which point you melt and go crazy for him. When he praised Marianne for her “tireless spirit of optimism” in the Co-op I saw my sister’s eyes film over with tears of gratitude."|"We Were the Mulvaneys"|"Joyce Carol Oates"
00:00|midnight|"Coatless in the thin, freezing wind, her eyes shifting, Marianne kissed us good-bye, hugged us and wept and made us promise we’d stay overnight next time we visited Kilburn, by then the weather would have turned warm. I’d slid behind the wheel of Mom’s Buick station wagon which was looking kind of grim these days, rust-flecked, low-slung, one of the rear windows mended with masking tape. I was impatient to get out of Kilburn: the sky had darkened in rapid, shifting patches, like a jammed-up ice floe. By the time we reached the foothills of the Chautauquas and twisty-treacherous High Point Road, it would be dark as midnight. Marianne was asking Mom another time to please say hello to Dad, and give him her love, and tell him she was thinking of him all the time; and the same to all the animals! And—did Muffin look all right? or did he look, maybe, a little thin? and Mom said brusquely, “When cats age their kidneys start to fail, you know that. Toxins build up in them and they lose their appetites, even the big, husky eaters, and they lose weight and you’ll have to be realistic, Marianne. Muffin isn’t a young cat any longer. He must be—how old?”"|"We Were the Mulvaneys"|"Joyce Carol Oates"
03:10|"3:10 A.M."|"Weather? I listened: wind. Possibly snow. It was 3:10 A.M. and I was speaking to Patrick ninety miles away on the phone in the family room, in the dark and with the door shut and Troy sleeping and wheezing contentedly at my feet. Upstairs, Mom was sleeping. She’d taken a long hot bath at eleven and I was pretty sure she was sleeping. I didn’t know Dad’s exact or even approximate whereabouts but I reasoned that if he drove up the driveway his headlights would precede him and I’d have no trouble escaping back upstairs to my room."|"We Were the Mulvaneys"|"Joyce Carol Oates"
"ap 11:00"|eleven|"Weather? I listened: wind. Possibly snow. It was 3:10 A.M. and I was speaking to Patrick ninety miles away on the phone in the family room, in the dark and with the door shut and Troy sleeping and wheezing contentedly at my feet. Upstairs, Mom was sleeping. She’d taken a long hot bath at eleven and I was pretty sure she was sleeping. I didn’t know Dad’s exact or even approximate whereabouts but I reasoned that if he drove up the driveway his headlights would precede him and I’d have no trouble escaping back upstairs to my room."|"We Were the Mulvaneys"|"Joyce Carol Oates"
17:00|"five in the afternoon"|"At the end of March, from a public telephone in Ithaca, Patrick called the Lundts, in Mt. Ephraim. It was five in the afternoon of a weekday. A woman answered on the fourth ring. Patrick introduced himself as a high school friend of Zachary’s, naming a name (“Don Maitland”) that might sound plausible to Mrs. Lundt, for there was in fact a “Don Maitland” who’d been on the periphery of Zachary’s circle, and Patrick guessed the young men wouldn’t be in contact, not after several years. Patrick asked for Zachary’s address, telephone number, and so forth, and Mrs. Lundt provided the information readily enough, yes he was at SUNY Binghamton, yes studying business administration, no he wouldn’t be graduating this year he’d taken a couple of semesters off but he was serious now, working very hard and she and her husband expected Zachary to get his degree possibly as early as next spring. Mrs. Lundt was pleasant-voiced, polite enough to ask “Don Maitland” how he was, what he was doing, and Patrick provided a plausible response, “Don Maitland” too had dropped out of school for a while but was back now, at Oswego Tech, studying electrical engineering. He asked, “Will Zachary be home over spring break? Around Easter?” and Mrs. Lundt said, “Certainly, yes,” and Patrick said, “Great! Us guys can all get together, then, like last time,” and Mrs. Lundt said, with a mild motherly laugh, “I’m sure you will.”"|"We Were the Mulvaneys"|"Joyce Carol Oates"
07:00|"7 A.M."|"“About six weeks ago. I mean the calls started then. She’d call any time—7 A.M., 10 P.M., once 2 A.M.! Of course we’d just hang up. We were thinking of changing to a private number. But finally I guess she was discouraged, she stopped. ‘Joellen’—something. I’m sure she wasn’t a college student really.”"|"We Were the Mulvaneys"|"Joyce Carol Oates"
