"ap 03:00"|"three o’clock"|"The girl nodded in a way that didn’t inspire confidence. Andy could tell instantly she was new and hours, if not minutes, from being fired. She had no pen or paper, no ability to remember all the requests or ferret out all the answers. Andy’s own mind was reflexively firing questions. Which “everyone” exactly needs to know about the run-through? Where’s the driver right now and can he get back there on time? Where is she going? What appointment does Caroline have this afternoon, and does she already know about it? Which tote bag? Will it be ready by three o’clock and if so, how do I get it to the office? Will she even be at the office, or will she already be at home? Which dress? I know for a fact she wore different dresses to each of those events, so how on earth do I know which one she means? Did she give me any color/cut/designer clues to narrow it down? Which sandals? Is there an accessories editor in right now and can she get earrings on time? What kind will look best with the mystery dress? What time exactly should I make the Nobu reservation? Tribeca or Fifty-Seventh Street location? And breakfast at the Four Seasons? Seven? Eight? Ten o’clock? Remember to send the general manager a thank-you gift for accommodating the grapefruit juice request. Find Nigel, relay blessedly specific information, and follow up on all grooming appointments. Preemptively make suite reservations at the Peninsula for when Miranda inevitably calls me in the middle of the night complaining about her houseguests (friends of her husband’s, no doubt) and demands an immediate escape. Warn driver of probable late-night transport from Miranda’s apartment to hotel. Stock hotel suite with Pellegrino, the Book, and an appropriate workday outfit for tomorrow, including all accessories, shoes, and toiletries. Plan to sleep not one wink as you see Miranda through this trying time. Repeat."|"Revenge Wears Prada"|"Lauren Weisberger"
"ap 10:00"|"Ten o’clock"|"The girl nodded in a way that didn’t inspire confidence. Andy could tell instantly she was new and hours, if not minutes, from being fired. She had no pen or paper, no ability to remember all the requests or ferret out all the answers. Andy’s own mind was reflexively firing questions. Which “everyone” exactly needs to know about the run-through? Where’s the driver right now and can he get back there on time? Where is she going? What appointment does Caroline have this afternoon, and does she already know about it? Which tote bag? Will it be ready by three o’clock and if so, how do I get it to the office? Will she even be at the office, or will she already be at home? Which dress? I know for a fact she wore different dresses to each of those events, so how on earth do I know which one she means? Did she give me any color/cut/designer clues to narrow it down? Which sandals? Is there an accessories editor in right now and can she get earrings on time? What kind will look best with the mystery dress? What time exactly should I make the Nobu reservation? Tribeca or Fifty-Seventh Street location? And breakfast at the Four Seasons? Seven? Eight? Ten o’clock? Remember to send the general manager a thank-you gift for accommodating the grapefruit juice request. Find Nigel, relay blessedly specific information, and follow up on all grooming appointments. Preemptively make suite reservations at the Peninsula for when Miranda inevitably calls me in the middle of the night complaining about her houseguests (friends of her husband’s, no doubt) and demands an immediate escape. Warn driver of probable late-night transport from Miranda’s apartment to hotel. Stock hotel suite with Pellegrino, the Book, and an appropriate workday outfit for tomorrow, including all accessories, shoes, and toiletries. Plan to sleep not one wink as you see Miranda through this trying time. Repeat."|"Revenge Wears Prada"|"Lauren Weisberger"
13:00|"one in the afternoon"|"Andy could see Lily watching her as she gingerly sat down on the couch. It was one in the afternoon, but Andy was still wearing a pair of Max’s sweatpants, furry slipper-socks that resembled indoor Uggs, and a pullover hooded sweatshirt so voluminously huge that it must have, at some point, belonged to a linebacker."|"Revenge Wears Prada"|"Lauren Weisberger"
"ap 03:00"|"three o’clock"|"A couple more babies started fussing as the time drew close to three o’clock, and Lori announced that the session was over for the week. “Some interesting things to think about, ladies,” she said as everyone began packing up bottles, pacifiers, teething rings, burp cloths, blankets, nursing covers, and stuffed animals. “Next we’ll have a sleep specialist from Baby 911 in to tell us how and when to set the little ones up on a schedule. Please let me know by e-mail if you can’t make it. As always, I’m inspired by all of you! Have a great week.” She left the room to give them all a few moments to talk among themselves."|"Revenge Wears Prada"|"Lauren Weisberger"
00:00|midnight|"“Delicious as ever. Perfect timing—she just woke up for her midnight feed.”"|"Revenge Wears Prada"|"Lauren Weisberger"
08:00|"Eight A.M."|"Max pulled the door shut and the cab took off like a race car. She checked her watch. Eight A.M. Gone were the days of leisurely coffees and fresh-made smoothies and gym visits—although Max still got there at least three days a week without her—but Andy didn’t mind. She’d so much rather spend those couple of hours with her daughter, snuggling in bed together, playing on the fluffy nursery rug. It was now the best part of the whole day."|"Revenge Wears Prada"|"Lauren Weisberger"
"ap > 09:00"|"a little after nine"|"Andy checked her watch. It was only a little after nine. She knew Emily would be calling to see when they could begin discussions."|"Revenge Wears Prada"|"Lauren Weisberger"
"ap 10:00"|ten|"Now Alex looked at his watch. “I need to hear more about your magazine. I’ve bought a bunch of the issues, do you know that? Look, the Rubin doesn’t open until ten. Do you have time for a quick breakfast?”"|"Revenge Wears Prada"|"Lauren Weisberger"
"ap 06:30"|"six thirty"|"They settled at a booth in the back of the Chelsea Diner, and Andy tried to suppress the weird feeling of being there with Alex. Just the weekend before she and Max had brought Clementine there at six thirty on Saturday morning; it was the only neighborhood place that was open. Now she looked across the way to the table they had occupied, almost willing Clementine to appear, kicking and grinning in her infant car seat, to snap her back to reality. The phone buzzed again. Emily. Again, she pushed “ignore.”"|"Revenge Wears Prada"|"Lauren Weisberger"
"ap 10:00"|ten|"How many times had she wanted to say that to Miranda, but instead she’d bitten her tongue and waited another hour, three, five? Miranda never felt guilty, though. Andy had regularly waited until ten, eleven o’clock at night, sometimes even midnight if the art department was running late with the Book. Now her own assistant was irritated at five P.M.?"|"Revenge Wears Prada"|"Lauren Weisberger"
23:00|"eleven o’clock at night"|"How many times had she wanted to say that to Miranda, but instead she’d bitten her tongue and waited another hour, three, five? Miranda never felt guilty, though. Andy had regularly waited until ten, eleven o’clock at night, sometimes even midnight if the art department was running late with the Book. Now her own assistant was irritated at five P.M.?"|"Revenge Wears Prada"|"Lauren Weisberger"
00:00|midnight|"How many times had she wanted to say that to Miranda, but instead she’d bitten her tongue and waited another hour, three, five? Miranda never felt guilty, though. Andy had regularly waited until ten, eleven o’clock at night, sometimes even midnight if the art department was running late with the Book. Now her own assistant was irritated at five P.M.?"|"Revenge Wears Prada"|"Lauren Weisberger"
17:00|"five P.M."|"How many times had she wanted to say that to Miranda, but instead she’d bitten her tongue and waited another hour, three, five? Miranda never felt guilty, though. Andy had regularly waited until ten, eleven o’clock at night, sometimes even midnight if the art department was running late with the Book. Now her own assistant was irritated at five P.M.?"|"Revenge Wears Prada"|"Lauren Weisberger"
20:00|"eight P.M."|"Andy worked without interruption for nearly two hours, reviewing the text for the two country singers, making notes about details that needed fleshing out or fact-checking. She was about to head to the art department to discuss the photography when Max called. She looked at the clock: eight P.M. He must have just landed in Boston."|"Revenge Wears Prada"|"Lauren Weisberger"
20:00|"eight o’clock in the evening"|"“This is she. May I ask who’s speaking?” Andy felt a wave of irritation. Who besides Max or Emily would be calling her at work at eight o’clock in the evening?"|"Revenge Wears Prada"|"Lauren Weisberger"
01:00|"one in the morning"|"Salvation came at one in the morning on the second night—ten o’clock Los Angeles time—in the form of a call from Olive’s publicist, who promised every which way that the wedding was back on. Neither Andy nor Emily believed her at first, but the girl, who sounded every bit as hysterical and exhausted as they felt, swore on her life and that of her firstborn that everything down to the doves they would be releasing at “I do” had been rescheduled for the following afternoon."|"Revenge Wears Prada"|"Lauren Weisberger"
"ap 10:00"|"ten o’clock"|"Salvation came at one in the morning on the second night—ten o’clock Los Angeles time—in the form of a call from Olive’s publicist, who promised every which way that the wedding was back on. Neither Andy nor Emily believed her at first, but the girl, who sounded every bit as hysterical and exhausted as they felt, swore on her life and that of her firstborn that everything down to the doves they would be releasing at “I do” had been rescheduled for the following afternoon."|"Revenge Wears Prada"|"Lauren Weisberger"
"ap 09:00"|nine|"“If you saw her face after they flew back to Santa Barbara on their helicopter, you’d be sure, too. Hair and makeup is scheduled to begin at nine. After that, it’s bridesmaids’ brunch at eleven, photos at two, ceremony at five, cocktails at six, reception from seven to midnight, afterparty until last man standing. Trust me, I’m sure.”"|"Revenge Wears Prada"|"Lauren Weisberger"
"ap 11:00"|eleven|"“If you saw her face after they flew back to Santa Barbara on their helicopter, you’d be sure, too. Hair and makeup is scheduled to begin at nine. After that, it’s bridesmaids’ brunch at eleven, photos at two, ceremony at five, cocktails at six, reception from seven to midnight, afterparty until last man standing. Trust me, I’m sure.”"|"Revenge Wears Prada"|"Lauren Weisberger"
"ap 02:00"|two|"“If you saw her face after they flew back to Santa Barbara on their helicopter, you’d be sure, too. Hair and makeup is scheduled to begin at nine. After that, it’s bridesmaids’ brunch at eleven, photos at two, ceremony at five, cocktails at six, reception from seven to midnight, afterparty until last man standing. Trust me, I’m sure.”"|"Revenge Wears Prada"|"Lauren Weisberger"
"ap 05:00"|five|"“If you saw her face after they flew back to Santa Barbara on their helicopter, you’d be sure, too. Hair and makeup is scheduled to begin at nine. After that, it’s bridesmaids’ brunch at eleven, photos at two, ceremony at five, cocktails at six, reception from seven to midnight, afterparty until last man standing. Trust me, I’m sure.”"|"Revenge Wears Prada"|"Lauren Weisberger"
"ap 06:00"|six|"“If you saw her face after they flew back to Santa Barbara on their helicopter, you’d be sure, too. Hair and makeup is scheduled to begin at nine. After that, it’s bridesmaids’ brunch at eleven, photos at two, ceremony at five, cocktails at six, reception from seven to midnight, afterparty until last man standing. Trust me, I’m sure.”"|"Revenge Wears Prada"|"Lauren Weisberger"
23:53|"seven to midnight"|"“If you saw her face after they flew back to Santa Barbara on their helicopter, you’d be sure, too. Hair and makeup is scheduled to begin at nine. After that, it’s bridesmaids’ brunch at eleven, photos at two, ceremony at five, cocktails at six, reception from seven to midnight, afterparty until last man standing. Trust me, I’m sure.”"|"Revenge Wears Prada"|"Lauren Weisberger"
"ap 11:00"|"eleven o’clock"|"The alarm blared. Disoriented, Andy rolled over to look at her clock and almost fell out of bed: eleven! How was it eleven o’clock?"|"Revenge Wears Prada"|"Lauren Weisberger"
"ap 00:30"|"twelve thirty"|"Had Miranda Priestly really hissed at her? The mommy group was great, but getting herself and the baby up and dressed for a brunch across town sounded about as appealing as a trip to the gynecologist right now. “Unfortunately, yes. The husband brunch. We’ve spent the last three-plus months divulging the intimate details of all our lives, including yours. Time to meet the subjects of our collective analysis.”
“Sounds terrific. You said it starts at twelve thirty?”
Andy nodded. She was about to tell him about the Miranda dinner when his phone rang."|"Revenge Wears Prada"|"Lauren Weisberger"
"~ 00:00"|"around midnight"|"Easier said than done. Although Andy managed to fall asleep around midnight, she woke at one wondering where Max was sleeping, at two figuring out how she would tell her parents and Jill, at three trying to envision what Barbara would say, at four thinking about Emily’s betrayal, at five asking herself how she would manage as a single mother, and at six for good, her tears dried up but her head pounding from lack of sleep and her mind racing with worst-case scenarios. Her entire skull ached, from the nape of her neck to the bones around her eye sockets, and her jaw was nearly locked closed with the pressure of grinding her teeth all night. She knew without looking in the mirror that her face and eyes would be splotchy and red, puffed enough to make her look sick or clinically depressed, neither of which was far from reality. Only scooping Clem from her crib and nuzzling her peach-fuzz hair calmed her; the sight of her daughter drinking ravenously from her bottle, the feel of the fleece-encased baby curled up in her arms, and the smell of her silky skin had to be the only things on earth that could have made Andy smile right then. She kissed her daughter, inhaled her delicious neck smell, and kissed her again."|"Revenge Wears Prada"|"Lauren Weisberger"
"ap 01:00"|one|"Easier said than done. Although Andy managed to fall asleep around midnight, she woke at one wondering where Max was sleeping, at two figuring out how she would tell her parents and Jill, at three trying to envision what Barbara would say, at four thinking about Emily’s betrayal, at five asking herself how she would manage as a single mother, and at six for good, her tears dried up but her head pounding from lack of sleep and her mind racing with worst-case scenarios. Her entire skull ached, from the nape of her neck to the bones around her eye sockets, and her jaw was nearly locked closed with the pressure of grinding her teeth all night. She knew without looking in the mirror that her face and eyes would be splotchy and red, puffed enough to make her look sick or clinically depressed, neither of which was far from reality. Only scooping Clem from her crib and nuzzling her peach-fuzz hair calmed her; the sight of her daughter drinking ravenously from her bottle, the feel of the fleece-encased baby curled up in her arms, and the smell of her silky skin had to be the only things on earth that could have made Andy smile right then. She kissed her daughter, inhaled her delicious neck smell, and kissed her again."|"Revenge Wears Prada"|"Lauren Weisberger"
"ap 02:00"|two|"Easier said than done. Although Andy managed to fall asleep around midnight, she woke at one wondering where Max was sleeping, at two figuring out how she would tell her parents and Jill, at three trying to envision what Barbara would say, at four thinking about Emily’s betrayal, at five asking herself how she would manage as a single mother, and at six for good, her tears dried up but her head pounding from lack of sleep and her mind racing with worst-case scenarios. Her entire skull ached, from the nape of her neck to the bones around her eye sockets, and her jaw was nearly locked closed with the pressure of grinding her teeth all night. She knew without looking in the mirror that her face and eyes would be splotchy and red, puffed enough to make her look sick or clinically depressed, neither of which was far from reality. Only scooping Clem from her crib and nuzzling her peach-fuzz hair calmed her; the sight of her daughter drinking ravenously from her bottle, the feel of the fleece-encased baby curled up in her arms, and the smell of her silky skin had to be the only things on earth that could have made Andy smile right then. She kissed her daughter, inhaled her delicious neck smell, and kissed her again."|"Revenge Wears Prada"|"Lauren Weisberger"
"ap 03:00"|three|"Easier said than done. Although Andy managed to fall asleep around midnight, she woke at one wondering where Max was sleeping, at two figuring out how she would tell her parents and Jill, at three trying to envision what Barbara would say, at four thinking about Emily’s betrayal, at five asking herself how she would manage as a single mother, and at six for good, her tears dried up but her head pounding from lack of sleep and her mind racing with worst-case scenarios. Her entire skull ached, from the nape of her neck to the bones around her eye sockets, and her jaw was nearly locked closed with the pressure of grinding her teeth all night. She knew without looking in the mirror that her face and eyes would be splotchy and red, puffed enough to make her look sick or clinically depressed, neither of which was far from reality. Only scooping Clem from her crib and nuzzling her peach-fuzz hair calmed her; the sight of her daughter drinking ravenously from her bottle, the feel of the fleece-encased baby curled up in her arms, and the smell of her silky skin had to be the only things on earth that could have made Andy smile right then. She kissed her daughter, inhaled her delicious neck smell, and kissed her again."|"Revenge Wears Prada"|"Lauren Weisberger"
"ap 04:00"|four|"Easier said than done. Although Andy managed to fall asleep around midnight, she woke at one wondering where Max was sleeping, at two figuring out how she would tell her parents and Jill, at three trying to envision what Barbara would say, at four thinking about Emily’s betrayal, at five asking herself how she would manage as a single mother, and at six for good, her tears dried up but her head pounding from lack of sleep and her mind racing with worst-case scenarios. Her entire skull ached, from the nape of her neck to the bones around her eye sockets, and her jaw was nearly locked closed with the pressure of grinding her teeth all night. She knew without looking in the mirror that her face and eyes would be splotchy and red, puffed enough to make her look sick or clinically depressed, neither of which was far from reality. Only scooping Clem from her crib and nuzzling her peach-fuzz hair calmed her; the sight of her daughter drinking ravenously from her bottle, the feel of the fleece-encased baby curled up in her arms, and the smell of her silky skin had to be the only things on earth that could have made Andy smile right then. She kissed her daughter, inhaled her delicious neck smell, and kissed her again."|"Revenge Wears Prada"|"Lauren Weisberger"
"ap 05:00"|five|"Easier said than done. Although Andy managed to fall asleep around midnight, she woke at one wondering where Max was sleeping, at two figuring out how she would tell her parents and Jill, at three trying to envision what Barbara would say, at four thinking about Emily’s betrayal, at five asking herself how she would manage as a single mother, and at six for good, her tears dried up but her head pounding from lack of sleep and her mind racing with worst-case scenarios. Her entire skull ached, from the nape of her neck to the bones around her eye sockets, and her jaw was nearly locked closed with the pressure of grinding her teeth all night. She knew without looking in the mirror that her face and eyes would be splotchy and red, puffed enough to make her look sick or clinically depressed, neither of which was far from reality. Only scooping Clem from her crib and nuzzling her peach-fuzz hair calmed her; the sight of her daughter drinking ravenously from her bottle, the feel of the fleece-encased baby curled up in her arms, and the smell of her silky skin had to be the only things on earth that could have made Andy smile right then. She kissed her daughter, inhaled her delicious neck smell, and kissed her again."|"Revenge Wears Prada"|"Lauren Weisberger"
"ap 06:00"|six|"Easier said than done. Although Andy managed to fall asleep around midnight, she woke at one wondering where Max was sleeping, at two figuring out how she would tell her parents and Jill, at three trying to envision what Barbara would say, at four thinking about Emily’s betrayal, at five asking herself how she would manage as a single mother, and at six for good, her tears dried up but her head pounding from lack of sleep and her mind racing with worst-case scenarios. Her entire skull ached, from the nape of her neck to the bones around her eye sockets, and her jaw was nearly locked closed with the pressure of grinding her teeth all night. She knew without looking in the mirror that her face and eyes would be splotchy and red, puffed enough to make her look sick or clinically depressed, neither of which was far from reality. Only scooping Clem from her crib and nuzzling her peach-fuzz hair calmed her; the sight of her daughter drinking ravenously from her bottle, the feel of the fleece-encased baby curled up in her arms, and the smell of her silky skin had to be the only things on earth that could have made Andy smile right then. She kissed her daughter, inhaled her delicious neck smell, and kissed her again."|"Revenge Wears Prada"|"Lauren Weisberger"
"ap 06:30"|"six thirty"|"When Andy’s phone rang at six thirty, she was perfectly content to ignore it, but she almost jumped out of her skin when the doorbell rang. Her first thought was Max, but she dismissed it immediately: no matter how intense the crisis they were experiencing, it was still his home and his daughter, and he would never, ever ring the doorbell. No one else she knew would even be awake at that hour, never mind showing up at her apartment, and if they were, the doorman would have called. Her heart beat a little faster. Was something wrong? Should she be nervous?"|"Revenge Wears Prada"|"Lauren Weisberger"
"ap 10:00"|ten|"“Hmm, no coffee. Do you want one too?” Emily didn’t wait for the answer; she grabbed a clean mug from the dishwasher, discarded the old coffee pod, selected and installed a new one, closed the lid, and hit “start,” all the while delivering an endless stream of chatter about an advertiser who called her at ten the previous night with a silly question."|"Revenge Wears Prada"|"Lauren Weisberger"
06:30|"six thirty in the morning"|"“Are you really here to tell me about the De Beers people? At six thirty in the morning?”"|"Revenge Wears Prada"|"Lauren Weisberger"
"ap 05:00"|"five o’clock"|"“I’m not sure that pizza at five o’clock with his brother and a kid are at the top of his list, but I’ll definitely ask him.”"|"Revenge Wears Prada"|"Lauren Weisberger"
