15:00|"3:00 p.m."|"In that week before Christmas, while the Delaney’s living room furniture was being pushed back to the walls, deal tables and folding chairs brought in, cots set up, and communications men were still fiddling with their equipment, including three extra telephone lines, a “council of war” was scheduled every afternoon at 3:00 p.m. It was held in the Captain’s study where the doors could be closed and locked. Attending were Captain Delaney, Lt. Jeri Fernandez, Detective first grade Ronald Blankenship, and Detective sergeant Thomas MacDonald. Delaney’s liquor cabinet was open or, if they preferred, there was cold beer or hot coffee from the kitchen."|"The First Deadly Sin"|"Lawrence Sanders"
"ap < 04:15"|"Almost 4:15"|"He looked at his watch. Almost 4:15; it was a long afternoon. He sighed, pulled himself to his feet, unlocked the study door to the living room, wandered in."|"The First Deadly Sin"|"Lawrence Sanders"
12:00|noon|"“When’s Blankenship coming back on?” he demanded.
“Tomorrow at noon, Captain. We’re splitting up because of Christmas.”
Delaney nodded. “Tell him, or leave a note for him, that I want to be informed immediately of any change in Danny Boy’s Time-Habit pattern. Got that?”"|"The First Deadly Sin"|"Lawrence Sanders"
16:00|"four in the afternoon"|"“When’s MacDonald due back?” Delaney asked.
“Tomorrow at four in the afternoon, Captain. We’re splitting—”
“I know, I know,” Delaney said testily. “Christmas. I want to leave a message for him.” The duty officer took up a pad and waited, pencil in hand. “Tell him I want a photograph of Detective Kope.”"|"The First Deadly Sin"|"Lawrence Sanders"
"< 19:00"|"Almost 7:00 p.m."|"He tramped back into his study, closed the doors. He looked at his watch. Almost 7:00 p.m. It was time. He looked at the list on his desk, then dialed the number of Daniel G. Blank. The phone rang and rang. No one answered. He walked back into the living room, over to the radio operator keeping the log."|"The First Deadly Sin"|"Lawrence Sanders"
"ap 03:00"|three|"Daniel Blank thought it had started two weeks ago. Or perhaps it was three; it was difficult to remember. But the garage attendant in his apartment house casually mentioned that an insurance examiner had been around, asking about Blank’s car."|"The First Deadly Sin"|"Lawrence Sanders"
12:00|noon|"By noon he had a rough timetable worked out; he was shocked at the number of men it required. The City of New York was spending a great deal of money to monitor the activities of Daniel G. Blank. That didn’t bother Delaney; the City spent more money for more frivolous projects. But the Captain was concerned about how long Thorsen, Johnson, et al., would give him a free hand and a limitless budget before screaming for results. Not too long, he thought grimly; perhaps another week."|"The First Deadly Sin"|"Lawrence Sanders"
12:00|noon|"Barbara seemed in a subdued mood, and answered his conversational offerings with a few words, a wan smile. He helped her with her noon meal and, that finished, just sat with her for another hour. He asked if she’d like him to read to her, but when she shook her head, he just sat stolidly, in silence, hoping his presence might be of some comfort, not daring to think of how long her illness would endure, or how it might end."|"The First Deadly Sin"|"Lawrence Sanders"
"ap 09:10"|"ten minutes after nine"|"“Captain, you asked to be informed of any erratic change in Danny Boy’s Time-Habit Pattern. Take a look at this.” Delaney leaned forward to follow Blankenship’s finger pointing out entries in the log. “This morning Danny Boy comes outside the White House at ten minutes after nine. Spotted by Bulldog One. Nine-ten is normal; he’s been leaving for work every day around nine-fifteen, give or take a few minutes. But this morning he doesn’t leave. According to Bulldog One, he turns around and goes right back into the White House. He comes out again almost an hour later. That means he just didn’t forget something—right? Okay … he gets a cab. Here it is: at almost ten a.m. Bulldog Two tails him. But he doesn’t go right to the Factory. His cab goes around and around Central Park for almost forty-five minutes. What a meter tab he must have had! Then, finally, he gets to his office. It’s close to eleven o’clock when Stryker calls to clock him in, almost two hours late. Captain, I realize this all might be a lot of crap. After all, it’s the day after Christmas, and Danny Boy might just be unwinding. But I thought you better know.”"|"The First Deadly Sin"|"Lawrence Sanders"
"ap 09:10"|Nine-ten|"“Captain, you asked to be informed of any erratic change in Danny Boy’s Time-Habit Pattern. Take a look at this.” Delaney leaned forward to follow Blankenship’s finger pointing out entries in the log. “This morning Danny Boy comes outside the White House at ten minutes after nine. Spotted by Bulldog One. Nine-ten is normal; he’s been leaving for work every day around nine-fifteen, give or take a few minutes. But this morning he doesn’t leave. According to Bulldog One, he turns around and goes right back into the White House. He comes out again almost an hour later. That means he just didn’t forget something—right? Okay … he gets a cab. Here it is: at almost ten a.m. Bulldog Two tails him. But he doesn’t go right to the Factory. His cab goes around and around Central Park for almost forty-five minutes. What a meter tab he must have had! Then, finally, he gets to his office. It’s close to eleven o’clock when Stryker calls to clock him in, almost two hours late. Captain, I realize this all might be a lot of crap. After all, it’s the day after Christmas, and Danny Boy might just be unwinding. But I thought you better know.”"|"The First Deadly Sin"|"Lawrence Sanders"
"ap ~ 09:15"|"around nine-fifteen"|"“Captain, you asked to be informed of any erratic change in Danny Boy’s Time-Habit Pattern. Take a look at this.” Delaney leaned forward to follow Blankenship’s finger pointing out entries in the log. “This morning Danny Boy comes outside the White House at ten minutes after nine. Spotted by Bulldog One. Nine-ten is normal; he’s been leaving for work every day around nine-fifteen, give or take a few minutes. But this morning he doesn’t leave. According to Bulldog One, he turns around and goes right back into the White House. He comes out again almost an hour later. That means he just didn’t forget something—right? Okay … he gets a cab. Here it is: at almost ten a.m. Bulldog Two tails him. But he doesn’t go right to the Factory. His cab goes around and around Central Park for almost forty-five minutes. What a meter tab he must have had! Then, finally, he gets to his office. It’s close to eleven o’clock when Stryker calls to clock him in, almost two hours late. Captain, I realize this all might be a lot of crap. After all, it’s the day after Christmas, and Danny Boy might just be unwinding. But I thought you better know.”"|"The First Deadly Sin"|"Lawrence Sanders"
"< 10:00"|"almost ten a.m."|"“Captain, you asked to be informed of any erratic change in Danny Boy’s Time-Habit Pattern. Take a look at this.” Delaney leaned forward to follow Blankenship’s finger pointing out entries in the log. “This morning Danny Boy comes outside the White House at ten minutes after nine. Spotted by Bulldog One. Nine-ten is normal; he’s been leaving for work every day around nine-fifteen, give or take a few minutes. But this morning he doesn’t leave. According to Bulldog One, he turns around and goes right back into the White House. He comes out again almost an hour later. That means he just didn’t forget something—right? Okay … he gets a cab. Here it is: at almost ten a.m. Bulldog Two tails him. But he doesn’t go right to the Factory. His cab goes around and around Central Park for almost forty-five minutes. What a meter tab he must have had! Then, finally, he gets to his office. It’s close to eleven o’clock when Stryker calls to clock him in, almost two hours late. Captain, I realize this all might be a lot of crap. After all, it’s the day after Christmas, and Danny Boy might just be unwinding. But I thought you better know.”"|"The First Deadly Sin"|"Lawrence Sanders"
"ap 11:00"|"eleven o’clock"|"“Captain, you asked to be informed of any erratic change in Danny Boy’s Time-Habit Pattern. Take a look at this.” Delaney leaned forward to follow Blankenship’s finger pointing out entries in the log. “This morning Danny Boy comes outside the White House at ten minutes after nine. Spotted by Bulldog One. Nine-ten is normal; he’s been leaving for work every day around nine-fifteen, give or take a few minutes. But this morning he doesn’t leave. According to Bulldog One, he turns around and goes right back into the White House. He comes out again almost an hour later. That means he just didn’t forget something—right? Okay … he gets a cab. Here it is: at almost ten a.m. Bulldog Two tails him. But he doesn’t go right to the Factory. His cab goes around and around Central Park for almost forty-five minutes. What a meter tab he must have had! Then, finally, he gets to his office. It’s close to eleven o’clock when Stryker calls to clock him in, almost two hours late. Captain, I realize this all might be a lot of crap. After all, it’s the day after Christmas, and Danny Boy might just be unwinding. But I thought you better know.”"|"The First Deadly Sin"|"Lawrence Sanders"
"ap 05:03"|five-three|"“Ronnie, this is Stryker, at the Factory. How you doing? Ronnie, I just came back from lunch with the cunt I been pushing down here. A little bony, but a wild piece. At lunch I got the talk around to Danny Boy. He was almost two hours late getting to work. This cunt of mine—she’s the outside receptionist in Danny Boy’s department—she told me that just before I met her for lunch, she was in the ladies’ john talking to Mrs. Cleek. That’s C-l-e-e-k. She’s Danny Boy’s personal secretary. A widow. First name Martha or Margaret. White, female, middle thirties, five-three, one-ten or thereabouts, dark brown hair, fair complexion, no visible scars, wears glasses all the time. Well, anyway, in the can, this Mrs. Cleek tells my cunt that Danny Boy was acting real queer this morning. Wouldn’t dictate or sign any letters. Wouldn’t read anything. Wouldn’t even answer any important phone calls. Probably a sack of shit, Ronnie—but I figured I better report it. If you think it’s important, I can cozy up to this Cleek dame and see what else I can find out. No problem; she’s hungry I can tell. Nice ass. Let me know if you want me to follow up on this. Stryker at the Factory, off.”"|"The First Deadly Sin"|"Lawrence Sanders"
"ap 01:10"|one-ten|"“Ronnie, this is Stryker, at the Factory. How you doing? Ronnie, I just came back from lunch with the cunt I been pushing down here. A little bony, but a wild piece. At lunch I got the talk around to Danny Boy. He was almost two hours late getting to work. This cunt of mine—she’s the outside receptionist in Danny Boy’s department—she told me that just before I met her for lunch, she was in the ladies’ john talking to Mrs. Cleek. That’s C-l-e-e-k. She’s Danny Boy’s personal secretary. A widow. First name Martha or Margaret. White, female, middle thirties, five-three, one-ten or thereabouts, dark brown hair, fair complexion, no visible scars, wears glasses all the time. Well, anyway, in the can, this Mrs. Cleek tells my cunt that Danny Boy was acting real queer this morning. Wouldn’t dictate or sign any letters. Wouldn’t read anything. Wouldn’t even answer any important phone calls. Probably a sack of shit, Ronnie—but I figured I better report it. If you think it’s important, I can cozy up to this Cleek dame and see what else I can find out. No problem; she’s hungry I can tell. Nice ass. Let me know if you want me to follow up on this. Stryker at the Factory, off.”"|"The First Deadly Sin"|"Lawrence Sanders"
13:30|"1:30 p.m."|"The newspaperman’s report was fluid and concise. He had arrived precisely at 1:30 p.m., the time previously arranged for the interview by Javis-Bircham’s Director of Public Relations. But Blank had kept him waiting almost a half-hour. It was only after two requests to Blank’s secretary that Handry had been allowed into the inner office."|"The First Deadly Sin"|"Lawrence Sanders"
"ap 09:00"|9:00|"For instance, this morning, completely unable to get to work at his usual hour, he sat stiffly in his living room, dressed for a normal day at Javis-Bircham. And between 9:00 and 11:00 a.m., he rose from his chair at least three times to check the locks and bolts on the front door. They were fastened—he knew they were fastened—but he had to check. Three times."|"The First Deadly Sin"|"Lawrence Sanders"
11:00|"11:00 a.m."|"For instance, this morning, completely unable to get to work at his usual hour, he sat stiffly in his living room, dressed for a normal day at Javis-Bircham. And between 9:00 and 11:00 a.m., he rose from his chair at least three times to check the locks and bolts on the front door. They were fastened—he knew they were fastened—but he had to check. Three times."|"The First Deadly Sin"|"Lawrence Sanders"
"< 12:00"|"Near noon"|"Near noon, Mrs. Cleek came in and found him weeping at his desk, head bent forward, palms gripping his temples. Her eyes blurred immediately with sympathy."|"The First Deadly Sin"|"Lawrence Sanders"
18:00|"6:00 p.m."|"It was early in the evening. Was it 6:00 p.m.? It might be eight. He didn’t want to look at his watch bracelet. He wasn’t sure he could trust it. Perhaps it might not be his own faulty time sense; it might be his wristwatch running wild. Or time itself running wild."|"The First Deadly Sin"|"Lawrence Sanders"
11:30|"11:30 a.m."|"It was good; everything was good. He had no sooner returned to his home when Blankenship came in to display Danny Boy’s Time-Habit Pattern. It was very erratic indeed: Arrived at the Factory at 11:30 a.m. Skipped lunch completely. Took a long zigzag walk along the docks. Sat on a wharf for almost an hour—“Just watching the turds float by” according to the man tailing him. Report from Stryker: He had taken Mrs. Cleek to lunch, and she told him she had found Danny Boy weeping in his office, and he had told her there had been a death in the family. Danny Boy returned to the White House at 2:03 p.m."|"The First Deadly Sin"|"Lawrence Sanders"
14:03|"2:03 p.m."|"It was good; everything was good. He had no sooner returned to his home when Blankenship came in to display Danny Boy’s Time-Habit Pattern. It was very erratic indeed: Arrived at the Factory at 11:30 a.m. Skipped lunch completely. Took a long zigzag walk along the docks. Sat on a wharf for almost an hour—“Just watching the turds float by” according to the man tailing him. Report from Stryker: He had taken Mrs. Cleek to lunch, and she told him she had found Danny Boy weeping in his office, and he had told her there had been a death in the family. Danny Boy returned to the White House at 2:03 p.m."|"The First Deadly Sin"|"Lawrence Sanders"
"ap 04:00"|four|"“Fine,” the Captain nodded, handing the log back to Blankenship. “Keep at it. Is Fernandez on?”
“Comes on at four, Captain.”
“Ask him to stop by to see me, will you?”"|"The First Deadly Sin"|"Lawrence Sanders"
19:00|"7:00 p.m."|"After Blankenship left, Delaney closed all the doors to his study, paced slowly around the room, head bowed. “A death in the family.” That was nice. He paused to call Monica Gilbert and ask if he could come over to see her that evening. She invited him for dinner but he begged off; they arranged that he would come over at 7:00 p.m. He told her it would only be for a few minutes; she didn’t ask the reason. Her girls were home from school during the holiday week so, she explained, she hadn’t been able to visit Barbara as much as she wanted to, but would try to get there the following afternoon. He thanked her."|"The First Deadly Sin"|"Lawrence Sanders"
"ap 08:00"|eight|"“No sweat, Captain. I’ll get on it right away.”
“Good. Put your first men on at eight tonight. Not before.”
Fernandez nodded. “Captain …”"|"The First Deadly Sin"|"Lawrence Sanders"
14:03|"2:03 p.m."|"Later that evening Delaney went into the living room to inspect the log. Danny Boy had returned to the White House at 2:03 p.m. At 5:28 p.m., he had called the Princess in the Castle, hung up abruptly after speaking only a few minutes and then, at 5:47 p.m., had taken a cab to the Castle. He was still inside as of that moment, reported by Bulldog Three."|"The First Deadly Sin"|"Lawrence Sanders"
17:28|"5:28 p.m."|"Later that evening Delaney went into the living room to inspect the log. Danny Boy had returned to the White House at 2:03 p.m. At 5:28 p.m., he had called the Princess in the Castle, hung up abruptly after speaking only a few minutes and then, at 5:47 p.m., had taken a cab to the Castle. He was still inside as of that moment, reported by Bulldog Three."|"The First Deadly Sin"|"Lawrence Sanders"
17:47|"5:47 p.m."|"Later that evening Delaney went into the living room to inspect the log. Danny Boy had returned to the White House at 2:03 p.m. At 5:28 p.m., he had called the Princess in the Castle, hung up abruptly after speaking only a few minutes and then, at 5:47 p.m., had taken a cab to the Castle. He was still inside as of that moment, reported by Bulldog Three."|"The First Deadly Sin"|"Lawrence Sanders"
"ap 05:28"|"five twenty-eight"|"“Did you get a tape of Danny Boy’s call to the Castle at five twenty-eight?”"|"The First Deadly Sin"|"Lawrence Sanders"
19:00|"7:00 p.m."|"But when he arrived at 7:00 p.m., the children were still awake, but in their nightgowns, and he had to play with them, inspect their Christmas gifts, accept a cup of coffee. The atmosphere was relaxed, warm, pleasant, domestic—all wrong for his purpose. He was glad when Monica packed the girls off to bed."|"The First Deadly Sin"|"Lawrence Sanders"
12:00|"high noon"|"“Oh yes,” he said, tasting the bile bubbling up. “Despicable. Oh yes. But Blank, he’s a poor, sick lad—right? Right? Smashed your husband’s skull in, but it’s Be Nice to Blank Week. Right? Let me tell you—let me tell you—” He was stuttering now in his passion to get it out. “He’s dead. You understand that? Daniel G. Blank is a dead man. Right now. You think—you think I’m going to let him walk away from this just because the law … You think I’m going to shrug, turn away, and give up? I tell you, he’s dead! There’s no way, no way, he can get away from me. If I have to blow his brains out with my service revolver at high noon on Fifth Avenue, I’ll do it. Do it! And wait right there for them to come and take me away. I don’t care. The man is dead! Can’t you get that through your skull? If you won’t help me, I’ll do it another way. No matter what you do, it doesn’t matter, doesn’t matter. He’s gone. He’s just gone.”"|"The First Deadly Sin"|"Lawrence Sanders"
07:18|"7:18 a.m."|"He thought, his mind churning, that he might be awake forever, staring at the darkness and wondering. But curiously, he fell asleep almost instantly: a deep, dreamless slumber, more coma than sleep, heavy and depressing. He awoke at 7:18 a.m. the next morning, sodden with weariness. His eyelids were stuck shut; he realized he had wept during the night."|"The First Deadly Sin"|"Lawrence Sanders"
14:18|"2:18 p.m."|"He roused early in the afternoon, looked at his watch; it seemed to be 2:18 p.m. That was possible; he was willing to accept it. He thought vaguely that he should get out, take a walk, get some fresh air."|"The First Deadly Sin"|"Lawrence Sanders"
09:00|"9:00 a.m."|"There was no report of any activity from Danny Boy at 9:00 a.m., 9:15, 9:30, 9:45, 10:00. Early on when the vigil was first established, they had discovered a back entrance to Blank’s apartment house, a seldom-used service door that opened onto a walk leading to 82nd Street. An unmarked car, with one man, was positioned there, in full view of this back exit, with orders to report in every fifteen minutes. This unit was coded Bulldog 10, but was familiarly known as Ten-0. Now, as Delaney passed back and forth through the radio room, he heard the reports from Ten-0 and from Bulldog One, the Con Ed van parked on the street in front of the White House."|"The First Deadly Sin"|"Lawrence Sanders"
"ap 09:15"|9:15|"There was no report of any activity from Danny Boy at 9:00 a.m., 9:15, 9:30, 9:45, 10:00. Early on when the vigil was first established, they had discovered a back entrance to Blank’s apartment house, a seldom-used service door that opened onto a walk leading to 82nd Street. An unmarked car, with one man, was positioned there, in full view of this back exit, with orders to report in every fifteen minutes. This unit was coded Bulldog 10, but was familiarly known as Ten-0. Now, as Delaney passed back and forth through the radio room, he heard the reports from Ten-0 and from Bulldog One, the Con Ed van parked on the street in front of the White House."|"The First Deadly Sin"|"Lawrence Sanders"
"ap 09:30"|9:30|"There was no report of any activity from Danny Boy at 9:00 a.m., 9:15, 9:30, 9:45, 10:00. Early on when the vigil was first established, they had discovered a back entrance to Blank’s apartment house, a seldom-used service door that opened onto a walk leading to 82nd Street. An unmarked car, with one man, was positioned there, in full view of this back exit, with orders to report in every fifteen minutes. This unit was coded Bulldog 10, but was familiarly known as Ten-0. Now, as Delaney passed back and forth through the radio room, he heard the reports from Ten-0 and from Bulldog One, the Con Ed van parked on the street in front of the White House."|"The First Deadly Sin"|"Lawrence Sanders"
"ap 09:45"|9:45|"There was no report of any activity from Danny Boy at 9:00 a.m., 9:15, 9:30, 9:45, 10:00. Early on when the vigil was first established, they had discovered a back entrance to Blank’s apartment house, a seldom-used service door that opened onto a walk leading to 82nd Street. An unmarked car, with one man, was positioned there, in full view of this back exit, with orders to report in every fifteen minutes. This unit was coded Bulldog 10, but was familiarly known as Ten-0. Now, as Delaney passed back and forth through the radio room, he heard the reports from Ten-0 and from Bulldog One, the Con Ed van parked on the street in front of the White House."|"The First Deadly Sin"|"Lawrence Sanders"
"ap 10:00"|10:00|"There was no report of any activity from Danny Boy at 9:00 a.m., 9:15, 9:30, 9:45, 10:00. Early on when the vigil was first established, they had discovered a back entrance to Blank’s apartment house, a seldom-used service door that opened onto a walk leading to 82nd Street. An unmarked car, with one man, was positioned there, in full view of this back exit, with orders to report in every fifteen minutes. This unit was coded Bulldog 10, but was familiarly known as Ten-0. Now, as Delaney passed back and forth through the radio room, he heard the reports from Ten-0 and from Bulldog One, the Con Ed van parked on the street in front of the White House."|"The First Deadly Sin"|"Lawrence Sanders"
"ap 10:15"|10:15|"10:15, nothing, 10:30, nothing. No report of Danny Boy at 10:45, 11:00, 11:15, 11:30. Shortly before 12:00, Delaney went into his study and called Blank’s apartment. The phone rang and rang, but there was no answer. He hung up; he was worried."|"The First Deadly Sin"|"Lawrence Sanders"
"ap 10:30"|10:30|"10:15, nothing, 10:30, nothing. No report of Danny Boy at 10:45, 11:00, 11:15, 11:30. Shortly before 12:00, Delaney went into his study and called Blank’s apartment. The phone rang and rang, but there was no answer. He hung up; he was worried."|"The First Deadly Sin"|"Lawrence Sanders"
"ap 10:45"|10:45|"10:15, nothing, 10:30, nothing. No report of Danny Boy at 10:45, 11:00, 11:15, 11:30. Shortly before 12:00, Delaney went into his study and called Blank’s apartment. The phone rang and rang, but there was no answer. He hung up; he was worried."|"The First Deadly Sin"|"Lawrence Sanders"
"ap 11:00"|11:00|"10:15, nothing, 10:30, nothing. No report of Danny Boy at 10:45, 11:00, 11:15, 11:30. Shortly before 12:00, Delaney went into his study and called Blank’s apartment. The phone rang and rang, but there was no answer. He hung up; he was worried."|"The First Deadly Sin"|"Lawrence Sanders"
"ap 11:15"|11:15|"10:15, nothing, 10:30, nothing. No report of Danny Boy at 10:45, 11:00, 11:15, 11:30. Shortly before 12:00, Delaney went into his study and called Blank’s apartment. The phone rang and rang, but there was no answer. He hung up; he was worried."|"The First Deadly Sin"|"Lawrence Sanders"
"ap 11:30"|11:30|"10:15, nothing, 10:30, nothing. No report of Danny Boy at 10:45, 11:00, 11:15, 11:30. Shortly before 12:00, Delaney went into his study and called Blank’s apartment. The phone rang and rang, but there was no answer. He hung up; he was worried."|"The First Deadly Sin"|"Lawrence Sanders"
"ap < 00:00"|"Shortly before 12:00"|"10:15, nothing, 10:30, nothing. No report of Danny Boy at 10:45, 11:00, 11:15, 11:30. Shortly before 12:00, Delaney went into his study and called Blank’s apartment. The phone rang and rang, but there was no answer. He hung up; he was worried."|"The First Deadly Sin"|"Lawrence Sanders"
