"ap 09:00"|"nine o’clock"|"THE FOLLOWING MORNING HE was having breakfast—a small glass of apple juice, a bowl of organic cereal with skim milk, a cup of black coffee—when the nine o’clock news came on the kitchen-radio and a toneless voice announced the murder of Detective third grade Roger Kope on East 75th Street the previous midnight. Kope had been promoted from uniformed patrolman only two weeks previously. He left a widow and three small children. Deputy Commissioner Broughton, in charge of the investigation, stated several important leads were being followed up, and he hoped to make an important statement on the case shortly."|"The First Deadly Sin"|"Lawrence Sanders"
00:00|midnight|"THE FOLLOWING MORNING HE was having breakfast—a small glass of apple juice, a bowl of organic cereal with skim milk, a cup of black coffee—when the nine o’clock news came on the kitchen-radio and a toneless voice announced the murder of Detective third grade Roger Kope on East 75th Street the previous midnight. Kope had been promoted from uniformed patrolman only two weeks previously. He left a widow and three small children. Deputy Commissioner Broughton, in charge of the investigation, stated several important leads were being followed up, and he hoped to make an important statement on the case shortly."|"The First Deadly Sin"|"Lawrence Sanders"
23:30|"11:30 p.m."|"The key, he reasoned, might be the time factor. His three killings had all taken place between 11:30 p.m. and 12:30 a.m. The police would be aware of this, of course, and all officers warned to be especially alert during the midnight hour. They might be less vigilant before and after. He needed every advantage he could find."|"The First Deadly Sin"|"Lawrence Sanders"
00:30|"12:30 a.m."|"The key, he reasoned, might be the time factor. His three killings had all taken place between 11:30 p.m. and 12:30 a.m. The police would be aware of this, of course, and all officers warned to be especially alert during the midnight hour. They might be less vigilant before and after. He needed every advantage he could find."|"The First Deadly Sin"|"Lawrence Sanders"
19:00|"seven p.m."|"He decided on an earlier time. It was the Christmas shopping season. It was dark by seven p.m., but the stores were open until nine, and even at ten o’clock people were scurrying home, laden with parcels and bundles. After 12:30 the streets were almost deserted except for the decoys and uniformed patrols. Neighborhood residents had read the newspaper reports following Kope’s death; few ventured out after midnight. Yes, earlier would be best: any time from nine to ten-thirty. Mountain climbers judged carefully the odds and percentages; they were not deliberate suicides."|"The First Deadly Sin"|"Lawrence Sanders"
"ap 09:00"|nine|"He decided on an earlier time. It was the Christmas shopping season. It was dark by seven p.m., but the stores were open until nine, and even at ten o’clock people were scurrying home, laden with parcels and bundles. After 12:30 the streets were almost deserted except for the decoys and uniformed patrols. Neighborhood residents had read the newspaper reports following Kope’s death; few ventured out after midnight. Yes, earlier would be best: any time from nine to ten-thirty. Mountain climbers judged carefully the odds and percentages; they were not deliberate suicides."|"The First Deadly Sin"|"Lawrence Sanders"
"ap 10:00"|"ten o’clock"|"He decided on an earlier time. It was the Christmas shopping season. It was dark by seven p.m., but the stores were open until nine, and even at ten o’clock people were scurrying home, laden with parcels and bundles. After 12:30 the streets were almost deserted except for the decoys and uniformed patrols. Neighborhood residents had read the newspaper reports following Kope’s death; few ventured out after midnight. Yes, earlier would be best: any time from nine to ten-thirty. Mountain climbers judged carefully the odds and percentages; they were not deliberate suicides."|"The First Deadly Sin"|"Lawrence Sanders"
"ap > 00:30"|"After 12:30"|"He decided on an earlier time. It was the Christmas shopping season. It was dark by seven p.m., but the stores were open until nine, and even at ten o’clock people were scurrying home, laden with parcels and bundles. After 12:30 the streets were almost deserted except for the decoys and uniformed patrols. Neighborhood residents had read the newspaper reports following Kope’s death; few ventured out after midnight. Yes, earlier would be best: any time from nine to ten-thirty. Mountain climbers judged carefully the odds and percentages; they were not deliberate suicides."|"The First Deadly Sin"|"Lawrence Sanders"
"> 00:00"|"after midnight"|"He decided on an earlier time. It was the Christmas shopping season. It was dark by seven p.m., but the stores were open until nine, and even at ten o’clock people were scurrying home, laden with parcels and bundles. After 12:30 the streets were almost deserted except for the decoys and uniformed patrols. Neighborhood residents had read the newspaper reports following Kope’s death; few ventured out after midnight. Yes, earlier would be best: any time from nine to ten-thirty. Mountain climbers judged carefully the odds and percentages; they were not deliberate suicides."|"The First Deadly Sin"|"Lawrence Sanders"
"ap 10:30"|ten-thirty|"He decided on an earlier time. It was the Christmas shopping season. It was dark by seven p.m., but the stores were open until nine, and even at ten o’clock people were scurrying home, laden with parcels and bundles. After 12:30 the streets were almost deserted except for the decoys and uniformed patrols. Neighborhood residents had read the newspaper reports following Kope’s death; few ventured out after midnight. Yes, earlier would be best: any time from nine to ten-thirty. Mountain climbers judged carefully the odds and percentages; they were not deliberate suicides."|"The First Deadly Sin"|"Lawrence Sanders"
"ap 11:00"|11:00|"The shoppers were thinning out; those still on the streets were hurrying homeward, packages under their arms or shopping bags swinging. Blank imitated their appearance: his two Christmas presents under one arm, his head and shoulders slightly bent against the cruel wind. But his eyes flicked everywhere. If he couldn’t finish his business before 11:00, he would give it up for another night; he was determined on that."|"The First Deadly Sin"|"Lawrence Sanders"
"ap < 10:30"|"almost 10:30"|"He would not be frustrated and tried to keep his rage under control. But still … what were they doing to him? He pulled his left wrist far enough from his coat pocket to read the time under a street lamp. It was almost 10:30. Not much left. Then he’d have to let it go for another night. But he couldn’t. Couldn’t. The fever was in his blood, blazing. The hell with … Damn the … Fix bayonets, lads, and over … Now or … It had to be. His luck was so good. A winning streak. Always ride a winning streak."|"The First Deadly Sin"|"Lawrence Sanders"
"ap 10:00"|"ten o’clock"|"“Impossible,” Morgenthau interrupted sharply. “I have patients until ten o’clock tonight. And then I must—”"|"The First Deadly Sin"|"Lawrence Sanders"
"ap 10:00"|"ten o’clock"|"“Be here promptly at ten o’clock. Then I will give you fifteen minutes. No more.”"|"The First Deadly Sin"|"Lawrence Sanders"
"~ 12:00"|"about noon"|"So he now had two more shipments of itemized sales checks for Calvin Case and another mailing list for Monica Gilbert. He decided to tackle Case first. He called, then subwayed down about noon."|"The First Deadly Sin"|"Lawrence Sanders"
"ap 01:16"|116|"IT BEGAN TO COME together. Slowly. What he had set in motion. The first report on the 116 names came from the New York State Department of Motor Vehicles: a neatly folded computer printout, an original and six copies. Delaney took a quick look, noted there were 11 individuals listed, tore off a carbon for his own file, and took the report over to Monica Gilbert. He explained what he wanted:"|"The First Deadly Sin"|"Lawrence Sanders"
09:00|"9:00 a.m."|"He waited until 9:00 a.m., then began his rounds, speaking only to doormen, supers, landlords, neighbors …"|"The First Deadly Sin"|"Lawrence Sanders"
13:00|"1:00 p.m."|"Mary had left a note that Mrs. Gilbert had called, and would the Captain please call her back. So he did, immediately, and there was no coolness in her voice he could detect. She told him she had completed noting all the reported criminal records in her master file, and had attached appropriately colored plastic tabs. He asked her if she’d care to have lunch with him at 1:00 p.m. the following day, and she accepted promptly."|"The First Deadly Sin"|"Lawrence Sanders"
"> 22:00"|"a little after ten that evening"|"He got home a little after ten that evening, his feet aching (he had not worn his “cop shoes”), and so soured with frustration that he whistled and thought of daffodils—anything to keep from brooding on false leads and time wasted. He soaked under a hot shower and washed his hair. That made him feel a little better. He pulled on pajamas, robe, slippers, and went down to the study."|"The First Deadly Sin"|"Lawrence Sanders"
00:00|midnight|"He stolidly wrote out reports on all his activities and added them to his files. Then he made his nightly tour of inspection, trying locks on all windows and outside doors. Lights out and up to bed. It wasn’t midnight, but he was weary. He was really getting too old for this kind of nonsense. No pill tonight. Blessed sleep would come easily."|"The First Deadly Sin"|"Lawrence Sanders"
12:00|noon|"He went directly to the hospital, helped feed Barbara her noon meal, and then read to her for almost an hour from “Honey Bunch: Her First Little Garden.” Strangely, the reading soothed him as much as it did her, and when he returned home he was in a somber but not depressed mood—a mood to work steadily without questioning the why’s or wherefore’s."|"The First Deadly Sin"|"Lawrence Sanders"
"> 12:00"|"past noon"|"He finally found what he was looking for: two stacks of relatively fresh cardboard cartons containing the last year’s garbage from the detective squad’s files. Each carton held folders in alphabetical order, but the cartons themselves were stacked helter-skelter, and Delaney spent almost an hour organizing them. It was then past noon, and he sat down on a nailed wooden crate (painted on the top: “Hold for Capt. Kelly”) and ate one of his sandwiches, spiced salami and thickly sliced Spanish onion on rye bread thinly spread with mayonnaise—which he dearly loved—and drank half his thermos of coffee."|"The First Deadly Sin"|"Lawrence Sanders"
"< 19:00"|"nearly 7:00 p.m."|"When he finished the last file in the last cardboard carton, it was nearly 7:00 p.m. He had long ago finished his second sandwich and the remainder of his coffee. But he wasn’t hungry; just thirsty. His nostrils and throat seemed caked with dust, but the radiator had never stopped clanking, hissing steam and water, and his shirt was plastered to armpits, chest, and back; he could smell his own sweat."|"The First Deadly Sin"|"Lawrence Sanders"
"ap < 11:00"|"toward eleven o’clock"|"He got the number and thanked her. It was now getting on toward eleven o’clock; he wondered if he should try or let it go till morning. He dialed the number. Blankenship had checked in all right, but he wasn’t on the premises. Delaney left his number, without identifying himself, and asked if the operator would have him call back."|"The First Deadly Sin"|"Lawrence Sanders"
"ap 05:10"|five-ten|"“Tall?”
“Tall? I’d guess five-ten or eleven.”
“Weight?”"|"The First Deadly Sin"|"Lawrence Sanders"
08:00|"8:00 a.m."|"HIS BEDSIDE ALARM WENT off at 8:00 a.m. He slapped it silent, swung his legs out from under the blankets, donned his glasses, consulted a slip of paper he had left under the phone. He called Thomas Handry at home. The phone rang eight times. He was about to give up when Handry answered."|"The First Deadly Sin"|"Lawrence Sanders"
12:00|noon|"“Well, we have some left over from last year—about twenty, I think—and they’re in the bottom drawer of the secretary in the living room. Now if you buy another three boxes, I’m sure it’ll be enough. Are you coming over today?”
“Yes. Definitely. At noon.”
“Well, bring the cards and the list. You know where the list is, don’t you?”"|"The First Deadly Sin"|"Lawrence Sanders"
12:00|noon|"“Detective!” she giggled. “Yes, that’s where it is. Bring the list and cards over at noon. I feel very good today. I’ll start writing them. I won’t try to do them all today, but I should have them finished up in two or three days, and they’ll get there in time.”"|"The First Deadly Sin"|"Lawrence Sanders"
12:00|noon|"“Yes, I’ll need stamps. Get a roll of a hundred. A roll is easier to handle. I make such a mess of a sheet. Oh Edward, I’m sorry … I forgot to ask. Did you find anything in the old files?”
“I’ll tell you all about it when I see you at noon.”
“Does it look good?”"|"The First Deadly Sin"|"Lawrence Sanders"
"> 09:00"|"a little past 9:00 a.m."|"He hung up and glanced at his watch. It was a little past 9:00 a.m., later than he wanted it to be. He dug hurriedly through his pack of business cards and found the one he was looking for: Arthur K. Ames. Automobile Insurance."|"The First Deadly Sin"|"Lawrence Sanders"
12:00|noon|"He got over to the hospital as Barbara’s noon meal was being served and he watched, beaming, as she ate almost all of it, feeding herself. She really was getting better, he told himself happily. Then he showed her the Christmas cards he had purchased, in three different price ranges; the most expensive for their “important” friends and acquaintances, the least expensive for—well, for people. And the twenty cards left over from last year, the list, the stamps."|"The First Deadly Sin"|"Lawrence Sanders"
"< 23:00"|"almost 11:00 p.m."|"He worked on his records and files till almost 11:00 p.m., then judged the time was right to call Charles Lipsky. He looked up the apartment house number and called from his study phone."|"The First Deadly Sin"|"Lawrence Sanders"
"ap 04:00"|four|"“Well, I get off tomorrow morning at four. I usually stop by this, luncheonette on Second and Eighty-fifth for coffee before I go home. It’s open twenty-four hours a day, but it’s usually empty at that hour except for some hackies and hookers.”"|"The First Deadly Sin"|"Lawrence Sanders"
"ap ~ 04:15"|"About four-fifteen"|"“Second Avenue and Eighty-fifth,” he repeated. “About four-fifteen, four-thirty tomorrow morning?”"|"The First Deadly Sin"|"Lawrence Sanders"
"ap 04:30"|four-thirty|"“Second Avenue and Eighty-fifth,” he repeated. “About four-fifteen, four-thirty tomorrow morning?”"|"The First Deadly Sin"|"Lawrence Sanders"
03:30|"3:30 a.m."|"He went immediately to bed, setting his alarm for 3:30 a.m. Thankfully, he fell asleep within half an hour, even as he was rehearsing in his mind how to handle Lipsky and what questions to ask."|"The First Deadly Sin"|"Lawrence Sanders"
"ap > 04:00"|"a few minutes after four"|"Delaney was early, a few minutes after four. When he entered, talk ceased, heads swivelled to inspect him. Apparently he didn’t look like a holdup man; when he ordered black coffee and two sugared doughnuts, the other customers went back to their food and talk."|"The First Deadly Sin"|"Lawrence Sanders"
12:00|noon|"“I ain’t got much time,” Lipsky said in his low, whiny voice. “I start on days again at noon.” He shoveled pie into his surprisingly prim little mouth. “So I got to get home and catch a few hours of shuteye. Then back on the door again at twelve.”"|"The First Deadly Sin"|"Lawrence Sanders"
"ap 00:00"|twelve|"“I ain’t got much time,” Lipsky said in his low, whiny voice. “I start on days again at noon.” He shoveled pie into his surprisingly prim little mouth. “So I got to get home and catch a few hours of shuteye. Then back on the door again at twelve.”"|"The First Deadly Sin"|"Lawrence Sanders"
"ap 01:20"|one-twenty|"“About eighteen,” Delaney said smoothly. “Long blonde hair. About five-four or five. Maybe one-twenty. Blue eyes. Peaches-and-cream complexion. Big jugs.”"|"The First Deadly Sin"|"Lawrence Sanders"
"ap ~ 11:00"|"About eleven"|"“Yeah. About eleven, twelve. Around there. Pretty enough to be a girl. I heard Blank call him Tony.”"|"The First Deadly Sin"|"Lawrence Sanders"
12:00|noon|"“Cleaning woman?”
“Two days a week. But she comes early and she’s out by noon.”
“So … what’s the problem? It’ll take me an hour. No more, I swear. Would anyone miss the keys?”"|"The First Deadly Sin"|"Lawrence Sanders"
15:00|"three in the afternoon"|"“So there you are. I come into the lobby. You’ve already got the keys off the board. You slip them to me. I’m up and down in an hour. Probably less. I pass the keys back to you. You replace them. You’re going on duty days starting today—right? So we make it about two or three in the afternoon. Right?”"|"The First Deadly Sin"|"Lawrence Sanders"
14:30|"two-thirty this afternoon"|"“A guess,” Delaney shrugged. He passed twenty under the table to the doorman. “I’ll see you at two-thirty this afternoon. What’s the apartment number?”"|"The First Deadly Sin"|"Lawrence Sanders"
"ap < 11:30"|"almost 11:30"|"He worked on his reports until Mary arrived. She fixed him coffee, dry toast, a soft-boiled egg. No grease. After breakfast, he went into the living room, pulled the shades, took off his shoes and jacket, unbuttoned his vest. He lay down on the couch, intending to nap for only an hour. But when he awoke, it was almost 11:30, and he was angry at himself for time wasted."|"The First Deadly Sin"|"Lawrence Sanders"
"ap 02:30"|2:30|"At 2:30, Captain Delaney walked steadily up the driveway, pushed through the lobby door. Lipsky saw him almost at once. His face was pale, sheeny with sweat. His hand dipped into his lefthand jacket pocket. Brainless idiot, Delaney thought mournfully. The whole idea had been to transfer the keys during a normal handshake. Well, it couldn’t be helped now …"|"The First Deadly Sin"|"Lawrence Sanders"
16:00|16|"Both men removed their hats. They rode up in silence. The magazine reader got off at 16. The woman with the shopping bag got off at 21. Delaney rode up to 24 and stepped out. He killed a few minutes pinpointing the direction of apartment H, assuming it was in the same location on every floor."|"The First Deadly Sin"|"Lawrence Sanders"
21:00|21|"Both men removed their hats. They rode up in silence. The magazine reader got off at 16. The woman with the shopping bag got off at 21. Delaney rode up to 24 and stepped out. He killed a few minutes pinpointing the direction of apartment H, assuming it was in the same location on every floor."|"The First Deadly Sin"|"Lawrence Sanders"
00:00|midnight|"Similarly, hanging from the rod, summer clothing on the left, winter on the right. The summer suits were bagged in clear plastic, jackets on wooden hangers, trousers suspended from their cuffs on clamps. The uncovered winter suits were almost all black or midnight blue. There was a suede sports jacket, a tartan, a modest hound’s tooth. Four pairs of slacks: two grey flannel, one tartan, one a bottle-green suede. Two silk dressing gowns, one in a bird print, one with purple orchids."|"The First Deadly Sin"|"Lawrence Sanders"
"ap 06:00"|"six o’clock"|"Thorsen was silent a minute. Then: “Will it wait till six o’clock? There’s another meeting with the Commissioner at seven, but I’ll be able to see you at six. Can it hold till then?”"|"The First Deadly Sin"|"Lawrence Sanders"
"ap 07:00"|seven|"Thorsen was silent a minute. Then: “Will it wait till six o’clock? There’s another meeting with the Commissioner at seven, but I’ll be able to see you at six. Can it hold till then?”"|"The First Deadly Sin"|"Lawrence Sanders"
"ap 06:00"|six|"Thorsen was silent a minute. Then: “Will it wait till six o’clock? There’s another meeting with the Commissioner at seven, but I’ll be able to see you at six. Can it hold till then?”"|"The First Deadly Sin"|"Lawrence Sanders"
"ap 06:00"|"six o’clock"|"Thorsen was silent a minute. Then: “Will it wait till six o’clock? There’s another meeting with the Commissioner at seven, but I’ll be able to see you at six. Can it hold till then?”
Delaney thought. “All right. Six o’clock. Where?”
“Uptown. The seven o’clock meeting’s at the Mansion. Better make it my house at six.”"|"The First Deadly Sin"|"Lawrence Sanders"
"ap 07:00"|seven|"Thorsen was silent a minute. Then: “Will it wait till six o’clock? There’s another meeting with the Commissioner at seven, but I’ll be able to see you at six. Can it hold till then?”
Delaney thought. “All right. Six o’clock. Where?”
“Uptown. The seven o’clock meeting’s at the Mansion. Better make it my house at six.”"|"The First Deadly Sin"|"Lawrence Sanders"
"ap 06:00"|six|"Thorsen was silent a minute. Then: “Will it wait till six o’clock? There’s another meeting with the Commissioner at seven, but I’ll be able to see you at six. Can it hold till then?”
Delaney thought. “All right. Six o’clock. Where?”
“Uptown. The seven o’clock meeting’s at the Mansion. Better make it my house at six.”"|"The First Deadly Sin"|"Lawrence Sanders"
"ap 07:00"|"seven o’clock"|"Thorsen was silent a minute. Then: “Will it wait till six o’clock? There’s another meeting with the Commissioner at seven, but I’ll be able to see you at six. Can it hold till then?”
Delaney thought. “All right. Six o’clock. Where?”
“Uptown. The seven o’clock meeting’s at the Mansion. Better make it my house at six.”"|"The First Deadly Sin"|"Lawrence Sanders"
"ap 07:00"|"seven o’clock"|"“Uptown. The seven o’clock meeting’s at the Mansion. Better make it my house at six.”"|"The First Deadly Sin"|"Lawrence Sanders"
"ap 06:00"|six|"“Uptown. The seven o’clock meeting’s at the Mansion. Better make it my house at six.”"|"The First Deadly Sin"|"Lawrence Sanders"
"ap 06:00"|"six o’clock"|"The problem, he decided—the essential problem—was not how to take Blank. That had to wait for his meeting with Thorsen at six o’clock. The essential problem was Blank, the man himself, who he was, what he was, what he might do."|"The First Deadly Sin"|"Lawrence Sanders"
"ap < 07:30"|"almost seven-thirty"|"He looked at his watch: almost seven-thirty. He didn’t have much time; it was dark outside; the street lights were on, had been since six. He went up to the bedroom, stripped down to his skin. He knew, from painful experience, what to wear on an all-night vigil in the winter."|"The First Deadly Sin"|"Lawrence Sanders"
"< 00:00"|"toward midnight"|"What time was it? Getting on toward midnight, Delaney guessed. On a long stake-out like this he very deliberately avoided looking at his watch. Start watching the clock, and you were dead; time seemed to go backwards. When the sky lightened, when it was dawn, then he could go home and sleep. Not before."|"The First Deadly Sin"|"Lawrence Sanders"
"< 11:00"|"almost 11:00 a.m."|"The phone awoke him. When he looked at the bedside clock it was almost 11:00 a.m. He wondered why Mary hadn’t picked it up downstairs, then remembered it was her day off. And he had left a note for her on the kitchen table. He really hadn’t been functioning too well when he came off that patrol, but he felt okay now. He must have slept “fast”—as they said in the Army; those four hours had been as good as eight."|"The First Deadly Sin"|"Lawrence Sanders"
"ap ~ 00:30"|"About twelve-thirty"|"“Sure. Fine. Great ale.”
“About twelve-thirty? In the bar?”
“I’ll be there.”"|"The First Deadly Sin"|"Lawrence Sanders"
"> 16:00"|"past 4:00 p.m."|"It was past 4:00 p.m. when he finished putting it all down on paper. The reports were added to the Daniel G. Blank file. He wondered if he’d ever see that plump folder again. Alinski and the Anti-Group had about two more hours. Delaney didn’t want to think of what would happen if he didn’t hear from them. He’d have to deliver Blank’s file to Broughton, of course, but how he’d deliver it was something he wouldn’t consider until the crunch."|"The First Deadly Sin"|"Lawrence Sanders"
"< 19:00"|"almost 7:00 p.m."|"When he awoke, the room was dark. He laced on his shoes, walked through to the kitchen before he put on a light. The wall clock showed almost 7:00 p.m. Well, it was time … Delaney opened the refrigerator door, looked for a cold can of beer to cleanse his palate and his dreams. He found it, was just peeling back the tab when the phone rang."|"The First Deadly Sin"|"Lawrence Sanders"
"ap 08:00"|eight|"“I know what you figured,” the Captain said, “and you figured right. Can you work till eight tomorrow morning?”"|"The First Deadly Sin"|"Lawrence Sanders"
"ap 08:00"|eight|"“I’d like them in one of the cars. If they’re not on duty, any good men will do. That makes seven men. You pick six more, three in plain and three in uniform, and have them stand by here until eight tomorrow morning. Everyone else can go home. But everyone back by eight tomorrow, and anyone else you can reach by phone or who calls in. Got it?”"|"The First Deadly Sin"|"Lawrence Sanders"
