"ap 03:20"|"twenty minutes past three"|"At twenty minutes past three the housekeeper and a maidservant who were in the basement underneath the studio heard a heavy thump as if someone had fallen. It was followed by other sounds, a series of knocks as if someone were beating upon the floor. There was an order that no servant was to be seen in the studio in business hours, but the sounds were so unusual and alarming that they took it upon themselves to investigate. They found Perceval lying rigid on the carpet, fighting for breath, his eyes glassy and staring, his skin turning blue. He was conscious but incapable of speech."|Waxwork|"Peter Lovesey"
"ap < 04:00"|"shortly before four o’clock"|"Mrs Miriam Cromer returned to the house shortly before four o’clock. She came directly to the studio. Asked whether she knew if there was any form of poison in the house, she took Dr Eagle to the cabinet and showed him where the cyanide was kept. A few minutes later she fainted."|Waxwork|"Peter Lovesey"
12:00|noon|"‘I have mentioned that I was accustomed to attend to the decanters which my husband keeps in the studio in order to offer a glass of wine to his sitters. The weekly order of wine is sent from Morgan’s in Brentford and arrives by noon on Mondays. At lunch-time I fill the decanters with fresh sherry, port and madeira."|Waxwork|"Peter Lovesey"
"ap 01:00"|"one o’clock"|"‘When Mr Perceval went out for lunch at one o’clock, I returned to the studio, unlocked the poison cabinet, found the bottle of potassium cyanide and poured about a third of the contents into the decanter of madeira. I then replaced the decanter in the chiffonier where it was kept with the others, and locked the cyanide bottle in the poison cabinet as before."|Waxwork|"Peter Lovesey"
"ap < 04:00"|"a few minutes before four o’clock"|"‘I duly returned a few minutes before four o’clock to learn that my plan had gone irretrievably wrong. The body had been discovered and Dr Eagle had already examined it. My understanding of the effects of potassium cyanide had been in error. Mr Perceval had not died instantaneously. His convulsions had been so frantic and so prolonged that two of the servants had seen fit to disregard their orders and rush to the studio to investigate. They had found him dying, unable to speak. The housemaid, I was told, had gone to fetch the doctor, who had recognised the symptoms of cyanide poisoning."|Waxwork|"Peter Lovesey"
10:00|"10 a.m."|"THE TRIAL ITSELF OPENED on a morning of overcast sky and heavy rain. The chandeliers were turned up in Number One Court at 10 a.m. The ushers opened the doors of the public gallery and it filled in little more than a minute, the jewellery in the gaslight confirming that it was still a fashionable occasion, even if the confession had removed the uncertainty over the outcome."|Waxwork|"Peter Lovesey"
10:35|"10.35 a.m."|"The call to rise came at 10.35 a.m. Mr Justice Colbeck was wearing the ermine-trimmed scarlet robe of the Queen’s Bench Division. He carried a pair of white gloves in his left hand and a piece of black material in his right. Without looking up, he deposited them on the bench beside the small posy of flowers to his right. Then he drew his robe forward and took his seat under the sword of justice. The court settled again."|Waxwork|"Peter Lovesey"
