12:00|noon|"Higher and higher every day,
Till over the mast at noon –
The Wedding-Guest here beat his breast,"|"The Rime of the Ancient Mariner"|"Samuel Taylor Coleridge"
"~ 16:30"|vespers|"In mist or cloud, on mast or shroud,
It perched for vespers nine;
Whiles all the night, through fog-smoke white,"|"The Rime of the Ancient Mariner"|"Samuel Taylor Coleridge"
12:00|noon|"All in a hot and copper sky,
The bloody Sun, at noon,
Right up above the mast did stand,"|"The Rime of the Ancient Mariner"|"Samuel Taylor Coleridge"
12:00|noon|"It ceased; yet still the sails made on
A pleasant noise till noon,
A noise like of a hidden brook"|"The Rime of the Ancient Mariner"|"Samuel Taylor Coleridge"
12:00|noon|"
Till noon we quietly sailed on,
Yet never a breeze did breathe:"|"The Rime of the Ancient Mariner"|"Samuel Taylor Coleridge"
12:00|noon|"That made the ship to go.
The sails at noon left off their tune,
And the ship stood still also."|"The Rime of the Ancient Mariner"|"Samuel Taylor Coleridge"
12:00|noon|"
He kneels at morn, and noon, and eve –
He hath a cushion plump:"|"The Rime of the Ancient Mariner"|"Samuel Taylor Coleridge"
