"ap 08:00"|eight|"'God,' the policeman breathed, handing it back after a long quiet moment. He made the radio call while Preis shot another roll. Police cars arrived, rather like the crows, one at a time, until eight were parked within sight of the fountain. A fire truck arrived in ten minutes, along with someone from the department of Recreation and Parks, trailering a boat behind his pickup. This was quickly put into the water. Then came the forensics people with a lab truck, and it was time to go out to the fountain. Preis asked to go along - he was a better photographer than the one the cops used - but was rebutted, and so he continued to record the event from the lake's edge. There wouldn't be another Pulitzer in this. There could have been, he thought. But the price of that would have involved immortalizing the instinctive act of a carrion bird, defiling the body of a girl in the midst of a major city. And that wasn't worth the nightmares. He had enough of those already."|"Without Remorse"|"Tom Clancy"
09:00|"9 a.m."|"'Anybody can do that.' The man smiled in the darkness, watching the movie. They were in the back row of a downtown theater, a 1930s film palace that was gradually falling to ruin, and had started running turns at 9 a.m. just to keep up with the painting bill. It was still a good place for a covert meeting with a confidential informant, which was how this meeting would go on the officer's time sheet."|"Without Remorse"|"Tom Clancy"
14:00|"two in the afternoon"|"'Still have the old touch, Johnnie-​boy,' Kelly said to himself, safing the pistol. But this was in daylight against a stationary piece of red metal, and Kelly knew that. He walked back to his shop and stripped the pistol down again. The suppressor had tolerated the use without any apparent damage, but he cleaned it anyway, lightly oiling the internal parts. One more thing, he thought. With a small brush and white enamel he painted a straight white line down the top of the slide. Now it was two in the afternoon. Kelly allowed himself a light lunch before starting his afternoon exercises."|"Without Remorse"|"Tom Clancy"
"ap 04:00"|four|"'Call it four, Tony. No sense squeezing your friends first time out. Let's generate a little goodwill at first, okay?'"|"Without Remorse"|"Tom Clancy"
20:45|"quarter of nine that night"|"At quarter of nine that night, two cars pulled into the service area on Interstate 95. The one in front was a Dodge Dart and the one behind it a red Plymouth Roadrunner. Roughly fifty feet apart, they picked a half-​full area north of Maryland House, a rest stop set in the median of the John F. Kennedy Highway, offering full restaurant services along with gas and oil - good coffee, but, understandably, no alcoholic beverages. The Dart took a few meandering turns in the parking lot, finally stopping three spaces from a white Oldsmobile with Pennsylvania tags and a brown vinyl top. The Roadrunner took a space in the next row. A woman got out and walked towards the brick restaurant, a path that took her past the Olds."|"Without Remorse"|"Tom Clancy"
03:00|"three in the morning"|"Despite a weekend of almost nonstop motion, there was no time to dawdle. Kelly packed clothing, most of it purchased in the suburbs of Washington. Linens he would buy in Baltimore. Food the same. His .45 automatic, plus the .22-.45 conversion kit, was packed in with old clothing, along with two boxes of ammunition. He shouldn't need more than that, Kelly thought, and ammo was heavy. While he fabricated one more silencer, this one for the Woodsman, he thought through his preparations. His physical condition was excellent, nearly as good as it had been in 3rd SOG, and he'd been shooting every day. His aim was probably better than it had ever been, he told himself, going through what were now almost mindless mechanical operations on the machine tools. By three in the morning the new suppressor was fitted to the Woodsman and tested. Thirty minutes after that he was back aboard Springer, headed north, looking forward to a few hours' sleep once he got past Annapolis."|"Without Remorse"|"Tom Clancy"
"ap 02:00"|two|"And that's where Kelly stopped, at two-​thirty in the morning, defeated by the next pile of paper. He locked everything up in the receptacles provided and jogged back to his room at the Q, leaving notice for a seven o'clock walk-​up call."|"Without Remorse"|"Tom Clancy"
"ap 07:00"|"seven o'clock"|"And that's where Kelly stopped, at two-​thirty in the morning, defeated by the next pile of paper. He locked everything up in the receptacles provided and jogged back to his room at the Q, leaving notice for a seven o'clock walk-​up call."|"Without Remorse"|"Tom Clancy"
"ap 07:00"|seven|"It was surprising how little sleep you needed when there was important work to be done. When the phone rang at seven, Kelly bounced from the bed, and fifteen minutes later was running along the beach barefoot, in a pair of shorts. He was not alone. He didn't know how many people were based at Eglin, but they were not terribly different from himself. Some had to be special operations types, doing things that he could only guess at. You could tell them from the somewhat wider shoulders. Running was only part of their fitness game. Eyes met and evaluated others, and expressions were exchanged as each man knew what the other was thinking - How tough is he, really? - as an automatic mental exercise, and Kelly smiled to himself that he was enough a part of the community that he merited that kind of competitive respect. A large breakfast and shower left him fully refreshed, enough to get him back to his clerk's work, and on the walk back to the office building, he asked himself, surprisingly, why he'd ever left this community of men. It was, after all, the only real home he'd known after leaving Indianapolis."|"Without Remorse"|"Tom Clancy"
"ap 09:00"|nine|"At nine-​ten two young women came to Lamarck. One sat on his lap while the other nibbled at his ear. The other two men at the table watched with neutral interest while both women handed over something to him. Kelly couldn't tell what it was because he was looking towards the band, careful not to stare too often in Lamarck's direction. The pimp solved that problem immediately: it turned out, unsurprisingly, to be cash, and the man somewhat ostentatiously wrapped the bills around a roll removed from his pocket. Flash money, Kelly had troubled himself to learn, an important part of a pimp's public image. The first two women left, and Lamarck was soon joined by another, in what became an intermittent stream that didn't stop. His table mates enjoyed the same sort of traffic, Kelly saw, sipping their drinks, paying cash, joshing with and occasionally fondling the waitress who served them, then tipping her heavily by way of apology. Kelly moved from time to time. He removed his jacket, rolling up his sleeves, to present a different image to the bar's patrons, and limiting himself to two beers, which he nursed as carefully as he could. Tedious as it was, he disregarded the unpleasant nature of the evening, instead noticing things. Who went where. Who came and left. Who stayed. Who lingered in one place. Kelly soon started recognizing patterns and identifying individuals to whom he assigned names of his own creation. Most of all he observed everything there was to see about Lamarck. He never took off his suit jacket, kept his back to the wall. He talked amiably with his two companions, but their familiarity was not that of friends. Their joking was too affected. There was too much emphasis on their interactive gestures, not the casual comfort that you saw among people whose company was shared for some purpose other than money. Even pimps got lonely, Kelly thought, and though they sought out their own kind, theirs was not friendship but mere association. The philosophical observations he put aside. If Lamarck never took off his coat, he had to be carrying a weapon."|"Without Remorse"|"Tom Clancy"
"> 00:00"|"Just after midnight"|"Just after midnight, Kelly put his coat back on and made yet another trip to the men's room. In the toilet stall he took the automatic he'd hidden inside his slacks and moved it to the waistband. Two beers in four hours, he thought. His liver ought to have eliminated the alcohol from his system, and even if it hadn't, two beers should not have had much effect on one as bulky as he. It was an important statement which, he hoped, wasn't a lie."|"Without Remorse"|"Tom Clancy"
11:00|"eleven that morning"|"Hell began promptly at eleven that morning, though Colonel Zacharias had no way of knowing the time. The tropical sun seemed always to be overhead, beating mercilessly down. Even in his windowless cell there was no escaping it, any more than he could escape the insects that seemed to thrive on the heat. He wondered how anything could thrive here, but everything that did seemed to be something that hurt or offended him, and that was as concise a definition of hell as anything he'd learned in the temples of his youth. Zacharias had been trained for possible capture. He'd been through the survival, evasion, resistance, and escape course, called SERE School. It was something you had to do if you flew airplanes for a living, and it was purposefully the most hated thing in the military because it did things to otherwise pampered Air Force and Navy officers that Marine drill instructors would have quailed at - things which were, in any other context, deeds worthy of a general court-​martial followed by a lengthy term at Leavenworth or Portsmouth. The experience for Zacharias, as for most others, had been one he would never willingly repeat. But his current situation was not of his own volition either, was it? And he was repeating SERE School."|"Without Remorse"|"Tom Clancy"
"ap 10:00"|ten|"Archie and Jughead were also in their accustomed place, a block away, he saw at once, talking to a motorist. It was ten-​twelve at night. Kelly allowed himself a sip of water and a candy bar as he leaned back, watching them for any changes in their usual pattern of activity, but there was none he could see in half an hour of observation. Big Bob was in his place, too, as was his lieutenant, whom Kelly now called Little Bob. Charlie Brown was also in business tonight, as was Dagwood, the former still working alone and the latter still teamed up with a lieutenant Kelly had not bothered to name. But the Wizard wasn't visible tonight. It turned out that he arrived late, just after eleven, along with his associate, whose assigned name was Toto, for he tended to scurry around like a little dog that belonged in the basket on the back of the Wicked Witch's bicycle. 'And your little dog, too ...' Kelly whispered to himself in amusement."|"Without Remorse"|"Tom Clancy"
"ap > 11:00"|"just after eleven"|"Archie and Jughead were also in their accustomed place, a block away, he saw at once, talking to a motorist. It was ten-​twelve at night. Kelly allowed himself a sip of water and a candy bar as he leaned back, watching them for any changes in their usual pattern of activity, but there was none he could see in half an hour of observation. Big Bob was in his place, too, as was his lieutenant, whom Kelly now called Little Bob. Charlie Brown was also in business tonight, as was Dagwood, the former still working alone and the latter still teamed up with a lieutenant Kelly had not bothered to name. But the Wizard wasn't visible tonight. It turned out that he arrived late, just after eleven, along with his associate, whose assigned name was Toto, for he tended to scurry around like a little dog that belonged in the basket on the back of the Wicked Witch's bicycle. 'And your little dog, too ...' Kelly whispered to himself in amusement."|"Without Remorse"|"Tom Clancy"
"ap 00:00"|twelve|"Kelly made himself comfortable, feeling his body relax now that all the decisions had been made. He stared down at the street, still intensely alert, watching, listening, noting everything that came and went as the minutes passed. At twelve-​forty, a police radio car traveled one of the cross streets, doing nothing more than showing the flag. It would return a few minutes after two, probably. The city buses made their whirring diesel noises, and Kelly recognized the one-​ten, with the brakes that needed work. Their thin screech must have annoyed every person who tried to sleep along its route. Traffic slowed perceptibly just after two. The dealers were smoking more now, talking more. Big Bob crossed the street to say something to the Wizard, and their relations seemed cordial enough, which surprised Kelly. He hadn't seen that before. Maybe the man just needed change for a hundred. The police cruiser made its scheduled pass. Kelly finished his third Snickers bar of the evening, collecting the wrappers. He checked the area. He'd left nothing. No surface he had touched was likely to retain a fingerprint. There was just too much dust and grit, and he'd been very careful not to touch a windowpane."|"Without Remorse"|"Tom Clancy"
"ap > 02:00"|"a few minutes after two"|"Kelly made himself comfortable, feeling his body relax now that all the decisions had been made. He stared down at the street, still intensely alert, watching, listening, noting everything that came and went as the minutes passed. At twelve-​forty, a police radio car traveled one of the cross streets, doing nothing more than showing the flag. It would return a few minutes after two, probably. The city buses made their whirring diesel noises, and Kelly recognized the one-​ten, with the brakes that needed work. Their thin screech must have annoyed every person who tried to sleep along its route. Traffic slowed perceptibly just after two. The dealers were smoking more now, talking more. Big Bob crossed the street to say something to the Wizard, and their relations seemed cordial enough, which surprised Kelly. He hadn't seen that before. Maybe the man just needed change for a hundred. The police cruiser made its scheduled pass. Kelly finished his third Snickers bar of the evening, collecting the wrappers. He checked the area. He'd left nothing. No surface he had touched was likely to retain a fingerprint. There was just too much dust and grit, and he'd been very careful not to touch a windowpane."|"Without Remorse"|"Tom Clancy"
"ap > 02:00"|"just after two"|"Kelly made himself comfortable, feeling his body relax now that all the decisions had been made. He stared down at the street, still intensely alert, watching, listening, noting everything that came and went as the minutes passed. At twelve-​forty, a police radio car traveled one of the cross streets, doing nothing more than showing the flag. It would return a few minutes after two, probably. The city buses made their whirring diesel noises, and Kelly recognized the one-​ten, with the brakes that needed work. Their thin screech must have annoyed every person who tried to sleep along its route. Traffic slowed perceptibly just after two. The dealers were smoking more now, talking more. Big Bob crossed the street to say something to the Wizard, and their relations seemed cordial enough, which surprised Kelly. He hadn't seen that before. Maybe the man just needed change for a hundred. The police cruiser made its scheduled pass. Kelly finished his third Snickers bar of the evening, collecting the wrappers. He checked the area. He'd left nothing. No surface he had touched was likely to retain a fingerprint. There was just too much dust and grit, and he'd been very careful not to touch a windowpane."|"Without Remorse"|"Tom Clancy"
"ap > 06:00"|"just after six"|"The cars started arriving just after six, not so incongruous an hour for activity on a military base. Fifteen of them, clunkers, none less than three years old, and all of them had been totaled in auto accidents and sold for scrap. The only thing unusual about them was that though they were no longer drivable, they almost looked as though they were. The work detail was composed of Marines, supervised by a gunnery sergeant who had no idea what this was all about. But he didn't have to. The cars were worked into place, haphazardly, not in neat military rows, but more the way real people parked. The job took ninety minutes, and the work detail left. At eight in the morning another such detail arrived, this one with mannequins. They came in several sizes, and they were dressed in old clothes. The child-​size ones went on the swings and in the sandbox. The adult ones were stood up, using the metal stands that came with them. And the second work party left, to return twice a day for the indefinite future and move the mannequins around in a random way prescribed by a set of instructions thought up and written down by some damned fool of an officer who didn't have anything better to do."|"Without Remorse"|"Tom Clancy"
08:00|"eight in the morning"|"The cars started arriving just after six, not so incongruous an hour for activity on a military base. Fifteen of them, clunkers, none less than three years old, and all of them had been totaled in auto accidents and sold for scrap. The only thing unusual about them was that though they were no longer drivable, they almost looked as though they were. The work detail was composed of Marines, supervised by a gunnery sergeant who had no idea what this was all about. But he didn't have to. The cars were worked into place, haphazardly, not in neat military rows, but more the way real people parked. The job took ninety minutes, and the work detail left. At eight in the morning another such detail arrived, this one with mannequins. They came in several sizes, and they were dressed in old clothes. The child-​size ones went on the swings and in the sandbox. The adult ones were stood up, using the metal stands that came with them. And the second work party left, to return twice a day for the indefinite future and move the mannequins around in a random way prescribed by a set of instructions thought up and written down by some damned fool of an officer who didn't have anything better to do."|"Without Remorse"|"Tom Clancy"
"> 05:00"|"just after five in the morning"|"Ryan and Douglas stood back, letting the forensics people do their jobs. The discovery had happened just after five in the morning. On his routine patrol pattern, Officer Chuck Monroe had come down the street, and spotting an irregular shadow in this passage between houses, shone his car light down it. The dark shape might easily have been a drunk passed out and sleeping it off, but the white spotlight had reflected off the pool of red and bathed the arched bricks in a pink glow that looked wrong from the first instant. Monroe had parked his car and come in for a look, then made his call. The officer was leaning on the side of his car now, smoking a cigarette and going over the details of his discovery, which was to him less horrific and more routine than civilians understood. He hadn't even bothered to call an ambulance. These two men were clearly beyond any medical redemption."|"Without Remorse"|"Tom Clancy"
"> 00:00"|"After midnight"|"'Not too long ago,' the man said, lifting one hand. 'No rigor yet. After midnight certainly, probably after two.'"|"Without Remorse"|"Tom Clancy"
"ap 03:00"|three|"'Not bad shooting, Em.' Douglas had his pencil out, pointing to the holes in the forehead of the unidentified victim. They were scarcely half an inch apart, just above the bridge of the nose. 'No powder marks. The killer must have been standing ... call it three, four feet, max.' Douglas stood back at the feet of the bodies and extended his arm. It was a natural shot, extending your arm and aiming down."|"Without Remorse"|"Tom Clancy"
12:00|noon|"Kelly arose at ten-​thirty, feeling clean for the first time in several days. He'd showered immediately on returning to his apartment, wondering if in doing so he'd left rings on the sewers. Now he could shave, even, and that compensated for the lack of sleep. Before breakfast - brunch - Kelly drove half a mile to a local park and ran for thirty minutes, then drove back home for another thoroughly wonderful shower and some food. Then there was work to do. All the clothing from the previous evening was in a brown paper grocery bag - slacks, shirt, underwear, socks, and shoes. It seemed a shame to part with the bush jacket, whose size and pockets had proven to be so useful. He'd have to get another, probably several. He felt certain that he hadn't been splattered with blood this time, but the dark colors made it difficult to be sure, and they probably did carry powder residue, and this was not the time to take any chances at all. Leftover food and coffee grounds went on top of the clothing, and found their way into the apartment complex's Dumpster. Kelly had considered taking them to a distant dumpsite, but that might cause more trouble than it solved. Someone might see him, and take note of what he did, and wonder why. Disposing of the four empty .22 cases was easy. He'd dumped them down a sewer while jogging. The noon news broadcast announced the discovery of two bodies, but no details. Maybe the newspaper would say more. There was one other thing."|"Without Remorse"|"Tom Clancy"
"ap 04:00"|four|"'Sandy's car broke down. I was going to run her home, but I've got a meeting that'll run till four. She gets off shift at three.'"|"Without Remorse"|"Tom Clancy"
"> 19:00"|"just after seven in the evening"|"Kelly had sighted the car just after seven in the evening, close to the bar which Archie had identified. Whatever he was like, Kelly thought, he didn't know much about being covert, but the car told him that. The mud was gone, he saw at once. The car looked freshly washed and waxed, and from their previous encounter, he knew Billy to be a man who treasured the thing. It offered a few interesting possibilities which Kelly considered while he trailed him, never closer than half a block, getting a feel for how he moved. It was soon apparent that he stayed clear of the major thoroughfares as much as possible and knew the side streets as a weasel knew his den. That placed Kelly at a disadvantage. Balancing it was the fact that Kelly was driving a car nobody noticed. There were just too many used Beetles on the street for one more to attract notice."|"Without Remorse"|"Tom Clancy"
"ap < 03:00"|"almost three"|"It was almost three when Kelly selected him. A loner, as Kelly had taken to calling them. This one had no lieutenant, perhaps was a new one in this business, just learning the ropes. He wasn't that old, or didn't appear so from forty yards away, as he counted through his roll after the night's enterprise. There was a lump at his right hip, undoubtedly a handgun, but his head was down. He was somewhat alert. On hearing Kelly's approach the head came up and turned, giving him a quick once-​over, but the head went back to its task, dismissing the approaching shape and counting the money as the distance closed."|"Without Remorse"|"Tom Clancy"
12:00|noon|"The thought evoked a frown. More yard sales, which he found tedious, especially now that he'd developed an operational routine. Like most men Kelly hated shopping, now all the more since his adventures were of necessity repetitive. His routine was also tiring him out, both from lack of sleep and the unremitting tension of his activity. None of it was routine, really. Everything was dangerous. Even though he was becoming accustomed to his mission, he would not become inured to the dangers, and the stress was there. That was partly good news in that he wasn't taking anything lightly, but stress could also wear at any man in little, hard-​to-​perceive ways such as the increased heart rate and blood pressure that resulted in fatigue. He was controlling it with exercise, Kelly thought, though sleep was becoming a problem. ?ll in all it was not unlike working the weeds in 3rd SOG, but he was older now, and the lack of backup, the absence of companions to share the stress and ease the strain in the off-​hours, was taking its toll. Sleep, he told himself, checking his watch. Kelly switched on the TV set in the bedroom, catching a noon news show."|"Without Remorse"|"Tom Clancy"
"ap 10:00"|"ten o'clock"|"'Some light flak at ten o'clock.' It was too far to be a matter of concern, though it did tell him which way out not to take. 'There's the plateau.'"|"Without Remorse"|"Tom Clancy"
"ap 05:15"|"quarter after five"|"'I usually get up quarter after five, leave here just after six. I like to be on the unit half an hour before shift change so I can check the status of the patients and get ready for the new arrivals from the OR. It's a busy unit. What about you?'"|"Without Remorse"|"Tom Clancy"
"ap > 06:00"|"just after six"|"'I usually get up quarter after five, leave here just after six. I like to be on the unit half an hour before shift change so I can check the status of the patients and get ready for the new arrivals from the OR. It's a busy unit. What about you?'"|"Without Remorse"|"Tom Clancy"
"ap 02:15"|"quarter after two"|"Finally, Kelly thought to himself. It was quarter after two when the Roadrunner appeared, after at least an hour's worrying that it might not appear at all. He settled back in the shadows, becoming a little more erect, and turned his head to give the man a good look. Billy and his sidekick. Laughing about something. The other one stumbled on the steps, maybe having had a drink too many or something. More to the point, when he fell there was a flutter of light little twirling rectangles that had to be banknotes."|"Without Remorse"|"Tom Clancy"
