"ap 08:00"|eight|"The buses passed every forty-​five minutes at this time of night, and their route was several blocks away. The police patrol was highly predictable. The neighborhood routine was predictable as well. By eight the regular traffic was gone, and by nine-​thirty the local citizens abandoned the streets entirely, barricading themselves behind triple-​locked doors, thanking Providence that they had survived another day, already dreading the dangers of the next, and leaving the streets mainly to the illicit traffic. That traffic lingered until about two, Kelly had long since established, and on careful consideration he decided that he knew all that he needed to know. There were still random elements to be considered. There always were, but you could not predict the random, only prepare for it. Alternate evasion routes, constant vigilance, and weapons were the defense against it. Something was always left to chance, and however uncomfortable that was, Kelly had to accept it as a part of normal life - not that anything about his mission was normal."|"Without Remorse"|"Tom Clancy"
"ap 09:00"|nine|"The buses passed every forty-​five minutes at this time of night, and their route was several blocks away. The police patrol was highly predictable. The neighborhood routine was predictable as well. By eight the regular traffic was gone, and by nine-​thirty the local citizens abandoned the streets entirely, barricading themselves behind triple-​locked doors, thanking Providence that they had survived another day, already dreading the dangers of the next, and leaving the streets mainly to the illicit traffic. That traffic lingered until about two, Kelly had long since established, and on careful consideration he decided that he knew all that he needed to know. There were still random elements to be considered. There always were, but you could not predict the random, only prepare for it. Alternate evasion routes, constant vigilance, and weapons were the defense against it. Something was always left to chance, and however uncomfortable that was, Kelly had to accept it as a part of normal life - not that anything about his mission was normal."|"Without Remorse"|"Tom Clancy"
"ap ~ 02:00"|"about two"|"The buses passed every forty-​five minutes at this time of night, and their route was several blocks away. The police patrol was highly predictable. The neighborhood routine was predictable as well. By eight the regular traffic was gone, and by nine-​thirty the local citizens abandoned the streets entirely, barricading themselves behind triple-​locked doors, thanking Providence that they had survived another day, already dreading the dangers of the next, and leaving the streets mainly to the illicit traffic. That traffic lingered until about two, Kelly had long since established, and on careful consideration he decided that he knew all that he needed to know. There were still random elements to be considered. There always were, but you could not predict the random, only prepare for it. Alternate evasion routes, constant vigilance, and weapons were the defense against it. Something was always left to chance, and however uncomfortable that was, Kelly had to accept it as a part of normal life - not that anything about his mission was normal."|"Without Remorse"|"Tom Clancy"
"ap 02:50"|"two fifty"|"Six, he thought, heading for the corner, his heart settling down from the rush of adrenaline, putting the gun back in its place next to the knife. It was two fifty-​six as Kelly began his evasion drill."|"Without Remorse"|"Tom Clancy"
"ap > 03:00"|"just after three"|"Things hadn't started off well, the Recon Marine thought. The chartered bus had broken down once, and the 'shortcut' the driver had selected to make up lost time had come to a halt behind a traffic tieup. The bus pulled into Quantico Marine Base just after three, following a jeep to its final destination. The Marines found an isolated barracks building already half occupied by snoring men and picked bunks for themselves so they could get some sleep. Whatever the interesting, exciting, dangerous mission was to be, the startup was just one more day in the Green Machine."|"Without Remorse"|"Tom Clancy"
"ap 02:00"|two|"'My idea,' Greer said. 'Ivan has satellites. The overhead schedules for the next six weeks are posted inside Building A. We don't know how good the cameras are, and so I'm going to assume that they're as good as ours, okay? You show the other guy what he wants to see or you make it easy for him to figure out. Any really harmless place has a parking lot.' The drill was already determined. Every day the new arrivals would move the cars around randomly. Around ten every day they would take the mannequins from the cars and distribute them around the playground equipment. At two or three the cars would be moved again and the mannequins rearranged. They suspected correctly that the ritual would acquire a great deal of institutional humor."|"Without Remorse"|"Tom Clancy"
"ap 03:00"|three|"'My idea,' Greer said. 'Ivan has satellites. The overhead schedules for the next six weeks are posted inside Building A. We don't know how good the cameras are, and so I'm going to assume that they're as good as ours, okay? You show the other guy what he wants to see or you make it easy for him to figure out. Any really harmless place has a parking lot.' The drill was already determined. Every day the new arrivals would move the cars around randomly. Around ten every day they would take the mannequins from the cars and distribute them around the playground equipment. At two or three the cars would be moved again and the mannequins rearranged. They suspected correctly that the ritual would acquire a great deal of institutional humor."|"Without Remorse"|"Tom Clancy"
00:00|midnight|"It was midnight when he left his apartment. The area was so agreeably quiet on a weekday night. The old apartment complex was peopled with residents who minded their own business. Kelly had not so much as shaken a hand since the manager's. A few friendly nods, that was all. There were no children in the complex, just middle-​aged people, almost all married couples sprinkled with a few widowed singles. Mainly white-​collar workers, a surprising number of whom rode the bus to work downtown, watched TV at night, heading to bed around ten or eleven. Kelly moved out quietly, driving the VW down Loch Raven Boulevard, past churches and other apartment complexes, past the city's sports stadium as the neighborhoods evolved downward from middle- to working-​class, and from working-​class to subsistence, passing darkened office buildings downtown in his continuing routine. But tonight there was a difference."|"Without Remorse"|"Tom Clancy"
"> 01:00"|"after one in the morning"|"There were two pushers on this block, both lone operators. They looked a little tense. Perhaps the word was getting out, Kelly thought with a suppressed smile. Some of their brethren were disappearing, and that had to be cause for concern. He kept well clear of both as he covered the block, inwardly amused that neither knew how close Death had passed them. How tenuous their lives were, and yet they didn't know. But that was a distraction, he told himself, turning yet again and heading to the objective. He paused at the corner, looking around. It was after one in the morning now, and things were settling down into the accustomed boredom that comes at the end of any working day, even the illegal kind. Activity on the street was diminishing, just as expected from all the reconnaissance he had done. There was nothing untoward on this street, and Kelly headed south past the rows of brownstones on one side of the street and brick row-​houses on the other. It required all of his concentration to maintain his uneven, harmless gait. One of those who had hurt Pam was now within a hundred yards. Probably two of them. Kelly allowed his mind to see her face again, to hear her voice, to feel the curves of her body. He allowed his face to become a frozen mask of stone and his hands to ball into, tight fists as his legs shambled down the wide sidewalk, but only for a few seconds. Then he cleared his mind and took five deep, slow breaths."|"Without Remorse"|"Tom Clancy"
02:45|"quarter to three in the morning"|"One does not expect to hear doorbells at a quarter to three in the morning. Sandy first thought she had dreamed it, but her eyes had opened, and in the way of the mind, the sound played back to her as though she had actually awakened a second earlier. Even so, she must have dreamed it, the nurse told herself, shaking her head. She'd just started to close her eyes again when it repeated. Sandy rose, slipped on a robe, and went downstairs, too disoriented to be frightened. There was a shape on the porch. She turned on the lights as she opened the door."|"Without Remorse"|"Tom Clancy"
"ap > 04:00"|"after four"|"It was after four when Kelly pulled into the marina. He backed the Scout to the transom of his boat and got out to open the cargo hatch after checking the darkness for spectators, of which, thankfully, there were none."|"Without Remorse"|"Tom Clancy"
01:00|"one this morning"|"'Call me Sid. Not much else. This individual is very clever, changing his methods, and this is the only case where he displayed his anger. That's it, do you see? This is the only crime with rage in it - except maybe for the one this morning, but we'll set that aside for the moment. Here we see rage. First he cripples the victim, then he kills him in a particularly difficult way. Why?' Farber paused for a few contemplative puffs, 'He was angry, but why was he angry? It had to have been an unplanned act. He wouldn't have planned something with Mrs Charles there. For some reason he had to do something that he hadn't expected to do, and that made him angry. Also, he let her go - knowing that she saw him.'"|"Without Remorse"|"Tom Clancy"
"ap 01:59"|"One of two"|"Farber nodded and puffed away for a few seconds. 'One of two things. Either that's the person he was after all along, or he's just one more step towards something else.'"|"Without Remorse"|"Tom Clancy"
00:00|midnight|"His voice was that of confession now. The information was somewhat remarkable, but it had to be true. No person like this had the imagination to make it up. The final part of the interrogation lasted for three hours, only once letting the valve hiss, and then only for a second or two. Kelly left and revisited questions to see if the answers changed, but they didn't. In fact, the renewed question developed yet more information that connected some bits of data to others, formulating an overall picture that became clearer still, and by midnight he was sure that he'd emptied Billy's mind of all the useful data that it contained."|"Without Remorse"|"Tom Clancy"
"ap ~ 01:45"|"about quarter of two"|"'Your lad seems to know his business - till now, anyway,' General Young observed about quarter of two."|"Without Remorse"|"Tom Clancy"
"ap 03:00"|"three o'clock"|"'Quite right. Please excuse us,' General Young replied. The two flag officers settled back into stillness, watching the illuminated hands of their watches turn to three o'clock, the operation's agreed stop-​time. They didn't hear Irvin speak, or even breathe, for all that time. That took an hour. It was a comfortable one for the Marine general, but the Admiral just didn't like being in the woods, with all the bloodsucking bugs, and probably snakes, and all manner of unpleasant things not ordinarily found in the cockpit of a fighter aircraft. They listened to the whispering breezes in the pines, heard the flapping of bats and owls and perhaps some other night fliers, and little else. Finally it was 02:55. Marty Young stood and stretched, fishing in his pocket for a cigarette."|"Without Remorse"|"Tom Clancy"
"ap 02:55"|02:55|"'Quite right. Please excuse us,' General Young replied. The two flag officers settled back into stillness, watching the illuminated hands of their watches turn to three o'clock, the operation's agreed stop-​time. They didn't hear Irvin speak, or even breathe, for all that time. That took an hour. It was a comfortable one for the Marine general, but the Admiral just didn't like being in the woods, with all the bloodsucking bugs, and probably snakes, and all manner of unpleasant things not ordinarily found in the cockpit of a fighter aircraft. They listened to the whispering breezes in the pines, heard the flapping of bats and owls and perhaps some other night fliers, and little else. Finally it was 02:55. Marty Young stood and stretched, fishing in his pocket for a cigarette."|"Without Remorse"|"Tom Clancy"
06:45|"quarter of seven in the morning"|"Sandy turned to look out the window. It was quarter of seven in the morning. She could see people coming out in pajamas and bathrobes to get their morning papers and collect half-​gallon bottles of milk. The early crowd was leaving for their cars, a process that in her neighborhood lasted until eight-​thirty or so. She turned back. 'No, nothing changed. It was always there. Something - I don't know, released it, let it out? like opening the door of a cage. What sort of man - part of him's like Tim, but another part I just don't understand.'"|"Without Remorse"|"Tom Clancy"
"ap 11:00"|"eleven o'clock"|"'Wally, we're going across the street for a few minutes. Could you tell my eleven o'clock that I'll be back as soon as I can?'"|"Without Remorse"|"Tom Clancy"
00:00|midnight|"'You be back here by midnight.' The pilot looked back at them from the right seat. Maxwell motioned for him to stay on the ground."|"Without Remorse"|"Tom Clancy"
"ap 11:00"|eleven|"He turned south on Interstate 95, and a final forty-​five or so delivered him to Quantico. It was eleven-​thirty when he drove into the training site."|"Without Remorse"|"Tom Clancy"
01:00|"one in the morning"|"Kelly awoke at one in the morning, local time. The big slug of whiskey he'd downed along the way had blessedly not resulted in a hangover. In fact, he felt unusually rested. The gentle rocking of the ship had soothed his body during the day/night, and lying in the darkness of his officers' accommodations he heard the gentle creaks of steel compressing and expanding as USS Ogden turned to port. He made his way to the shower, using cold water to wake himself up. In ten minutes he was dressed and presentable. It was time to explore the ship."|"Without Remorse"|"Tom Clancy"
08:00|"eight that morning"|"Captain Franks watched the Russian ship disappear an hour later. Two more hours passed, just to be sure. At eight that morning a pair of AH-1 Huey Cobras completed their lonely overwater flight from the Marine air base at Danang, landing on Ogden's ample flight deck. The Russians might have wondered about the presence of two attack helicopters on the ship which, their intelligence reports confidently told them, was on an electronic-​intelligence mission not unlike their own. Maintenance men already aboard immediately wheeled the 'snakes' to a sheltered spot and began a complete maintenance check which would verify the condition of every component. Members of Ogden's crew lit up their own machine shop, and skilled chief machinist's mates offered everything they had to the new arrivals. They were still not briefed on the mission, but it was clear now that something most unusual indeed was under way. The time for questioning was over. Whatever the hell it was, every resource of their ship was made available even before officers troubled themselves to relay that order to their various divisions. Cobra gunships meant action, and every man aboard knew they were a hell of a lot closer to North Vietnam than South. Speculation was running wild, but not that wild. They had a spook team aboard, then Marines, now gunships, and more helicopters would land this afternoon. The Navy medical corpsmen aboard were told to open up the ship's hospital spaces for new arrivals."|"Without Remorse"|"Tom Clancy"
03:00|"three in the morning"|"Climbing the first hill took half an hour. Kelly stopped there, finding a clear spot from which to look and listen. It was approaching three in the morning, local time. The only people awake were those who had to be, and they wouldn't like it very much. The human body was linked to a day/night cycle, and at this time of the morning bodily functions ebbed."|"Without Remorse"|"Tom Clancy"
"ap 03:45"|"quarter to four"|"At quarter to four he saw some lights in the barracks, flickering yellow, like candles. Guard change, perhaps. The two soldiers in the tower nearest him were stretching, chatting to each other casually. Kelly could barely make out the murmur of conversation but not the words or cadence. They were bored. This would be that sort of duty. They might grouse about it, but not that badly. The alternative would be a stroll down the Ho Chi Minh Trail through Laos, and, patriotic though they might have been, only a fool would relish that thought. Here they kept watch on twenty or so men, locked in individual cells, perhaps chained to walls or otherwise hobbled, with as much chance of escaping the camp as Kelly had of walking on water - and even if they succeeded in that most impossible of feats, what would they be? Six-​foot-​tall white men in a land of small yellow people, none of whom would lift a hand on their behalf. Alcatraz Federal Prison could be no more secure than this. So the guards had three squares a day and quiet boring duty that would dull their senses."|"Without Remorse"|"Tom Clancy"
"ap 08:00"|eight|"At eight, the guard cycle changed again. Those relieved from the towers went in for chow. Two men took posts at the gate, bored before they got there, looking out at the road for traffic that would probably never come to this backwater camp. Some work details formed, and the jobs they performed were as clearly useless to Kelly as to those who carried them out in a. stoic, unhurried way."|"Without Remorse"|"Tom Clancy"
"ap > 08:00"|"just after eight"|"Colonel Grishanov arose just after eight. He'd been up late the night before, and though he'd planned to arise earner, he'd just learned to his displeasure that his mechanical alarm clock had finally given up the ghost, corroded to death by the miserable climate. Eight-​ten, he saw, looking at his aviator's watch. Damn. No morning ran. It would soon be too hot for that, and besides, it looked like it would be raining all day. He brewed his own pot of tea over a small army-​type cook stove. No morning paper to read - again. No news of the football scores. No review of a new ballet production. Nothing at all in this miserable place to distract him. Important as his duty was, he needed distraction as much as any man did. Not even decent plumbing. He was used to all of that, but it didn't help. God, to be able to go home, to hear people speaking his native language again, to be in a cultured place where there was something to talk about. Grishanov frowned in the shaving mirror. Months more to go, and he was grumbling like a private soldier, a damned recruit. He was supposed to know better."|"Without Remorse"|"Tom Clancy"
"< 12:00"|"Before noon"|"It was decided that Ogden would continue as planned, steaming at twenty knots back towards Subic Bay. The big amphibious ship became a quiet place. The crew, pumped up for an important and dramatic mission, became subdued with its failure. Watches were changed, the ship continued to function as before, but the mess rooms' only noise was that of the metal trays and utensils. No jokes, no stories. The additional medical personnel took it the hardest of all. With no one to treat and nothing to do, they just wandered about. Before noon the helicopters departed, the Cobras for Danang and the rescue birds back to their carrier. The signal-​intelligence people switched over to more regular duties, searching the airways for radio messages, finding a new mission to replace the old."|"Without Remorse"|"Tom Clancy"
18:00|"1800 hours"|"Kelly didn't awaken until 1800 hours. After showering, he headed below to find the Marines. He owed them an explanation, he thought. Somebody did. They were in the same space. The sand-​table model was still there as well."|"Without Remorse"|"Tom Clancy"
"ap > 10:00"|"after ten"|"It was after ten when her eyes opened back up. Angry with herself, she shook her head clear and went back to the kitchen. Doris's number was pinned next to the phone. She called, and heard the phone ring... four - six - ten times, without an answer. Damn. Out shopping? Off to see Dr Bryant? She'd try again in an hour. In the meantime she'd try to figure out exactly what she would say. Might this be a crime? Was she obstructing justice? How deeply was she involved in this business? The thought came as an unpleasant surprise. But she was involved. She'd helped rescue this girl from a dangerous life, and she couldn't stop now. She'd just tell Doris not to hurt the people who had helped her, to be very, very careful. Please."|"Without Remorse"|"Tom Clancy"
17:00|"five in the afternoon"|"The following winds had allowed the ??-135 to make the hop in from Hawaii without a refueling stop, and the landing was a gentle one. Remarkably, Kelly's sleep cycle was about right now. It was five in the afternoon, and in another six or seven hours he'd be ready for more sleep."|"Without Remorse"|"Tom Clancy"
"> 00:00"|"after midnight"|"His small dinghy, now camouflaged, went into the water after midnight. He'd attached a small electric trolling motor to the transom, and hoped he had enough battery power to get in and out. It couldn't be too far. The chart showed that the area was not a large one, and the place they used had to be in the middle for maximum isolation. With darkened face and hands he moved into the maze of derelicts, steering the dinghy with his left hand while his eyes and ears searched for something that didn't belong. The sky helped. There was no moon, and the starlight was just enough to show him the grass and reeds that had grown in this tidal wetland that had been created when the hulks had been left there, silting up this part of the Bay and making a place that birds loved in the fall season."|"Without Remorse"|"Tom Clancy"
00:00|midnight|"The work was every bit as menial and boring as Burt had told them it would be, Phil thought. Mixing the milk sugar in was the easy part, sifting it into large stainless-​steel bowls like flour for a cake, making sure it was all evenly distributed. He remembered helping his mother with baking when he'd been a small child, watching her and learning things that a kid forgot as soon as he discovered baseball. They came back now, the rattling sound of the sitter, the way the powders came together. It was actually rather a pleasant excursion back to a time when he hadn't even had to wake up and go to school. But that was the easy part. Then came the tedious job of doling out precisely measured portions into the little plastic envelopes which had to be stapled shut, and piled, and counted, and bagged. He shared an exasperated look with Mike, who felt the same way he did. Burt probably felt the same way, but didn't let it show, and he had been nice enough to bring entertainment along. They had a radio playing, and for breaks they had this Xantha girl, half-​blasted on pills, but... compliant, they'd all found out at their midnight break. They'd gotten her nice and tired, anyway. She was sleeping in the corner. There would be another break at four, allowing each of them enough time to recover. It was hard staying awake, and Phil was worried about all this powder, some of it dust in the air. Was he breathing it in? Might he get high on the stuff? If he had to do this again, he promised himself some sort of mask. He might like the idea of making money off selling the shit, but he had no desire at all to use it. Well, Tony and Henry were setting up a proper lab. Travel wouldn't be such a pain in the ass. That was something."|"Without Remorse"|"Tom Clancy"
"ap 04:00"|four|"The work was every bit as menial and boring as Burt had told them it would be, Phil thought. Mixing the milk sugar in was the easy part, sifting it into large stainless-​steel bowls like flour for a cake, making sure it was all evenly distributed. He remembered helping his mother with baking when he'd been a small child, watching her and learning things that a kid forgot as soon as he discovered baseball. They came back now, the rattling sound of the sitter, the way the powders came together. It was actually rather a pleasant excursion back to a time when he hadn't even had to wake up and go to school. But that was the easy part. Then came the tedious job of doling out precisely measured portions into the little plastic envelopes which had to be stapled shut, and piled, and counted, and bagged. He shared an exasperated look with Mike, who felt the same way he did. Burt probably felt the same way, but didn't let it show, and he had been nice enough to bring entertainment along. They had a radio playing, and for breaks they had this Xantha girl, half-​blasted on pills, but... compliant, they'd all found out at their midnight break. They'd gotten her nice and tired, anyway. She was sleeping in the corner. There would be another break at four, allowing each of them enough time to recover. It was hard staying awake, and Phil was worried about all this powder, some of it dust in the air. Was he breathing it in? Might he get high on the stuff? If he had to do this again, he promised himself some sort of mask. He might like the idea of making money off selling the shit, but he had no desire at all to use it. Well, Tony and Henry were setting up a proper lab. Travel wouldn't be such a pain in the ass. That was something."|"Without Remorse"|"Tom Clancy"
