10:00|"ten in the morning"|"It was ten in the morning in Moscow when Voloshin's dispatch emerged from the decoding department. A senior member of the KGB's First Chief Directorate, he had a pipeline into any number of senior officers, one of whom was an academician in Service I, an American specialist who was advising the senior KGB leadership and the Foreign Ministry on this new development that the American media called detente. This man, who didn't hold a paramilitary rank within the KGB hierarchy, was probably the best person to get fast action, though an information copy of the dispatch had also gone to the Deputy Chairman with oversight duties for Voloshin's Directorate. Typically, the message was short and to the point. The Academician was appalled. The reduction of tension between the two superpowers, in the midst of a shooting war for one of them, was little short of miraculous, and coming as it did in parallel with the American approach to China, it could well signal a new era in relations. So he had said to the Politburo in a lengthy briefing only two weeks earlier. The public revelation that a Soviet officer had been involved in something like this - it was madness. What cretin at GRU had thought this one up? Assuming it really was true, which was something he had to check. For that he called the Deputy Chairman."|"Without Remorse"|"Tom Clancy"
16:00|"four in the afternoon"|"'Okay, I'll call back.' Oreza hung up. He looked at the clock. Pushing four in the afternoon - he'd been at the station since midnight. He pulled open a drawer and started filling out the forms accounting for the fuel he'd burned up today, making the Chesapeake Bay safe for drunks who owned boats. Then he planned to get home, get dinner, and get some sleep."|"Without Remorse"|"Tom Clancy"
00:00|midnight|"'Okay, I'll call back.' Oreza hung up. He looked at the clock. Pushing four in the afternoon - he'd been at the station since midnight. He pulled open a drawer and started filling out the forms accounting for the fuel he'd burned up today, making the Chesapeake Bay safe for drunks who owned boats. Then he planned to get home, get dinner, and get some sleep."|"Without Remorse"|"Tom Clancy"
"ap 08:45"|"quarter to nine"|"The State Police only had three helicopters, all Bell Jet Rangers, and were still learning how to make use of them. Getting one was not the most trivial of exercises, but the Captain running Barracks 'V' was a senior man who ran a quiet county - this was less a matter of his competence than of the nature of his area, but police hierarchies tend to place stock in results, however obtained. The helicopter arrived on the barracks helicopter pad at a quarter to nine. Captain Ernest Joy and Trooper 1/c Freeland were waiting. Neither had taken a helicopter ride before, and both were a little nervous when they saw how small the aircraft was. They always look smaller close up, and smaller still on the inside. Mainly used for Medevac missions, the aircraft had a pilot and a paramedic, both of whom were gun-​toting State Police officers in sporty flight suits that went well, they thought, with their shoulder holsters and aviator shades. The standard safety lecture took a total of ninety seconds, delivered so quickly as to be incomprehensible. The ground-​pounders strapped in, and the helicopter spooled up. The pilot decided against jazzing up the ride. The senior man was a captain, after all, and cleaning vomit out of the back was a drag."|"Without Remorse"|"Tom Clancy"
"> 00:00"|"after midnight"|"Kelly packed his clothing into the suitcase, which was large enough to contain it all, and carried it out to the rented car, and with that his residence in the apartment ended. It was after midnight when he drove south again, into the center of the danger zone, ready to act one last time."|"Without Remorse"|"Tom Clancy"
"> 12:00"|"after noon"|"The two-​truck convoy had to take a route even more circuitous than planned, and they didn't arrive at the destination until after noon. That was Hoa Lo Prison. The name meant 'place of cooking fires,' and its reputation was well known to the Americans. When the trucks had pulled into the courtyard and the gates were secure, the men were let down. Again, each man was given an individual guard who took him inside. They were allowed a drink of water and nothing more before assignment to individual cells that were scattered around, and presently Robin Zacharias found his. It wasn't much of a change, really. He found a nice piece of floor and sat down, tired from the journey, resting his head against the wall. It took several minutes before he heard the tapping."|"Without Remorse"|"Tom Clancy"
02:00|"two this morning"|"'Those two guys on the boat, the ones you gave to Henry? I got 'em. I got the other two this morning, too.'"|"Without Remorse"|"Tom Clancy"
10:00|"ten o'clock in the morning"|"The remarkable thing was that it was ten o'clock in the morning now, a clean, sunny late-​summer day. There was truck traffic on O'Donnell Street, only half a block away, and some private autos as well, driving past, going about their business. Perhaps their drivers saw the tall abandoned building Kelly was in, wondering, as he was, what it had been constructed for; seeing the four automobiles parked at the former trucking building, wondering if that business was starting up again; but if they did, it wasn't worth anything more than a passing thought for people who had work to do. The drama was being played in plain sight, and only the players knew."|"Without Remorse"|"Tom Clancy"
"ap 08:00"|eight|"'Yes, I will. Very well, there's a PanAm flight from Dulles to Paris tonight at eight-​fifteen. I'll deliver him there if you wish to see him off. You can have him met at Orly.'"|"Without Remorse"|"Tom Clancy"
"ap 08:00"|"eight o'clock"|"They got back under way just shy of a lazy eight o'clock. It promised to be a hot, sunny Saturday. Kelly donned his sunglasses and relaxed in his chair, keeping himself alert with the odd sip from his mug. He maneuvcred west, tracing down the edge of the main ship channel to avoid the hundreds of fishing boats he fully expected to sortie from their various harbors today in pursuit of rockfish."|"Without Remorse"|"Tom Clancy"
"ap 11:41"|11:41|"Cody-193 crossed the border between Laos and North Vietnam at 11:41:38 local time. Still descending, it leveled out for the first time at five hundred feet above ground level, turning northeast, somewhat slower now in the thicker air this close to the ground. The low altitude and small size of the speeding drone made it a difficult target, but by no means an impossible one, and outlying gun positions of the dense and sophisticated North Vietnamese air-​defense network spotted it. The drone flew directly towards a recently sited 37mm twin gun mount whose alert crew got their mount slued around quickly enough to loose twenty quick rounds, three of which passed within feet of the diminutive shape but missed. Cody-193 took no note of this, and neither jinked nor evaded the fire. Without a brain, without eyes, it continued along on its flight path rather like a toy train around a Christmas tree while its new owner ate breakfast in the kitchen. In fact it was being watched. A distant EC-121 Warning Star tracked -193 by means of a coded radar transponder located atop the drone's vertical fin."|"Without Remorse"|"Tom Clancy"
"ap 11:00"|"eleven o'clock"|"'Bear off, dickhead,' he whispered to himself. The jerks in a boat, drinking beer, probably half-​potted already, not even eleven o'clock yet. He gave them a good look, and was vaguely grateful that they passed no closer than fifty yards. He caught the name: Henry's Eighth. If he saw that name again, Kelly told himself, he'd remember to keep clear."|"Without Remorse"|"Tom Clancy"
"> 16:00"|"just after four in the afternoon"|"'Working late shift this week.' It was just after four in the afternoon, and Allen had just come on duty. He didn't know that Kelly had called three times that day already without leaving a message. 'I get off around midnight, one o'clock, like that. It depends on the night,' he explained. 'Some are busier than others.'"|"Without Remorse"|"Tom Clancy"
"~ 00:00"|"around midnight"|"'Working late shift this week.' It was just after four in the afternoon, and Allen had just come on duty. He didn't know that Kelly had called three times that day already without leaving a message. 'I get off around midnight, one o'clock, like that. It depends on the night,' he explained. 'Some are busier than others.'"|"Without Remorse"|"Tom Clancy"
"ap 01:00"|"one o'clock"|"'Working late shift this week.' It was just after four in the afternoon, and Allen had just come on duty. He didn't know that Kelly had called three times that day already without leaving a message. 'I get off around midnight, one o'clock, like that. It depends on the night,' he explained. 'Some are busier than others.'"|"Without Remorse"|"Tom Clancy"
10:00|"ten in the morning"|"'Tomorrow, probably, but he's going to be very rocky for a couple of days.'
'Is ten in the morning okay, sir?'
'Yes.'"|"Without Remorse"|"Tom Clancy"
