"ap 06:30"|"half past six"|"The young couple came back into the compartment, no longer talking or smiling; their animation had been all for their friends in North Station. Eduard continued to gaze out the window as the train ran steadily north on the level embankments by the Molsen. The river was wide, serene, a pale silken blue color between low banks. Willows stood in the late sunlight by the river. The haze was thickening; it looked like rain ahead, in the north, a heavy blueness of clouds. He had got off work early to catch the five o’clock express. They would be in Brailava by half past six, following the river all the way. He got a little drowsy, looking at the silken water."|"The Compass Rose"|"Ursula K. le Guin"
"ap 05:45"|"quarter to six"|"At a quarter to six there was a tremendous noise and a subsequent absolute silence. As Eduard picked himself up from the floor of the compartment where for some reason he had arrived, the young man kicked him in the shoulder. “Watch that!” Eduard said furiously, and retrieved his briefcase, which had also slid across the floor. There was now a strange, thin commotion of voices in the corridor. “Oh, oh, oh, oh,” the young woman was saying in a silly voice. The commotion grew to a hubbub like that of an audience at intermission, both inside the car and outside along the tracks, shouts, exclamations, descriptions, comparisons, complaints, as it became clear that the engine had hit a hay truck stalled at a crossing, and that though nobody was hurt except for the truck driver, who had been killed, the engine had derailed and there was going to be a delay while they brought a relief engine down from Brailava. Another break, a dash not a period; non-arrival. Eduard walked up and down the tracks a while in the late long sunlight. It was almost seven when a relief engine arrived, from the south not the north, and pulled the train back to a siding at the local station called Isestno, which was not even mentioned on the Krasnoy-Brailava schedule of the Northern Line; and there it waited, while night fell and the rain came on, until the tracks were mended and the relief engine from Brailava came and hauled it on in, arriving at Sumeny Station at half past ten."|"The Compass Rose"|"Ursula K. le Guin"
"ap < 07:00"|"almost seven"|"At a quarter to six there was a tremendous noise and a subsequent absolute silence. As Eduard picked himself up from the floor of the compartment where for some reason he had arrived, the young man kicked him in the shoulder. “Watch that!” Eduard said furiously, and retrieved his briefcase, which had also slid across the floor. There was now a strange, thin commotion of voices in the corridor. “Oh, oh, oh, oh,” the young woman was saying in a silly voice. The commotion grew to a hubbub like that of an audience at intermission, both inside the car and outside along the tracks, shouts, exclamations, descriptions, comparisons, complaints, as it became clear that the engine had hit a hay truck stalled at a crossing, and that though nobody was hurt except for the truck driver, who had been killed, the engine had derailed and there was going to be a delay while they brought a relief engine down from Brailava. Another break, a dash not a period; non-arrival. Eduard walked up and down the tracks a while in the late long sunlight. It was almost seven when a relief engine arrived, from the south not the north, and pulled the train back to a siding at the local station called Isestno, which was not even mentioned on the Krasnoy-Brailava schedule of the Northern Line; and there it waited, while night fell and the rain came on, until the tracks were mended and the relief engine from Brailava came and hauled it on in, arriving at Sumeny Station at half past ten."|"The Compass Rose"|"Ursula K. le Guin"
"ap 10:30"|"half past ten"|"At a quarter to six there was a tremendous noise and a subsequent absolute silence. As Eduard picked himself up from the floor of the compartment where for some reason he had arrived, the young man kicked him in the shoulder. “Watch that!” Eduard said furiously, and retrieved his briefcase, which had also slid across the floor. There was now a strange, thin commotion of voices in the corridor. “Oh, oh, oh, oh,” the young woman was saying in a silly voice. The commotion grew to a hubbub like that of an audience at intermission, both inside the car and outside along the tracks, shouts, exclamations, descriptions, comparisons, complaints, as it became clear that the engine had hit a hay truck stalled at a crossing, and that though nobody was hurt except for the truck driver, who had been killed, the engine had derailed and there was going to be a delay while they brought a relief engine down from Brailava. Another break, a dash not a period; non-arrival. Eduard walked up and down the tracks a while in the late long sunlight. It was almost seven when a relief engine arrived, from the south not the north, and pulled the train back to a siding at the local station called Isestno, which was not even mentioned on the Krasnoy-Brailava schedule of the Northern Line; and there it waited, while night fell and the rain came on, until the tracks were mended and the relief engine from Brailava came and hauled it on in, arriving at Sumeny Station at half past ten."|"The Compass Rose"|"Ursula K. le Guin"
"ap 06:30"|"half past six"|"There had been nothing whatever to eat on the train and no vendors at mournful Isestno siding, but Eduard did not feel hungry as he walked under the bright cavernous dome of Sumeny, carrying the briefcase which was all he had brought. Now that he was off the train at last, he felt shaken. He had planned to arrive at half past six, find a hotel near the station, have dinner, but now he did not want to stay up and eat out among strangers, he wanted to go home. Other men hurried past him through the high doors into the rainy night"|"The Compass Rose"|"Ursula K. le Guin"
12:00|noon|"The man thing looked around. It had no gun, like the ones from the man places do. But it picked up a heavy fallen tree branch in its long white foot, and shoved the end of that down into our house, at me. I snapped the end of it in my teeth and started to force my way out, because I knew the man would kill our children if it could. But my sister was already coming. I saw her running at the man with her head low and her mane high and her eyes yellow as the winter sun. It turned on her and raised up that branch to hit her. But I come out of the doorway, mad with the mother anger, and the others all were coming answering my call, the whole pack gathering, there in that blind glare and heat of the sun at noon."|"The Compass Rose"|"Ursula K. le Guin"
